Gene_set	Term	Overlap	P-value	Adjusted P-value	Old P-value	Old Adjusted P-value	Odds Ratio	Combined Score	Genes
GO_Biological_Process_2021	enzyme linked receptor protein signaling pathway (GO:0007167)	8/140	3.1511278825415338e-12	2.1207090649504524e-09	0	0	75.16666666666667	1990.658426970362	ALK;EPHA5;PTPRT;PTPRD;PDGFRA;EPHA7;NTRK3;EPHA3
GO_Biological_Process_2021	regulation of kinase activity (GO:0043549)	6/94	1.152455318949078e-09	3.8780121482636474e-07	0	0	75.33333333333333	1550.4632903331485	ALK;EPHA5;PDGFRA;EPHA7;NTRK3;EPHA3
GO_Biological_Process_2021	positive regulation of kinase activity (GO:0033674)	6/114	3.7169053239964267e-09	8.33825761016532e-07	0	0	61.32098765432099	1190.2633299927804	ALK;EPHA5;PDGFRA;EPHA7;NTRK3;EPHA3
GO_Biological_Process_2021	transmembrane receptor protein tyrosine kinase signaling pathway (GO:0007169)	8/404	1.4333832443581158e-08	2.40688703817572e-06	0	0	24.72222222222222	446.49923439180554	ALK;EPHA5;PTPRT;PDGFRA;EPHA7;IRS1;NTRK3;EPHA3
GO_Biological_Process_2021	positive regulation of transferase activity (GO:0051347)	6/148	1.788177591512422e-08	2.40688703817572e-06	0	0	46.55868544600939	830.5829123433186	ALK;EPHA5;PDGFRA;EPHA7;NTRK3;EPHA3
KEGG_2021_Human	Hepatocellular carcinoma	6/168	3.813588117778337e-08	4.2330828107339535e-06	0	0	40.76954732510288	696.4299016302244	KEAP1;ARID1A;ARID2;TP53;MTOR;SMARCA4
Reactome_2022	RUNX1 Interacts With Co-Factors Whose Precise Effect On RUNX1 Targets Is Not Known R-HSA-8939243	4/35	8.142490043065713e-08	2.312467172230662e-05	0	0	128.67741935483872	2100.476754925315	EP300;ARID1A;ARID2;SMARCA4
GO_Biological_Process_2021	positive regulation of phosphorylation (GO:0042327)	6/253	4.2936803133658516e-07	4.816078084825364e-05	0	0	26.62483130904183	390.345357958506	ALK;EPHA5;PDGFRA;EPHA7;NTRK3;EPHA3
Reactome_2022	Generic Transcription Pathway R-HSA-212436	10/1190	4.873049007802522e-07	6.919729591079581e-05	0	0	11.37772397094431	165.3681162852861	ZFHX3;GRIN2A;EP300;ATM;CDK12;ARID1A;ARID2;TP53;MTOR;SMARCA4
GO_Biological_Process_2021	protein autophosphorylation (GO:0046777)	5/159	1.121513803228559e-06	9.154373816526532e-05	0	0	33.87218045112782	464.0770258979763	ALK;PDGFRA;ATM;CDK12;MTOR
Reactome_2022	RNA Polymerase II Transcription R-HSA-73857	10/1312	1.1959280431434108e-06	0.00010313519121783929	0	0	10.244678516567918	139.702460828148	ZFHX3;GRIN2A;EP300;ATM;CDK12;ARID1A;ARID2;TP53;MTOR;SMARCA4
GO_Biological_Process_2021	chromatin disassembly (GO:0031498)	3/18	1.2242104658059254e-06	9.154373816526532e-05	0	0	190.10476190476192	2587.9368897735044	ARID1A;ARID2;SMARCA4
GO_Biological_Process_2021	nucleosome disassembly (GO:0006337)	3/18	1.2242104658059254e-06	9.154373816526532e-05	0	0	190.10476190476192	2587.9368897735044	ARID1A;ARID2;SMARCA4
KEGG_2021_Human	Central carbon metabolism in cancer	4/70	1.3865076857688556e-06	5.200313396957435e-05	0	0	60.333333333333336	813.819586526614	PDGFRA;NTRK3;TP53;MTOR
KEGG_2021_Human	MicroRNAs in cancer	6/310	1.4054901072857933e-06	5.200313396957435e-05	0	0	21.57017543859649	290.6607992026371	PDGFRA;IRS1;EP300;ATM;TP53;MTOR
Reactome_2022	Regulation Of TP53 Activity Thru Methylation R-HSA-6804760	3/19	1.4526083270118209e-06	0.00010313519121783929	0	0	178.21428571428572	2395.5831199572035	EP300;ATM;TP53
GO_Biological_Process_2021	protein-DNA complex disassembly (GO:0032986)	3/20	1.7076087361357007e-06	0.00011492206794193263	0	0	167.72268907563026	2227.4271785014485	ARID1A;ARID2;SMARCA4
Reactome_2022	Gene Expression (Transcription) R-HSA-74160	10/1449	2.953835095645837e-06	0.00016777783343268355	0	0	9.201330288891096	117.15507481393055	ZFHX3;GRIN2A;EP300;ATM;CDK12;ARID1A;ARID2;TP53;MTOR;SMARCA4
GO_Biological_Process_2021	positive regulation of neuron projection development (GO:0010976)	4/88	3.475796401601599e-06	0.0002126555434798069	0	0	47.36190476190476	595.3243150235196	ALK;NTRK3;EP300;EPHA3
Reactome_2022	Signaling By ALK R-HSA-201556	3/26	3.876221144670624e-06	0.00018347446751440955	0	0	123.93167701863354	1544.2692277813176	ALK;IRS1;EP300
GO_Biological_Process_2021	regulation of actin cytoskeleton organization (GO:0032956)	4/91	3.974190298463977e-06	0.0002228858392388547	0	0	45.72183908045977	568.5825955043872	EPHA5;PDGFRA;MTOR;EPHA3
KEGG_2021_Human	Prostate cancer	4/97	5.127438351516854e-06	0.0001422864142545927	0	0	42.759139784946235	520.8449926715696	PDGFRA;EP300;TP53;MTOR
GO_Biological_Process_2021	regulation of cell migration (GO:0030334)	6/408	6.847886788338928e-06	0.00035450983142708444	0	0	16.23051409618574	193.0063018362299	PTPRT;PDGFRA;NTRK3;NF1;ATM;ARID2
Reactome_2022	Chromatin Modifying Enzymes R-HSA-3247509	5/238	8.084314202919251e-06	0.0003028336862797151	0	0	22.298396205105036	261.4617376566152	KDM5C;EP300;ARID1A;ARID2;SMARCA4
Reactome_2022	Diseases Of Signal Transduction By Growth Factor Receptors And Second Messengers R-HSA-5663202	6/424	8.530526374076482e-06	0.0003028336862797151	0	0	15.596491228070176	182.0400541478957	ALK;PDGFRA;IRS1;NF1;EP300;MTOR
Reactome_2022	Regulation Of TP53 Degradation R-HSA-6804757	3/36	1.0561305190162971e-05	0.00032614977450395497	0	0	86.33333333333333	989.234415216844	ATM;TP53;MTOR
GO_Biological_Process_2021	positive regulation of cell projection organization (GO:0031346)	4/117	1.07968654925157e-05	0.0005190207483187904	0	0	35.15575221238938	402.0501364053756	PTPRD;NTRK3;EP300;EPHA3
Reactome_2022	Regulation Of TP53 Expression And Degradation R-HSA-6806003	3/37	1.148414698957588e-05	0.00032614977450395497	0	0	83.78991596638656	953.0720018141094	ATM;TP53;MTOR
Reactome_2022	Activated NTRK3 Signals Thru PI3K R-HSA-9603381	2/6	2.063922922489771e-05	0.0004916145676909818	0	0	453.90909090909093	4896.9151445712	IRS1;NTRK3
GO_Biological_Process_2021	protein phosphorylation (GO:0006468)	6/496	2.077244652215416e-05	0.00093199043396065	0	0	13.25578231292517	142.92229577242006	ALK;PDGFRA;ATM;CDK12;MTOR;EPHA3
Reactome_2022	Signaling By Receptor Tyrosine Kinases R-HSA-9006934	6/496	2.077244652215416e-05	0.0004916145676909818	0	0	13.25578231292517	142.92229577242006	ALK;PDGFRA;IRS1;NTRK3;EP300;MTOR
GO_Biological_Process_2021	regulation of fibroblast proliferation (GO:0048145)	3/46	2.2277900155129167e-05	0.0009370641752751206	0	0	66.22259136212625	709.3707959300292	PDGFRA;NF1;TP53
Reactome_2022	RMTs Methylate Histone Arginines R-HSA-3214858	3/49	2.6974986716344915e-05	0.000546677871730686	0	0	61.8944099378882	651.1663625699358	ARID1A;ARID2;SMARCA4
Reactome_2022	EPH-ephrin Mediated Repulsion Of Cells R-HSA-3928665	3/49	2.6974986716344915e-05	0.000546677871730686	0	0	61.8944099378882	651.1663625699358	EPHA5;EPHA7;EPHA3
GO_Biological_Process_2021	brain development (GO:0007420)	4/150	2.8736140711648317e-05	0.0011272711331812	0	0	27.16438356164383	284.0676014223557	ZFHX3;EPHA7;GRIN2A;NF1
Reactome_2022	RUNX3 Regulates CDKN1A Transcription R-HSA-8941855	2/7	2.88738312533813e-05	0.000546677871730686	0	0	363.1090909090909	3795.424957257872	ZFHX3;TP53
GO_Biological_Process_2021	intrinsic apoptotic signaling pathway in response to DNA damage (GO:0008630)	3/51	3.044239845139448e-05	0.0011272711331812	0	0	59.30952380952381	616.7997266711214	EP300;ATM;TP53
KEGG_2021_Human	Pathways in cancer	6/531	3.0489010873070804e-05	0.0006768560413821719	0	0	12.349841269841267	128.41543084661004	ALK;PDGFRA;KEAP1;EP300;TP53;MTOR
GO_Biological_Process_2021	regulation of signal transduction by p53 class mediator (GO:1901796)	4/156	3.350832660511875e-05	0.0011272711331812	0	0	26.08421052631579	268.76431285811844	EP300;ATM;TP53;MTOR
GO_Biological_Process_2021	regulation of cell differentiation (GO:0045595)	4/156	3.350832660511875e-05	0.0011272711331812	0	0	26.08421052631579	268.76431285811844	ALK;ZFHX3;NF1;EPHA3
Reactome_2022	Regulation Of TP53 Activity R-HSA-5633007	4/157	3.435682485358264e-05	0.0006098336411510919	0	0	25.912418300653595	266.3462298289791	EP300;ATM;TP53;MTOR
GO_Biological_Process_2021	cellular response to oxygen-containing compound (GO:1901701)	5/323	3.517487934146542e-05	0.0011272711331812	0	0	16.26779212181397	166.8291101426385	PDGFRA;IRS1;ATM;MTOR;EPHA3
GO_Biological_Process_2021	DNA damage response, signal transduction by p53 class mediator resulting in cell cycle arrest (GO:0006977)	3/56	4.036253222957771e-05	0.0012347265541139	0	0	53.700808625336926	543.323764430037	EP300;ATM;TP53
Reactome_2022	PI5P Regulates TP53 Acetylation R-HSA-6811555	2/9	4.942569622883086e-05	0.0008192585974025591	0	0	259.3376623376623	2571.343322149568	EP300;TP53
Reactome_2022	Transcriptional Regulation By TP53 R-HSA-3700989	5/354	5.441168117477957e-05	0.0008192585974025591	0	0	14.799426934097422	145.31456226023994	EP300;ATM;CDK12;TP53;MTOR
Reactome_2022	TP53 Regulates Transcription Of DNA Repair Genes R-HSA-6796648	3/62	5.480955405157966e-05	0.0008192585974025591	0	0	48.22518159806295	473.16841182341153	ATM;CDK12;TP53
GO_Biological_Process_2021	positive regulation of transcription of nucleolar large rRNA by RNA polymerase I (GO:1901838)	2/10	6.173695322587491e-05	0.0017000716102398	0	0	226.9090909090909	2199.345382715804	MTOR;SMARCA4
GO_Biological_Process_2021	regulation of cellular catabolic process (GO:0031329)	3/65	6.315273440712488e-05	0.0017000716102398	0	0	45.884792626728114	443.7038528087822	KEAP1;EP300;ATM
GO_Biological_Process_2021	mitotic G1 DNA damage checkpoint signaling (GO:0031571)	3/65	6.315273440712488e-05	0.0017000716102398	0	0	45.884792626728114	443.7038528087822	EP300;ATM;TP53
GO_Biological_Process_2021	phosphatidylinositol-mediated signaling (GO:0048015)	3/71	8.2245729511214e-05	0.0020876783258747	0	0	41.8235294117647	393.3837149028032	PDGFRA;IRS1;NF1
GO_Biological_Process_2021	regulation of actin filament-based process (GO:0032970)	3/73	8.935896442564729e-05	0.0020876783258747	0	0	40.624489795918365	378.7359837468843	EPHA5;MTOR;EPHA3
GO_Biological_Process_2021	regulation of hydrolase activity (GO:0051336)	3/73	8.935896442564729e-05	0.0020876783258747	0	0	40.624489795918365	378.7359837468843	EPHA5;NF1;EPHA3
Reactome_2022	TP53 Regulates Transcription Of Caspase Activators And Caspases R-HSA-6803207	2/12	9.041513427391056e-05	0.0012838949066895	0	0	181.5090909090909	1690.049094896529	ATM;TP53
GO_Biological_Process_2021	replicative senescence (GO:0090399)	2/12	9.041513427391056e-05	0.0020876783258747	0	0	181.5090909090909	1690.049094896529	ATM;TP53
GO_Biological_Process_2021	DNA damage response, signal transduction by p53 class mediator (GO:0030330)	3/74	9.306144097509942e-05	0.0020876783258747	0	0	40.05030181086519	371.7569391075242	EP300;ATM;TP53
Reactome_2022	Transcriptional Regulation By RUNX1 R-HSA-8878171	4/204	9.5159746559803e-05	0.0012869222868087	0	0	19.776	183.12484112475292	EP300;ARID1A;ARID2;SMARCA4
KEGG_2021_Human	Glioma	3/75	9.6862754847748e-05	0.0017919609646833	0	0	39.492063492063494	364.99416053763736	PDGFRA;TP53;MTOR
GO_Biological_Process_2021	phosphorylation (GO:0016310)	5/400	9.693068301388968e-05	0.0021043338602692	0	0	13.045303131245836	120.558357300972	ALK;EPHA7;ATM;CDK12;MTOR
Reactome_2022	Disease R-HSA-1643685	9/1736	0.00010736888165666268	0.0013860346541132	0	0	6.3401273885350315	57.94394685111136	ALK;PDGFRA;IRS1;NF1;KEAP1;EP300;ATM;TP53;MTOR
GO_Biological_Process_2021	phosphate-containing compound metabolic process (GO:0006796)	4/212	0.00011040246981037472	0.0023061504891443	0	0	19.00769230769231	173.18627052859776	ALK;PTPRD;EPHA7;MTOR
GO_Biological_Process_2021	regulation of cellular response to heat (GO:1900034)	3/79	0.00011308018743204	0.0023061504891443	0	0	37.40601503759399	339.9239210821424	EP300;ATM;MTOR
GO_Biological_Process_2021	regulation of transcription of nucleolar large rRNA by RNA polymerase I (GO:1901836)	2/14	0.000124480947880634	0.0024293206841008	0	0	151.24242424242425	1359.874763432084	MTOR;SMARCA4
GO_Biological_Process_2021	ephrin receptor signaling pathway (GO:0048013)	3/82	0.00012633911432916592	0.0024293206841008	0	0	35.98010849909584	322.97691490739055	EPHA5;EPHA7;EPHA3
GO_Biological_Process_2021	regulation of phospholipase C activity (GO:1900274)	2/15	0.00014352676264691865	0.0026698032667848	0	0	139.6013986013986	1235.3312463141472	PDGFRA;NTRK3
GO_Biological_Process_2021	regulation of intracellular signal transduction (GO:1902531)	5/437	0.00014677967439976087	0.0026698032667848	0	0	11.905458089668617	105.08445337242918	NTRK3;EP300;ATM;TP53;MTOR
GO_Biological_Process_2021	regulation of autophagy (GO:0010506)	4/231	0.00015363514538750735	0.0027209592854155	0	0	17.4	152.78818117014856	KEAP1;EP300;ATM;MTOR
Reactome_2022	Protein-protein Interactions At Synapses R-HSA-6794362	3/88	0.0001558113728712707	0.0019239317345843	0	0	33.430252100840335	293.07848804835965	PTPRD;GRIN2A;NTRK3
GO_Biological_Process_2021	positive regulation by host of viral transcription (GO:0043923)	2/16	0.00016391054960449903	0.0028285076893289	0	0	129.62337662337663	1129.8219412644194	EP300;SMARCA4
Reactome_2022	Signaling By NTRK3 (TRKC) R-HSA-9034015	2/16	0.00016391054960449903	0.0019396081703199	0	0	129.62337662337663	1129.8219412644194	IRS1;NTRK3
Reactome_2022	EPH-Ephrin Signaling R-HSA-2682334	3/91	0.0001720868277972388	0.0019549063637766	0	0	32.285714285714285	279.83679649139845	EPHA5;EPHA7;EPHA3
GO_Biological_Process_2021	cellular response to gamma radiation (GO:0071480)	2/17	0.00018562933966781003	0.0031094138405436	0	0	120.97575757575756	1039.394514011186	ATM;TP53
GO_Biological_Process_2021	nucleosome organization (GO:0034728)	3/94	0.00018942937215793472	0.0031094138405436	0	0	31.21664050235479	267.5732564184208	ARID1A;ARID2;SMARCA4
Reactome_2022	Transcriptional Regulation By RUNX3 R-HSA-8878159	3/95	0.00019545258891225063	0.002134943663503	0	0	30.875776397515526	263.68508081155176	ZFHX3;EP300;TP53
GO_Biological_Process_2021	positive regulation of DNA-binding transcription factor activity (GO:0051091)	4/246	0.0001955487916316563	0.0031334365897167	0	0	16.30909090909091	139.2747540107997	ALK;EPHA5;EP300;SMARCA4
Reactome_2022	TP53 Regulates Transcription Of Genes Involved In G2 Cell Cycle Arrest R-HSA-6804114	2/18	0.00020868016842799032	0.0021950062160573	0	0	113.4090909090909	961.10890422201	EP300;TP53
GO_Biological_Process_2021	negative regulation of fibroblast proliferation (GO:0048147)	2/18	0.00020868016842799032	0.0032660872872566	0	0	113.4090909090909	961.10890422201	NF1;TP53
GO_Biological_Process_2021	positive regulation of signal transduction (GO:0009967)	4/252	0.00021442838597140147	0.0032676964821835	0	0	15.90967741935484	134.39755270659575	IRS1;NTRK3;EP300;SMARCA4
Reactome_2022	Cellular Response To Heat Stress R-HSA-3371556	3/99	0.0002207869375035619	0.0022394103661075	0	0	29.583333333333332	249.04174198623193	EP300;ATM;MTOR
GO_Biological_Process_2021	regulation of cell population proliferation (GO:0042127)	6/764	0.0002272207094008733	0.0032676964821835	0	0	8.451187335092348	70.90198597714968	ALK;PDGFRA;IRS1;NTRK3;ARID2;TP53
GO_Biological_Process_2021	positive regulation of gene expression (GO:0010628)	5/482	0.0002316402638211001	0.0032676964821835	0	0	10.757475449630364	90.04356544206422	NTRK3;EP300;ATM;TP53;MTOR
GO_Biological_Process_2021	interleukin-7-mediated signaling pathway (GO:0038111)	2/19	0.00023306007599526184	0.0032676964821835	0	0	106.73262032085562	892.7345092435008	IRS1;SMARCA4
GO_Biological_Process_2021	cellular response to interleukin-7 (GO:0098761)	2/19	0.00023306007599526184	0.0032676964821835	0	0	106.73262032085562	892.7345092435008	IRS1;SMARCA4
KEGG_2021_Human	Longevity regulating pathway	3/102	0.00024112207109460744	0.0038235071273573	0	0	28.682539682539684	238.9314995428402	IRS1;TP53;MTOR
GO_Biological_Process_2021	chromatin remodeling (GO:0006338)	3/103	0.000248160437794501	0.0034084076456265	0	0	28.394285714285715	235.71331990829248	KDM5C;ARID1A;SMARCA4
Reactome_2022	TP53 Regulates Transcription Of Genes Involved In Cytochrome C Release R-HSA-6803204	2/20	0.00025876610708752327	0.0024060630824097	0	0	100.7979797979798	832.5495793111635	ATM;TP53
Reactome_2022	Receptor-type Tyrosine-Protein Phosphatases R-HSA-388844	2/20	0.00025876610708752327	0.0024060630824097	0	0	100.7979797979798	832.5495793111635	PTPRD;NTRK3
Reactome_2022	PI3K/AKT Signaling In Cancer R-HSA-2219528	3/105	0.00026263364631937797	0.0024060630824097	0	0	27.834733893557424	229.4904355365835	PDGFRA;IRS1;MTOR
Reactome_2022	PIP3 Activates AKT Signaling R-HSA-1257604	4/268	0.00027118811268630214	0.0024067945000909	0	0	14.933333333333334	122.64295433803603	PDGFRA;IRS1;TP53;MTOR
GO_Biological_Process_2021	central nervous system development (GO:0007417)	4/268	0.00027118811268630214	0.0036297248093931	0	0	14.933333333333334	122.64295433803603	ZFHX3;EPHA7;GRIN2A;NF1
GO_Biological_Process_2021	positive regulation of cell migration (GO:0030335)	4/269	0.0002750608696568323	0.0036297248093931	0	0	14.87622641509434	121.96301212758664	PDGFRA;NTRK3;ATM;MTOR
GO_Biological_Process_2021	intrinsic apoptotic signaling pathway in response to DNA damage by p53 class mediator (GO:0042771)	2/21	0.0002857953111961309	0.0036988508545191	0	0	95.48803827751196	779.2048032433584	EP300;TP53
Reactome_2022	Synaptic Adhesion-Like Molecules R-HSA-8849932	2/21	0.0002857953111961309	0.0024595717690818	0	0	95.48803827751196	779.2048032433584	PTPRD;GRIN2A
GO_Biological_Process_2021	positive regulation of nucleic acid-templated transcription (GO:1903508)	5/511	0.0003034792171636857	0.0038536134556822	0	0	10.125858123569794	82.02144991900619	ZFHX3;EP300;ARID1A;TP53;SMARCA4
GO_Biological_Process_2021	regulation of cytoskeleton organization (GO:0051493)	3/112	0.00031756514969554097	0.0039578026989833	0	0	26.03800786369594	209.7316634727131	EPHA5;MTOR;EPHA3
GO_Biological_Process_2021	negative regulation of cell motility (GO:2000146)	3/114	0.00033451627935222807	0.0040932628364372	0	0	25.566280566280565	204.60246957607467	PTPRT;NF1;ARID2
GO_Biological_Process_2021	positive regulation of transcription by RNA polymerase I (GO:0045943)	2/23	0.00034381145881898543	0.0041318769961638	0	0	86.38528138528139	688.9586534300897	MTOR;SMARCA4
GO_Biological_Process_2021	positive regulation of transcription, DNA-templated (GO:0045893)	7/1183	0.000353382079929542	0.004135006046809	0	0	6.582633053221288	52.3185088554536	ZFHX3;EP300;ATM;ARID1A;TP53;MTOR;SMARCA4
GO_Biological_Process_2021	regulation of cellular response to stress (GO:0080135)	3/118	0.0003701480171554325	0.004135006046809	0	0	24.672049689440993	194.94885498719952	EP300;ATM;MTOR
GO_Biological_Process_2021	positive regulation of neuron apoptotic process (GO:0043525)	2/24	0.0003747925243021608	0.004135006046809	0	0	82.45454545454545	650.4952839948423	EPHA7;NF1
GO_Biological_Process_2021	positive regulation of phospholipase activity (GO:0010518)	2/24	0.0003747925243021608	0.004135006046809	0	0	82.45454545454545	650.4952839948423	PDGFRA;NTRK3
GO_Biological_Process_2021	response to gamma radiation (GO:0010332)	2/24	0.0003747925243021608	0.004135006046809	0	0	82.45454545454545	650.4952839948423	ATM;TP53
KEGG_2021_Human	Neurotrophin signaling pathway	3/119	0.0003794222686254727	0.0043193366364062	0	0	24.458128078817733	192.6532704977716	IRS1;NTRK3;TP53
KEGG_2021_Human	Growth hormone synthesis, secretion and action	3/119	0.0003794222686254727	0.0043193366364062	0	0	24.458128078817733	192.6532704977716	IRS1;EP300;MTOR
KEGG_2021_Human	Thyroid hormone signaling pathway	3/121	0.0003984175036804402	0.0043193366364062	0	0	24.041162227602907	188.19446069201703	EP300;TP53;MTOR
Reactome_2022	Interleukin-7 Signaling R-HSA-1266695	2/25	0.0004070850063970531	0.0034003571122577	0	0	78.86561264822134	615.663500818195	IRS1;SMARCA4
GO_Biological_Process_2021	positive regulation of intracellular signal transduction (GO:1902533)	5/546	0.0004115065052038854	0.0044668367419712	0	0	9.453740636248662	73.69839096799326	PDGFRA;IRS1;NTRK3;EP300;TP53
KEGG_2021_Human	Cell cycle	3/124	0.0004280423693735877	0.0043193366364062	0	0	23.44155844155844	181.8194871950706	EP300;ATM;TP53
GO_Biological_Process_2021	cellular response to oxidative stress (GO:0034599)	3/125	0.0004382232175732551	0.0046813369115365	0	0	23.24824355971897	179.7736027765765	PDGFRA;KEAP1;TP53
Reactome_2022	Intracellular Signaling By Second Messengers R-HSA-9006925	4/306	0.0004483320554260031	0.0036378943925995	0	0	13.029139072847682	100.45435482848636	PDGFRA;IRS1;TP53;MTOR
GO_Biological_Process_2021	positive regulation of apoptotic process (GO:0043065)	4/310	0.00047084533110052786	0.0049512329348539	0	0	12.856209150326798	98.49117277216736	EPHA7;NF1;ATM;TP53
KEGG_2021_Human	FoxO signaling pathway	3/131	0.000502589798260098	0.0046489556339059	0	0	22.151785714285715	168.25912133115668	IRS1;EP300;ATM
GO_Biological_Process_2021	cellular response to hypoxia (GO:0071456)	3/131	0.000502589798260098	0.0052037374496776	0	0	22.151785714285715	168.25912133115668	EP300;TP53;MTOR
GO_Biological_Process_2021	positive regulation of phosphatidylinositol 3-kinase activity (GO:0043552)	2/28	0.0005118017005884158	0.0052188264317576	0	0	69.75524475524476	528.5754809934051	PDGFRA;IRS1
Reactome_2022	Signaling By NTRKs R-HSA-166520	3/132	0.0005138736641401859	0.0040538922393281	0	0	21.978959025470655	166.4583739539652	IRS1;NTRK3;EP300
GO_Biological_Process_2021	regulation of cell adhesion (GO:0030155)	3/133	0.0005253190192256105	0.0052767119393856	0	0	21.80879120879121	164.6891920243082	ZFHX3;EPHA7;ATM
Reactome_2022	Regulation Of TP53 Activity Thru Acetylation R-HSA-6804758	2/29	0.0005493106201692561	0.0042163301656234	0	0	67.16835016835017	504.2224932837275	EP300;TP53
GO_Biological_Process_2021	beta-catenin-TCF complex assembly (GO:1904837)	2/29	0.0005493106201692561	0.0054365595202045	0	0	67.16835016835017	504.2224932837275	EP300;SMARCA4
GO_Biological_Process_2021	positive regulation of transcription by RNA polymerase II (GO:0045944)	6/908	0.000573353983990952	0.0055922787134189	0	0	7.048780487804878	52.61214872726023	ZFHX3;EP300;ATM;CDK12;TP53;SMARCA4
GO_Biological_Process_2021	positive regulation of lipid kinase activity (GO:0090218)	2/30	0.0005881163648560729	0.0056543187649733	0	0	64.76623376623377	481.769182294251	PDGFRA;IRS1
KEGG_2021_Human	Human papillomavirus infection	4/331	0.0006025114044968272	0.0051445204537806	0	0	12.017737003058103	89.10435687562422	EP300;ATM;TP53;MTOR
GO_Biological_Process_2021	activation of protein kinase B activity (GO:0032148)	2/31	0.000628216029972281	0.0059425219025193	0	0	62.529780564263326	461.00871434329	NTRK3;MTOR
GO_Biological_Process_2021	chromatin organization (GO:0006325)	3/142	0.0006357527146826035	0.0059425219025193	0	0	20.387461459403905	150.0660055790807	KDM5C;ARID1A;SMARCA4
GO_Biological_Process_2021	negative regulation of cell migration (GO:0030336)	3/144	0.0006621504024195333	0.0060898016180829	0	0	20.096251266464034	147.10491766394088	PTPRT;NF1;ARID2
GO_Biological_Process_2021	modulation by host of symbiont process (GO:0051851)	2/32	0.0006696067158070427	0.0060898016180829	0	0	60.442424242424245	441.7627997111452	EP300;SMARCA4
GO_Biological_Process_2021	phosphatidylinositol 3-kinase signaling (GO:0014065)	2/34	0.000756249572304744	0.0066508537024565	0	0	56.65909090909091	407.2167684458615	IRS1;NF1
GO_Biological_Process_2021	positive regulation of pri-miRNA transcription by RNA polymerase II (GO:1902895)	2/34	0.000756249572304744	0.0066508537024565	0	0	56.65909090909091	407.2167684458615	TP53;SMARCA4
GO_Biological_Process_2021	positive regulation of cellular process (GO:0048522)	5/625	0.0007609446286614422	0.0066508537024565	0	0	8.215619694397283	58.995953949013185	PDGFRA;ZFHX3;IRS1;NTRK3;ATM
KEGG_2021_Human	PI3K-Akt signaling pathway	4/354	0.0007747619076066085	0.0061427551245952	0	0	11.214857142857143	80.33151471081355	PDGFRA;IRS1;TP53;MTOR
GO_Biological_Process_2021	regulation of phosphatidylinositol 3-kinase activity (GO:0043551)	2/35	0.0008014959660444926	0.0069154716044608	0	0	54.93939393939394	391.66462157966185	PDGFRA;IRS1
KEGG_2021_Human	Cellular senescence	3/156	0.0008353133639175971	0.0061813188929902	0	0	18.50887021475257	131.1853863748443	ATM;TP53;MTOR
GO_Biological_Process_2021	regulation of androgen receptor signaling pathway (GO:0060765)	2/36	0.0008480218264323183	0.0071339836148618	0	0	53.32085561497326	377.1173065055224	EP300;SMARCA4
Reactome_2022	HSF1-dependent Transactivation R-HSA-3371571	2/36	0.0008480218264323183	0.0063378473343889	0	0	53.32085561497326	377.1173065055224	EP300;MTOR
GO_Biological_Process_2021	intrinsic apoptotic signaling pathway by p53 class mediator (GO:0072332)	2/36	0.0008480218264323183	0.0071339836148618	0	0	53.32085561497326	377.1173065055224	EP300;TP53
GO_Biological_Process_2021	regulation of actin cytoskeleton reorganization (GO:2000249)	2/37	0.0008958242762467574	0.0074430831841242	0	0	51.79480519480519	363.4838376075078	PDGFRA;NTRK3
KEGG_2021_Human	JAK-STAT signaling pathway	3/162	0.0009317187931565796	0.0064637991275237	0	0	17.80503144654088	124.25204717600278	PDGFRA;EP300;MTOR
GO_Biological_Process_2021	regulation of neuron projection development (GO:0010975)	3/165	0.0009824607924292772	0.0080633672354256	0	0	17.472663139329807	121.00605705144206	NTRK3;EP300;EPHA3
GO_Biological_Process_2021	regulation of MAPK cascade (GO:0043408)	3/166	0.0009997567321736792	0.0081064612138901	0	0	17.364592462751972	119.95458001250672	EPHA7;NTRK3;NF1
GO_Biological_Process_2021	positive regulation of macromolecule metabolic process (GO:0010604)	4/384	0.001048589650058	0.0084012004105838	0	0	10.313684210526317	70.75506275914125	NTRK3;ATM;TP53;MTOR
GO_Biological_Process_2021	cellular protein modification process (GO:0006464)	6/1025	0.0010835702243069	0.0085793265995127	0	0	6.20117762512267	42.338502573429565	PTPRT;PTPRD;KEAP1;ATM;CDK12;MTOR
GO_Biological_Process_2021	neuron differentiation (GO:0030182)	3/174	0.0011451211495162	0.0089260298654611	0	0	16.545530492898912	112.05038350783684	ALK;EPHA5;PTPRD
GO_Biological_Process_2021	ATP-dependent chromatin remodeling (GO:0043044)	2/42	0.0011538849900373	0.0089260298654611	0	0	45.30909090909091	306.4988177902879	ARID1A;SMARCA4
GO_Biological_Process_2021	positive regulation of phospholipase C activity (GO:0010863)	2/43	0.0012092868136118	0.0091443823096715	0	0	44.20177383592018	296.9353391905164	PDGFRA;NTRK3
