Gene_set	Term	Overlap	P-value	Adjusted P-value	Old P-value	Old Adjusted P-value	Odds Ratio	Combined Score	Genes
GO_Biological_Process_2021	positive regulation of positive chemotaxis (GO:0050927)	1/17	0.0202131865779684	0.0464282408429104	0	0	54.23913043478261	211.60963296162683	NTRK3
GO_Biological_Process_2021	positive regulation of transcription of Notch receptor target (GO:0007221)	1/17	0.0202131865779684	0.0464282408429104	0	0	54.23913043478261	211.60963296162683	EP300
GO_Biological_Process_2021	regulation of neuroblast proliferation (GO:1902692)	1/17	0.0202131865779684	0.0464282408429104	0	0	54.23913043478261	211.60963296162683	NF1
GO_Biological_Process_2021	vasculature development (GO:0001944)	1/17	0.0202131865779684	0.0464282408429104	0	0	54.23913043478261	211.60963296162683	PDGFRA
Reactome_2022	Mitotic G2-G2/M Phases R-HSA-453274	2/184	0.0203441002430925	0.051130305035737	0	0	9.887112887112886	38.50995195743669	EP300;TP53
Reactome_2022	Regulation Of NF-kappa B Signaling R-HSA-9758274	1/18	0.0213899261577365	0.0523684399034238	0	0	51.0460358056266	196.26359569838613	TP53
Reactome_2022	MECP2 Regulates Neuronal Receptors And Channels R-HSA-9022699	1/18	0.0213899261577365	0.0523684399034238	0	0	51.0460358056266	196.26359569838613	GRIN2A
GO_Biological_Process_2021	regulation of telomere maintenance via telomere lengthening (GO:1904356)	1/18	0.0213899261577365	0.0475096379675137	0	0	51.0460358056266	196.26359569838613	ATM
Reactome_2022	RORA Activates Gene Expression R-HSA-1368082	1/18	0.0213899261577365	0.0523684399034238	0	0	51.0460358056266	196.26359569838613	EP300
GO_Biological_Process_2021	negative regulation of lipid catabolic process (GO:0050995)	1/18	0.0213899261577365	0.0475096379675137	0	0	51.0460358056266	196.26359569838613	ALK
GO_Biological_Process_2021	negative regulation of peptide hormone secretion (GO:0090278)	1/18	0.0213899261577365	0.0475096379675137	0	0	51.0460358056266	196.26359569838613	IRS1
GO_Biological_Process_2021	positive regulation of CREB transcription factor activity (GO:0032793)	1/18	0.0213899261577365	0.0475096379675137	0	0	51.0460358056266	196.26359569838613	EPHA5
GO_Biological_Process_2021	positive regulation of phosphoprotein phosphatase activity (GO:0032516)	1/18	0.0213899261577365	0.0475096379675137	0	0	51.0460358056266	196.26359569838613	MTOR
GO_Biological_Process_2021	presynapse assembly (GO:0099054)	1/18	0.0213899261577365	0.0475096379675137	0	0	51.0460358056266	196.26359569838613	PTPRD
GO_Biological_Process_2021	regulation of presynapse assembly (GO:1905606)	1/18	0.0213899261577365	0.0475096379675137	0	0	51.0460358056266	196.26359569838613	PTPRD
GO_Biological_Process_2021	regulation of presynapse organization (GO:0099174)	1/18	0.0213899261577365	0.0475096379675137	0	0	51.0460358056266	196.26359569838613	PTPRD
GO_Biological_Process_2021	regulation of production of miRNAs involved in gene silencing by miRNA (GO:1903798)	1/18	0.0213899261577365	0.0475096379675137	0	0	51.0460358056266	196.26359569838613	TP53
GO_Biological_Process_2021	intracellular estrogen receptor signaling pathway (GO:0030520)	1/18	0.0213899261577365	0.0475096379675137	0	0	51.0460358056266	196.26359569838613	ARID1A
KEGG_2021_Human	Transcriptional misregulation in cancer	2/192	0.0220283558432485	0.0461348584641619	0	0	9.466985645933017	36.12057137527057	ATM;TP53
GO_Biological_Process_2021	DNA double-strand break processing (GO:0000729)	1/19	0.0225653114296027	0.0493066707536449	0	0	48.207729468599034	182.7719626724847	ATM
GO_Biological_Process_2021	regulation of oligodendrocyte differentiation (GO:0048713)	1/19	0.0225653114296027	0.0493066707536449	0	0	48.207729468599034	182.7719626724847	NF1
GO_Biological_Process_2021	excitatory postsynaptic potential (GO:0060079)	1/19	0.0225653114296027	0.0493066707536449	0	0	48.207729468599034	182.7719626724847	GRIN2A
Reactome_2022	Nuclear Events Stimulated By ALK Signaling In Cancer R-HSA-9725371	1/19	0.0225653114296027	0.0538533482857745	0	0	48.207729468599034	182.7719626724847	ALK
Reactome_2022	Signaling By PDGFR In Disease R-HSA-9671555	1/19	0.0225653114296027	0.0538533482857745	0	0	48.207729468599034	182.7719626724847	PDGFRA
Reactome_2022	SUMOylation Of Transcription Factors R-HSA-3232118	1/19	0.0225653114296027	0.0538533482857745	0	0	48.207729468599034	182.7719626724847	TP53
GO_Biological_Process_2021	response to fatty acid (GO:0070542)	1/19	0.0225653114296027	0.0493066707536449	0	0	48.207729468599034	182.7719626724847	IRS1
GO_Biological_Process_2021	positive regulation of actin cytoskeleton reorganization (GO:2000251)	1/19	0.0225653114296027	0.0493066707536449	0	0	48.207729468599034	182.7719626724847	NTRK3
Reactome_2022	TCF Dependent Signaling In Response To WNT R-HSA-201681	2/198	0.0233285705497785	0.0548127939681725	0	0	9.174397031539888	34.478085571504906	EP300;SMARCA4
Reactome_2022	Axon Guidance R-HSA-422475	3/519	0.023458560224707	0.0548127939681725	0	0	5.387596899224806	20.217064087980663	EPHA5;EPHA7;EPHA3
GO_Biological_Process_2021	eye morphogenesis (GO:0048592)	1/20	0.0237393438664972	0.0510433815404237	0	0	45.66819221967963	170.827422984315	NF1
GO_Biological_Process_2021	positive regulation of dendrite morphogenesis (GO:0050775)	1/20	0.0237393438664972	0.0510433815404237	0	0	45.66819221967963	170.827422984315	PTPRD
GO_Biological_Process_2021	hepaticobiliary system development (GO:0061008)	1/20	0.0237393438664972	0.0510433815404237	0	0	45.66819221967963	170.827422984315	NF1
GO_Biological_Process_2021	granulocyte differentiation (GO:0030851)	1/20	0.0237393438664972	0.0510433815404237	0	0	45.66819221967963	170.827422984315	EP300
Reactome_2022	CD209 (DC-SIGN) Signaling R-HSA-5621575	1/20	0.0237393438664972	0.0548127939681725	0	0	45.66819221967963	170.827422984315	EP300
Reactome_2022	NOTCH4 Intracellular Domain Regulates Transcription R-HSA-9013695	1/20	0.0237393438664972	0.0548127939681725	0	0	45.66819221967963	170.827422984315	EP300
GO_Biological_Process_2021	embryonic digestive tract development (GO:0048566)	1/20	0.0237393438664972	0.0510433815404237	0	0	45.66819221967963	170.827422984315	PDGFRA
Reactome_2022	Ub-specific Processing Proteases R-HSA-5689880	2/201	0.0239904078806052	0.0548450781837209	0	0	9.034719049794427	33.70041637079752	KEAP1;TP53
Reactome_2022	Immune System R-HSA-168256	6/1943	0.0242725899141692	0.0548450781837209	0	0	3.104284976768198	11.542996702302124	IRS1;KEAP1;EP300;TP53;MTOR;SMARCA4
KEGG_2021_Human	Viral carcinogenesis	2/203	0.0244359367200017	0.0493161631985489	0	0	8.943916779737675	33.197139612521894	EP300;TP53
KEGG_2021_Human	Diabetic cardiomyopathy	2/203	0.0244359367200017	0.0493161631985489	0	0	8.943916779737675	33.197139612521894	IRS1;MTOR
Reactome_2022	Signaling By NOTCH R-HSA-157118	2/203	0.0244359367200017	0.0548450781837209	0	0	8.943916779737675	33.197139612521894	EP300;TP53
KEGG_2021_Human	Proteoglycans in cancer	2/205	0.0248848882219672	0.0493254034399708	0	0	8.854903716972682	32.705538694372066	TP53;MTOR
GO_Biological_Process_2021	autonomic nervous system development (GO:0048483)	1/21	0.0249120249496479	0.0515870547418862	0	0	43.38260869565217	160.18614661402282	NF1
GO_Biological_Process_2021	mitotic spindle checkpoint signaling (GO:0071174)	1/21	0.0249120249496479	0.0515870547418862	0	0	43.38260869565217	160.18614661402282	ATM
GO_Biological_Process_2021	mitotic spindle assembly checkpoint signaling (GO:0007094)	1/21	0.0249120249496479	0.0515870547418862	0	0	43.38260869565217	160.18614661402282	ATM
GO_Biological_Process_2021	positive regulation of transcription regulatory region DNA binding (GO:2000679)	1/21	0.0249120249496479	0.0515870547418862	0	0	43.38260869565217	160.18614661402282	EP300
GO_Biological_Process_2021	positive regulation of transcription from RNA polymerase II promoter involved in cellular response to chemical stimulus (GO:1901522)	1/21	0.0249120249496479	0.0515870547418862	0	0	43.38260869565217	160.18614661402282	EP300
GO_Biological_Process_2021	regulation of lipid catabolic process (GO:0050994)	1/21	0.0249120249496479	0.0515870547418862	0	0	43.38260869565217	160.18614661402282	ALK
GO_Biological_Process_2021	long-term synaptic potentiation (GO:0060291)	1/21	0.0249120249496479	0.0515870547418862	0	0	43.38260869565217	160.18614661402282	GRIN2A
GO_Biological_Process_2021	positive regulation of phosphatase activity (GO:0010922)	1/21	0.0249120249496479	0.0515870547418862	0	0	43.38260869565217	160.18614661402282	MTOR
GO_Biological_Process_2021	spindle assembly checkpoint signaling (GO:0071173)	1/21	0.0249120249496479	0.0515870547418862	0	0	43.38260869565217	160.18614661402282	ATM
GO_Biological_Process_2021	regulation of cell-substrate junction assembly (GO:0090109)	1/21	0.0249120249496479	0.0515870547418862	0	0	43.38260869565217	160.18614661402282	EPHA3
GO_Biological_Process_2021	calcium ion transport into cytosol (GO:0060402)	1/21	0.0249120249496479	0.0515870547418862	0	0	43.38260869565217	160.18614661402282	GRIN2A
GO_Biological_Process_2021	regulation of transcription by RNA polymerase III (GO:0006359)	1/21	0.0249120249496479	0.0515870547418862	0	0	43.38260869565217	160.18614661402282	MTOR
Reactome_2022	Unblocking Of NMDA Receptors, Glutamate Binding And Activation R-HSA-438066	1/21	0.0249120249496479	0.0548450781837209	0	0	43.38260869565217	160.18614661402282	GRIN2A
Reactome_2022	Negative Regulation Of NMDA Receptor-Mediated Neuronal Transmission R-HSA-9617324	1/21	0.0249120249496479	0.0548450781837209	0	0	43.38260869565217	160.18614661402282	GRIN2A
Reactome_2022	TP53 Regulates Transcription Of Additional Cell Cycle Genes With Uncertain Roles In P53 Pathway R-HSA-6804115	1/21	0.0249120249496479	0.0548450781837209	0	0	43.38260869565217	160.18614661402282	TP53
KEGG_2021_Human	Rap1 signaling pathway	2/210	0.0260221263770835	0.0506746671553732	0	0	8.63986013986014	31.52519156066381	PDGFRA;GRIN2A
GO_Biological_Process_2021	negative regulation of B cell activation (GO:0050869)	1/22	0.0260833561592032	0.0522443413545945	0	0	41.31469979296066	150.65231192236567	ATM
GO_Biological_Process_2021	regulation of adenylate cyclase activity (GO:0045761)	1/22	0.0260833561592032	0.0522443413545945	0	0	41.31469979296066	150.65231192236567	NF1
GO_Biological_Process_2021	positive regulation of lipid catabolic process (GO:0050996)	1/22	0.0260833561592032	0.0522443413545945	0	0	41.31469979296066	150.65231192236567	IRS1
GO_Biological_Process_2021	negative regulation of phosphate metabolic process (GO:0045936)	1/22	0.0260833561592032	0.0522443413545945	0	0	41.31469979296066	150.65231192236567	TP53
GO_Biological_Process_2021	regulation of execution phase of apoptosis (GO:1900117)	1/22	0.0260833561592032	0.0522443413545945	0	0	41.31469979296066	150.65231192236567	TP53
GO_Biological_Process_2021	negative regulation of small molecule metabolic process (GO:0062014)	1/22	0.0260833561592032	0.0522443413545945	0	0	41.31469979296066	150.65231192236567	EP300
GO_Biological_Process_2021	cellular response to nerve growth factor stimulus (GO:1990090)	1/22	0.0260833561592032	0.0522443413545945	0	0	41.31469979296066	150.65231192236567	NTRK3
GO_Biological_Process_2021	regulation of platelet activation (GO:0010543)	1/22	0.0260833561592032	0.0522443413545945	0	0	41.31469979296066	150.65231192236567	PDGFRA
GO_Biological_Process_2021	negative regulation of mitotic metaphase/anaphase transition (GO:0045841)	1/22	0.0260833561592032	0.0522443413545945	0	0	41.31469979296066	150.65231192236567	ATM
GO_Biological_Process_2021	positive regulation of signal transduction by p53 class mediator (GO:1901798)	1/22	0.0260833561592032	0.0522443413545945	0	0	41.31469979296066	150.65231192236567	ATM
GO_Biological_Process_2021	positive regulation of translational initiation (GO:0045948)	1/22	0.0260833561592032	0.0522443413545945	0	0	41.31469979296066	150.65231192236567	MTOR
KEGG_2021_Human	Human immunodeficiency virus 1 infection	2/212	0.0264829197162943	0.0506828291122184	0	0	8.556709956709957	31.071598319277047	ATM;MTOR
GO_Biological_Process_2021	negative regulation of cellular macromolecule biosynthetic process (GO:2000113)	3/547	0.0268779270784417	0.0533183056047533	0	0	5.102941176470588	18.45453102528947	KDM5C;TP53;SMARCA4
GO_Biological_Process_2021	positive regulation of GTPase activity (GO:0043547)	2/214	0.0269470573977443	0.0533183056047533	0	0	8.475128644939966	30.628107866128612	NTRK3;NF1
GO_Biological_Process_2021	response to nutrient levels (GO:0031667)	1/23	0.0272533389718204	0.0533183056047533	0	0	39.43478260869565	142.06692893534887	MTOR
Reactome_2022	CD28 Dependent PI3K/Akt Signaling R-HSA-389357	1/23	0.0272533389718204	0.0590835745648626	0	0	39.43478260869565	142.06692893534887	MTOR
Reactome_2022	Long-term Potentiation R-HSA-9620244	1/23	0.0272533389718204	0.0590835745648626	0	0	39.43478260869565	142.06692893534887	GRIN2A
GO_Biological_Process_2021	regulation of telomere capping (GO:1904353)	1/23	0.0272533389718204	0.0533183056047533	0	0	39.43478260869565	142.06692893534887	ATM
GO_Biological_Process_2021	artery development (GO:0060840)	1/23	0.0272533389718204	0.0533183056047533	0	0	39.43478260869565	142.06692893534887	NF1
GO_Biological_Process_2021	regulation of cysteine-type endopeptidase activity (GO:2000116)	1/23	0.0272533389718204	0.0533183056047533	0	0	39.43478260869565	142.06692893534887	EPHA7
GO_Biological_Process_2021	positive regulation of transcription initiation from RNA polymerase II promoter (GO:0060261)	1/23	0.0272533389718204	0.0533183056047533	0	0	39.43478260869565	142.06692893534887	TP53
GO_Biological_Process_2021	regulation of protein export from nucleus (GO:0046825)	1/23	0.0272533389718204	0.0533183056047533	0	0	39.43478260869565	142.06692893534887	TP53
KEGG_2021_Human	cAMP signaling pathway	2/216	0.0274145221746449	0.0515764739217897	0	0	8.395072217502124	30.194408488211764	GRIN2A;EP300
GO_Biological_Process_2021	cardiac muscle cell development (GO:0055013)	1/24	0.0284219748654964	0.0543408780809065	0	0	37.71833648393195	134.2996324147713	PDGFRA
GO_Biological_Process_2021	DNA packaging (GO:0006323)	1/24	0.0284219748654964	0.0543408780809065	0	0	37.71833648393195	134.2996324147713	TP53
GO_Biological_Process_2021	positive regulation of transforming growth factor beta receptor signaling pathway (GO:0030511)	1/24	0.0284219748654964	0.0543408780809065	0	0	37.71833648393195	134.2996324147713	EP300
GO_Biological_Process_2021	positive regulation of transcription from RNA polymerase II promoter in response to stress (GO:0036003)	1/24	0.0284219748654964	0.0543408780809065	0	0	37.71833648393195	134.2996324147713	TP53
GO_Biological_Process_2021	regulation of cell size (GO:0008361)	1/24	0.0284219748654964	0.0543408780809065	0	0	37.71833648393195	134.2996324147713	MTOR
GO_Biological_Process_2021	negative regulation of lipid metabolic process (GO:0045833)	1/24	0.0284219748654964	0.0543408780809065	0	0	37.71833648393195	134.2996324147713	ALK
GO_Biological_Process_2021	endocrine system development (GO:0035270)	1/24	0.0284219748654964	0.0543408780809065	0	0	37.71833648393195	134.2996324147713	NF1
GO_Biological_Process_2021	positive regulation of cellular response to transforming growth factor beta stimulus (GO:1903846)	1/24	0.0284219748654964	0.0543408780809065	0	0	37.71833648393195	134.2996324147713	EP300
Reactome_2022	Defective Intrinsic Pathway For Apoptosis R-HSA-9734009	1/24	0.0284219748654964	0.0597914137911184	0	0	37.71833648393195	134.2996324147713	TP53
Reactome_2022	mTORC1-mediated Signaling R-HSA-166208	1/24	0.0284219748654964	0.0597914137911184	0	0	37.71833648393195	134.2996324147713	MTOR
Reactome_2022	Impaired BRCA2 Binding To PALB2 R-HSA-9709603	1/24	0.0284219748654964	0.0597914137911184	0	0	37.71833648393195	134.2996324147713	ATM
Reactome_2022	Growth Hormone Receptor Signaling R-HSA-982772	1/24	0.0284219748654964	0.0597914137911184	0	0	37.71833648393195	134.2996324147713	IRS1
GO_Biological_Process_2021	negative regulation of cellular process (GO:0048523)	3/566	0.0293443183096023	0.0551622591582409	0	0	4.925907130170008	17.38183340270165	ARID2;TP53;SMARCA4
GO_Biological_Process_2021	cAMP-mediated signaling (GO:0019933)	1/25	0.0295892653137072	0.0551622591582409	0	0	36.14492753623188	127.2425658336615	EPHA5
GO_Biological_Process_2021	positive regulation of lipid metabolic process (GO:0045834)	1/25	0.0295892653137072	0.0551622591582409	0	0	36.14492753623188	127.2425658336615	MTOR
GO_Biological_Process_2021	negative regulation of endocytosis (GO:0045806)	1/25	0.0295892653137072	0.0551622591582409	0	0	36.14492753623188	127.2425658336615	EPHA3
GO_Biological_Process_2021	positive regulation of DNA-templated transcription, elongation (GO:0032786)	1/25	0.0295892653137072	0.0551622591582409	0	0	36.14492753623188	127.2425658336615	CDK12
GO_Biological_Process_2021	chemical synaptic transmission, postsynaptic (GO:0099565)	1/25	0.0295892653137072	0.0551622591582409	0	0	36.14492753623188	127.2425658336615	GRIN2A
GO_Biological_Process_2021	peripheral nervous system development (GO:0007422)	1/25	0.0295892653137072	0.0551622591582409	0	0	36.14492753623188	127.2425658336615	NF1
Reactome_2022	NOTCH3 Intracellular Domain Regulates Transcription R-HSA-9013508	1/25	0.0295892653137072	0.0608938503557453	0	0	36.14492753623188	127.2425658336615	EP300
Reactome_2022	Defective HDR Thru Homologous Recombination (HRR) Due To BRCA1 Loss-Of-Function R-HSA-9701192	1/25	0.0295892653137072	0.0608938503557453	0	0	36.14492753623188	127.2425658336615	ATM
Reactome_2022	Assembly And Cell Surface Presentation Of NMDA Receptors R-HSA-9609736	1/25	0.0295892653137072	0.0608938503557453	0	0	36.14492753623188	127.2425658336615	GRIN2A
GO_Biological_Process_2021	negative regulation of cellular carbohydrate metabolic process (GO:0010677)	1/25	0.0295892653137072	0.0551622591582409	0	0	36.14492753623188	127.2425658336615	EP300
GO_Biological_Process_2021	positive regulation of release of cytochrome c from mitochondria (GO:0090200)	1/25	0.0295892653137072	0.0551622591582409	0	0	36.14492753623188	127.2425658336615	TP53
Reactome_2022	Pyroptosis R-HSA-5620971	1/26	0.0307552117947077	0.0615104235894154	0	0	34.697391304347825	120.8057619164666	TP53
GO_Biological_Process_2021	glial cell development (GO:0021782)	1/26	0.0307552117947077	0.0557904515844697	0	0	34.697391304347825	120.8057619164666	NF1
Reactome_2022	Constitutive Signaling By AKT1 E17K In Cancer R-HSA-5674400	1/26	0.0307552117947077	0.0615104235894154	0	0	34.697391304347825	120.8057619164666	MTOR
Reactome_2022	HDMs Demethylate Histones R-HSA-3214842	1/26	0.0307552117947077	0.0615104235894154	0	0	34.697391304347825	120.8057619164666	KDM5C
GO_Biological_Process_2021	regulation of protein insertion into mitochondrial membrane involved in apoptotic signaling pathway (GO:1900739)	1/26	0.0307552117947077	0.0557904515844697	0	0	34.697391304347825	120.8057619164666	TP53
GO_Biological_Process_2021	metanephros development (GO:0001656)	1/26	0.0307552117947077	0.0557904515844697	0	0	34.697391304347825	120.8057619164666	NF1
GO_Biological_Process_2021	TOR signaling (GO:0031929)	1/26	0.0307552117947077	0.0557904515844697	0	0	34.697391304347825	120.8057619164666	MTOR
GO_Biological_Process_2021	histone lysine demethylation (GO:0070076)	1/26	0.0307552117947077	0.0557904515844697	0	0	34.697391304347825	120.8057619164666	KDM5C
GO_Biological_Process_2021	regulation of glycogen biosynthetic process (GO:0005979)	1/26	0.0307552117947077	0.0557904515844697	0	0	34.697391304347825	120.8057619164666	IRS1
GO_Biological_Process_2021	cellular response to drug (GO:0035690)	1/26	0.0307552117947077	0.0557904515844697	0	0	34.697391304347825	120.8057619164666	TP53
Reactome_2022	Attenuation Phase R-HSA-3371568	1/26	0.0307552117947077	0.0615104235894154	0	0	34.697391304347825	120.8057619164666	EP300
GO_Biological_Process_2021	positive regulation of glucose import (GO:0046326)	1/26	0.0307552117947077	0.0557904515844697	0	0	34.697391304347825	120.8057619164666	IRS1
GO_Biological_Process_2021	negative regulation of macroautophagy (GO:0016242)	1/26	0.0307552117947077	0.0557904515844697	0	0	34.697391304347825	120.8057619164666	MTOR
GO_Biological_Process_2021	positive regulation of protein insertion into mitochondrial membrane involved in apoptotic signaling pathway (GO:1900740)	1/26	0.0307552117947077	0.0557904515844697	0	0	34.697391304347825	120.8057619164666	TP53
GO_Biological_Process_2021	apoptotic process (GO:0006915)	2/231	0.0310248336779126	0.0561282609280516	0	0	7.839221913457721	27.22536143195465	EP300;MTOR
Reactome_2022	VEGFR2 Mediated Vascular Permeability R-HSA-5218920	1/27	0.0319198157870248	0.0629529700244101	0	0	33.36120401337793	114.91361059553886	MTOR
Reactome_2022	Resolution Of D-loop Structures Thru Synthesis-Dependent Strand Annealing (SDSA) R-HSA-5693554	1/27	0.0319198157870248	0.0629529700244101	0	0	33.36120401337793	114.91361059553886	ATM
GO_Biological_Process_2021	entrainment of circadian clock by photoperiod (GO:0043153)	1/27	0.0319198157870248	0.0566808338381734	0	0	33.36120401337793	114.91361059553886	TP53
GO_Biological_Process_2021	positive regulation of gene silencing by miRNA (GO:2000637)	1/27	0.0319198157870248	0.0566808338381734	0	0	33.36120401337793	114.91361059553886	TP53
GO_Biological_Process_2021	camera-type eye development (GO:0043010)	1/27	0.0319198157870248	0.0566808338381734	0	0	33.36120401337793	114.91361059553886	NF1
GO_Biological_Process_2021	negative regulation of insulin receptor signaling pathway (GO:0046627)	1/27	0.0319198157870248	0.0566808338381734	0	0	33.36120401337793	114.91361059553886	IRS1
GO_Biological_Process_2021	regulation of vasculature development (GO:1901342)	1/27	0.0319198157870248	0.0566808338381734	0	0	33.36120401337793	114.91361059553886	NF1
GO_Biological_Process_2021	negative regulation of catalytic activity (GO:0043086)	1/27	0.0319198157870248	0.0566808338381734	0	0	33.36120401337793	114.91361059553886	TP53
GO_Biological_Process_2021	regulation of transcription elongation from RNA polymerase II promoter (GO:0034243)	1/27	0.0319198157870248	0.0566808338381734	0	0	33.36120401337793	114.91361059553886	CDK12
Reactome_2022	Downstream Signal Transduction R-HSA-186763	1/28	0.0330830787572745	0.0643533860757943	0	0	32.12399355877617	109.5021279575476	PDGFRA
Reactome_2022	TRAF6 Mediated IRF7 Activation R-HSA-933541	1/28	0.0330830787572745	0.0643533860757943	0	0	32.12399355877617	109.5021279575476	EP300
GO_Biological_Process_2021	cellular response to interleukin-6 (GO:0071354)	1/28	0.0330830787572745	0.057089517958066	0	0	32.12399355877617	109.5021279575476	PTPRT
GO_Biological_Process_2021	negative regulation of cellular response to insulin stimulus (GO:1900077)	1/28	0.0330830787572745	0.057089517958066	0	0	32.12399355877617	109.5021279575476	IRS1
GO_Biological_Process_2021	photoperiodism (GO:0009648)	1/28	0.0330830787572745	0.057089517958066	0	0	32.12399355877617	109.5021279575476	TP53
GO_Biological_Process_2021	positive regulation of synapse assembly (GO:0051965)	1/28	0.0330830787572745	0.057089517958066	0	0	32.12399355877617	109.5021279575476	PTPRD
GO_Biological_Process_2021	macromolecule catabolic process (GO:0009057)	1/28	0.0330830787572745	0.057089517958066	0	0	32.12399355877617	109.5021279575476	MTOR
GO_Biological_Process_2021	regulation of insulin secretion involved in cellular response to glucose stimulus (GO:0061178)	1/28	0.0330830787572745	0.057089517958066	0	0	32.12399355877617	109.5021279575476	EPHA5
GO_Biological_Process_2021	internal peptidyl-lysine acetylation (GO:0018393)	1/28	0.0330830787572745	0.057089517958066	0	0	32.12399355877617	109.5021279575476	EP300
GO_Biological_Process_2021	cellular response to acid chemical (GO:0071229)	1/28	0.0330830787572745	0.057089517958066	0	0	32.12399355877617	109.5021279575476	MTOR
GO_Biological_Process_2021	positive regulation of fibroblast proliferation (GO:0048146)	1/28	0.0330830787572745	0.057089517958066	0	0	32.12399355877617	109.5021279575476	PDGFRA
GO_Biological_Process_2021	histone mRNA metabolic process (GO:0008334)	1/28	0.0330830787572745	0.057089517958066	0	0	32.12399355877617	109.5021279575476	ATM
GO_Biological_Process_2021	regulation of DNA damage response, signal transduction by p53 class mediator (GO:0043516)	1/28	0.0330830787572745	0.057089517958066	0	0	32.12399355877617	109.5021279575476	ATM
GO_Biological_Process_2021	negative regulation of transferase activity (GO:0051348)	1/29	0.0342450021823671	0.0586434770196771	0	0	30.975155279503102	104.51682262493934	TP53
GO_Biological_Process_2021	regulation of gluconeogenesis (GO:0006111)	1/29	0.0342450021823671	0.0586434770196771	0	0	30.975155279503102	104.51682262493934	EP300
GO_Biological_Process_2021	regulation of DNA biosynthetic process (GO:2000278)	1/29	0.0342450021823671	0.0586434770196771	0	0	30.975155279503102	104.51682262493934	ATM
Reactome_2022	Energy Dependent Regulation Of mTOR By LKB1-AMPK R-HSA-380972	1/29	0.0342450021823671	0.065713382566164	0	0	30.975155279503102	104.51682262493934	MTOR
Reactome_2022	EGR2 And SOX10-mediated Initiation Of Schwann Cell Myelination R-HSA-9619665	1/29	0.0342450021823671	0.065713382566164	0	0	30.975155279503102	104.51682262493934	SMARCA4
GO_Biological_Process_2021	positive regulation of DNA recombination (GO:0045911)	1/30	0.035405587532064	0.0601716171946442	0	0	29.90554722638681	99.91101302805887	ARID2
Reactome_2022	Activation Of BH3-only Proteins R-HSA-114452	1/30	0.035405587532064	0.0674844755644711	0	0	29.90554722638681	99.91101302805887	TP53
GO_Biological_Process_2021	response to alcohol (GO:0097305)	1/30	0.035405587532064	0.0601716171946442	0	0	29.90554722638681	99.91101302805887	GRIN2A
GO_Biological_Process_2021	artery morphogenesis (GO:0048844)	1/30	0.035405587532064	0.0601716171946442	0	0	29.90554722638681	99.91101302805887	NF1
Reactome_2022	Metalloprotease DUBs R-HSA-5689901	1/31	0.036564836271725	0.0692294233411328	0	0	28.907246376811596	95.64448851318151	EP300
GO_Biological_Process_2021	protein acetylation (GO:0006473)	1/31	0.036564836271725	0.0616745233355162	0	0	28.907246376811596	95.64448851318151	EP300
