Gene_set	Term	Overlap	P-value	Adjusted P-value	Old P-value	Old Adjusted P-value	Odds Ratio	Combined Score	Genes
GO_Biological_Process_2021	negative regulation of cell growth (GO:0030308)	2/126	0.0099259195632287	0.0369068721881379	0	0	14.55425219941349	67.13302818963572	TP53;SMARCA4
GO_Biological_Process_2021	negative regulation of cell population proliferation (GO:0008285)	3/379	0.0101704895795888	0.0374869280508593	0	0	7.446808510638298	34.16793033346907	NF1;ARID2;TP53
Reactome_2022	Autophagy R-HSA-9612973	2/128	0.0102298935421192	0.0367758198223019	0	0	14.32178932178932	65.62875609266037	ATM;MTOR
GO_Biological_Process_2021	positive regulation of macromolecule biosynthetic process (GO:0010557)	2/129	0.0103834277603468	0.0374869280508593	0	0	14.208303507516106	64.89705468059547	IRS1;MTOR
Reactome_2022	Neuronal System R-HSA-112316	3/386	0.0106872953689665	0.037232876097628	0	0	7.308093994778068	33.16924322995538	PTPRD;GRIN2A;NTRK3
GO_Biological_Process_2021	phosphorylation of RNA polymerase II C-terminal domain (GO:0070816)	1/9	0.0107503374648081	0.0374869280508593	0	0	108.52173913043478	491.9093069362491	CDK12
GO_Biological_Process_2021	regulation of RNA polymerase II regulatory region sequence-specific DNA binding (GO:1903025)	1/9	0.0107503374648081	0.0374869280508593	0	0	108.52173913043478	491.9093069362491	EP300
GO_Biological_Process_2021	anoikis (GO:0043276)	1/9	0.0107503374648081	0.0374869280508593	0	0	108.52173913043478	491.9093069362491	MTOR
GO_Biological_Process_2021	negative regulation of glial cell differentiation (GO:0045686)	1/9	0.0107503374648081	0.0374869280508593	0	0	108.52173913043478	491.9093069362491	NF1
GO_Biological_Process_2021	positive regulation of fatty acid beta-oxidation (GO:0032000)	1/9	0.0107503374648081	0.0374869280508593	0	0	108.52173913043478	491.9093069362491	IRS1
GO_Biological_Process_2021	Schwann cell development (GO:0014044)	1/9	0.0107503374648081	0.0374869280508593	0	0	108.52173913043478	491.9093069362491	NF1
GO_Biological_Process_2021	regulation of helicase activity (GO:0051095)	1/9	0.0107503374648081	0.0374869280508593	0	0	108.52173913043478	491.9093069362491	TP53
GO_Biological_Process_2021	peripheral nervous system axon ensheathment (GO:0032292)	1/9	0.0107503374648081	0.0374869280508593	0	0	108.52173913043478	491.9093069362491	NF1
GO_Biological_Process_2021	embryonic digestive tract morphogenesis (GO:0048557)	1/9	0.0107503374648081	0.0374869280508593	0	0	108.52173913043478	491.9093069362491	PDGFRA
GO_Biological_Process_2021	regulation of protein deacetylation (GO:0090311)	1/9	0.0107503374648081	0.0374869280508593	0	0	108.52173913043478	491.9093069362491	EP300
Reactome_2022	PI3K/AKT Activation R-HSA-198203	1/9	0.0107503374648081	0.037232876097628	0	0	108.52173913043478	491.9093069362491	IRS1
Reactome_2022	Activation Of PUMA And Translocation To Mitochondria R-HSA-139915	1/9	0.0107503374648081	0.037232876097628	0	0	108.52173913043478	491.9093069362491	TP53
GO_Biological_Process_2021	regulation of apoptotic process (GO:0042981)	4/742	0.0110499180448091	0.038332963114209	0	0	5.213550135501355	23.4887756552946	ALK;NF1;ATM;TP53
KEGG_2021_Human	Autophagy	2/137	0.0116485087629211	0.0300694063414941	0	0	13.36094276094276	59.49062791002039	IRS1;MTOR
KEGG_2021_Human	Insulin signaling pathway	2/137	0.0116485087629211	0.0300694063414941	0	0	13.36094276094276	59.49062791002039	IRS1;MTOR
Reactome_2022	RUNX3 Regulates p14-ARF R-HSA-8951936	1/10	0.0119379646683197	0.0390905209427804	0	0	96.45893719806764	427.1232267263204	EP300
Reactome_2022	Regulation Of FOXO Transcriptional Activity By Acetylation R-HSA-9617629	1/10	0.0119379646683197	0.0390905209427804	0	0	96.45893719806764	427.1232267263204	EP300
GO_Biological_Process_2021	positive regulation of transcription by RNA polymerase III (GO:0045945)	1/10	0.0119379646683197	0.0385603661250882	0	0	96.45893719806764	427.1232267263204	MTOR
Reactome_2022	STAT3 Nuclear Events Downstream Of ALK Signaling R-HSA-9701898	1/10	0.0119379646683197	0.0390905209427804	0	0	96.45893719806764	427.1232267263204	EP300
GO_Biological_Process_2021	positive regulation of T cell apoptotic process (GO:0070234)	1/10	0.0119379646683197	0.0385603661250882	0	0	96.45893719806764	427.1232267263204	TP53
GO_Biological_Process_2021	hematopoietic stem cell differentiation (GO:0060218)	1/10	0.0119379646683197	0.0385603661250882	0	0	96.45893719806764	427.1232267263204	TP53
GO_Biological_Process_2021	cellular response to leucine starvation (GO:1990253)	1/10	0.0119379646683197	0.0385603661250882	0	0	96.45893719806764	427.1232267263204	MTOR
GO_Biological_Process_2021	smooth muscle tissue development (GO:0048745)	1/10	0.0119379646683197	0.0385603661250882	0	0	96.45893719806764	427.1232267263204	NF1
GO_Biological_Process_2021	cellular response to leucine (GO:0071233)	1/10	0.0119379646683197	0.0385603661250882	0	0	96.45893719806764	427.1232267263204	MTOR
GO_Biological_Process_2021	positive regulation of keratinocyte migration (GO:0051549)	1/10	0.0119379646683197	0.0385603661250882	0	0	96.45893719806764	427.1232267263204	MTOR
GO_Biological_Process_2021	response to leucine (GO:0043201)	1/10	0.0119379646683197	0.0385603661250882	0	0	96.45893719806764	427.1232267263204	MTOR
GO_Biological_Process_2021	adrenal gland development (GO:0030325)	1/10	0.0119379646683197	0.0385603661250882	0	0	96.45893719806764	427.1232267263204	NF1
GO_Biological_Process_2021	regulation of RNA polymerase II transcription preinitiation complex assembly (GO:0045898)	1/10	0.0119379646683197	0.0385603661250882	0	0	96.45893719806764	427.1232267263204	TP53
Reactome_2022	Signal Attenuation R-HSA-74749	1/10	0.0119379646683197	0.0390905209427804	0	0	96.45893719806764	427.1232267263204	IRS1
GO_Biological_Process_2021	negative regulation of telomerase activity (GO:0051974)	1/10	0.0119379646683197	0.0385603661250882	0	0	96.45893719806764	427.1232267263204	TP53
GO_Biological_Process_2021	DNA damage response, signal transduction by p53 class mediator resulting in transcription of p21 class mediator (GO:0006978)	1/10	0.0119379646683197	0.0385603661250882	0	0	96.45893719806764	427.1232267263204	TP53
GO_Biological_Process_2021	peptidyl-lysine acetylation (GO:0018394)	1/10	0.0119379646683197	0.0385603661250882	0	0	96.45893719806764	427.1232267263204	EP300
GO_Biological_Process_2021	presynaptic membrane assembly (GO:0097105)	1/10	0.0119379646683197	0.0385603661250882	0	0	96.45893719806764	427.1232267263204	PTPRD
Reactome_2022	PTEN Regulation R-HSA-6807070	2/139	0.0119749131057109	0.0390905209427804	0	0	13.164565361645652	58.25243017669269	TP53;MTOR
GO_Biological_Process_2021	protein dephosphorylation (GO:0006470)	2/139	0.0119749131057109	0.0385603661250882	0	0	13.164565361645652	58.25243017669269	PTPRT;PTPRD
KEGG_2021_Human	Fluid shear stress and atherosclerosis	2/139	0.0119749131057109	0.0302094398803161	0	0	13.164565361645652	58.25243017669269	KEAP1;TP53
GO_Biological_Process_2021	Ras protein signal transduction (GO:0007265)	2/142	0.0124720407479625	0.0396080894656153	0	0	12.88051948051948	56.47162207610311	NF1;TP53
KEGG_2021_Human	Apoptosis	2/142	0.0124720407479625	0.0305002563408545	0	0	12.88051948051948	56.47162207610311	ATM;TP53
GO_Biological_Process_2021	regulation of transcription by RNA polymerase II (GO:0006357)	7/2206	0.0125262857636727	0.0396080894656153	0	0	3.3287590616055427	14.579718300072008	ZFHX3;EP300;ATM;CDK12;ARID1A;TP53;SMARCA4
GO_Biological_Process_2021	neuron development (GO:0048666)	2/143	0.0126397458709847	0.0396080894656153	0	0	12.788523533204383	55.89747255184229	ALK;EPHA5
KEGG_2021_Human	Spinocerebellar ataxia	2/143	0.0126397458709847	0.0305002563408545	0	0	12.788523533204383	55.89747255184229	GRIN2A;MTOR
Reactome_2022	Regulation Of Gene Expression By Hypoxia-inducible Factor R-HSA-1234158	1/11	0.0131242257813257	0.0409591222186429	0	0	86.80869565217391	376.1677267870623	EP300
Reactome_2022	Pexophagy R-HSA-9664873	1/11	0.0131242257813257	0.0409591222186429	0	0	86.80869565217391	376.1677267870623	ATM
GO_Biological_Process_2021	positive regulation of production of miRNAs involved in gene silencing by miRNA (GO:1903800)	1/11	0.0131242257813257	0.0396080894656153	0	0	86.80869565217391	376.1677267870623	TP53
GO_Biological_Process_2021	chromatin-mediated maintenance of transcription (GO:0048096)	1/11	0.0131242257813257	0.0396080894656153	0	0	86.80869565217391	376.1677267870623	ARID1A
GO_Biological_Process_2021	presynaptic membrane organization (GO:0097090)	1/11	0.0131242257813257	0.0396080894656153	0	0	86.80869565217391	376.1677267870623	PTPRD
GO_Biological_Process_2021	positive regulation of transcription from RNA polymerase II promoter in response to endoplasmic reticulum stress (GO:1990440)	1/11	0.0131242257813257	0.0396080894656153	0	0	86.80869565217391	376.1677267870623	TP53
GO_Biological_Process_2021	nucleus localization (GO:0051647)	1/11	0.0131242257813257	0.0396080894656153	0	0	86.80869565217391	376.1677267870623	MTOR
GO_Biological_Process_2021	DNA damage response, signal transduction resulting in transcription (GO:0042772)	1/11	0.0131242257813257	0.0396080894656153	0	0	86.80869565217391	376.1677267870623	TP53
GO_Biological_Process_2021	negative regulation of receptor signaling pathway via STAT (GO:1904893)	1/11	0.0131242257813257	0.0396080894656153	0	0	86.80869565217391	376.1677267870623	PTPRT
GO_Biological_Process_2021	positive regulation of transcription elongation from RNA polymerase II promoter (GO:0032968)	1/11	0.0131242257813257	0.0396080894656153	0	0	86.80869565217391	376.1677267870623	CDK12
Reactome_2022	Signaling By PDGFRA Extracellular Domain Mutants R-HSA-9673770	1/11	0.0131242257813257	0.0409591222186429	0	0	86.80869565217391	376.1677267870623	PDGFRA
Reactome_2022	Signaling By Leptin R-HSA-2586552	1/11	0.0131242257813257	0.0409591222186429	0	0	86.80869565217391	376.1677267870623	IRS1
GO_Biological_Process_2021	insulin-like growth factor receptor signaling pathway (GO:0048009)	1/11	0.0131242257813257	0.0396080894656153	0	0	86.80869565217391	376.1677267870623	IRS1
GO_Biological_Process_2021	camera-type eye morphogenesis (GO:0048593)	1/11	0.0131242257813257	0.0396080894656153	0	0	86.80869565217391	376.1677267870623	NF1
GO_Biological_Process_2021	positive regulation of dendrite development (GO:1900006)	1/11	0.0131242257813257	0.0396080894656153	0	0	86.80869565217391	376.1677267870623	ALK
KEGG_2021_Human	Breast cancer	2/147	0.0133204813739999	0.0309594050118039	0	0	12.433228840125391	53.69230786103003	TP53;MTOR
Reactome_2022	G2/M Checkpoints R-HSA-69481	2/148	0.0134931319408641	0.0416527116435372	0	0	12.34744707347447	53.16285286593607	ATM;TP53
KEGG_2021_Human	Phospholipase D signaling pathway	2/148	0.0134931319408641	0.0309594050118039	0	0	12.34744707347447	53.16285286593607	PDGFRA;MTOR
KEGG_2021_Human	Gastric cancer	2/149	0.0136667643745801	0.0309594050118039	0	0	12.262832405689547	52.64174410891394	TP53;MTOR
Reactome_2022	DNA Double-Strand Break Repair R-HSA-5693532	2/149	0.0136667643745801	0.0417350654019436	0	0	12.262832405689547	52.64174410891394	ATM;TP53
GO_Biological_Process_2021	negative regulation of protein phosphorylation (GO:0001933)	2/152	0.0141935289211861	0.0413306406816902	0	0	12.015757575757576	51.12667753459452	NTRK3;NF1
GO_Biological_Process_2021	regulation of nucleic acid-templated transcription (GO:1903506)	3/430	0.0142856338496551	0.0413306406816902	0	0	6.540314486450318	27.78653180269294	ZFHX3;EP300;TP53
GO_Biological_Process_2021	mRNA transcription (GO:0009299)	1/12	0.014309122256811	0.0413306406816902	0	0	78.91304347826087	335.1324919763037	TP53
GO_Biological_Process_2021	mitotic G1/S transition checkpoint signaling (GO:0044819)	1/12	0.014309122256811	0.0413306406816902	0	0	78.91304347826087	335.1324919763037	TP53
GO_Biological_Process_2021	regulation of keratinocyte migration (GO:0051547)	1/12	0.014309122256811	0.0413306406816902	0	0	78.91304347826087	335.1324919763037	MTOR
GO_Biological_Process_2021	chromatin assembly or disassembly (GO:0006333)	1/12	0.014309122256811	0.0413306406816902	0	0	78.91304347826087	335.1324919763037	TP53
GO_Biological_Process_2021	positive regulation of fatty acid oxidation (GO:0046321)	1/12	0.014309122256811	0.0413306406816902	0	0	78.91304347826087	335.1324919763037	IRS1
GO_Biological_Process_2021	axonal fasciculation (GO:0007413)	1/12	0.014309122256811	0.0413306406816902	0	0	78.91304347826087	335.1324919763037	EPHA3
GO_Biological_Process_2021	negative regulation of B cell proliferation (GO:0030889)	1/12	0.014309122256811	0.0413306406816902	0	0	78.91304347826087	335.1324919763037	ATM
Reactome_2022	NOTCH2 Intracellular Domain Regulates Transcription R-HSA-2197563	1/12	0.014309122256811	0.0418947497003539	0	0	78.91304347826087	335.1324919763037	EP300
Reactome_2022	TP53 Regulates Transcription Of Death Receptors And Ligands R-HSA-6803211	1/12	0.014309122256811	0.0418947497003539	0	0	78.91304347826087	335.1324919763037	TP53
Reactome_2022	Activation Of TFAP2 (AP-2) Family Of Transcription Factors R-HSA-8866907	1/12	0.014309122256811	0.0418947497003539	0	0	78.91304347826087	335.1324919763037	EP300
Reactome_2022	ALK Mutants Bind TKIs R-HSA-9700645	1/12	0.014309122256811	0.0418947497003539	0	0	78.91304347826087	335.1324919763037	ALK
GO_Biological_Process_2021	autophagy of peroxisome (GO:0030242)	1/12	0.014309122256811	0.0413306406816902	0	0	78.91304347826087	335.1324919763037	ATM
GO_Biological_Process_2021	dephosphorylation (GO:0016311)	2/153	0.0143710648838566	0.0413321652428869	0	0	11.935580975316077	50.63716153294024	PTPRT;PTPRD
KEGG_2021_Human	mTOR signaling pathway	2/154	0.0145495707624935	0.0323000470927355	0	0	11.85645933014354	50.15512059015245	IRS1;MTOR
GO_Biological_Process_2021	positive regulation of NF-kappaB transcription factor activity (GO:0051092)	2/155	0.0147290441792645	0.042181475458064	0	0	11.778371954842545	49.6803948263265	ALK;EP300
GO_Biological_Process_2021	peptidyl-serine phosphorylation (GO:0018105)	2/156	0.0149094827595128	0.0422127821701615	0	0	11.7012987012987	49.212828770492855	ATM;MTOR
GO_Biological_Process_2021	cellular response to starvation (GO:0009267)	2/158	0.0152732459311361	0.0422127821701615	0	0	11.55011655011655	48.29857505429492	TP53;MTOR
GO_Biological_Process_2021	positive regulation of insulin receptor signaling pathway (GO:0046628)	1/13	0.0154926555661662	0.0422127821701615	0	0	72.33333333333333	301.441152263015	IRS1
GO_Biological_Process_2021	regulation of receptor signaling pathway via STAT (GO:1904892)	1/13	0.0154926555661662	0.0422127821701615	0	0	72.33333333333333	301.441152263015	PTPRT
GO_Biological_Process_2021	positive regulation of cellular carbohydrate metabolic process (GO:0010676)	1/13	0.0154926555661662	0.0422127821701615	0	0	72.33333333333333	301.441152263015	IRS1
GO_Biological_Process_2021	response to interleukin-6 (GO:0070741)	1/13	0.0154926555661662	0.0422127821701615	0	0	72.33333333333333	301.441152263015	PTPRT
GO_Biological_Process_2021	spinal cord development (GO:0021510)	1/13	0.0154926555661662	0.0422127821701615	0	0	72.33333333333333	301.441152263015	NF1
GO_Biological_Process_2021	negative regulation of gluconeogenesis (GO:0045721)	1/13	0.0154926555661662	0.0422127821701615	0	0	72.33333333333333	301.441152263015	EP300
GO_Biological_Process_2021	cytoplasmic sequestering of protein (GO:0051220)	1/13	0.0154926555661662	0.0422127821701615	0	0	72.33333333333333	301.441152263015	KEAP1
GO_Biological_Process_2021	muscle tissue development (GO:0060537)	1/13	0.0154926555661662	0.0422127821701615	0	0	72.33333333333333	301.441152263015	NF1
GO_Biological_Process_2021	chromatin organization involved in regulation of transcription (GO:0034401)	1/13	0.0154926555661662	0.0422127821701615	0	0	72.33333333333333	301.441152263015	ARID1A
GO_Biological_Process_2021	myelination in peripheral nervous system (GO:0022011)	1/13	0.0154926555661662	0.0422127821701615	0	0	72.33333333333333	301.441152263015	NF1
GO_Biological_Process_2021	positive regulation of protein kinase B signaling (GO:0051897)	2/161	0.0158260702747734	0.0429473600601715	0	0	11.330474556889651	46.977242958345784	PDGFRA;IRS1
KEGG_2021_Human	Hepatitis B	2/162	0.016012250186845	0.0348501915831334	0	0	11.25909090909091	46.54959911198913	EP300;TP53
GO_Biological_Process_2021	heart development (GO:0007507)	2/164	0.0163874536188361	0.0431621488106978	0	0	11.118967452300785	45.712735522488046	NTRK3;NF1
Reactome_2022	Signaling By Interleukins R-HSA-449147	3/453	0.0164107764186634	0.0459771933839485	0	0	6.198730158730159	25.4756469644206	IRS1;TP53;SMARCA4
Reactome_2022	Cellular Senescence R-HSA-2559583	2/165	0.0165764724567529	0.0459771933839485	0	0	11.050195203569436	45.303268854838	ATM;TP53
Reactome_2022	RUNX3 Regulates NOTCH Signaling R-HSA-8941856	1/14	0.0166748271779813	0.0459771933839485	0	0	66.76588628762542	273.32986083800455	EP300
Reactome_2022	Regulation Of TP53 Activity Thru Association With Co-factors R-HSA-6804759	1/14	0.0166748271779813	0.0459771933839485	0	0	66.76588628762542	273.32986083800455	TP53
GO_Biological_Process_2021	cytoplasmic sequestering of transcription factor (GO:0042994)	1/14	0.0166748271779813	0.0431621488106978	0	0	66.76588628762542	273.32986083800455	KEAP1
Reactome_2022	TP53 Regulates Transcription Of Genes Involved In G1 Cell Cycle Arrest R-HSA-6804116	1/14	0.0166748271779813	0.0459771933839485	0	0	66.76588628762542	273.32986083800455	TP53
GO_Biological_Process_2021	negative regulation of TORC1 signaling (GO:1904262)	1/14	0.0166748271779813	0.0431621488106978	0	0	66.76588628762542	273.32986083800455	ATM
GO_Biological_Process_2021	synaptic membrane adhesion (GO:0099560)	1/14	0.0166748271779813	0.0431621488106978	0	0	66.76588628762542	273.32986083800455	PTPRD
GO_Biological_Process_2021	response to X-ray (GO:0010165)	1/14	0.0166748271779813	0.0431621488106978	0	0	66.76588628762542	273.32986083800455	ATM
GO_Biological_Process_2021	activation of cysteine-type endopeptidase activity (GO:0097202)	1/14	0.0166748271779813	0.0431621488106978	0	0	66.76588628762542	273.32986083800455	GRIN2A
GO_Biological_Process_2021	negative regulation of cell activation (GO:0050866)	1/14	0.0166748271779813	0.0431621488106978	0	0	66.76588628762542	273.32986083800455	PDGFRA
GO_Biological_Process_2021	positive regulation of cellular response to insulin stimulus (GO:1900078)	1/14	0.0166748271779813	0.0431621488106978	0	0	66.76588628762542	273.32986083800455	IRS1
GO_Biological_Process_2021	positive regulation of cyclase activity (GO:0031281)	1/14	0.0166748271779813	0.0431621488106978	0	0	66.76588628762542	273.32986083800455	NF1
GO_Biological_Process_2021	regulation of fatty acid beta-oxidation (GO:0031998)	1/14	0.0166748271779813	0.0431621488106978	0	0	66.76588628762542	273.32986083800455	IRS1
Reactome_2022	TP53 Regulates Transcription Of Additional Cell Death Genes With Uncertain Roles In P53-Dependent Apoptosis R-HSA-6803205	1/14	0.0166748271779813	0.0459771933839485	0	0	66.76588628762542	273.32986083800455	TP53
GO_Biological_Process_2021	positive regulation of glycogen biosynthetic process (GO:0045725)	1/14	0.0166748271779813	0.0431621488106978	0	0	66.76588628762542	273.32986083800455	IRS1
GO_Biological_Process_2021	positive regulation of glucose metabolic process (GO:0010907)	1/14	0.0166748271779813	0.0431621488106978	0	0	66.76588628762542	273.32986083800455	IRS1
KEGG_2021_Human	Wnt signaling pathway	2/166	0.0167664329236634	0.0357898856639739	0	0	10.982261640798226	44.89961965764408	EP300;TP53
Reactome_2022	SUMO E3 Ligases SUMOylate Target Proteins R-HSA-3108232	2/168	0.0171491694307768	0.0468304242148135	0	0	10.848849945235488	44.10931416912402	EP300;TP53
GO_Biological_Process_2021	peptidyl-serine modification (GO:0018209)	2/169	0.0173419408150938	0.0437104713485744	0	0	10.783342406096898	43.72243544143796	ATM;MTOR
GO_Biological_Process_2021	negative regulation of nucleic acid-templated transcription (GO:1903507)	3/464	0.0174872305975323	0.0437104713485744	0	0	6.047412457390766	24.469550351315256	KDM5C;TP53;SMARCA4
GO_Biological_Process_2021	cell-cell adhesion via plasma-membrane adhesion molecules (GO:0098742)	2/170	0.017535644524137	0.0437104713485744	0	0	10.718614718614718	43.34092912432098	PTPRT;PTPRD
GO_Biological_Process_2021	embryonic cranial skeleton morphogenesis (GO:0048701)	1/15	0.0178556385652366	0.0437104713485744	0	0	61.993788819875775	249.55202523941097	PDGFRA
GO_Biological_Process_2021	positive regulation of protein export from nucleus (GO:0046827)	1/15	0.0178556385652366	0.0437104713485744	0	0	61.993788819875775	249.55202523941097	TP53
Reactome_2022	TRAF3-dependent IRF Activation Pathway R-HSA-918233	1/15	0.0178556385652366	0.0482952509764495	0	0	61.993788819875775	249.55202523941097	EP300
GO_Biological_Process_2021	positive regulation of lyase activity (GO:0051349)	1/15	0.0178556385652366	0.0437104713485744	0	0	61.993788819875775	249.55202523941097	NF1
GO_Biological_Process_2021	response to ethanol (GO:0045471)	1/15	0.0178556385652366	0.0437104713485744	0	0	61.993788819875775	249.55202523941097	GRIN2A
GO_Biological_Process_2021	positive regulation of glycogen metabolic process (GO:0070875)	1/15	0.0178556385652366	0.0437104713485744	0	0	61.993788819875775	249.55202523941097	IRS1
GO_Biological_Process_2021	positive regulation of double-strand break repair via homologous recombination (GO:1905168)	1/15	0.0178556385652366	0.0437104713485744	0	0	61.993788819875775	249.55202523941097	ARID2
GO_Biological_Process_2021	histone mRNA catabolic process (GO:0071044)	1/15	0.0178556385652366	0.0437104713485744	0	0	61.993788819875775	249.55202523941097	ATM
GO_Biological_Process_2021	negative regulation of androgen receptor signaling pathway (GO:0060766)	1/15	0.0178556385652366	0.0437104713485744	0	0	61.993788819875775	249.55202523941097	SMARCA4
GO_Biological_Process_2021	positive regulation of DNA damage response, signal transduction by p53 class mediator (GO:0043517)	1/15	0.0178556385652366	0.0437104713485744	0	0	61.993788819875775	249.55202523941097	ATM
GO_Biological_Process_2021	androgen receptor signaling pathway (GO:0030521)	1/15	0.0178556385652366	0.0437104713485744	0	0	61.993788819875775	249.55202523941097	ARID1A
GO_Biological_Process_2021	cardiac myofibril assembly (GO:0055003)	1/15	0.0178556385652366	0.0437104713485744	0	0	61.993788819875775	249.55202523941097	PDGFRA
GO_Biological_Process_2021	regulation of cellular macromolecule biosynthetic process (GO:2000112)	3/468	0.0178883570800971	0.0437104713485744	0	0	5.994162826420891	24.11814483922118	ZFHX3;EP300;TP53
GO_Biological_Process_2021	positive regulation of ERK1 and ERK2 cascade (GO:0070374)	2/172	0.0179258396615253	0.0437104713485744	0	0	10.59144385026738	42.59361907659191	PDGFRA;NTRK3
Reactome_2022	SUMOylation R-HSA-2990846	2/174	0.01831973634842	0.0490830671976536	0	0	10.46723044397463	41.86658037474361	EP300;TP53
GO_Biological_Process_2021	positive regulation of cell population proliferation (GO:0008284)	3/474	0.0184997589905048	0.0449470678722373	0	0	5.915984228086139	23.604762720980005	PDGFRA;IRS1;NTRK3
GO_Biological_Process_2021	negative regulation of platelet activation (GO:0010544)	1/16	0.0190350912060612	0.0451078041608423	0	0	57.857971014492755	229.20267994354347	PDGFRA
GO_Biological_Process_2021	negative regulation of telomere maintenance (GO:0032205)	1/16	0.0190350912060612	0.0451078041608423	0	0	57.857971014492755	229.20267994354347	ATM
GO_Biological_Process_2021	sympathetic nervous system development (GO:0048485)	1/16	0.0190350912060612	0.0451078041608423	0	0	57.857971014492755	229.20267994354347	NF1
GO_Biological_Process_2021	platelet-derived growth factor receptor signaling pathway (GO:0048008)	1/16	0.0190350912060612	0.0451078041608423	0	0	57.857971014492755	229.20267994354347	PDGFRA
GO_Biological_Process_2021	digestive tract morphogenesis (GO:0048546)	1/16	0.0190350912060612	0.0451078041608423	0	0	57.857971014492755	229.20267994354347	PDGFRA
GO_Biological_Process_2021	N-terminal protein amino acid acetylation (GO:0006474)	1/16	0.0190350912060612	0.0451078041608423	0	0	57.857971014492755	229.20267994354347	EP300
Reactome_2022	Regulation Of Gene Expression In Late Stage (Branching Morphogenesis) Pancreatic Bud Precursor Cells R-HSA-210744	1/16	0.0190350912060612	0.0495960174543247	0	0	57.857971014492755	229.20267994354347	EP300
Reactome_2022	Polo-like Kinase Mediated Events R-HSA-156711	1/16	0.0190350912060612	0.0495960174543247	0	0	57.857971014492755	229.20267994354347	EP300
Reactome_2022	FOXO-mediated Transcription Of Cell Death Genes R-HSA-9614657	1/16	0.0190350912060612	0.0495960174543247	0	0	57.857971014492755	229.20267994354347	EP300
GO_Biological_Process_2021	positive regulation of small molecule metabolic process (GO:0062013)	1/16	0.0190350912060612	0.0451078041608423	0	0	57.857971014492755	229.20267994354347	IRS1
GO_Biological_Process_2021	positive regulation of cellular biosynthetic process (GO:0031328)	2/180	0.0195234517588823	0.0461027474867642	0	0	10.111338100102143	39.79963104203045	IRS1;MTOR
Reactome_2022	Cellular Response To Chemical Stress R-HSA-9711123	2/182	0.0199319709919696	0.0509971149704448	0	0	9.9979797979798	39.14639257902854	KEAP1;EP300
Reactome_2022	G2/M Transition R-HSA-69275	2/182	0.0199319709919696	0.0509971149704448	0	0	9.9979797979798	39.14639257902854	EP300;TP53
Reactome_2022	Formation Of Senescence-Associated Heterochromatin Foci (SAHF) R-HSA-2559584	1/17	0.0202131865779684	0.051130305035737	0	0	54.23913043478261	211.60963296162683	TP53
GO_Biological_Process_2021	regulation of transferase activity (GO:0051338)	1/17	0.0202131865779684	0.0464282408429104	0	0	54.23913043478261	211.60963296162683	ATM
GO_Biological_Process_2021	negative regulation of ATPase activity (GO:0032780)	1/17	0.0202131865779684	0.0464282408429104	0	0	54.23913043478261	211.60963296162683	TP53
GO_Biological_Process_2021	negative regulation of insulin secretion (GO:0046676)	1/17	0.0202131865779684	0.0464282408429104	0	0	54.23913043478261	211.60963296162683	IRS1
GO_Biological_Process_2021	cellular response to fatty acid (GO:0071398)	1/17	0.0202131865779684	0.0464282408429104	0	0	54.23913043478261	211.60963296162683	IRS1
