Cluster_ID	Gene_set	Term	Overlap	P-value	Adjusted P-value	Genes
2	KEGG_2021_Human	Pancreatic cancer	2/76	0.0014490874335407	0.0153603267955322	SMAD4;CDKN2A
2	GO_Biological_Process_2021	regulation of BMP signaling pathway (GO:0030510)	2/76	0.0014490874335407	0.0203429582016301	SMAD4;XIAP
2	GO_Biological_Process_2021	regulation of epithelial to mesenchymal transition (GO:0010717)	2/76	0.0014490874335407	0.0203429582016301	SMAD4;GATA3
2	Reactome_Pathways_2024	SUMOylation of DNA Damage Response and Repair Proteins	2/77	0.0014870860669846	0.0176343657911959	STAG2;CDKN2A
2	Reactome_Pathways_2024	Generic Transcription Pathway	5/1230	0.0015582414244869	0.0176343657911959	CDKN2B;SMAD4;RYBP;CDKN2A;GATA3
2	Reactome_Pathways_2024	Signal Transduction	7/2613	0.0015878265283253	0.0176343657911959	CDKN2B;SMAD4;STAG2;NCOA3;XIAP;GATA3;TEK
2	GO_Biological_Process_2021	negative regulation of cell cycle (GO:0045786)	2/80	0.0016039286166702	0.0216827387068385	CDKN2A;GATA3
2	Reactome_Pathways_2024	Senescence-Associated Secretory Phenotype (SASP)	2/81	0.0016438228945336	0.0176343657911959	CDKN2B;CDKN2A
2	GO_Biological_Process_2021	regulation of cyclin-dependent protein serine/threonine kinase activity (GO:0000079)	2/82	0.0016841894934286	0.0217865722857514	CDKN2B;CDKN2A
2	GO_Biological_Process_2021	negative regulation of defense response (GO:0031348)	2/85	0.0018081168721341	0.0217865722857514	GATA3;TEK
2	GO_Biological_Process_2021	positive regulation of endothelial cell migration (GO:0010595)	2/86	0.0018503664133103	0.0217865722857514	GATA3;TEK
2	GO_Biological_Process_2021	negative regulation of phosphorylation (GO:0042326)	2/86	0.0018503664133103	0.0217865722857514	CDKN2B;CDKN2A
2	Reactome_Pathways_2024	Transcriptional Regulation by RUNX3	2/86	0.0018503664133103	0.0176343657911959	SMAD4;CDKN2A
2	GO_Cellular_Component_2021	nucleus (GO:0005634)	9/4484	0.0018641845181259	0.0316911368081415	CDKN2B;SMAD4;RYBP;STAG2;CDKN2A;NCOA3;XIAP;GATA3;KDM6A
2	GO_Biological_Process_2021	regulation of endothelial cell migration (GO:0010594)	2/89	0.0019799274273914	0.0225835472186831	GATA3;TEK
2	Reactome_Pathways_2024	Activation of HOX Genes During Differentiation	2/91	0.0020686387832529	0.0176343657911959	NCOA3;KDM6A
2	Reactome_Pathways_2024	Activation of Anterior HOX Genes in Hindbrain Development During Early Embryogenesis	2/91	0.0020686387832529	0.0176343657911959	NCOA3;KDM6A
2	KEGG_2021_Human	Small cell lung cancer	2/92	0.0021136937745399	0.0166965085213787	CDKN2B;XIAP
2	GO_Biological_Process_2021	positive regulation of transmembrane receptor protein serine/threonine kinase signaling pathway (GO:0090100)	2/92	0.0021136937745399	0.022691124344326	CDKN2B;SMAD4
2	GO_Biological_Process_2021	negative regulation of mitotic cell cycle phase transition (GO:1901991)	2/92	0.0021136937745399	0.022691124344326	CDKN2B;CDKN2A
2	KEGG_2021_Human	TGF-beta signaling pathway	2/94	0.0022051992386726	0.0166965085213787	CDKN2B;SMAD4
2	GO_Biological_Process_2021	positive regulation of epithelial cell migration (GO:0010634)	2/94	0.0022051992386726	0.0229970777747292	GATA3;TEK
2	Reactome_Pathways_2024	Oxidative Stress Induced Senescence	2/94	0.0022051992386726	0.0176343657911959	CDKN2B;CDKN2A
2	Reactome_Pathways_2024	Signaling by TGF-beta Receptor Complex	2/94	0.0022051992386726	0.0176343657911959	CDKN2B;SMAD4
2	Reactome_Pathways_2024	RNA Polymerase II Transcription	5/1360	0.0024359732423259	0.0176343657911959	CDKN2B;SMAD4;RYBP;CDKN2A;GATA3
2	GO_Biological_Process_2021	regulation of transforming growth factor beta receptor signaling pathway (GO:0017015)	2/100	0.0024908343052083	0.0252542922611398	CDKN2B;SMAD4
2	GO_Biological_Process_2021	negative regulation of cell population proliferation (GO:0008285)	3/379	0.0025930632372506	0.0255802184215264	CDKN2B;CDKN2A;GATA3
2	Reactome_Pathways_2024	Developmental Biology	5/1385	0.0026397829747249	0.0176343657911959	SMAD4;CDKN2A;NCOA3;GATA3;KDM6A
2	Reactome_Pathways_2024	Epigenetic Regulation of Adipogenesis Genes by MLL3 and MLL4 Complexes	2/103	0.0026398751184425	0.0176343657911959	NCOA3;KDM6A
2	Reactome_Pathways_2024	Epigenetic Regulation of Gene Expression by MLL3 and MLL4 Complexes	2/103	0.0026398751184425	0.0176343657911959	NCOA3;KDM6A
2	Reactome_Pathways_2024	MLL4 and MLL3 Complexes Regulate Expression of PPARG Targets in Adipogenesis and Hepatic Steatosis	2/103	0.0026398751184425	0.0176343657911959	NCOA3;KDM6A
2	KEGG_2021_Human	Th17 cell differentiation	2/107	0.0028450121422312	0.0188482054422817	SMAD4;GATA3
2	Reactome_Pathways_2024	Adipogenesis	2/110	0.0030036551186086	0.0192927078772168	SMAD4;NCOA3
2	GO_Biological_Process_2021	negative regulation of response to external stimulus (GO:0032102)	2/118	0.0034466401799523	0.0265583981439261	GATA3;TEK
2	GO_Biological_Process_2021	L-methionine salvage from methylthioadenosine (GO:0019509)	1/5	0.0037446970839379	0.0265583981439261	MTAP
2	GO_Biological_Process_2021	cellular response to nutrient (GO:0031670)	1/5	0.0037446970839379	0.0265583981439261	CDKN2B
2	GO_Biological_Process_2021	positive regulation of cell proliferation involved in heart morphogenesis (GO:2000138)	1/5	0.0037446970839379	0.0265583981439261	SMAD4
2	GO_Biological_Process_2021	nephric duct development (GO:0072176)	1/5	0.0037446970839379	0.0265583981439261	GATA3
2	GO_Biological_Process_2021	receptor transactivation (GO:0035624)	1/5	0.0037446970839379	0.0265583981439261	NCOA3
2	GO_Biological_Process_2021	positive regulation of histone H3-K9 acetylation (GO:2000617)	1/5	0.0037446970839379	0.0265583981439261	SMAD4
2	GO_Biological_Process_2021	cardiac endothelial cell differentiation (GO:0003348)	1/5	0.0037446970839379	0.0265583981439261	SMAD4
2	GO_Biological_Process_2021	histone H3-K27 demethylation (GO:0071557)	1/5	0.0037446970839379	0.0265583981439261	KDM6A
2	GO_Biological_Process_2021	regulation of nucleotide-binding oligomerization domain containing signaling pathway (GO:0070424)	1/5	0.0037446970839379	0.0265583981439261	XIAP
2	GO_Biological_Process_2021	endocardial cell differentiation (GO:0060956)	1/5	0.0037446970839379	0.0265583981439261	SMAD4
2	GO_Molecular_Function_2021	1,4-alpha-oligoglucan phosphorylase activity (GO:0004645)	1/5	0.0037446970839379	0.0327279268648487	MTAP
2	GO_Molecular_Function_2021	histone demethylase activity (H3-K27 specific) (GO:0071558)	1/5	0.0037446970839379	0.0327279268648487	KDM6A
2	Reactome_Pathways_2024	RUNX3 Regulates BCL2L11 (BIM) Transcription	1/5	0.0037446970839379	0.0231616449265793	SMAD4
2	GO_Biological_Process_2021	positive regulation of transcription by RNA polymerase II (GO:0045944)	4/908	0.0038549851010632	0.0265583981439261	CDKN2B;SMAD4;NCOA3;GATA3
2	GO_Biological_Process_2021	regulation of phosphorylation (GO:0042325)	2/125	0.0038578467913376	0.0265583981439261	CDKN2B;CDKN2A
2	GO_Biological_Process_2021	negative regulation of cell growth (GO:0030308)	2/126	0.0039183752064815	0.0265583981439261	SMAD4;CDKN2A
2	GO_Biological_Process_2021	circulatory system development (GO:0072359)	2/126	0.0039183752064815	0.0265583981439261	TEK;KDM6A
2	GO_Biological_Process_2021	negative regulation of growth (GO:0045926)	2/126	0.0039183752064815	0.0265583981439261	SMAD4;CDKN2A
2	KEGG_2021_Human	FoxO signaling pathway	2/131	0.0042276699293122	0.0248962784726163	CDKN2B;SMAD4
2	Reactome_Pathways_2024	Signaling by Interleukins	3/452	0.0042613372895391	0.0241992071505428	MTAP;GATA3;CRLF2
2	Reactome_Pathways_2024	Epigenetic Regulation by WDR5-containing Histone Modifying Complexes	2/135	0.0044830524255101	0.0241992071505428	NCOA3;KDM6A
2	GO_Biological_Process_2021	epithelial tube formation (GO:0072175)	1/6	0.0044920683932145	0.0265583981439261	GATA3
2	GO_Biological_Process_2021	positive regulation of animal organ morphogenesis (GO:0110110)	1/6	0.0044920683932145	0.0265583981439261	GATA3
2	GO_Biological_Process_2021	negative regulation of cardiac muscle cell differentiation (GO:2000726)	1/6	0.0044920683932145	0.0265583981439261	SMAD4
2	GO_Biological_Process_2021	nephric duct morphogenesis (GO:0072178)	1/6	0.0044920683932145	0.0265583981439261	GATA3
2	GO_Biological_Process_2021	norepinephrine biosynthetic process (GO:0042421)	1/6	0.0044920683932145	0.0265583981439261	GATA3
2	GO_Biological_Process_2021	glomerulus vasculature development (GO:0072012)	1/6	0.0044920683932145	0.0265583981439261	TEK
2	GO_Biological_Process_2021	regulation of macrophage apoptotic process (GO:2000109)	1/6	0.0044920683932145	0.0265583981439261	CDKN2A
2	GO_Biological_Process_2021	ear development (GO:0043583)	1/6	0.0044920683932145	0.0265583981439261	GATA3
2	GO_Molecular_Function_2021	oncostatin-M receptor activity (GO:0004924)	1/6	0.0044920683932145	0.0327279268648487	CRLF2
2	GO_Molecular_Function_2021	leukemia inhibitory factor receptor activity (GO:0004923)	1/6	0.0044920683932145	0.0327279268648487	CRLF2
2	Reactome_Pathways_2024	Activation of Caspases Through Apoptosome-Mediated Cleavage	1/6	0.0044920683932145	0.0241992071505428	XIAP
2	Reactome_Pathways_2024	Methionine Salvage Pathway	1/6	0.0044920683932145	0.0241992071505428	MTAP
2	GO_Biological_Process_2021	negative regulation of nucleic acid-templated transcription (GO:1903507)	3/464	0.0045856853030302	0.0265583981439261	SMAD4;CDKN2A;GATA3
2	Reactome_Pathways_2024	Mitotic G1 Phase and G1 S Transition	2/139	0.0047454566771111	0.0243027533700584	CDKN2B;CDKN2A
2	GO_Biological_Process_2021	SMAD protein complex assembly (GO:0007183)	1/7	0.0052389168941443	0.0265583981439261	SMAD4
2	GO_Biological_Process_2021	L-methionine salvage (GO:0071267)	1/7	0.0052389168941443	0.0265583981439261	MTAP
2	GO_Biological_Process_2021	regulation of transforming growth factor beta2 production (GO:0032909)	1/7	0.0052389168941443	0.0265583981439261	SMAD4
2	GO_Biological_Process_2021	norepinephrine metabolic process (GO:0042415)	1/7	0.0052389168941443	0.0265583981439261	GATA3
2	GO_Biological_Process_2021	atrioventricular valve formation (GO:0003190)	1/7	0.0052389168941443	0.0265583981439261	SMAD4
2	GO_Biological_Process_2021	positive regulation of epithelial tube formation (GO:1905278)	1/7	0.0052389168941443	0.0265583981439261	GATA3
2	GO_Biological_Process_2021	definitive hemopoiesis (GO:0060216)	1/7	0.0052389168941443	0.0265583981439261	TEK
2	GO_Biological_Process_2021	heart trabecula formation (GO:0060347)	1/7	0.0052389168941443	0.0265583981439261	TEK
2	GO_Biological_Process_2021	positive regulation of hormone metabolic process (GO:0032352)	1/7	0.0052389168941443	0.0265583981439261	GATA3
2	GO_Biological_Process_2021	positive regulation of mast cell activation (GO:0033005)	1/7	0.0052389168941443	0.0265583981439261	CRLF2
2	Reactome_Pathways_2024	SMAC (DIABLO) Binds to IAPs	1/7	0.0052389168941443	0.0243027533700584	XIAP
2	Reactome_Pathways_2024	SMAC(DIABLO)-mediated Dissociation of IAP Caspase Complexes	1/7	0.0052389168941443	0.0243027533700584	XIAP
2	Reactome_Pathways_2024	RUNX3 Regulates CDKN1A Transcription	1/7	0.0052389168941443	0.0243027533700584	SMAD4
2	Reactome_Pathways_2024	Loss of Function of SMAD2 3 in Cancer	1/7	0.0052389168941443	0.0243027533700584	SMAD4
2	KEGG_2021_Human	Gastric cancer	2/149	0.005431934438354	0.0262266809186364	CDKN2B;SMAD4
2	GO_Cellular_Component_2021	intracellular membrane-bounded organelle (GO:0043231)	9/5192	0.00549398557512	0.0465861660341382	CDKN2B;SMAD4;RYBP;STAG2;CDKN2A;NCOA3;XIAP;GATA3;KDM6A
2	KEGG_2021_Human	Cushing syndrome	2/155	0.0058645211069789	0.0262266809186364	CDKN2B;CDKN2A
2	KEGG_2021_Human	Cellular senescence	2/156	0.0059381164344082	0.0262266809186364	CDKN2B;CDKN2A
2	GO_Biological_Process_2021	cellular response to interferon-alpha (GO:0035457)	1/8	0.0059852428364459	0.0280765808300157	GATA3
2	GO_Biological_Process_2021	regulation of stem cell division (GO:2000035)	1/8	0.0059852428364459	0.0280765808300157	NCOA3
2	GO_Biological_Process_2021	negative regulation of muscle hypertrophy (GO:0014741)	1/8	0.0059852428364459	0.0280765808300157	SMAD4
2	GO_Biological_Process_2021	regulation of pattern recognition receptor signaling pathway (GO:0062207)	1/8	0.0059852428364459	0.0280765808300157	XIAP
2	GO_Biological_Process_2021	positive regulation of myeloid cell apoptotic process (GO:0033034)	1/8	0.0059852428364459	0.0280765808300157	CDKN2A
2	GO_Molecular_Function_2021	ciliary neurotrophic factor receptor activity (GO:0004897)	1/8	0.0059852428364459	0.0381425967985935	CRLF2
2	Reactome_Pathways_2024	SMAC, XIAP-regulated Apoptotic Response	1/8	0.0059852428364459	0.0263035672022754	XIAP
2	Reactome_Pathways_2024	Signaling by TGF-beta Receptor Complex in Cancer	1/8	0.0059852428364459	0.0263035672022754	SMAD4
2	GO_Biological_Process_2021	positive regulation of nucleic acid-templated transcription (GO:1903508)	3/511	0.0059999268623047	0.0280765808300157	SMAD4;RYBP;GATA3
2	Reactome_Pathways_2024	Cell Cycle, Mitotic	3/516	0.00616418202514	0.0263545854174068	CDKN2B;STAG2;CDKN2A
2	GO_Biological_Process_2021	positive regulation of protein kinase B signaling (GO:0051897)	2/161	0.0063124755490794	0.0289039055324982	GATA3;TEK
2	Reactome_Pathways_2024	Signaling by TGFB Family Members	2/161	0.0063124755490794	0.0263545854174068	CDKN2B;SMAD4
2	GO_Biological_Process_2021	heart development (GO:0007507)	2/164	0.0065421757147795	0.0289039055324982	TEK;KDM6A
2	GO_Biological_Process_2021	regulation of smooth muscle cell apoptotic process (GO:0034391)	1/9	0.0067310464938694	0.0289039055324982	CDKN2A
2	GO_Biological_Process_2021	positive regulation of protein polyubiquitination (GO:1902916)	1/9	0.0067310464938694	0.0289039055324982	XIAP
2	GO_Biological_Process_2021	positive regulation of smooth muscle cell apoptotic process (GO:0034393)	1/9	0.0067310464938694	0.0289039055324982	CDKN2A
2	GO_Biological_Process_2021	regulation of mammary gland epithelial cell proliferation (GO:0033599)	1/9	0.0067310464938694	0.0289039055324982	GATA3
2	GO_Biological_Process_2021	regulation of nephron tubule epithelial cell differentiation (GO:0072182)	1/9	0.0067310464938694	0.0289039055324982	GATA3
2	GO_Molecular_Function_2021	ciliary neurotrophic factor receptor binding (GO:0005127)	1/9	0.0067310464938694	0.0381425967985935	CRLF2
2	Reactome_Pathways_2024	Regulation of PTEN Localization	1/9	0.0067310464938694	0.026617304041911	XIAP
2	Reactome_Pathways_2024	Cellular Senescence	2/167	0.0067756699481309	0.026617304041911	CDKN2B;CDKN2A
2	KEGG_2021_Human	Hepatocellular carcinoma	2/168	0.0068543417420515	0.0279446240252868	SMAD4;CDKN2A
2	Reactome_Pathways_2024	Apoptosis	2/168	0.0068543417420515	0.026617304041911	CDKN2A;XIAP
2	Reactome_Pathways_2024	SUMO E3 Ligases SUMOylate Target Proteins	2/170	0.0070129423822999	0.026617304041911	STAG2;CDKN2A
2	GO_Biological_Process_2021	negative regulation of cellular macromolecule biosynthetic process (GO:2000113)	3/547	0.0072434359262269	0.029987470078063	SMAD4;CDKN2A;GATA3
2	GO_Biological_Process_2021	cellular response to interleukin-4 (GO:0071353)	1/10	0.0074763281564485	0.029987470078063	GATA3
2	GO_Biological_Process_2021	regulation of mast cell activation (GO:0033003)	1/10	0.0074763281564485	0.029987470078063	CRLF2
2	GO_Biological_Process_2021	mesenchymal to epithelial transition (GO:0060231)	1/10	0.0074763281564485	0.029987470078063	GATA3
2	GO_Biological_Process_2021	response to interleukin-4 (GO:0070670)	1/10	0.0074763281564485	0.029987470078063	GATA3
2	GO_Biological_Process_2021	regulation of epithelial cell apoptotic process (GO:1904035)	1/10	0.0074763281564485	0.029987470078063	TEK
2	Reactome_Pathways_2024	Cohesin Loading Onto Chromatin	1/10	0.0074763281564485	0.0266445252685481	STAG2
2	Reactome_Pathways_2024	RUNX3 Regulates p14-ARF	1/10	0.0074763281564485	0.0266445252685481	CDKN2A
2	Reactome_Pathways_2024	SUMOylation	2/176	0.0074987586085135	0.0266445252685481	STAG2;CDKN2A
2	GO_Biological_Process_2021	regulation of histone H3-K9 acetylation (GO:2000615)	1/11	0.0082210881236714	0.0315862859488429	SMAD4
2	GO_Biological_Process_2021	mesonephros development (GO:0001823)	1/11	0.0082210881236714	0.0315862859488429	GATA3
2	GO_Biological_Process_2021	positive regulation of interleukin-13 production (GO:0032736)	1/11	0.0082210881236714	0.0315862859488429	GATA3
2	GO_Biological_Process_2021	positive regulation of leukocyte apoptotic process (GO:2000108)	1/11	0.0082210881236714	0.0315862859488429	CDKN2A
2	GO_Cellular_Component_2021	MLL3/4 complex (GO:0044666)	1/11	0.0082210881236714	0.0465861660341382	KDM6A
2	Reactome_Pathways_2024	Establishment of Sister Chromatid Cohesion	1/11	0.0082210881236714	0.0274584343330626	STAG2
2	Reactome_Pathways_2024	Formation of Apoptosome	1/11	0.0082210881236714	0.0274584343330626	XIAP
2	Reactome_Pathways_2024	Regulation of the Apoptosome Activity	1/11	0.0082210881236714	0.0274584343330626	XIAP
2	GO_Molecular_Function_2021	RNA polymerase II-specific DNA-binding transcription factor binding (GO:0061629)	2/190	0.0086901490890521	0.0443197603541659	CDKN2A;NCOA3
2	Reactome_Pathways_2024	Ub-specific Processing Proteases	2/190	0.0086901490890521	0.0284559783896413	SMAD4;GATA3
2	GO_Biological_Process_2021	negative regulation of cardiac muscle hypertrophy (GO:0010614)	1/12	0.0089653267055102	0.0327234424751125	SMAD4
2	GO_Biological_Process_2021	positive regulation of cellular senescence (GO:2000774)	1/12	0.0089653267055102	0.0327234424751125	CDKN2A
2	GO_Biological_Process_2021	megakaryocyte differentiation (GO:0030219)	1/12	0.0089653267055102	0.0327234424751125	CDKN2B
2	GO_Biological_Process_2021	replicative senescence (GO:0090399)	1/12	0.0089653267055102	0.0327234424751125	CDKN2A
2	GO_Biological_Process_2021	catecholamine biosynthetic process (GO:0042423)	1/12	0.0089653267055102	0.0327234424751125	GATA3
2	GO_Biological_Process_2021	regulation of receptor signaling pathway via STAT (GO:1904892)	1/13	0.0097090442156726	0.0340750109492356	CRLF2
2	GO_Biological_Process_2021	positive regulation of cell aging (GO:0090343)	1/13	0.0097090442156726	0.0340750109492356	CDKN2A
2	GO_Biological_Process_2021	negative regulation of locomotion (GO:0040013)	1/13	0.0097090442156726	0.0340750109492356	GATA3
2	GO_Biological_Process_2021	cardiac right ventricle morphogenesis (GO:0003215)	1/13	0.0097090442156726	0.0340750109492356	GATA3
2	GO_Molecular_Function_2021	I-SMAD binding (GO:0070411)	1/13	0.0097090442156726	0.0450146595453913	SMAD4
2	Reactome_Pathways_2024	Mitotic Telophase Cytokinesis	1/13	0.0097090442156726	0.029679869630142	STAG2
2	Reactome_Pathways_2024	Cytochrome C-Mediated Apoptotic Response	1/13	0.0097090442156726	0.029679869630142	XIAP
2	Reactome_Pathways_2024	Programmed Cell Death	2/202	0.0097748073632204	0.029679869630142	CDKN2A;XIAP
2	Reactome_Pathways_2024	Transcriptional Regulation by RUNX1	2/202	0.0097748073632204	0.029679869630142	RYBP;GATA3
2	KEGG_2021_Human	Viral carcinogenesis	2/203	0.0098678064690312	0.0373566959184755	CDKN2B;CDKN2A
2	GO_Biological_Process_2021	regulation of protein kinase B signaling (GO:0051896)	2/207	0.0102437874491362	0.0346824359490218	GATA3;TEK
2	GO_Biological_Process_2021	mitotic cell cycle phase transition (GO:0044772)	2/209	0.0104341607449084	0.0346824359490218	CDKN2B;CDKN2A
2	GO_Biological_Process_2021	positive regulation of SMAD protein signal transduction (GO:0060391)	1/14	0.0104522409709381	0.0346824359490218	SMAD4
2	GO_Biological_Process_2021	negative regulation of fibroblast growth factor receptor signaling pathway (GO:0040037)	1/14	0.0104522409709381	0.0346824359490218	GATA3
2	GO_Biological_Process_2021	cardiac left ventricle morphogenesis (GO:0003214)	1/14	0.0104522409709381	0.0346824359490218	SMAD4
2	GO_Biological_Process_2021	secondary palate development (GO:0062009)	1/14	0.0104522409709381	0.0346824359490218	SMAD4
2	GO_Biological_Process_2021	negative regulation of inflammatory response (GO:0050728)	2/212	0.0107226864850295	0.0352592843877097	GATA3;TEK
2	GO_Molecular_Function_2021	transcription regulatory region nucleic acid binding (GO:0001067)	2/212	0.0107226864850295	0.0455714175613755	SMAD4;GATA3
2	GO_Biological_Process_2021	negative regulation of cellular component movement (GO:0051271)	1/15	0.0111949172924613	0.0355841164827622	GATA3
2	GO_Biological_Process_2021	positive regulation of histone H3-K4 methylation (GO:0051571)	1/15	0.0111949172924613	0.0355841164827622	SMAD4
2	GO_Biological_Process_2021	positive regulation of keratinocyte differentiation (GO:0045618)	1/15	0.0111949172924613	0.0355841164827622	NCOA3
2	GO_Biological_Process_2021	regulation of cell growth (GO:0001558)	2/217	0.0112114339603223	0.0355841164827622	SMAD4;CDKN2A
2	Reactome_Pathways_2024	Cell Cycle	3/649	0.01156256908803	0.0344812328160895	CDKN2B;STAG2;CDKN2A
2	GO_Biological_Process_2021	sympathetic nervous system development (GO:0048485)	1/16	0.0119370735063595	0.0369182502334084	GATA3
2	GO_Biological_Process_2021	regulation of interleukin-13 production (GO:0032656)	1/16	0.0119370735063595	0.0369182502334084	GATA3
2	GO_Biological_Process_2021	copper ion homeostasis (GO:0055070)	1/17	0.012678709933633	0.0369182502334084	XIAP
2	GO_Biological_Process_2021	regulation of cellular response to growth factor stimulus (GO:0090287)	1/17	0.012678709933633	0.0369182502334084	XIAP
2	GO_Biological_Process_2021	histone H2A monoubiquitination (GO:0035518)	1/17	0.012678709933633	0.0369182502334084	RYBP
2	GO_Biological_Process_2021	histone H2A ubiquitination (GO:0033522)	1/17	0.012678709933633	0.0369182502334084	RYBP
2	GO_Biological_Process_2021	pharyngeal system development (GO:0060037)	1/17	0.012678709933633	0.0369182502334084	GATA3
2	Reactome_Pathways_2024	FOXO-mediated Transcription of Cell Cycle Genes	1/17	0.012678709933633	0.0352890759819453	SMAD4
2	Reactome_Pathways_2024	Signaling by Activin	1/17	0.012678709933633	0.0352890759819453	SMAD4
2	Reactome_Pathways_2024	Germ Layer Formation at Gastrulation	1/17	0.012678709933633	0.0352890759819453	SMAD4
2	Reactome_Pathways_2024	Regulation of MITF-M-dependent Genes Involved in Cell Cycle and Proliferation	1/17	0.012678709933633	0.0352890759819453	CDKN2A
2	GO_Biological_Process_2021	regulation of ERK1 and ERK2 cascade (GO:0070372)	2/238	0.0133701403293186	0.0369182502334084	SMAD4;TEK
2	GO_Biological_Process_2021	regulation of transforming growth factor beta production (GO:0071634)	1/18	0.01341982690512	0.0369182502334084	SMAD4
2	GO_Biological_Process_2021	response to interferon-alpha (GO:0035455)	1/18	0.01341982690512	0.0369182502334084	GATA3
2	GO_Biological_Process_2021	positive regulation of interleukin-4 production (GO:0032753)	1/18	0.01341982690512	0.0369182502334084	GATA3
2	GO_Biological_Process_2021	interleukin-6-mediated signaling pathway (GO:0070102)	1/18	0.01341982690512	0.0369182502334084	SMAD4
2	GO_Biological_Process_2021	endothelial cell proliferation (GO:0001935)	1/18	0.01341982690512	0.0369182502334084	TEK
2	GO_Biological_Process_2021	regulation of establishment or maintenance of cell polarity (GO:0032878)	1/18	0.01341982690512	0.0369182502334084	TEK
2	Reactome_Pathways_2024	Formation of Definitive Endoderm	1/18	0.01341982690512	0.035573191954842	SMAD4
2	Reactome_Pathways_2024	Formation of the Nephric Duct	1/18	0.01341982690512	0.035573191954842	GATA3
2	Reactome_Pathways_2024	Tie2 Signaling	1/18	0.01341982690512	0.035573191954842	TEK
2	GO_Biological_Process_2021	cellular response to interleukin-7 (GO:0098761)	1/19	0.0141604247470607	0.0369182502334084	CRLF2
2	GO_Biological_Process_2021	regulation of histone H3-K4 methylation (GO:0051569)	1/19	0.0141604247470607	0.0369182502334084	SMAD4
2	GO_Biological_Process_2021	regulation of stem cell population maintenance (GO:2000036)	1/19	0.0141604247470607	0.0369182502334084	NCOA3
2	GO_Biological_Process_2021	atrioventricular valve morphogenesis (GO:0003181)	1/19	0.0141604247470607	0.0369182502334084	SMAD4
2	GO_Biological_Process_2021	positive regulation of focal adhesion assembly (GO:0051894)	1/19	0.0141604247470607	0.0369182502334084	TEK
2	GO_Biological_Process_2021	heart trabecula morphogenesis (GO:0061384)	1/19	0.0141604247470607	0.0369182502334084	TEK
2	GO_Biological_Process_2021	ureteric bud morphogenesis (GO:0060675)	1/19	0.0141604247470607	0.0369182502334084	GATA3
2	GO_Biological_Process_2021	positive regulation of leukocyte activation (GO:0002696)	1/19	0.0141604247470607	0.0369182502334084	CRLF2
2	GO_Biological_Process_2021	interleukin-7-mediated signaling pathway (GO:0038111)	1/19	0.0141604247470607	0.0369182502334084	CRLF2
2	GO_Biological_Process_2021	regulation of epithelial cell differentiation (GO:0030856)	1/19	0.0141604247470607	0.0369182502334084	GATA3
2	GO_Biological_Process_2021	positive regulation of actin cytoskeleton reorganization (GO:2000251)	1/19	0.0141604247470607	0.0369182502334084	TEK
2	GO_Molecular_Function_2021	R-SMAD binding (GO:0070412)	1/19	0.0141604247470607	0.051313651671979	SMAD4
2	Reactome_Pathways_2024	SARS-CoV-1 Targets Host Intracellular Signalling and Regulatory Pathways	1/19	0.0141604247470607	0.0369498583243616	SMAD4
2	GO_Biological_Process_2021	positive regulation of nitrogen compound metabolic process (GO:0051173)	1/20	0.0149005037888985	0.037508164709986	GATA3
2	GO_Biological_Process_2021	negative regulation of cyclin-dependent protein serine/threonine kinase activity (GO:0045736)	1/20	0.0149005037888985	0.037508164709986	CDKN2A
2	GO_Biological_Process_2021	positive regulation of epidermal cell differentiation (GO:0045606)	1/20	0.0149005037888985	0.037508164709986	NCOA3
2	GO_Biological_Process_2021	cardiac ventricle development (GO:0003231)	1/20	0.0149005037888985	0.037508164709986	GATA3
2	GO_Biological_Process_2021	positive regulation of lymphocyte differentiation (GO:0045621)	1/20	0.0149005037888985	0.037508164709986	GATA3
2	GO_Molecular_Function_2021	transcription coactivator binding (GO:0001223)	1/20	0.0149005037888985	0.051313651671979	SMAD4
2	Reactome_Pathways_2024	SUMOylation of Transcription Factors	1/20	0.0149005037888985	0.0382828328114778	CDKN2A
2	GO_Biological_Process_2021	autonomic nervous system development (GO:0048483)	1/21	0.0156400643604775	0.0383129093394248	GATA3
