Cluster_ID	Gene_set	Term	Overlap	P-value	Adjusted P-value	Genes
3	GO_Biological_Process_2021	negative regulation of mitotic cell cycle (GO:0045930)	1/48	0.0377301695361429	0.0601324576982278	CDKN1B
3	Reactome_Pathways_2024	NOTCH1 Intracellular Domain Regulates Transcription	1/48	0.0377301695361429	0.0641106132768608	MYC
3	GO_Biological_Process_2021	regulation of stress-activated MAPK cascade (GO:0032872)	1/49	0.0385018352066202	0.0610895785278374	MYC
3	Reactome_Pathways_2024	Signaling by TGFBR3	1/49	0.0385018352066202	0.064375068465469	AGO2
3	Reactome_Pathways_2024	TP53 Regulates Transcription of Cell Cycle Genes	1/49	0.0385018352066202	0.064375068465469	CDKN1B
3	GO_Biological_Process_2021	negative regulation of ERK1 and ERK2 cascade (GO:0070373)	1/50	0.0392729207344652	0.062037312841611	FLCN
3	Reactome_Pathways_2024	SCF(Skp2)-mediated Degradation of P27 P21	1/50	0.0392729207344652	0.0648765592506608	CDKN1B
3	GO_Biological_Process_2021	regulation of protein modification process (GO:0031399)	1/51	0.0400434265231351	0.0629757853249306	FLCN
3	GO_Molecular_Function_2021	endonuclease activity (GO:0004519)	1/51	0.0400434265231351	0.0582449840336511	AGO2
3	Reactome_Pathways_2024	Nonhomologous End-Joining (NHEJ)	1/51	0.0400434265231351	0.0648765592506608	NBN
3	Reactome_Pathways_2024	Transcriptional Activity of SMAD2 SMAD3 SMAD4 Heterotrimer	1/51	0.0400434265231351	0.0648765592506608	MYC
3	Reactome_Pathways_2024	Diseases of DNA Repair	1/51	0.0400434265231351	0.0648765592506608	NBN
3	GO_Biological_Process_2021	signal transduction in response to DNA damage (GO:0042770)	1/52	0.040813352985687	0.0639051184907468	NBN
3	Reactome_Pathways_2024	p53-Dependent G1 DNA Damage Response	1/53	0.0415827005217073	0.0659231987688017	CDKN1B
3	Reactome_Pathways_2024	p53-Dependent G1 S DNA Damage Checkpoint	1/53	0.0415827005217073	0.0659231987688017	CDKN1B
3	GO_Biological_Process_2021	regulation of megakaryocyte differentiation (GO:0045652)	1/54	0.0423514695379364	0.0660239066595778	KMT2D
3	GO_Molecular_Function_2021	iron ion binding (GO:0005506)	1/54	0.0423514695379364	0.0602332011206207	TET1
3	Reactome_Pathways_2024	NR1H2 and NR1H3-mediated Signaling	1/54	0.0423514695379364	0.0659231987688017	AGO2
3	GO_Biological_Process_2021	regulation of gene silencing by RNA (GO:0060966)	1/55	0.0431196604465476	0.0663522361181789	AGO2
3	GO_Biological_Process_2021	positive regulation of response to DNA damage stimulus (GO:2001022)	1/55	0.0431196604465476	0.0663522361181789	MYC
3	GO_Biological_Process_2021	regulation of posttranscriptional gene silencing (GO:0060147)	1/55	0.0431196604465476	0.0663522361181789	AGO2
3	Reactome_Pathways_2024	Amino Acids Regulate mTORC1	1/55	0.0431196604465476	0.0659231987688017	FLCN
3	Reactome_Pathways_2024	G1 S DNA Damage Checkpoints	1/55	0.0431196604465476	0.0659231987688017	CDKN1B
3	Reactome_Pathways_2024	Signaling by Non-Receptor Tyrosine Kinases	1/55	0.0431196604465476	0.0659231987688017	CDKN1B
3	Reactome_Pathways_2024	Signaling by PTK6	1/55	0.0431196604465476	0.0659231987688017	CDKN1B
3	KEGG_2021_Human	Hedgehog signaling pathway	1/56	0.0438872736413355	0.0908415370594014	CCND2
3	GO_Biological_Process_2021	protein-containing complex disassembly (GO:0032984)	1/56	0.0438872736413355	0.0666713050636459	MYC
3	GO_Biological_Process_2021	negative regulation of metabolic process (GO:0009892)	1/56	0.0438872736413355	0.0666713050636459	FLCN
3	GO_Biological_Process_2021	DNA damage response, signal transduction by p53 class mediator resulting in cell cycle arrest (GO:0006977)	1/56	0.0438872736413355	0.0666713050636459	CDKN1B
3	Reactome_Pathways_2024	Regulation of PTEN Stability and Activity	1/56	0.0438872736413355	0.0659231987688017	PREX2
3	Reactome_Pathways_2024	Meiotic Recombination	1/57	0.0446543095355443	0.0659231987688017	NBN
3	KEGG_2021_Human	Endometrial cancer	1/58	0.0454207685297007	0.0908415370594014	MYC
3	GO_Biological_Process_2021	chordate embryonic development (GO:0043009)	1/58	0.0454207685297007	0.068131152794551	FLCN
3	GO_Biological_Process_2021	cellular iron ion homeostasis (GO:0006879)	1/58	0.0454207685297007	0.068131152794551	MYC
3	GO_Biological_Process_2021	positive regulation of mitotic cell cycle phase transition (GO:1901992)	1/58	0.0454207685297007	0.068131152794551	CCND2
3	Reactome_Pathways_2024	Signaling by NOTCH1 HD+PEST Domain Mutants in Cancer	1/58	0.0454207685297007	0.0659231987688017	MYC
3	Reactome_Pathways_2024	Signaling by NOTCH1 PEST Domain Mutants in Cancer	1/58	0.0454207685297007	0.0659231987688017	MYC
3	Reactome_Pathways_2024	Signaling by NOTCH1 in Cancer	1/58	0.0454207685297007	0.0659231987688017	MYC
3	Reactome_Pathways_2024	Constitutive Signaling by NOTCH1 HD+PEST Domain Mutants	1/58	0.0454207685297007	0.0659231987688017	MYC
3	Reactome_Pathways_2024	Constitutive Signaling by NOTCH1 PEST Domain Mutants	1/58	0.0454207685297007	0.0659231987688017	MYC
3	Reactome_Pathways_2024	Transcriptional Regulation of Granulopoiesis	1/58	0.0454207685297007	0.0659231987688017	MYC
3	GO_Biological_Process_2021	mitotic DNA damage checkpoint signaling (GO:0044773)	1/59	0.0461866510315301	0.0689901021684362	NBN
3	Reactome_Pathways_2024	Adherens Junctions Interactions	1/59	0.0461866510315301	0.0661165072985602	AGO2
3	Reactome_Pathways_2024	Meiotic Synapsis	1/59	0.0461866510315301	0.0661165072985602	RAD21
3	GO_Biological_Process_2021	regulation of intracellular signal transduction (GO:1902531)	2/437	0.0467038859305755	0.0694720303217311	FLCN;NBN
3	GO_Biological_Process_2021	Notch signaling pathway (GO:0007219)	1/60	0.0469519574385199	0.0695512398570606	MYC
3	Reactome_Pathways_2024	Recruitment and ATM-med Phosphorylation of Repair and Signaling Proteins at DNA Double Strand Breaks	1/60	0.0469519574385199	0.066754823841161	NBN
3	GO_Biological_Process_2021	iron ion homeostasis (GO:0055072)	1/61	0.0477166881586132	0.0701022949490737	MYC
3	GO_Biological_Process_2021	positive regulation of DNA biosynthetic process (GO:2000573)	1/61	0.0477166881586132	0.0701022949490737	MYC
3	Reactome_Pathways_2024	DNA Double Strand Break Response	1/61	0.0477166881586132	0.0673837015212849	NBN
3	GO_Molecular_Function_2021	transition metal ion binding (GO:0046914)	2/445	0.0482528653789067	0.0670562371584843	KDM5A;TET1
3	GO_Biological_Process_2021	positive regulation of cysteine-type endopeptidase activity (GO:2001056)	1/62	0.048480843602201	0.0703563462031941	MYC
3	GO_Biological_Process_2021	negative regulation of kinase activity (GO:0033673)	1/62	0.048480843602201	0.0703563462031941	CDKN1B
3	GO_Biological_Process_2021	double-strand break repair via nonhomologous end joining (GO:0006303)	1/62	0.048480843602201	0.0703563462031941	NBN
3	KEGG_2021_Human	Lysine degradation	1/63	0.0492444241632619	0.0909557088272395	KMT2D
3	GO_Molecular_Function_2021	methylation-dependent protein binding (GO:0140034)	1/63	0.0492444241632619	0.0670562371584843	KDM5A
3	Reactome_Pathways_2024	Transcriptional Regulation by MECP2	1/63	0.0492444241632619	0.0690743936249781	AGO2
4	KEGG_2021_Human	Colorectal cancer	3/86	7.628211937495278e-07	5.034619878746884e-05	SMAD2;BCL2;PMAIP1
4	Reactome_Pathways_2024	BH3-only Proteins Associate With and Inactivate Anti-Apoptotic BCL-2 Members	2/9	1.7986799164027146e-06	0.0001978547908042986	BCL2;PMAIP1
4	KEGG_2021_Human	Tuberculosis	3/180	7.074687081141612e-06	0.0002334646736776732	BCL2;PIK3C3;MALT1
4	GO_Biological_Process_2021	regulation of mitochondrial membrane permeability (GO:0046902)	2/19	8.53534381334727e-06	0.0012374318727448	BCL2;PMAIP1
4	GO_Biological_Process_2021	positive regulation of protein insertion into mitochondrial membrane involved in apoptotic signaling pathway (GO:1900740)	2/26	1.621089789622037e-05	0.0012374318727448	BCL2;PMAIP1
4	GO_Biological_Process_2021	regulation of protein insertion into mitochondrial membrane involved in apoptotic signaling pathway (GO:1900739)	2/26	1.621089789622037e-05	0.0012374318727448	BCL2;PMAIP1
4	KEGG_2021_Human	Shigellosis	3/246	1.805057585741449e-05	0.0003971126688631188	BCL2;PIK3C3;MALT1
4	Reactome_Pathways_2024	Activation of BH3-only Proteins	2/30	2.168904440952184e-05	0.0011928974425237	BCL2;PMAIP1
4	GO_Biological_Process_2021	mitochondrial membrane organization (GO:0007006)	2/32	2.4725579551199923e-05	0.0012805800707196	BCL2;PMAIP1
4	GO_Biological_Process_2021	positive regulation of mitochondrial outer membrane permeabilization involved in apoptotic signaling pathway (GO:1901030)	2/34	2.796026355283031e-05	0.0012805800707196	BCL2;PMAIP1
4	GO_Biological_Process_2021	positive regulation of intrinsic apoptotic signaling pathway (GO:2001244)	2/40	3.8852016054455135e-05	0.0012871298844666	BCL2;PMAIP1
4	GO_Biological_Process_2021	regulation of mitochondrial membrane potential (GO:0051881)	2/41	4.084035796971542e-05	0.0012871298844666	BCL2;PMAIP1
4	GO_Biological_Process_2021	cellular response to glucose starvation (GO:0042149)	2/43	4.496523613857176e-05	0.0012871298844666	PMAIP1;PIK3C3
4	GO_Biological_Process_2021	regulation of intrinsic apoptotic signaling pathway (GO:2001242)	2/52	6.596944588909246e-05	0.0015943712268443	BCL2;PMAIP1
4	Reactome_Pathways_2024	Intrinsic Pathway for Apoptosis	2/55	7.385769263711544e-05	0.0027081153966942	BCL2;PMAIP1
4	GO_Biological_Process_2021	positive regulation of establishment of protein localization to mitochondrion (GO:1903749)	2/56	7.658551744667382e-05	0.0015943712268443	BCL2;PMAIP1
4	GO_Biological_Process_2021	mitochondrial transport (GO:0006839)	2/56	7.658551744667382e-05	0.0015943712268443	BCL2;PMAIP1
4	GO_Biological_Process_2021	positive regulation of apoptotic signaling pathway (GO:2001235)	2/59	8.506401139074483e-05	0.00162330488404	BCL2;PMAIP1
4	GO_Biological_Process_2021	positive regulation of cysteine-type endopeptidase activity (GO:2001056)	2/62	9.398472243329424e-05	0.0016555770336326	PMAIP1;MALT1
4	KEGG_2021_Human	p53 signaling pathway	2/73	0.00013047092716623584	0.0021527702982428	BCL2;PMAIP1
4	GO_Biological_Process_2021	proteolysis involved in cellular protein catabolic process (GO:0051603)	2/74	0.0001340817157708724	0.0021931937793949	PMAIP1;MALT1
4	GO_Biological_Process_2021	B cell activation (GO:0042113)	2/85	0.00017702535507589228	0.0026162218802951	BCL2;MALT1
4	KEGG_2021_Human	Pathways in cancer	3/531	0.00017882314390156004	0.0023604654995005	SMAD2;BCL2;PMAIP1
4	GO_Biological_Process_2021	regulation of cysteine-type endopeptidase activity involved in apoptotic process (GO:0043281)	2/89	0.0001941047458800732	0.0026162218802951	PMAIP1;MALT1
4	GO_Biological_Process_2021	positive regulation of intracellular signal transduction (GO:1902533)	3/546	0.0001942173448254038	0.0026162218802951	BCL2;PMAIP1;MALT1
4	KEGG_2021_Human	AGE-RAGE signaling pathway in diabetic complications	2/100	0.0002450871709985121	0.0024993549219112	SMAD2;BCL2
4	GO_Biological_Process_2021	positive regulation of protein localization to membrane (GO:1905477)	2/101	0.0002500133982121356	0.0030732780877086	BCL2;PMAIP1
4	GO_Biological_Process_2021	intrinsic apoptotic signaling pathway (GO:0097193)	2/102	0.00025498813828150007	0.0030732780877086	BCL2;PMAIP1
4	KEGG_2021_Human	NF-kappa B signaling pathway	2/104	0.0002650830977784653	0.0024993549219112	BCL2;MALT1
4	GO_Biological_Process_2021	positive regulation of cysteine-type endopeptidase activity involved in apoptotic process (GO:0043280)	2/119	0.0003469668760434559	0.0039727707306975	PMAIP1;MALT1
4	GO_Biological_Process_2021	defense response to symbiont (GO:0140546)	2/124	0.0003766762887531929	0.0041075652440229	BCL2;PMAIP1
4	GO_Cellular_Component_2021	mitochondrial outer membrane (GO:0005741)	2/126	0.0003888973722052202	0.003701916847451	BCL2;PMAIP1
4	GO_Biological_Process_2021	defense response to virus (GO:0051607)	2/133	0.0004331869326339608	0.0045090821624171	BCL2;PMAIP1
4	KEGG_2021_Human	Apelin signaling pathway	2/137	0.0004595524823877063	0.0032576868257568	SMAD2;PIK3C3
4	KEGG_2021_Human	Autophagy	2/137	0.0004595524823877063	0.0032576868257568	BCL2;PIK3C3
4	GO_Biological_Process_2021	regulation of apoptotic process (GO:0042981)	3/742	0.00048086732661713633	0.004787765991101	BCL2;PMAIP1;MALT1
4	KEGG_2021_Human	Apoptosis	2/142	0.0004935889129934685	0.0032576868257568	BCL2;PMAIP1
4	GO_Cellular_Component_2021	organelle outer membrane (GO:0031968)	2/142	0.0004935889129934685	0.003701916847451	BCL2;PMAIP1
4	GO_Biological_Process_2021	positive regulation of intracellular protein transport (GO:0090316)	2/148	0.0005360134629173235	0.0051144617920027	BCL2;PMAIP1
4	KEGG_2021_Human	Gastric cancer	2/149	0.0005432516798779257	0.0032595100792675	SMAD2;BCL2
4	GO_Biological_Process_2021	cellular response to starvation (GO:0009267)	2/158	0.0006105451511103391	0.0055925935841707	PMAIP1;PIK3C3
4	Reactome_Pathways_2024	Apoptosis	2/168	0.0006898442667143013	0.0160317347202156	BCL2;PMAIP1
4	GO_Biological_Process_2021	antigen receptor-mediated signaling pathway (GO:0050851)	2/185	0.0008355525865727664	0.0073592900894293	BCL2;MALT1
4	GO_Biological_Process_2021	regulation of programmed cell death (GO:0043067)	2/194	0.000918228546940683	0.007787938416645	PMAIP1;MALT1
4	Reactome_Pathways_2024	Programmed Cell Death	2/202	0.0009949247057345542	0.0160317347202156	BCL2;PMAIP1
4	GO_Molecular_Function_2021	DNA-binding transcription factor binding (GO:0140297)	2/208	0.0010544225692085	0.0109185347616656	SMAD2;BCL2
4	GO_Biological_Process_2021	regulation of nodal signaling pathway involved in determination of lateral mesoderm left/right asymmetry (GO:1900175)	1/5	0.0012494733811348	0.0098091811186039	SMAD2
4	GO_Biological_Process_2021	dorsal/ventral axis specification (GO:0009950)	1/5	0.0012494733811348	0.0098091811186039	SMAD2
4	Reactome_Pathways_2024	Activation of NOXA and Translocation to Mitochondria	1/5	0.0012494733811348	0.0160317347202156	PMAIP1
4	GO_Biological_Process_2021	apoptotic process (GO:0006915)	2/231	0.0012981262690588	0.0098091811186039	BCL2;PMAIP1
4	GO_Biological_Process_2021	positive regulation of activin receptor signaling pathway (GO:0032927)	1/6	0.0014992198216206	0.0098091811186039	SMAD2
4	GO_Biological_Process_2021	positive regulation of endoplasmic reticulum stress-induced intrinsic apoptotic signaling pathway (GO:1902237)	1/6	0.0014992198216206	0.0098091811186039	PMAIP1
4	GO_Biological_Process_2021	positive regulation of extrinsic apoptotic signaling pathway via death domain receptors (GO:1902043)	1/6	0.0014992198216206	0.0098091811186039	PMAIP1
4	GO_Biological_Process_2021	protein insertion into mitochondrial membrane involved in apoptotic signaling pathway (GO:0001844)	1/6	0.0014992198216206	0.0098091811186039	PMAIP1
4	GO_Biological_Process_2021	intracellular pH elevation (GO:0051454)	1/6	0.0014992198216206	0.0098091811186039	BCL2
4	GO_Cellular_Component_2021	phosphatidylinositol 3-kinase complex, class III (GO:0035032)	1/6	0.0014992198216206	0.0074960991081034	PIK3C3
4	GO_Molecular_Function_2021	BH domain binding (GO:0051400)	1/6	0.0014992198216206	0.0109185347616656	BCL2
4	GO_Molecular_Function_2021	BH3 domain binding (GO:0051434)	1/6	0.0014992198216206	0.0109185347616656	BCL2
4	Reactome_Pathways_2024	TGFBR1 KD Mutants in Cancer	1/6	0.0014992198216206	0.0160317347202156	SMAD2
4	Reactome_Pathways_2024	SMAD2 3 Phosphorylation Motif Mutants in Cancer	1/6	0.0014992198216206	0.0160317347202156	SMAD2
4	Reactome_Pathways_2024	CLEC7A Inflammasome Pathway	1/6	0.0014992198216206	0.0160317347202156	MALT1
4	KEGG_2021_Human	Salmonella infection	2/249	0.0015060592050701	0.0082833256278858	BCL2;PIK3C3
4	GO_Molecular_Function_2021	ubiquitin protein ligase binding (GO:0031625)	2/265	0.0017034983986122	0.0109185347616656	SMAD2;BCL2
4	Reactome_Pathways_2024	Innate Immune System	3/1149	0.0017325669494139	0.0160317347202156	BCL2;PIK3C3;MALT1
4	GO_Biological_Process_2021	SMAD protein complex assembly (GO:0007183)	1/7	0.0017489165149326	0.0105395232084097	SMAD2
4	GO_Biological_Process_2021	nodal signaling pathway (GO:0038092)	1/7	0.0017489165149326	0.0105395232084097	SMAD2
4	GO_Biological_Process_2021	positive regulation of T-helper 17 cell differentiation (GO:2000321)	1/7	0.0017489165149326	0.0105395232084097	MALT1
4	Reactome_Pathways_2024	Loss of Function of SMAD2 3 in Cancer	1/7	0.0017489165149326	0.0160317347202156	SMAD2
4	Reactome_Pathways_2024	Loss of Function of TGFBR1 in Cancer	1/7	0.0017489165149326	0.0160317347202156	SMAD2
4	GO_Molecular_Function_2021	ubiquitin-like protein ligase binding (GO:0044389)	2/282	0.001926212702551	0.0109185347616656	SMAD2;BCL2
4	GO_Biological_Process_2021	negative regulation of mitochondrial membrane potential (GO:0010917)	1/8	0.0019985634316589	0.0114417756462477	PMAIP1
4	GO_Biological_Process_2021	phosphatidylinositol-3-phosphate biosynthetic process (GO:0036092)	1/8	0.0019985634316589	0.0114417756462477	PIK3C3
4	Reactome_Pathways_2024	Signaling by TGF-beta Receptor Complex in Cancer	1/8	0.0019985634316589	0.0169109213448068	SMAD2
4	GO_Biological_Process_2021	regulation of transmembrane transporter activity (GO:0022898)	1/9	0.0022481605524021	0.0122578277738117	BCL2
4	GO_Biological_Process_2021	negative regulation of membrane potential (GO:0045837)	1/9	0.0022481605524021	0.0122578277738117	PMAIP1
4	GO_Molecular_Function_2021	type I transforming growth factor beta receptor binding (GO:0034713)	1/9	0.0022481605524021	0.0109185347616656	SMAD2
4	GO_Biological_Process_2021	regulation of T-helper 17 cell differentiation (GO:2000319)	1/10	0.0024977078641967	0.0129994341113875	MALT1
4	GO_Biological_Process_2021	primary miRNA processing (GO:0031053)	1/10	0.0024977078641967	0.0129994341113875	SMAD2
4	GO_Cellular_Component_2021	autolysosome (GO:0044754)	1/10	0.0024977078641967	0.0093664044907377	PIK3C3
4	GO_Molecular_Function_2021	1-phosphatidylinositol-3-kinase activity (GO:0016303)	1/10	0.0024977078641967	0.0109185347616656	PIK3C3
4	GO_Molecular_Function_2021	co-SMAD binding (GO:0070410)	1/10	0.0024977078641967	0.0109185347616656	SMAD2
4	GO_Biological_Process_2021	lipoprotein biosynthetic process (GO:0042158)	1/11	0.0027472053583369	0.0131064588970657	PIK3C3
4	GO_Biological_Process_2021	T cell homeostasis (GO:0043029)	1/11	0.0027472053583369	0.0131064588970657	PMAIP1
4	GO_Biological_Process_2021	regulation of mitochondrial depolarization (GO:0051900)	1/11	0.0027472053583369	0.0131064588970657	BCL2
4	GO_Biological_Process_2021	response to sterol (GO:0036314)	1/11	0.0027472053583369	0.0131064588970657	SMAD2
4	GO_Molecular_Function_2021	death domain binding (GO:0070513)	1/11	0.0027472053583369	0.0109185347616656	BCL2
4	Reactome_Pathways_2024	Synthesis of PIPs at the Late Endosome Membrane	1/11	0.0027472053583369	0.019766087916929	PIK3C3
4	Reactome_Pathways_2024	NFE2L2 Regulating Tumorigenic Genes	1/11	0.0027472053583369	0.019766087916929	BCL2
4	GO_Biological_Process_2021	autophagy of peroxisome (GO:0030242)	1/12	0.0029966530298936	0.0131220712545014	PIK3C3
4	GO_Biological_Process_2021	mesoderm morphogenesis (GO:0048332)	1/12	0.0029966530298936	0.0131220712545014	SMAD2
4	GO_Biological_Process_2021	positive regulation of T-helper 17 type immune response (GO:2000318)	1/12	0.0029966530298936	0.0131220712545014	MALT1
4	GO_Molecular_Function_2021	phosphatidylinositol 3-kinase activity (GO:0035004)	1/12	0.0029966530298936	0.0109185347616656	PIK3C3
4	KEGG_2021_Human	Amyotrophic lateral sclerosis	2/364	0.0031854270152703	0.0161721679236799	BCL2;PIK3C3
4	GO_Biological_Process_2021	positive regulation of cellular carbohydrate metabolic process (GO:0010676)	1/13	0.0032460508750897	0.0131220712545014	PMAIP1
4	GO_Biological_Process_2021	toll-like receptor 9 signaling pathway (GO:0034162)	1/13	0.0032460508750897	0.0131220712545014	PIK3C3
4	GO_Biological_Process_2021	negative regulation of intrinsic apoptotic signaling pathway in response to DNA damage by p53 class mediator (GO:1902166)	1/13	0.0032460508750897	0.0131220712545014	BCL2
4	GO_Biological_Process_2021	mitochondrial outer membrane permeabilization (GO:0097345)	1/13	0.0032460508750897	0.0131220712545014	PMAIP1
4	GO_Biological_Process_2021	response to iron ion (GO:0010039)	1/13	0.0032460508750897	0.0131220712545014	BCL2
4	GO_Molecular_Function_2021	I-SMAD binding (GO:0070411)	1/13	0.0032460508750897	0.0109185347616656	SMAD2
4	GO_Biological_Process_2021	negative regulation of programmed cell death (GO:0043069)	2/381	0.0034843611368475	0.0131220712545014	BCL2;MALT1
4	GO_Biological_Process_2021	regulation of intrinsic apoptotic signaling pathway in response to DNA damage by p53 class mediator (GO:1902165)	1/14	0.0034953988931204	0.0131220712545014	BCL2
4	GO_Biological_Process_2021	positive regulation of T-helper cell differentiation (GO:0045624)	1/14	0.0034953988931204	0.0131220712545014	MALT1
4	GO_Biological_Process_2021	positive regulation of glucose metabolic process (GO:0010907)	1/14	0.0034953988931204	0.0131220712545014	PMAIP1
4	GO_Biological_Process_2021	secondary palate development (GO:0062009)	1/14	0.0034953988931204	0.0131220712545014	SMAD2
4	Reactome_Pathways_2024	Formation of Axial Mesoderm	1/14	0.0034953988931204	0.019766087916929	SMAD2
4	GO_Biological_Process_2021	positive regulation of DNA damage response, signal transduction by p53 class mediator (GO:0043517)	1/15	0.0037446970839379	0.0138312198745451	PMAIP1
4	GO_Molecular_Function_2021	phosphatidylinositol kinase activity (GO:0052742)	1/15	0.0037446970839379	0.0115461493421421	PIK3C3
4	Reactome_Pathways_2024	Activation of BAD and Translocation to Mitochondria	1/15	0.0037446970839379	0.019766087916929	BCL2
4	GO_Biological_Process_2021	negative regulation of anoikis (GO:2000811)	1/16	0.0039939454486556	0.0140709770421867	BCL2
4	GO_Biological_Process_2021	activation of NF-kappaB-inducing kinase activity (GO:0007250)	1/16	0.0039939454486556	0.0140709770421867	MALT1
4	GO_Biological_Process_2021	positive regulation of small molecule metabolic process (GO:0062013)	1/16	0.0039939454486556	0.0140709770421867	PMAIP1
4	GO_Cellular_Component_2021	secondary lysosome (GO:0005767)	1/16	0.0039939454486556	0.0119818363459669	PIK3C3
4	Reactome_Pathways_2024	Synthesis of PIPs at the Early Endosome Membrane	1/16	0.0039939454486556	0.019766087916929	PIK3C3
4	GO_Biological_Process_2021	mesenchyme morphogenesis (GO:0072132)	1/17	0.0042431439889969	0.0142894113747102	SMAD2
4	GO_Biological_Process_2021	regulation of metal ion transport (GO:0010959)	1/17	0.0042431439889969	0.0142894113747102	BCL2
4	GO_Biological_Process_2021	negative regulation of intrinsic apoptotic signaling pathway by p53 class mediator (GO:1902254)	1/17	0.0042431439889969	0.0142894113747102	BCL2
4	Reactome_Pathways_2024	FOXO-mediated Transcription of Cell Cycle Genes	1/17	0.0042431439889969	0.019766087916929	SMAD2
4	Reactome_Pathways_2024	Signaling by Activin	1/17	0.0042431439889969	0.019766087916929	SMAD2
4	Reactome_Pathways_2024	Translation of Replicase and Assembly of the Replication Transcription Complex 9694676	1/17	0.0042431439889969	0.019766087916929	PIK3C3
4	Reactome_Pathways_2024	Germ Layer Formation at Gastrulation	1/17	0.0042431439889969	0.019766087916929	SMAD2
4	GO_Biological_Process_2021	positive regulation of response to endoplasmic reticulum stress (GO:1905898)	1/18	0.0044922927083929	0.0144892257777745	PMAIP1
4	GO_Biological_Process_2021	release of cytochrome c from mitochondria (GO:0001836)	1/18	0.0044922927083929	0.0144892257777745	BCL2
4	GO_Biological_Process_2021	embryonic axis specification (GO:0000578)	1/18	0.0044922927083929	0.0144892257777745	SMAD2
4	GO_Molecular_Function_2021	transforming growth factor beta receptor binding (GO:0005160)	1/18	0.0044922927083929	0.0125308206819845	SMAD2
4	Reactome_Pathways_2024	Synthesis of PIPs at the Golgi Membrane	1/18	0.0044922927083929	0.019766087916929	PIK3C3
4	Reactome_Pathways_2024	Formation of Definitive Endoderm	1/18	0.0044922927083929	0.019766087916929	SMAD2
4	Reactome_Pathways_2024	Translation of Replicase and Assembly of the Replication Transcription Complex 9679504	1/18	0.0044922927083929	0.019766087916929	PIK3C3
4	GO_Biological_Process_2021	activin receptor signaling pathway (GO:0032924)	1/19	0.0047413916093995	0.014632094557267	SMAD2
4	GO_Biological_Process_2021	regulation of T cell cytokine production (GO:0002724)	1/19	0.0047413916093995	0.014632094557267	MALT1
4	GO_Biological_Process_2021	response to cholesterol (GO:0070723)	1/19	0.0047413916093995	0.014632094557267	SMAD2
4	GO_Molecular_Function_2021	R-SMAD binding (GO:0070412)	1/19	0.0047413916093995	0.0125308206819845	SMAD2
4	Reactome_Pathways_2024	Regulation of MITF-M-dependent Genes Involved in Apoptosis	1/19	0.0047413916093995	0.0200597337320751	BCL2
4	GO_Biological_Process_2021	gastrulation (GO:0007369)	1/20	0.0049904406959516	0.014632094557267	SMAD2
4	GO_Biological_Process_2021	mesoderm formation (GO:0001707)	1/20	0.0049904406959516	0.014632094557267	SMAD2
4	GO_Biological_Process_2021	early endosome to late endosome transport (GO:0045022)	1/20	0.0049904406959516	0.014632094557267	PIK3C3
4	GO_Biological_Process_2021	endoplasmic reticulum calcium ion homeostasis (GO:0032469)	1/20	0.0049904406959516	0.014632094557267	BCL2
4	Reactome_Pathways_2024	TP53 Regulates Transcription of Genes Involved in Cytochrome C Release	1/20	0.0049904406959516	0.0203314250575808	PMAIP1
4	GO_Cellular_Component_2021	mitochondrial membrane (GO:0031966)	2/469	0.0052356579652572	0.0130891449131432	BCL2;PMAIP1
4	GO_Biological_Process_2021	extrinsic apoptotic signaling pathway in absence of ligand (GO:0097192)	1/21	0.0052394399724711	0.014632094557267	BCL2
4	GO_Biological_Process_2021	neuron apoptotic process (GO:0051402)	1/21	0.0052394399724711	0.014632094557267	BCL2
4	GO_Biological_Process_2021	regulation of anoikis (GO:2000209)	1/21	0.0052394399724711	0.014632094557267	BCL2
4	GO_Biological_Process_2021	positive regulation of T cell cytokine production (GO:0002726)	1/21	0.0052394399724711	0.014632094557267	MALT1
4	KEGG_2021_Human	Pathways of neurodegeneration	2/475	0.0053673619852678	0.0253032779305483	BCL2;PIK3C3
4	GO_Biological_Process_2021	positive regulation of signal transduction by p53 class mediator (GO:1901798)	1/22	0.0054883894433205	0.0149623950300047	PMAIP1
