Cluster_ID	Gene_set	Term	Overlap	P-value	Adjusted P-value	Genes
1	GO_Biological_Process_2021	cardiac atrium morphogenesis (GO:0003209)	2/19	0.0012321620650803	0.0087931565553458	NOTCH2;NOTCH1
1	GO_Biological_Process_2021	negative regulation of protein localization to nucleus (GO:1900181)	2/19	0.0012321620650803	0.0087931565553458	LATS1;LATS2
1	GO_Biological_Process_2021	cellular response to interleukin-7 (GO:0098761)	2/19	0.0012321620650803	0.0087931565553458	JAK3;SMARCA4
1	GO_Biological_Process_2021	DNA double-strand break processing (GO:0000729)	2/19	0.0012321620650803	0.0087931565553458	ATM;BRCA1
1	GO_Biological_Process_2021	endocardial cushion morphogenesis (GO:0003203)	2/19	0.0012321620650803	0.0087931565553458	NOTCH1;TGFBR2
1	GO_Biological_Process_2021	interleukin-7-mediated signaling pathway (GO:0038111)	2/19	0.0012321620650803	0.0087931565553458	JAK3;SMARCA4
1	Reactome_Pathways_2024	Regulation of TP53 Activity Through Methylation	2/19	0.0012321620650803	0.0065554872368725	EP300;ATM
1	KEGG_2021_Human	Bacterial invasion of epithelial cells	3/77	0.0012464760668206	0.0027275829226899	PIK3CA;SRC;PIK3CD
1	GO_Biological_Process_2021	positive regulation of protein modification by small protein conjugation or removal (GO:1903322)	3/77	0.0012464760668206	0.0088450505080609	AMER1;AXIN1;BRCA1
1	KEGG_2021_Human	Influenza A	4/172	0.0012800895238754	0.0027685657144283	NFKBIA;PIK3CA;PIK3CD;EP300
1	GO_Biological_Process_2021	positive regulation of ERK1 and ERK2 cascade (GO:0070374)	4/172	0.0012800895238754	0.009028020621517	NOTCH2;CSF1R;NOTCH1;NTRK3
1	GO_Biological_Process_2021	negative regulation of apoptotic signaling pathway (GO:2001234)	3/78	0.0012938246113639	0.009028020621517	RB1;AR;SRC
1	GO_Biological_Process_2021	negative regulation of protein serine/threonine kinase activity (GO:0071901)	3/78	0.0012938246113639	0.009028020621517	RB1;LATS1;LATS2
1	GO_Biological_Process_2021	recombinational repair (GO:0000725)	3/79	0.0013422923389401	0.0092632921852132	BRCA1;BRCA2;PALB2
1	GO_Biological_Process_2021	regulation of cellular response to heat (GO:1900034)	3/79	0.0013422923389401	0.0092632921852132	RPTOR;EP300;ATM
1	GO_Biological_Process_2021	protein-DNA complex disassembly (GO:0032986)	2/20	0.0013666584956143	0.0092785030837383	ARID1A;SMARCA4
1	GO_Biological_Process_2021	negative regulation of cyclin-dependent protein serine/threonine kinase activity (GO:0045736)	2/20	0.0013666584956143	0.0092785030837383	LATS1;LATS2
1	GO_Biological_Process_2021	granulocyte differentiation (GO:0030851)	2/20	0.0013666584956143	0.0092785030837383	RARA;EP300
1	Reactome_Pathways_2024	Signaling by Hippo	2/20	0.0013666584956143	0.0071045376756744	LATS1;LATS2
1	Reactome_Pathways_2024	Signaling by KIT in Disease	2/20	0.0013666584956143	0.0071045376756744	PIK3CA;SRC
1	Reactome_Pathways_2024	Signaling by Phosphorylated Juxtamembrane, Extracellular and Kinase Domain KIT Mutants	2/20	0.0013666584956143	0.0071045376756744	PIK3CA;SRC
1	GO_Biological_Process_2021	negative regulation of cell cycle (GO:0045786)	3/80	0.0013918891757704	0.0092990042806789	RB1;LATS1;LATS2
1	GO_Biological_Process_2021	negative regulation of cellular component organization (GO:0051129)	3/80	0.0013918891757704	0.0092990042806789	AR;SRC;EP300
1	GO_Biological_Process_2021	negative regulation of extrinsic apoptotic signaling pathway (GO:2001237)	3/80	0.0013918891757704	0.0092990042806789	AR;SRC;BRCA1
1	GO_Biological_Process_2021	MAPK cascade (GO:0000165)	5/303	0.0014458883563055	0.0096086548969298	RET;PIK3CA;FLT3;ERBB2;JAK3
1	GO_Biological_Process_2021	positive regulation of protein ubiquitination (GO:0031398)	3/82	0.0014945093736871	0.00971215338641	AMER1;AXIN1;BRCA1
1	GO_Cellular_Component_2021	plasma membrane raft (GO:0044853)	3/82	0.0014945093736871	0.0119560749894974	SRC;INSR;TGFBR2
1	Reactome_Pathways_2024	Signaling by Insulin Receptor	3/82	0.0014945093736871	0.0077103097233407	PIK3CA;FLT3;INSR
1	GO_Biological_Process_2021	beta-catenin destruction complex disassembly (GO:1904886)	2/21	0.0015078582088773	0.00971215338641	AMER1;AXIN1
1	GO_Biological_Process_2021	cellular response to steroid hormone stimulus (GO:0071383)	2/21	0.0015078582088773	0.00971215338641	AR;SRC
1	GO_Biological_Process_2021	regulation of transcription by RNA polymerase III (GO:0006359)	2/21	0.0015078582088773	0.00971215338641	RPTOR;AR
1	GO_Biological_Process_2021	positive regulation of transcription from RNA polymerase II promoter involved in cellular response to chemical stimulus (GO:1901522)	2/21	0.0015078582088773	0.00971215338641	NOTCH1;EP300
1	GO_Biological_Process_2021	positive regulation of transcription regulatory region DNA binding (GO:2000679)	2/21	0.0015078582088773	0.00971215338641	RB1;EP300
1	GO_Molecular_Function_2021	acetylation-dependent protein binding (GO:0140033)	2/21	0.0015078582088773	0.0092031345852169	CARM1;SMARCA4
1	GO_Molecular_Function_2021	lysine-acetylated histone binding (GO:0070577)	2/21	0.0015078582088773	0.0092031345852169	CARM1;SMARCA4
1	Reactome_Pathways_2024	Synaptic Adhesion-Like Molecules	2/21	0.0015078582088773	0.0077206875206426	PTPRD;PTPRS
1	GO_Biological_Process_2021	positive regulation of apoptotic process (GO:0043065)	5/310	0.0015986677281354	0.0102122528359673	FOXA1;LATS1;LATS2;ATM;FOXO1
1	GO_Biological_Process_2021	lymphocyte differentiation (GO:0030098)	3/84	0.0016017625865331	0.0102122528359673	FLT3;PIK3CD;JAK3
1	Reactome_Pathways_2024	PI Metabolism	3/84	0.0016017625865331	0.0081403009061868	PIK3CA;INPPL1;PIK3CD
1	Reactome_Pathways_2024	DNA Repair	5/312	0.001644424654836	0.0082907978344668	POLD1;ATM;BRCA1;BRCA2;PALB2
1	GO_Biological_Process_2021	negative regulation of biomineral tissue development (GO:0070168)	2/22	0.0016557246776615	0.0102531073752095	NOTCH1;BCOR
1	GO_Biological_Process_2021	negative regulation of cyclin-dependent protein kinase activity (GO:1904030)	2/22	0.0016557246776615	0.0102531073752095	LATS1;LATS2
1	GO_Biological_Process_2021	osteoclast differentiation (GO:0030316)	2/22	0.0016557246776615	0.0102531073752095	CSF1R;SRC
1	Reactome_Pathways_2024	Regulation of Signaling by CBL	2/22	0.0016557246776615	0.0082907978344668	PIK3CA;PIK3CD
1	GO_Biological_Process_2021	B cell activation (GO:0042113)	3/85	0.0016571503162161	0.0102531073752095	FLT3;PIK3CD;JAK3
1	GO_Biological_Process_2021	G1/S transition of mitotic cell cycle (GO:0000082)	3/85	0.0016571503162161	0.0102531073752095	RB1;LATS1;LATS2
1	GO_Biological_Process_2021	positive regulation of protein catabolic process (GO:0045732)	3/85	0.0016571503162161	0.0102531073752095	AMER1;AXIN1;FOXO1
1	GO_Biological_Process_2021	positive regulation of transcription by RNA polymerase I (GO:0045943)	2/23	0.0018102215186427	0.0111452854285062	ERBB2;SMARCA4
1	KEGG_2021_Human	Gap junction	3/88	0.0018304695807811	0.0039134177244286	SRC;GNA11;GNAS
1	GO_Biological_Process_2021	positive regulation of neuron projection development (GO:0010976)	3/88	0.0018304695807811	0.0112149746022493	RET;NTRK3;EP300
1	Reactome_Pathways_2024	Protein-protein Interactions at Synapses	3/88	0.0018304695807811	0.0090989035365836	PTPRD;PTPRS;NTRK3
1	KEGG_2021_Human	PD-L1 expression and PD-1 checkpoint pathway in cancer	3/89	0.0018906584490158	0.0039961644490561	NFKBIA;PIK3CA;PIK3CD
1	Reactome_Pathways_2024	Meiosis	3/89	0.0018906584490158	0.0093299884331868	ATM;BRCA1;BRCA2
1	Reactome_Pathways_2024	Cell Cycle	7/649	0.0019253112196789	0.0094326398604415	RB1;SRC;POLD1;EP300;ATM;BRCA1;BRCA2
1	GO_Biological_Process_2021	negative regulation of protein kinase activity (GO:0006469)	3/90	0.0019520701748225	0.0117903261426793	PTPRT;RB1;TSC2
1	GO_Biological_Process_2021	regulation of cellular response to transforming growth factor beta stimulus (GO:1903844)	2/24	0.0019713124920084	0.0117903261426793	LATS1;LATS2
1	GO_Biological_Process_2021	negative regulation of ossification (GO:0030279)	2/24	0.0019713124920084	0.0117903261426793	NOTCH1;BCOR
1	GO_Biological_Process_2021	dendritic cell differentiation (GO:0097028)	2/24	0.0019713124920084	0.0117903261426793	FLT3;TGFBR2
1	GO_Biological_Process_2021	positive regulation of phospholipase activity (GO:0010518)	2/24	0.0019713124920084	0.0117903261426793	FLT1;NTRK3
1	GO_Biological_Process_2021	negative regulation of macromolecule metabolic process (GO:0010605)	4/194	0.0019894287926835	0.0118422870313295	RB1;NOTCH2;DNMT1;NOTCH1
1	GO_Biological_Process_2021	regulation of actin cytoskeleton organization (GO:0032956)	3/91	0.002014713593609	0.0119362277055331	NOTCH2;CSF1R;PIK3CA
1	Reactome_Pathways_2024	Activation of HOX Genes During Differentiation	3/91	0.002014713593609	0.0097306379946652	KMT2C;RARA;EP300
1	Reactome_Pathways_2024	Activation of Anterior HOX Genes in Hindbrain Development During Early Embryogenesis	3/91	0.002014713593609	0.0097306379946652	KMT2C;RARA;EP300
1	GO_Biological_Process_2021	regulation of interferon-alpha production (GO:0032647)	2/25	0.0021389615004277	0.0125539048810154	SETD2;PTPRS
1	GO_Biological_Process_2021	positive regulation of peptidyl-threonine phosphorylation (GO:0010800)	2/25	0.0021389615004277	0.0125539048810154	RPTOR;AXIN1
1	GO_Molecular_Function_2021	NF-kappaB binding (GO:0051059)	2/25	0.0021389615004277	0.0126198728525239	NFKBIA;EP300
1	Reactome_Pathways_2024	ADP Signalling Through P2Y Purinoceptor 1	2/25	0.0021389615004277	0.0099769368615844	SRC;GNA11
1	Reactome_Pathways_2024	Signaling by ERBB2 KD Mutants	2/25	0.0021389615004277	0.0099769368615844	PIK3CA;ERBB2
1	Reactome_Pathways_2024	Signaling by Erythropoietin	2/25	0.0021389615004277	0.0099769368615844	PIK3CA;PIK3CD
1	Reactome_Pathways_2024	Signaling by NTRK2 (TRKB)	2/25	0.0021389615004277	0.0099769368615844	PIK3CA;SRC
1	Reactome_Pathways_2024	Interleukin-7 Signaling	2/25	0.0021389615004277	0.0099769368615844	JAK3;SMARCA4
1	KEGG_2021_Human	GnRH signaling pathway	3/93	0.0021437303738923	0.0044801556128535	SRC;GNA11;GNAS
1	GO_Biological_Process_2021	nucleosome organization (GO:0034728)	3/94	0.0022101209289895	0.0129112180781898	SETD2;ARID1A;SMARCA4
1	Reactome_Pathways_2024	MITF-M-dependent Gene Expression	3/94	0.0022101209289895	0.0102387234873595	ARID1A;ARID1B;SMARCA4
1	GO_Biological_Process_2021	positive regulation of cytokine production (GO:0001819)	5/335	0.0022425591447087	0.0130400661377506	CSF1R;RARA;PIK3CD;EP300;BRCA1
1	GO_Biological_Process_2021	negative regulation of macroautophagy (GO:0016242)	2/26	0.0023131325887415	0.0132058842339063	PIK3CA;TSC2
1	GO_Biological_Process_2021	positive regulation of histone methylation (GO:0031062)	2/26	0.0023131325887415	0.0132058842339063	DNMT1;BRCA1
1	GO_Biological_Process_2021	hippo signaling (GO:0035329)	2/26	0.0023131325887415	0.0132058842339063	LATS1;LATS2
1	GO_Biological_Process_2021	mononuclear cell differentiation (GO:1903131)	2/26	0.0023131325887415	0.0132058842339063	CSF1R;FLT3
1	Reactome_Pathways_2024	Constitutive Signaling by AKT1 E17K in Cancer	2/26	0.0023131325887415	0.0105721026371342	TSC2;FOXO1
1	Reactome_Pathways_2024	Signaling by ERBB2 in Cancer	2/26	0.0023131325887415	0.0105721026371342	PIK3CA;ERBB2
1	KEGG_2021_Human	Diabetic cardiomyopathy	4/203	0.0023453128151742	0.0048469798180268	PIK3CA;INSR;PIK3CD;TGFBR2
1	GO_Biological_Process_2021	regulation of angiogenesis (GO:0045765)	4/203	0.0023453128151742	0.0133290176283206	FLT1;ERBB2;PIK3CD;BRCA1
1	GO_Cellular_Component_2021	axon (GO:0030424)	4/204	0.0023873856649326	0.0169769647284098	RET;PTPRS;INSR;NTRK3
1	KEGG_2021_Human	Fc gamma R-mediated phagocytosis	3/97	0.0024169224375632	0.004859952923628	PIK3CA;INPPL1;PIK3CD
1	KEGG_2021_Human	Phosphatidylinositol signaling system	3/97	0.0024169224375632	0.004859952923628	PIK3CA;INPPL1;PIK3CD
1	GO_Biological_Process_2021	double-strand break repair via homologous recombination (GO:0000724)	3/97	0.0024169224375632	0.0136741197368442	BRCA1;BRCA2;PALB2
1	KEGG_2021_Human	Proteoglycans in cancer	4/205	0.002429976461814	0.004859952923628	PIK3CA;SRC;ERBB2;PIK3CD
1	KEGG_2021_Human	Choline metabolism in cancer	3/98	0.002488427116072	0.0049239089743553	PIK3CA;PIK3CD;TSC2
1	GO_Biological_Process_2021	regulation of transcription regulatory region DNA binding (GO:2000677)	2/27	0.0024937899442036	0.0140457406722861	RB1;DOT1L
1	GO_Molecular_Function_2021	androgen receptor binding (GO:0050681)	2/27	0.0024937899442036	0.0139119151011455	EP300;SMARCA4
1	GO_Molecular_Function_2021	protein serine/threonine kinase activity (GO:0004674)	5/344	0.0025151484928624	0.0139119151011455	LATS1;LATS2;ATM;CDK12;TGFBR2
1	Reactome_Pathways_2024	Signaling by NOTCH	4/209	0.0026055836708294	0.0118293498655656	NOTCH2;NOTCH3;NOTCH1;EP300
1	GO_Biological_Process_2021	cellular response to interleukin-6 (GO:0071354)	2/28	0.0026808978945138	0.0148991493606612	PTPRT;SRC
1	GO_Biological_Process_2021	positive regulation of phosphatidylinositol 3-kinase activity (GO:0043552)	2/28	0.0026808978945138	0.0148991493606612	FLT1;FLT3
1	GO_Biological_Process_2021	ventricular septum morphogenesis (GO:0060412)	2/28	0.0026808978945138	0.0148991493606612	NOTCH1;TGFBR2
1	Reactome_Pathways_2024	FLT3 Signaling in Disease	2/28	0.0026808978945138	0.0120111280668681	PIK3CA;FLT3
1	Reactome_Pathways_2024	TGFBR3 Expression	2/28	0.0026808978945138	0.0120111280668681	RARA;EP300
1	GO_Biological_Process_2021	cellular response to DNA damage stimulus (GO:0006974)	5/350	0.002709800941111	0.0149329963433905	POLD1;DOT1L;ATM;BRCA1;FOXO1
1	GO_Biological_Process_2021	cellular response to chemical stress (GO:0062197)	3/101	0.0027107668521441	0.0149329963433905	PIK3CA;ATM;FOXO1
1	Reactome_Pathways_2024	Cellular Response to Heat Stress	3/101	0.0027107668521441	0.0120655701066023	RPTOR;EP300;ATM
1	GO_Biological_Process_2021	phosphate-containing compound metabolic process (GO:0006796)	4/212	0.0027428852859784	0.0150439472453663	PTPRD;PIK3CA;INPPL1;PIK3CD
1	GO_Biological_Process_2021	positive regulation of cellular protein metabolic process (GO:0032270)	3/102	0.0027875150003159	0.0151563586164362	AMER1;NFKBIA;ERBB2
1	GO_Biological_Process_2021	positive regulation of vasculature development (GO:1904018)	3/102	0.0027875150003159	0.0151563586164362	FLT1;PIK3CD;BRCA1
1	Reactome_Pathways_2024	Epigenetic Regulation of Adipogenesis Genes by MLL3 and MLL4 Complexes	3/103	0.0028655935415031	0.01238911796867	RB1;KMT2C;EP300
1	Reactome_Pathways_2024	Epigenetic Regulation of Gene Expression by MLL3 and MLL4 Complexes	3/103	0.0028655935415031	0.01238911796867	RB1;KMT2C;EP300
1	Reactome_Pathways_2024	MLL4 and MLL3 Complexes Regulate Expression of PPARG Targets in Adipogenesis and Hepatic Steatosis	3/103	0.0028655935415031	0.01238911796867	RB1;KMT2C;EP300
1	GO_Biological_Process_2021	negative regulation of epithelial to mesenchymal transition (GO:0010719)	2/29	0.0028744209090306	0.0154285156484721	FOXA1;NKX2-1
1	GO_Biological_Process_2021	beta-catenin-TCF complex assembly (GO:1904837)	2/29	0.0028744209090306	0.0154285156484721	EP300;SMARCA4
1	GO_Biological_Process_2021	mismatch repair (GO:0006298)	2/29	0.0028744209090306	0.0154285156484721	SETD2;POLD1
1	Reactome_Pathways_2024	Downstream Signal Transduction	2/29	0.0028744209090306	0.01238911796867	PIK3CA;SRC
1	Reactome_Pathways_2024	Energy Dependent Regulation of mTOR by LKB1-AMPK	2/29	0.0028744209090306	0.01238911796867	RPTOR;TSC2
1	KEGG_2021_Human	Lipid and atherosclerosis	4/215	0.0028850795442638	0.0056471327811918	NFKBIA;PIK3CA;SRC;PIK3CD
1	KEGG_2021_Human	T cell receptor signaling pathway	3/104	0.0029450101063204	0.0056471327811918	NFKBIA;PIK3CA;PIK3CD
1	KEGG_2021_Human	Toll-like receptor signaling pathway	3/104	0.0029450101063204	0.0056471327811918	NFKBIA;PIK3CA;PIK3CD
1	GO_Biological_Process_2021	regulation of cell growth (GO:0001558)	4/217	0.0029826362082676	0.0159412386280178	RB1;RPTOR;ERBB2;SMARCA4
1	GO_Biological_Process_2021	nucleotide-excision repair (GO:0006289)	3/105	0.0030257722359341	0.0160353161533048	POLD1;EP300;BRCA2
1	GO_Biological_Process_2021	positive regulation of cellular metabolic process (GO:0031325)	3/105	0.0030257722359341	0.0160353161533048	NFKBIA;INSR;TGFBR2
1	GO_Biological_Process_2021	positive regulation of lipid kinase activity (GO:0090218)	2/30	0.0030743235966317	0.0161562779806254	FLT1;FLT3
1	GO_Biological_Process_2021	positive regulation of phosphate metabolic process (GO:0045937)	2/30	0.0030743235966317	0.0161562779806254	AR;SRC
1	Reactome_Pathways_2024	SUMOylation of Intracellular Receptors	2/30	0.0030743235966317	0.0131673859704794	AR;RARA
1	GO_Biological_Process_2021	cellular response to peptide hormone stimulus (GO:0071375)	3/106	0.0031078873837272	0.0161971226305452	SRC;INSR;FOXO1
1	GO_Biological_Process_2021	chromosome organization (GO:0051276)	3/106	0.0031078873837272	0.0161971226305452	LATS1;DOT1L;SMARCA4
1	Reactome_Pathways_2024	Transcriptional Regulation by RUNX2	3/106	0.0031078873837272	0.013227945676989	RB1;AR;SRC
1	KEGG_2021_Human	Glucagon signaling pathway	3/107	0.0031913629139537	0.0060570765509734	GNAS;EP300;FOXO1
1	GO_Molecular_Function_2021	sequence-specific double-stranded DNA binding (GO:1990837)	7/712	0.0032335596926522	0.0170782651508519	FOXA1;AR;CARM1;RARA;NKX2-1;BRCA1;BCOR
1	GO_Biological_Process_2021	negative regulation of transmembrane receptor protein serine/threonine kinase signaling pathway (GO:0090101)	3/108	0.0032762061040925	0.0167495805200032	NOTCH1;NKX2-1;TGFBR2
1	GO_Biological_Process_2021	DNA replication (GO:0006260)	3/108	0.0032762061040925	0.0167495805200032	POLD1;ATM;BRCA1
1	Reactome_Pathways_2024	Signaling by VEGF	3/108	0.0032762061040925	0.0136223698257828	FLT1;PIK3CA;SRC
1	GO_Biological_Process_2021	activation of protein kinase B activity (GO:0032148)	2/31	0.0032805707069433	0.0167495805200032	INSR;NTRK3
1	GO_Biological_Process_2021	regulation of transmembrane receptor protein serine/threonine kinase signaling pathway (GO:0090092)	2/31	0.0032805707069433	0.0167495805200032	LATS1;LATS2
1	GO_Biological_Process_2021	protein acetylation (GO:0006473)	2/31	0.0032805707069433	0.0167495805200032	EP300;FOXO1
1	GO_Molecular_Function_2021	histone acetyltransferase activity (GO:0004402)	2/31	0.0032805707069433	0.0170782651508519	EP300;BRCA2
1	Reactome_Pathways_2024	Disassembly of the Destruction Complex and Recruitment of AXIN to the Membrane	2/31	0.0032805707069433	0.0136223698257828	AMER1;AXIN1
1	Reactome_Pathways_2024	Turbulent Flow Shear Stress Activates Signaling by PIEZO1 and Integrins in Endothelial Cells	2/31	0.0032805707069433	0.0136223698257828	NFKBIA;GNA11
1	Reactome_Pathways_2024	Metalloprotease DUBs	2/31	0.0032805707069433	0.0136223698257828	EP300;BRCA1
1	GO_Biological_Process_2021	regulation of protein ubiquitination (GO:0031396)	3/109	0.0033624241437536	0.0170979948362534	AMER1;AXIN1;BRCA1
1	GO_Biological_Process_2021	aortic valve morphogenesis (GO:0003180)	2/32	0.0034931271287104	0.0174101891811918	RB1;NOTCH1
1	GO_Biological_Process_2021	negative regulation of intracellular steroid hormone receptor signaling pathway (GO:0033144)	2/32	0.0034931271287104	0.0174101891811918	BRCA1;SMARCA4
1	GO_Biological_Process_2021	DNA damage checkpoint signaling (GO:0000077)	2/32	0.0034931271287104	0.0174101891811918	DOT1L;ATM
1	GO_Biological_Process_2021	positive regulation of lamellipodium organization (GO:1902745)	2/32	0.0034931271287104	0.0174101891811918	PIK3CA;SRC
1	GO_Biological_Process_2021	modulation by host of symbiont process (GO:0051851)	2/32	0.0034931271287104	0.0174101891811918	EP300;SMARCA4
1	GO_Molecular_Function_2021	SH2 domain binding (GO:0042169)	2/32	0.0034931271287104	0.0176652429080501	SRC;INPPL1
1	Reactome_Pathways_2024	Thrombin Signalling Through Proteinase Activated Receptors (PARs)	2/32	0.0034931271287104	0.0144170883312232	SRC;GNA11
1	Reactome_Pathways_2024	Regulation of Endogenous Retroelements	3/111	0.0035390131021105	0.0145184814610681	ARID1A;ARID1B;SMARCA4
1	KEGG_2021_Human	TNF signaling pathway	3/112	0.003629397969687	0.0068188689127453	NFKBIA;PIK3CA;PIK3CD
1	GO_Biological_Process_2021	regulation of macroautophagy (GO:0016241)	3/112	0.003629397969687	0.0180178808297505	RPTOR;PIK3CA;TSC2
1	GO_Biological_Process_2021	vasculogenesis (GO:0001570)	2/33	0.0037119578894409	0.0182832121926973	NOTCH1;TGFBR2
1	GO_Biological_Process_2021	mitotic G2 DNA damage checkpoint signaling (GO:0007095)	2/33	0.0037119578894409	0.0182832121926973	ATM;BRCA1
1	GO_Cellular_Component_2021	heterotrimeric G-protein complex (GO:0005834)	2/33	0.0037119578894409	0.0237565304924219	GNA11;GNAS
1	Reactome_Pathways_2024	Signal Amplification	2/33	0.0037119578894409	0.0151367863635286	SRC;GNA11
1	KEGG_2021_Human	Cholinergic synapse	3/113	0.0037211855876421	0.0069214051930144	PIK3CA;GNA11;PIK3CD
1	GO_Biological_Process_2021	regulation of autophagy (GO:0010506)	4/231	0.0037295935277248	0.0182983182453999	RPTOR;EP300;ATM;FOXO1
1	GO_Biological_Process_2021	positive regulation of cellular component organization (GO:0051130)	3/114	0.0038143827180623	0.0185692429995591	RB1;AR;INSR
1	GO_Biological_Process_2021	response to lipid (GO:0033993)	3/114	0.0038143827180623	0.0185692429995591	FOXA1;RARA;FOXO1
1	GO_Biological_Process_2021	positive regulation of protein metabolic process (GO:0051247)	3/115	0.0039089960391144	0.0189563668923849	NFKBIA;AXIN1;FOXO1
1	Reactome_Pathways_2024	Signaling by NTRK1 (TRKA)	3/115	0.0039089960391144	0.015845394658553	PIK3CA;SRC;EP300
1	GO_Biological_Process_2021	sister chromatid segregation (GO:0000819)	2/34	0.0039370281555363	0.019018874474437	RB1;LATS1
1	Reactome_Pathways_2024	Transcriptional Regulation by E2F6	2/34	0.0039370281555363	0.0158645927450902	MGA;BRCA1
1	GO_Biological_Process_2021	positive regulation of angiogenesis (GO:0045766)	3/116	0.0040050321458407	0.0192732581424364	FLT1;PIK3CD;BRCA1
1	GO_Biological_Process_2021	peptidyl-tyrosine dephosphorylation (GO:0035335)	2/35	0.0041683032309063	0.0199064215133776	PTPRT;PTPRS
1	GO_Biological_Process_2021	regulation of phosphatidylinositol 3-kinase activity (GO:0043551)	2/35	0.0041683032309063	0.0199064215133776	FLT1;FLT3
1	GO_Molecular_Function_2021	protein-lysine N-methyltransferase activity (GO:0016279)	2/35	0.0041683032309063	0.020494157551956	SETD2;DOT1L
1	Reactome_Pathways_2024	CD28 Co-Stimulation	2/35	0.0041683032309063	0.0166977323543952	PIK3CA;SRC
1	GO_Biological_Process_2021	regulation of cellular response to stress (GO:0080135)	3/118	0.0042013986787755	0.0199884725020534	RPTOR;EP300;ATM
1	Reactome_Pathways_2024	Gastrulation	3/120	0.0044035334205149	0.0173428599279285	FOXA1;NOTCH1;EP300
1	GO_Biological_Process_2021	negative regulation of cellular protein localization (GO:1903828)	2/36	0.0044057485573151	0.0207251692434002	LATS1;LATS2
1	GO_Biological_Process_2021	aortic valve development (GO:0003176)	2/36	0.0044057485573151	0.0207251692434002	RB1;NOTCH1
1	GO_Biological_Process_2021	positive regulation of mitotic nuclear division (GO:0045840)	2/36	0.0044057485573151	0.0207251692434002	RB1;INSR
1	Reactome_Pathways_2024	Signaling by NOTCH2	2/36	0.0044057485573151	0.0173428599279285	NOTCH2;EP300
1	Reactome_Pathways_2024	Transcriptional Regulation by the AP-2 (TFAP2) Family of Transcription Factors	2/36	0.0044057485573151	0.0173428599279285	ERBB2;EP300
1	Reactome_Pathways_2024	Nervous System Development	6/567	0.0045156723329499	0.0176734072341317	RET;PIK3CA;SRC;ERBB2;PIK3CD;SMARCA4
1	Reactome_Pathways_2024	HDR Through Single Strand Annealing (SSA)	2/37	0.0046493297130716	0.0179897359920555	ATM;BRCA1
1	Reactome_Pathways_2024	HSF1-dependent Transactivation	2/37	0.0046493297130716	0.0179897359920555	RPTOR;EP300
1	GO_Biological_Process_2021	positive regulation of epithelial cell proliferation (GO:0050679)	3/123	0.0047176595034208	0.0221096281205098	NOTCH2;ERBB2;PIK3CD
1	KEGG_2021_Human	Cell cycle	3/124	0.0048253054284841	0.0088862060366144	RB1;EP300;ATM
1	GO_Cellular_Component_2021	bounding membrane of organelle (GO:0098588)	7/767	0.0048577262675382	0.0282631346474949	RET;NOTCH2;NOTCH3;NOTCH1;FLT3;INSR;ERBB2
1	GO_Biological_Process_2021	negative regulation of G0 to G1 transition (GO:0070317)	2/38	0.0048990124149553	0.022705385952708	MGA;BRCA1
1	GO_Biological_Process_2021	negative regulation of TOR signaling (GO:0032007)	2/38	0.0048990124149553	0.022705385952708	TSC2;ATM
1	GO_Biological_Process_2021	ventricular septum development (GO:0003281)	2/38	0.0048990124149553	0.022705385952708	NOTCH1;TGFBR2
1	Reactome_Pathways_2024	FLT3 Signaling	2/38	0.0048990124149553	0.0188487426812687	PIK3CA;FLT3
1	GO_Biological_Process_2021	negative regulation of cell growth (GO:0030308)	3/126	0.0050450384275917	0.0232056692334887	RB1;PTPRS;SMARCA4
1	GO_Biological_Process_2021	phosphatidylinositol biosynthetic process (GO:0006661)	3/126	0.0050450384275917	0.0232056692334887	PIK3CA;INPPL1;PIK3CD
1	GO_Biological_Process_2021	regulation of canonical Wnt signaling pathway (GO:0060828)	4/253	0.0051452157890396	0.0232056692334887	LATS1;AMER1;LATS2;AXIN1
1	GO_Biological_Process_2021	regulation of cellular component biogenesis (GO:0044087)	2/39	0.005154762512853	0.0232056692334887	LATS1;NOTCH1
1	GO_Biological_Process_2021	cellular response to ketone (GO:1901655)	2/39	0.005154762512853	0.0232056692334887	AR;SRC
1	GO_Biological_Process_2021	DNA integrity checkpoint signaling (GO:0031570)	2/39	0.005154762512853	0.0232056692334887	DOT1L;ATM
1	GO_Biological_Process_2021	regulation of peptidyl-threonine phosphorylation (GO:0010799)	2/39	0.005154762512853	0.0232056692334887	RPTOR;AXIN1
1	GO_Biological_Process_2021	protein acylation (GO:0043543)	2/39	0.005154762512853	0.0232056692334887	EP300;FOXO1
1	Reactome_Pathways_2024	Reproduction	3/127	0.0051571369940157	0.0197303949040713	ATM;BRCA1;BRCA2
1	GO_Biological_Process_2021	positive regulation of macromolecule biosynthetic process (GO:0010557)	3/129	0.0053858264008086	0.0241592784264845	AR;INSR;ERBB2
1	Reactome_Pathways_2024	Signaling by FGFR3	2/40	0.0054165459946757	0.0206070828065597	PIK3CA;SRC
1	Reactome_Pathways_2024	C-type Lectin Receptors (CLRs)	3/131	0.0056205421321285	0.0212643843998865	NFKBIA;SRC;EP300
1	GO_Biological_Process_2021	regulation of cell development (GO:0060284)	2/41	0.0056843289829896	0.0251391450797005	NOTCH2;FOXO1
