Cluster_ID	Gene_set	Term	Overlap	P-value	Adjusted P-value	Genes
1	GO_Biological_Process_2021	chromatin-mediated maintenance of transcription (GO:0048096)	2/11	0.0004625553866292832	0.0046848558389376	ARID1A;ARID1B
1	GO_Cellular_Component_2021	MLL3/4 complex (GO:0044666)	2/11	0.0004625553866292832	0.0055506646395513	KMT2D;KMT2C
1	KEGG_2021_Human	Human T-cell leukemia virus 1 infection	5/219	0.0004655613890637895	0.0018980579707985	SMAD2;CREBBP;PIK3CD;EP300;ATM
1	KEGG_2021_Human	Cell cycle	4/124	0.000492218290371669	0.0019565677042273	SMAD2;CREBBP;EP300;ATM
1	GO_Biological_Process_2021	cellular response to cytokine stimulus (GO:0071345)	7/482	0.0005223150966446651	0.0052067140579322	CSF1R;AXL;INPPL1;PIK3CD;BRCA1;JAK2;CBL
1	GO_Biological_Process_2021	circulatory system development (GO:0072359)	4/126	0.0005228683315560692	0.0052067140579322	NOTCH1;ERBB4;NTRK3;BCOR
1	KEGG_2021_Human	Fanconi anemia pathway	3/54	0.0005434871479572364	0.0021076696713463	BRCA1;BRCA2;PALB2
1	GO_Molecular_Function_2021	phosphatidylinositol 3-kinase activity (GO:0035004)	2/12	0.0005540143472810427	0.0045376413205875	PIK3CD;ATM
1	GO_Biological_Process_2021	cellular response to DNA damage stimulus (GO:0006974)	6/350	0.0005677680431075714	0.0055955292079114	MSH2;APC;POLD1;DOT1L;ATM;BRCA1
1	GO_Biological_Process_2021	positive regulation of macromolecule biosynthetic process (GO:0010557)	4/129	0.0005713578347318887	0.0055955292079114	AR;IRS1;INSR;JAK2
1	KEGG_2021_Human	Regulation of lipolysis in adipocytes	3/55	0.0005736413587560141	0.0021716422867191	IRS1;INSR;PIK3CD
1	GO_Biological_Process_2021	protein-containing complex disassembly (GO:0032984)	3/56	0.0006048456145763179	0.0058749348628929	AMER1;APC;AXIN1
1	GO_Biological_Process_2021	positive regulation of gene expression, epigenetic (GO:0045815)	3/57	0.0006371147313502033	0.0060500113601413	EP300;ARID1A;ARID1B
1	GO_Biological_Process_2021	regulation of cell adhesion (GO:0030155)	4/133	0.0006408763291536351	0.0060500113601413	EPHA7;ZFHX3;SRC;ATM
1	GO_Biological_Process_2021	negative regulation of histone methylation (GO:0031061)	2/13	0.000653503336791641	0.0060500113601413	BRCA1;BCOR
1	GO_Biological_Process_2021	chromatin organization involved in regulation of transcription (GO:0034401)	2/13	0.000653503336791641	0.0060500113601413	ARID1A;ARID1B
1	GO_Biological_Process_2021	entry into host (GO:0044409)	2/13	0.000653503336791641	0.0060500113601413	SRC;CBL
1	GO_Biological_Process_2021	regulation of receptor signaling pathway via STAT (GO:1904892)	2/13	0.000653503336791641	0.0060500113601413	DOT1L;JAK2
1	GO_Molecular_Function_2021	I-SMAD binding (GO:0070411)	2/13	0.000653503336791641	0.0051092079058255	SMAD2;AXIN1
1	GO_Biological_Process_2021	positive regulation of peptidyl-tyrosine phosphorylation (GO:0050731)	4/134	0.0006591522762236412	0.0060550034676357	CSF1R;SRC;ERBB4;JAK2
1	KEGG_2021_Human	Chemical carcinogenesis	5/239	0.000691788616461773	0.0025580090701726	AR;SRC;PIK3CD;PGR;JAK2
1	GO_Molecular_Function_2021	protein kinase binding (GO:0019901)	7/506	0.000696273117788619	0.0052069120112888	RPTOR;MSH2;APC;IRS1;AXIN1;RICTOR;JAK2
1	GO_Biological_Process_2021	positive regulation of tyrosine phosphorylation of STAT protein (GO:0042531)	3/59	0.0007049060570094211	0.0063766335481693	CSF1R;ERBB4;JAK2
1	GO_Biological_Process_2021	axonogenesis (GO:0007409)	5/240	0.0007049274217807502	0.0063766335481693	NOTCH3;EPHA7;NOTCH1;SRC;PIK3CD
1	GO_Biological_Process_2021	positive regulation of cardiac muscle cell proliferation (GO:0060045)	2/14	0.0007609758027855225	0.0066305612228003	NOTCH1;ERBB4
1	GO_Biological_Process_2021	positive regulation of glycogen biosynthetic process (GO:0045725)	2/14	0.0007609758027855225	0.0066305612228003	IRS1;INSR
1	GO_Biological_Process_2021	histone H3-K4 trimethylation (GO:0080182)	2/14	0.0007609758027855225	0.0066305612228003	KMT2D;KMT2A
1	GO_Biological_Process_2021	response to X-ray (GO:0010165)	2/14	0.0007609758027855225	0.0066305612228003	MSH2;ATM
1	GO_Biological_Process_2021	synaptic membrane adhesion (GO:0099560)	2/14	0.0007609758027855225	0.0066305612228003	PTPRD;PTPRS
1	GO_Cellular_Component_2021	nBAF complex (GO:0071565)	2/14	0.0007609758027855225	0.0078271796857939	ARID1A;ARID1B
1	GO_Molecular_Function_2021	insulin-like growth factor receptor binding (GO:0005159)	2/14	0.0007609758027855225	0.0054536599199629	IRS1;INSR
1	KEGG_2021_Human	Basal cell carcinoma	3/63	0.0008539022982507015	0.0030856923959513	APC;AXIN1;AXIN2
1	GO_Biological_Process_2021	androgen receptor signaling pathway (GO:0030521)	2/15	0.0008763853887510972	0.0074179763262146	AR;ARID1A
1	GO_Biological_Process_2021	positive regulation of glycogen metabolic process (GO:0070875)	2/15	0.0008763853887510972	0.0074179763262146	IRS1;INSR
1	GO_Biological_Process_2021	positive regulation of histone H3-K4 methylation (GO:0051571)	2/15	0.0008763853887510972	0.0074179763262146	KMT2A;BRCA1
1	GO_Biological_Process_2021	steroid hormone mediated signaling pathway (GO:0043401)	2/15	0.0008763853887510972	0.0074179763262146	AR;PGR
1	GO_Molecular_Function_2021	phosphatidylinositol kinase activity (GO:0052742)	2/15	0.0008763853887510972	0.0060295314746075	PIK3CD;ATM
1	GO_Biological_Process_2021	regulation of canonical Wnt signaling pathway (GO:0060828)	5/253	0.0008932928965806758	0.0075074615776461	AMER1;LATS2;APC;AXIN1;AXIN2
1	GO_Biological_Process_2021	regulation of cellular catabolic process (GO:0031329)	3/65	0.0009353311806859376	0.0078054045712171	RPTOR;EP300;ATM
1	GO_Biological_Process_2021	negative regulation of anoikis (GO:2000811)	2/16	0.0009996859337130693	0.0082072898998735	NOTCH1;SRC
1	GO_Biological_Process_2021	N-terminal protein amino acid acetylation (GO:0006474)	2/16	0.0009996859337130693	0.0082072898998735	CREBBP;EP300
1	GO_Biological_Process_2021	response to cytokine (GO:0034097)	4/150	0.0010042675404908	0.0082072898998735	CSF1R;SETD2;SRC;JAK2
1	KEGG_2021_Human	Acute myeloid leukemia	3/67	0.0010215260045017	0.0035309268416475	CSF1R;PIK3CD;BRAF
1	KEGG_2021_Human	Long-term potentiation	3/67	0.0010215260045017	0.0035309268416475	CREBBP;EP300;BRAF
1	GO_Biological_Process_2021	canonical Wnt signaling pathway (GO:0060070)	3/68	0.0010664439232001	0.0085968438706947	AMER1;APC;AXIN1
1	GO_Biological_Process_2021	regulation of tyrosine phosphorylation of STAT protein (GO:0042509)	3/68	0.0010664439232001	0.0085968438706947	CSF1R;ERBB4;JAK2
1	GO_Biological_Process_2021	negative regulation of cellular macromolecule biosynthetic process (GO:2000113)	7/547	0.0010974245484014	0.008786811417944	SMAD2;SPEN;KDM5C;NCOR1;NOTCH1;BRCA1;BCOR
1	GO_Molecular_Function_2021	ubiquitin protein ligase binding (GO:0031625)	5/265	0.0010983625677072	0.0072660908325246	SMAD2;APC;AXIN1;BRCA1;AXIN2
1	GO_Biological_Process_2021	negative regulation of fatty acid metabolic process (GO:0045922)	2/17	0.0011308314717929	0.0087959069107318	NCOR1;BRCA1
1	GO_Biological_Process_2021	embryo development ending in birth or egg hatching (GO:0009792)	2/17	0.0011308314717929	0.0087959069107318	RICTOR;BRCA1
1	GO_Biological_Process_2021	positive regulation of cardiac muscle tissue growth (GO:0055023)	2/17	0.0011308314717929	0.0087959069107318	NOTCH1;ERBB4
1	GO_Biological_Process_2021	mesenchyme morphogenesis (GO:0072132)	2/17	0.0011308314717929	0.0087959069107318	SMAD2;NOTCH1
1	GO_Biological_Process_2021	protein deubiquitination (GO:0016579)	5/267	0.0011356740568286	0.0087959069107318	SMAD2;AR;APC;EP300;BRCA1
1	KEGG_2021_Human	Prolactin signaling pathway	3/70	0.0011599860918289	0.0039242082681021	SRC;PIK3CD;JAK2
1	GO_Biological_Process_2021	cellular response to light stimulus (GO:0071482)	3/70	0.0011599860918289	0.0088788129890301	CREBBP;POLD1;EP300
1	GO_Biological_Process_2021	regulation of signal transduction by p53 class mediator (GO:1901796)	4/156	0.0011613637243035	0.0088788129890301	EP300;RICTOR;ATM;BRCA1
1	GO_Biological_Process_2021	regulation of glycolytic process (GO:0006110)	3/71	0.0012086360478818	0.0090077592247796	NCOR1;INSR;EP300
1	GO_Biological_Process_2021	phosphatidylinositol-mediated signaling (GO:0048015)	3/71	0.0012086360478818	0.0090077592247796	CSF1R;IRS1;PIK3CD
1	GO_Biological_Process_2021	histone acetylation (GO:0016573)	3/71	0.0012086360478818	0.0090077592247796	CREBBP;EP300;BRCA2
1	GO_Biological_Process_2021	myeloid leukocyte differentiation (GO:0002573)	3/71	0.0012086360478818	0.0090077592247796	CSF1R;PIK3CD;EP300
1	KEGG_2021_Human	Non-small cell lung cancer	3/72	0.0012585554907899	0.0041689650632418	ALK;PIK3CD;BRAF
1	GO_Biological_Process_2021	response to ionizing radiation (GO:0010212)	3/72	0.0012585554907899	0.0093211766036633	MSH2;ATM;BRCA1
1	GO_Biological_Process_2021	intracellular estrogen receptor signaling pathway (GO:0030520)	2/18	0.0012697762309429	0.0093458685320955	AR;ARID1A
1	GO_Biological_Process_2021	insulin receptor signaling pathway (GO:0008286)	3/73	0.0013097569266924	0.0095624118861981	APC;IRS1;INSR
1	GO_Molecular_Function_2021	ATPase binding (GO:0051117)	3/73	0.0013097569266924	0.0083436367181887	AR;SRC;PGR
1	GO_Biological_Process_2021	protein modification by small protein removal (GO:0070646)	5/276	0.0013153359809707	0.0095624118861981	SMAD2;AR;APC;EP300;BRCA1
1	KEGG_2021_Human	JAK-STAT signaling pathway	4/162	0.0013349555207427	0.0043317944448591	CREBBP;PIK3CD;EP300;JAK2
1	GO_Biological_Process_2021	negative regulation of cellular process (GO:0048523)	7/566	0.0013363446689173	0.0096559050772382	AR;PBRM1;NOTCH1;APC;ERBB4;AXIN2;JAK2
1	GO_Biological_Process_2021	double-strand break repair (GO:0006302)	4/164	0.0013966403711286	0.0100304172108329	ATM;BRCA1;BRCA2;PALB2
1	GO_Biological_Process_2021	regulation of transcription from RNA polymerase II promoter in response to hypoxia (GO:0061418)	3/75	0.0014160551181192	0.0100510325742021	CREBBP;NOTCH1;EP300
1	GO_Biological_Process_2021	DNA double-strand break processing (GO:0000729)	2/19	0.00141647463282	0.0100510325742021	ATM;BRCA1
1	GO_Cellular_Component_2021	SWI/SNF complex (GO:0016514)	2/19	0.00141647463282	0.0127482716953804	ARID1A;ARID1B
1	GO_Molecular_Function_2021	ubiquitin-like protein ligase binding (GO:0044389)	5/282	0.0014462668234813	0.0088842104870995	SMAD2;APC;AXIN1;BRCA1;AXIN2
1	KEGG_2021_Human	Chronic myeloid leukemia	3/76	0.0014711762036101	0.0046783403274804	PIK3CD;BRAF;CBL
1	KEGG_2021_Human	Bacterial invasion of epithelial cells	3/77	0.0015276279442501	0.004762604767368	SRC;PIK3CD;CBL
1	GO_Biological_Process_2021	cellular response to UV (GO:0034644)	3/77	0.0015276279442501	0.0106484653760963	CREBBP;POLD1;EP300
1	GO_Biological_Process_2021	positive regulation of protein modification by small protein conjugation or removal (GO:1903322)	3/77	0.0015276279442501	0.0106484653760963	AMER1;AXIN1;BRCA1
1	GO_Biological_Process_2021	positive regulation of type I interferon production (GO:0032481)	3/77	0.0015276279442501	0.0106484653760963	SETD2;CREBBP;EP300
1	GO_Biological_Process_2021	negative regulation of cyclin-dependent protein serine/threonine kinase activity (GO:0045736)	2/20	0.0015708812917978	0.0108859317589502	LATS2;APC
1	GO_Molecular_Function_2021	transcription coactivator binding (GO:0001223)	2/20	0.0015708812917978	0.0093169511099736	AR;PGR
1	GO_Biological_Process_2021	recombinational repair (GO:0000725)	3/79	0.0016445705710681	0.0111605812620411	BRCA1;BRCA2;PALB2
1	KEGG_2021_Human	Influenza A	4/172	0.0016633686696748	0.005086069586121	CREBBP;PIK3CD;EP300;JAK2
1	GO_Biological_Process_2021	negative regulation of cellular component organization (GO:0051129)	3/80	0.0017050847160341	0.0111605812620411	AR;SRC;EP300
1	GO_Biological_Process_2021	negative regulation of extrinsic apoptotic signaling pathway (GO:2001237)	3/80	0.0017050847160341	0.0111605812620411	AR;SRC;BRCA1
1	GO_Biological_Process_2021	positive regulation of cell adhesion (GO:0045785)	3/80	0.0017050847160341	0.0111605812620411	ZFHX3;ATM;JAK2
1	GO_Biological_Process_2021	regulation of anoikis (GO:2000209)	2/21	0.0017329510145279	0.0111605812620411	NOTCH1;SRC
1	GO_Biological_Process_2021	regulation of cardiac muscle cell proliferation (GO:0060043)	2/21	0.0017329510145279	0.0111605812620411	NOTCH1;ERBB4
1	GO_Biological_Process_2021	cellular response to steroid hormone stimulus (GO:0071383)	2/21	0.0017329510145279	0.0111605812620411	AR;SRC
1	GO_Biological_Process_2021	regulation of transcription by RNA polymerase III (GO:0006359)	2/21	0.0017329510145279	0.0111605812620411	RPTOR;AR
1	GO_Biological_Process_2021	intrinsic apoptotic signaling pathway in response to DNA damage by p53 class mediator (GO:0042771)	2/21	0.0017329510145279	0.0111605812620411	MSH2;EP300
1	GO_Biological_Process_2021	spindle assembly checkpoint signaling (GO:0071173)	2/21	0.0017329510145279	0.0111605812620411	APC;ATM
1	GO_Biological_Process_2021	positive regulation of transcription from RNA polymerase II promoter involved in cellular response to chemical stimulus (GO:1901522)	2/21	0.0017329510145279	0.0111605812620411	NOTCH1;EP300
1	GO_Biological_Process_2021	mitotic spindle assembly checkpoint signaling (GO:0007094)	2/21	0.0017329510145279	0.0111605812620411	APC;ATM
1	GO_Biological_Process_2021	mitotic spindle checkpoint signaling (GO:0071174)	2/21	0.0017329510145279	0.0111605812620411	APC;ATM
1	GO_Molecular_Function_2021	ephrin receptor binding (GO:0046875)	2/21	0.0017329510145279	0.0099355858166266	SRC;CBL
1	GO_Biological_Process_2021	regulation of cell cycle (GO:0051726)	5/296	0.0017889825584008	0.0114591585497566	NOTCH1;APC;EP300;ATM;BRCA1
1	GO_Biological_Process_2021	positive regulation of protein ubiquitination (GO:0031398)	3/82	0.001830255827203	0.0116605008346	AMER1;AXIN1;BRCA1
1	GO_Biological_Process_2021	positive regulation of developmental process (GO:0051094)	4/177	0.001846985496853	0.0117041594319298	ALK;AR;SRC;INSR
1	GO_Biological_Process_2021	negative regulation of biomineral tissue development (GO:0070168)	2/22	0.0019026387993678	0.0117428488398486	NOTCH1;BCOR
1	GO_Biological_Process_2021	negative regulation of cyclin-dependent protein kinase activity (GO:1904030)	2/22	0.0019026387993678	0.0117428488398486	LATS2;APC
1	GO_Biological_Process_2021	negative regulation of mitotic metaphase/anaphase transition (GO:0045841)	2/22	0.0019026387993678	0.0117428488398486	APC;ATM
1	GO_Biological_Process_2021	negative regulation of small molecule metabolic process (GO:0062014)	2/22	0.0019026387993678	0.0117428488398486	NCOR1;EP300
1	GO_Biological_Process_2021	osteoclast differentiation (GO:0030316)	2/22	0.0019026387993678	0.0117428488398486	CSF1R;SRC
1	GO_Biological_Process_2021	lymphocyte differentiation (GO:0030098)	3/84	0.0019610253894767	0.0120404926763208	MSH2;AXL;PIK3CD
1	KEGG_2021_Human	Tuberculosis	4/180	0.0019636627637951	0.0058909882913855	CREBBP;SRC;EP300;JAK2
1	GO_Biological_Process_2021	positive regulation of protein catabolic process (GO:0045732)	3/85	0.0020285371140543	0.0123908065987339	AMER1;APC;AXIN1
1	KEGG_2021_Human	Mismatch repair	2/23	0.0020798998349281	0.006124149513955	MSH2;POLD1
1	GO_Biological_Process_2021	positive regulation of neuron projection development (GO:0010976)	3/88	0.0022397091090647	0.0132854309798223	ALK;NTRK3;EP300
1	GO_Biological_Process_2021	cytokine-mediated signaling pathway (GO:0019221)	7/621	0.002263609582333	0.0132854309798223	CSF1R;IRS1;SRC;INPPL1;PIK3CD;JAK2;CBL
1	GO_Biological_Process_2021	negative regulation of lipid metabolic process (GO:0045833)	2/24	0.0022646895003579	0.0132854309798223	ALK;NCOR1
1	GO_Biological_Process_2021	regulation of cellular response to transforming growth factor beta stimulus (GO:1903844)	2/24	0.0022646895003579	0.0132854309798223	SMAD2;LATS2
1	GO_Biological_Process_2021	negative regulation of ossification (GO:0030279)	2/24	0.0022646895003579	0.0132854309798223	NOTCH1;BCOR
1	GO_Biological_Process_2021	positive regulation of cellular response to transforming growth factor beta stimulus (GO:1903846)	2/24	0.0022646895003579	0.0132854309798223	CREBBP;EP300
1	GO_Biological_Process_2021	mammary gland development (GO:0030879)	2/24	0.0022646895003579	0.0132854309798223	ERBB4;JAK2
1	GO_Biological_Process_2021	positive regulation of transforming growth factor beta receptor signaling pathway (GO:0030511)	2/24	0.0022646895003579	0.0132854309798223	CREBBP;EP300
1	KEGG_2021_Human	PD-L1 expression and PD-1 checkpoint pathway in cancer	3/89	0.0023130138238595	0.0066867126907939	ALK;PIK3CD;JAK2
1	GO_Biological_Process_2021	transforming growth factor beta receptor signaling pathway (GO:0007179)	3/89	0.0023130138238595	0.0135020757698204	SMAD2;SRC;CBL
1	GO_Biological_Process_2021	negative regulation of cellular carbohydrate metabolic process (GO:0010677)	2/25	0.0024569633643719	0.0141335028484502	NCOR1;EP300
1	GO_Biological_Process_2021	regulation of interferon-alpha production (GO:0032647)	2/25	0.0024569633643719	0.0141335028484502	SETD2;PTPRS
1	GO_Biological_Process_2021	positive regulation of peptidyl-threonine phosphorylation (GO:0010800)	2/25	0.0024569633643719	0.0141335028484502	RPTOR;AXIN1
1	KEGG_2021_Human	Chemokine signaling pathway	4/192	0.0024816168546628	0.0070460192837747	SRC;PIK3CD;BRAF;JAK2
1	KEGG_2021_Human	Th1 and Th2 cell differentiation	3/92	0.0025418140818155	0.0070903234913801	NOTCH3;NOTCH1;JAK2
1	GO_Biological_Process_2021	regulation of peptidyl-tyrosine phosphorylation (GO:0050730)	3/92	0.0025418140818155	0.0144810081103432	EPHA7;SRC;JAK2
1	GO_Biological_Process_2021	Wnt signaling pathway (GO:0016055)	3/92	0.0025418140818155	0.0144810081103432	AMER1;APC;AXIN1
1	GO_Biological_Process_2021	regulation of programmed cell death (GO:0043067)	4/194	0.0025762338962856	0.0146068763976002	ALK;CREBBP;ATM;JAK2
1	GO_Biological_Process_2021	regulation of glycogen biosynthetic process (GO:0005979)	2/26	0.002656677184464	0.0147110395494853	IRS1;INSR
1	GO_Biological_Process_2021	positive regulation of glucose import (GO:0046326)	2/26	0.002656677184464	0.0147110395494853	IRS1;INSR
1	GO_Biological_Process_2021	histone lysine demethylation (GO:0070076)	2/26	0.002656677184464	0.0147110395494853	KDM5A;KDM5C
1	GO_Biological_Process_2021	TOR signaling (GO:0031929)	2/26	0.002656677184464	0.0147110395494853	RPTOR;RICTOR
1	GO_Biological_Process_2021	mononuclear cell differentiation (GO:1903131)	2/26	0.002656677184464	0.0147110395494853	CSF1R;AXL
1	KEGG_2021_Human	TGF-beta signaling pathway	3/94	0.0027018527359435	0.0074068031899143	SMAD2;CREBBP;EP300
1	GO_Biological_Process_2021	positive regulation of BMP signaling pathway (GO:0030513)	2/27	0.0028637869058653	0.0157841278300018	SMAD2;NOTCH1
1	GO_Biological_Process_2021	cellular protein modification process (GO:0006464)	9/1025	0.0029377313185903	0.0161167204283778	PTPRD;PTPRS;LATS2;INSR;PIK3CD;BRAF;ATM;CDK12;JAK2
1	GO_Biological_Process_2021	double-strand break repair via homologous recombination (GO:0000724)	3/97	0.0029533630809532	0.0161278122162652	BRCA1;BRCA2;PALB2
1	GO_Biological_Process_2021	negative regulation of apoptotic process (GO:0043066)	6/485	0.0029965607458438	0.0162886444212151	NOTCH1;MSH2;SRC;AXL;BRAF;CBL
1	KEGG_2021_Human	Viral carcinogenesis	4/203	0.0030328380002216	0.0080370207005873	CREBBP;SRC;PIK3CD;EP300
1	KEGG_2021_Human	Diabetic cardiomyopathy	4/203	0.0030328380002216	0.0080370207005873	SMAD2;IRS1;INSR;PIK3CD
1	GO_Biological_Process_2021	positive regulation of cytokine production (GO:0001819)	5/335	0.0030568158039005	0.0165403046923386	CSF1R;CREBBP;PIK3CD;EP300;BRCA1
1	GO_Biological_Process_2021	internal peptidyl-lysine acetylation (GO:0018393)	2/28	0.003078248660908	0.0165805666508001	CREBBP;EP300
1	GO_Molecular_Function_2021	histone demethylase activity (GO:0032452)	2/28	0.003078248660908	0.0170793151508446	KDM5A;KDM5C
1	GO_Cellular_Component_2021	integral component of plasma membrane (GO:0005887)	11/1454	0.0031604353408641	0.0252834827269134	ALK;PTPRD;CSF1R;EPHA7;PTPRS;IRS1;ERBB4;AXL;INSR;NTRK3;FAT1
1	KEGG_2021_Human	AGE-RAGE signaling pathway in diabetic complications	3/100	0.0032188419242375	0.0082547720315123	SMAD2;PIK3CD;JAK2
1	KEGG_2021_Human	Progesterone-mediated oocyte maturation	3/100	0.0032188419242375	0.0082547720315123	PIK3CD;PGR;BRAF
1	GO_Biological_Process_2021	positive regulation of multicellular organismal process (GO:0051240)	5/345	0.003466004576668	0.0185846851735365	SMAD2;APC;PIK3CD;AXIN2;JAK2
1	GO_Biological_Process_2021	positive regulation of phosphate metabolic process (GO:0045937)	2/30	0.0035290537376922	0.0188375165728169	AR;SRC
1	GO_Biological_Process_2021	nucleotide-excision repair (GO:0006289)	3/105	0.0036930092985155	0.0196242870795555	POLD1;EP300;BRCA2
1	GO_Molecular_Function_2021	growth factor receptor binding (GO:0070851)	3/105	0.0036930092985155	0.0198499249795208	SRC;ERBB4;JAK2
1	GO_Biological_Process_2021	regulation of developmental growth (GO:0048638)	2/31	0.0037653102558952	0.0196258573977121	LATS2;INSR
1	GO_Biological_Process_2021	regulation of transmembrane receptor protein serine/threonine kinase signaling pathway (GO:0090092)	2/31	0.0037653102558952	0.0196258573977121	SMAD2;LATS2
1	GO_Biological_Process_2021	protein acetylation (GO:0006473)	2/31	0.0037653102558952	0.0196258573977121	CREBBP;EP300
1	KEGG_2021_Human	cAMP signaling pathway	4/216	0.0037858999527648	0.009554890356978	CREBBP;PIK3CD;EP300;BRAF
1	GO_Biological_Process_2021	cellular response to peptide hormone stimulus (GO:0071375)	3/106	0.0037926762397266	0.0196258573977121	IRS1;SRC;INSR
1	GO_Biological_Process_2021	chromosome organization (GO:0051276)	3/106	0.0037926762397266	0.0196258573977121	MSH2;DOT1L;AXIN2
1	GO_Biological_Process_2021	positive regulation of protein serine/threonine kinase activity (GO:0071902)	3/106	0.0037926762397266	0.0196258573977121	RPTOR;CSF1R;SRC
1	KEGG_2021_Human	Regulation of actin cytoskeleton	4/218	0.0039120264167356	0.0097189406290775	APC;SRC;PIK3CD;BRAF
1	GO_Biological_Process_2021	cellular response to lipid (GO:0071396)	4/219	0.0039761469094206	0.0202143108982263	AR;IRS1;AXL;ATM
1	KEGG_2021_Human	Insulin resistance	3/108	0.0039969104890497	0.0097770579655218	IRS1;INSR;PIK3CD
1	GO_Biological_Process_2021	DNA replication (GO:0006260)	3/108	0.0039969104890497	0.0202143108982263	POLD1;ATM;BRCA1
1	GO_Biological_Process_2021	negative regulation of intracellular steroid hormone receptor signaling pathway (GO:0033144)	2/32	0.0040087451992263	0.0202143108982263	NCOR1;BRCA1
1	GO_Biological_Process_2021	DNA damage checkpoint signaling (GO:0000077)	2/32	0.0040087451992263	0.0202143108982263	DOT1L;ATM
1	GO_Biological_Process_2021	ERBB2 signaling pathway (GO:0038128)	2/32	0.0040087451992263	0.0202143108982263	SRC;ERBB4
1	GO_Biological_Process_2021	positive regulation of receptor signaling pathway via STAT (GO:1904894)	2/32	0.0040087451992263	0.0202143108982263	NOTCH1;ERBB4
1	GO_Molecular_Function_2021	acetyltransferase activity (GO:0016407)	2/32	0.0040087451992263	0.0208940658868765	CREBBP;EP300
1	GO_Biological_Process_2021	regulation of protein ubiquitination (GO:0031396)	3/109	0.0041014940201432	0.0205943661604649	AMER1;AXIN1;BRCA1
1	GO_Biological_Process_2021	regulation of histone acetylation (GO:0035065)	2/33	0.0042593156284662	0.0211183640992989	KMT2A;BRCA1
1	GO_Biological_Process_2021	positive regulation of histone modification (GO:0031058)	2/33	0.0042593156284662	0.0211183640992989	TET1;BRCA1
1	GO_Biological_Process_2021	mitotic G2 DNA damage checkpoint signaling (GO:0007095)	2/33	0.0042593156284662	0.0211183640992989	ATM;BRCA1
1	GO_Molecular_Function_2021	DNA secondary structure binding (GO:0000217)	2/33	0.0042593156284662	0.021547126120476	KMT2A;MSH2
1	GO_Biological_Process_2021	protein-containing complex subunit organization (GO:0043933)	3/112	0.0044252052569112	0.0217587893337753	CREBBP;KMT2A;APC
1	GO_Biological_Process_2021	phosphatidylinositol metabolic process (GO:0046488)	3/112	0.0044252052569112	0.0217587893337753	CSF1R;INPPL1;PIK3CD
1	GO_Biological_Process_2021	phosphatidylinositol 3-kinase signaling (GO:0014065)	2/34	0.0045169787852541	0.0220272422243875	IRS1;PIK3CD
1	GO_Biological_Process_2021	protein destabilization (GO:0031648)	2/34	0.0045169787852541	0.0220272422243875	CREBBP;EP300
1	GO_Biological_Process_2021	positive regulation of metabolic process (GO:0009893)	3/113	0.0045364549772722	0.022031553885523	APC;INSR;JAK2
1	GO_Biological_Process_2021	cellular response to transforming growth factor beta stimulus (GO:0071560)	3/114	0.0046493902936446	0.0224878673386486	SMAD2;SRC;CBL
1	GO_Biological_Process_2021	cellular response to lectin (GO:1990858)	3/115	0.004764018613487	0.0228557168298873	CREBBP;SRC;EP300
1	GO_Biological_Process_2021	stimulatory C-type lectin receptor signaling pathway (GO:0002223)	3/115	0.004764018613487	0.0228557168298873	CREBBP;SRC;EP300
1	GO_Molecular_Function_2021	protein-lysine N-methyltransferase activity (GO:0016279)	2/35	0.0047816920962989	0.022989898288397	SETD2;DOT1L
1	GO_Molecular_Function_2021	sequence-specific double-stranded DNA binding (GO:1990837)	7/712	0.0048118391766412	0.022989898288397	KDM5A;AR;KMT2D;NCOR1;ERBB4;BRCA1;BCOR
1	GO_Biological_Process_2021	positive regulation of cell projection organization (GO:0031346)	3/117	0.0049983833523716	0.0238834043248404	PTPRD;NTRK3;EP300
1	GO_Biological_Process_2021	negative regulation of DNA metabolic process (GO:0051053)	2/36	0.0050534131683621	0.0239531784180366	KMT2A;MSH2
1	GO_Biological_Process_2021	intrinsic apoptotic signaling pathway by p53 class mediator (GO:0072332)	2/36	0.0050534131683621	0.0239531784180366	MSH2;EP300
1	GO_Biological_Process_2021	innate immune response activating cell surface receptor signaling pathway (GO:0002220)	3/119	0.0052396063293077	0.0247367868535046	CREBBP;SRC;EP300
1	GO_Biological_Process_2021	regulation of actin cytoskeleton reorganization (GO:2000249)	2/37	0.0053320997910666	0.0249744594957075	CSF1R;NTRK3
1	GO_Biological_Process_2021	regulation of glucose import (GO:0046324)	2/37	0.0053320997910666	0.0249744594957075	IRS1;INSR
1	GO_Molecular_Function_2021	nuclear receptor binding (GO:0016922)	3/120	0.0053628070569952	0.0249298057784642	NCOR1;EP300;ARID1A
1	GO_Biological_Process_2021	negative regulation of cellular metabolic process (GO:0031324)	2/39	0.0059102017448563	0.0271456940606775	NCOR1;BRCA1
