Cluster_ID	Gene_set	Term	Overlap	P-value	Adjusted P-value	Genes
1	GO_Biological_Process_2021	negative regulation of myotube differentiation (GO:0010832)	1/13	0.0414478394284331	0.0834339624858069	NOTCH1
1	GO_Biological_Process_2021	cellular component maintenance (GO:0043954)	1/13	0.0414478394284331	0.0834339624858069	INSR
1	GO_Biological_Process_2021	negative regulation of stem cell differentiation (GO:2000737)	1/13	0.0414478394284331	0.0834339624858069	NOTCH1
1	GO_Biological_Process_2021	regulation of platelet-derived growth factor receptor signaling pathway (GO:0010640)	1/13	0.0414478394284331	0.0834339624858069	CBL
1	GO_Biological_Process_2021	embryonic hemopoiesis (GO:0035162)	1/13	0.0414478394284331	0.0834339624858069	KMT2A
1	GO_Biological_Process_2021	endochondral bone morphogenesis (GO:0060350)	1/13	0.0414478394284331	0.0834339624858069	INPPL1
1	GO_Biological_Process_2021	establishment of protein localization to chromosome (GO:0070199)	1/13	0.0414478394284331	0.0834339624858069	BRCA2
1	GO_Biological_Process_2021	positive regulation of cellular carbohydrate metabolic process (GO:0010676)	1/13	0.0414478394284331	0.0834339624858069	IRS1
1	GO_Biological_Process_2021	relaxation of cardiac muscle (GO:0055119)	1/13	0.0414478394284331	0.0834339624858069	PIK3CA
1	GO_Biological_Process_2021	positive regulation of insulin receptor signaling pathway (GO:0046628)	1/13	0.0414478394284331	0.0834339624858069	IRS1
1	GO_Biological_Process_2021	response to UV-B (GO:0010224)	1/13	0.0414478394284331	0.0834339624858069	MSH2
1	GO_Biological_Process_2021	homeostasis of number of cells (GO:0048872)	1/13	0.0414478394284331	0.0834339624858069	NOTCH1
1	GO_Biological_Process_2021	lymphocyte mediated immunity (GO:0002449)	1/13	0.0414478394284331	0.0834339624858069	MSH2
1	GO_Biological_Process_2021	positive regulation of transporter activity (GO:0032411)	1/13	0.0414478394284331	0.0834339624858069	KMT2A
1	GO_Cellular_Component_2021	integral component of synaptic vesicle membrane (GO:0030285)	1/13	0.0414478394284331	0.1519754112375881	PTPRS
1	GO_Molecular_Function_2021	insulin-like growth factor I binding (GO:0031994)	1/13	0.0414478394284331	0.0807142136237908	INSR
1	GO_Molecular_Function_2021	BMP receptor binding (GO:0070700)	1/13	0.0414478394284331	0.0807142136237908	SRC
1	GO_Biological_Process_2021	cellular response to chemical stress (GO:0062197)	2/101	0.0427535593131807	0.085808677606653	PIK3CA;ATM
1	GO_Biological_Process_2021	protein O-linked glycosylation (GO:0006493)	2/102	0.0435191589352504	0.085808677606653	TET2;TET1
1	GO_Biological_Process_2021	regulation of cell death (GO:0010941)	2/102	0.0435191589352504	0.085808677606653	APC;AXIN2
1	GO_Biological_Process_2021	regulation of protein catabolic process (GO:0042176)	2/102	0.0435191589352504	0.085808677606653	APC;AXIN1
1	GO_Biological_Process_2021	intrinsic apoptotic signaling pathway (GO:0097193)	2/102	0.0435191589352504	0.085808677606653	ATM;BRCA1
1	GO_Biological_Process_2021	positive regulation of vasculature development (GO:1904018)	2/102	0.0435191589352504	0.085808677606653	PIK3CD;BRCA1
1	GO_Biological_Process_2021	cellular response to organonitrogen compound (GO:0071417)	2/103	0.0442898907755059	0.085808677606653	RPTOR;BRCA1
1	GO_Biological_Process_2021	negative regulation of bone mineralization (GO:0030502)	1/14	0.0445651519182939	0.085808677606653	BCOR
1	GO_Biological_Process_2021	negative regulation of cell migration involved in sprouting angiogenesis (GO:0090051)	1/14	0.0445651519182939	0.085808677606653	NOTCH1
1	GO_Biological_Process_2021	atrioventricular valve development (GO:0003171)	1/14	0.0445651519182939	0.085808677606653	NOTCH1
1	GO_Biological_Process_2021	cardiac left ventricle morphogenesis (GO:0003214)	1/14	0.0445651519182939	0.085808677606653	NOTCH1
1	GO_Biological_Process_2021	cell junction maintenance (GO:0034331)	1/14	0.0445651519182939	0.085808677606653	CSF1R
1	GO_Biological_Process_2021	regulation of DNA methylation-dependent heterochromatin assembly (GO:0090308)	1/14	0.0445651519182939	0.085808677606653	TET1
1	GO_Biological_Process_2021	regulation of fatty acid beta-oxidation (GO:0031998)	1/14	0.0445651519182939	0.085808677606653	IRS1
1	GO_Biological_Process_2021	negative regulation of TORC1 signaling (GO:1904262)	1/14	0.0445651519182939	0.085808677606653	ATM
1	GO_Biological_Process_2021	regulation of histone methylation (GO:0031060)	1/14	0.0445651519182939	0.085808677606653	TET1
1	GO_Biological_Process_2021	regulation of nitric-oxide synthase biosynthetic process (GO:0051769)	1/14	0.0445651519182939	0.085808677606653	JAK2
1	GO_Biological_Process_2021	regulation of protein kinase C signaling (GO:0090036)	1/14	0.0445651519182939	0.085808677606653	FLT4
1	GO_Biological_Process_2021	regulation of response to interferon-gamma (GO:0060330)	1/14	0.0445651519182939	0.085808677606653	JAK2
1	GO_Biological_Process_2021	positive regulation of cellular response to insulin stimulus (GO:1900078)	1/14	0.0445651519182939	0.085808677606653	IRS1
1	GO_Biological_Process_2021	relaxation of muscle (GO:0090075)	1/14	0.0445651519182939	0.085808677606653	PIK3CA
1	GO_Biological_Process_2021	growth hormone receptor signaling pathway via JAK-STAT (GO:0060397)	1/14	0.0445651519182939	0.085808677606653	JAK2
1	GO_Biological_Process_2021	positive regulation of glucose metabolic process (GO:0010907)	1/14	0.0445651519182939	0.085808677606653	IRS1
1	GO_Biological_Process_2021	positive regulation of macrophage chemotaxis (GO:0010759)	1/14	0.0445651519182939	0.085808677606653	CSF1R
1	GO_Biological_Process_2021	secondary palate development (GO:0062009)	1/14	0.0445651519182939	0.085808677606653	SMAD2
1	GO_Biological_Process_2021	positive regulation of protein-containing complex disassembly (GO:0043243)	1/14	0.0445651519182939	0.085808677606653	INSR
1	GO_Biological_Process_2021	positive regulation of SMAD protein signal transduction (GO:0060391)	1/14	0.0445651519182939	0.085808677606653	JAK2
1	GO_Biological_Process_2021	positive regulation of transmembrane transport (GO:0034764)	1/14	0.0445651519182939	0.085808677606653	BRAF
1	GO_Molecular_Function_2021	phospholipase binding (GO:0043274)	1/14	0.0445651519182939	0.0858807615092123	SRC
1	KEGG_2021_Human	T cell receptor signaling pathway	2/104	0.0450657145329558	0.0687443103045089	PIK3CA;PIK3CD
1	KEGG_2021_Human	Toll-like receptor signaling pathway	2/104	0.0450657145329558	0.0687443103045089	PIK3CA;PIK3CD
1	GO_Molecular_Function_2021	cytokine receptor binding (GO:0005126)	2/105	0.0458465901179244	0.0874393729053198	SMAD2;JAK2
1	KEGG_2021_Human	Parathyroid hormone synthesis, secretion and action	2/106	0.046632477637007	0.0705365207954728	GNAS;BRAF
1	GO_Biological_Process_2021	regulation of cell cycle process (GO:0010564)	2/106	0.046632477637007	0.0888930498669028	SETD2;APC
1	KEGG_2021_Human	Th17 cell differentiation	2/107	0.0474233373750707	0.0711350060626061	SMAD2;JAK2
1	GO_Biological_Process_2021	negative regulation of androgen receptor signaling pathway (GO:0060766)	1/15	0.0476724823882987	0.0888930498669028	NCOR1
1	GO_Biological_Process_2021	regulation of dephosphorylation (GO:0035303)	1/15	0.0476724823882987	0.0888930498669028	SRC
1	GO_Biological_Process_2021	regulation of endothelial cell chemotaxis (GO:2001026)	1/15	0.0476724823882987	0.0888930498669028	NOTCH1
1	GO_Biological_Process_2021	cellular response to estrogen stimulus (GO:0071391)	1/15	0.0476724823882987	0.0888930498669028	AR
1	GO_Biological_Process_2021	regulation of extracellular matrix organization (GO:1903053)	1/15	0.0476724823882987	0.0888930498669028	NOTCH1
1	GO_Biological_Process_2021	regulation of integrin activation (GO:0033623)	1/15	0.0476724823882987	0.0888930498669028	SRC
1	GO_Biological_Process_2021	neurotrophin TRK receptor signaling pathway (GO:0048011)	1/15	0.0476724823882987	0.0888930498669028	NTRK1
1	GO_Biological_Process_2021	contractile actin filament bundle assembly (GO:0030038)	1/15	0.0476724823882987	0.0888930498669028	SRC
1	GO_Biological_Process_2021	peptidyl-tyrosine autophosphorylation (GO:0038083)	1/15	0.0476724823882987	0.0888930498669028	NTRK1
1	GO_Biological_Process_2021	regulation of phospholipase C activity (GO:1900274)	1/15	0.0476724823882987	0.0888930498669028	NTRK3
1	GO_Biological_Process_2021	positive regulation of DNA damage response, signal transduction by p53 class mediator (GO:0043517)	1/15	0.0476724823882987	0.0888930498669028	ATM
1	GO_Biological_Process_2021	positive regulation of double-strand break repair via homologous recombination (GO:1905168)	1/15	0.0476724823882987	0.0888930498669028	ARID2
1	GO_Biological_Process_2021	response to muscle stretch (GO:0035994)	1/15	0.0476724823882987	0.0888930498669028	PIK3CA
1	GO_Biological_Process_2021	histone mRNA catabolic process (GO:0071044)	1/15	0.0476724823882987	0.0888930498669028	ATM
1	GO_Biological_Process_2021	interleukin-27-mediated signaling pathway (GO:0070106)	1/15	0.0476724823882987	0.0888930498669028	JAK2
1	GO_Biological_Process_2021	positive regulation of natural killer cell activation (GO:0032816)	1/15	0.0476724823882987	0.0888930498669028	AXL
1	GO_Biological_Process_2021	stress fiber assembly (GO:0043149)	1/15	0.0476724823882987	0.0888930498669028	SRC
1	GO_Biological_Process_2021	macrophage differentiation (GO:0030225)	1/15	0.0476724823882987	0.0888930498669028	CSF1R
1	GO_Biological_Process_2021	positive regulation of response to cytokine stimulus (GO:0060760)	1/15	0.0476724823882987	0.0888930498669028	AXL
1	GO_Biological_Process_2021	protein localization to chromosome, telomeric region (GO:0070198)	1/15	0.0476724823882987	0.0888930498669028	BRCA2
1	GO_Cellular_Component_2021	integral component of postsynaptic specialization membrane (GO:0099060)	1/15	0.0476724823882987	0.1668536883590454	PTPRS
1	GO_Molecular_Function_2021	insulin-like growth factor binding (GO:0005520)	1/15	0.0476724823882987	0.0899939718554618	INSR
1	GO_Biological_Process_2021	negative regulation of transmembrane receptor protein serine/threonine kinase signaling pathway (GO:0090101)	2/108	0.0482191298475558	0.0897773588753291	SMAD2;NOTCH1
1	KEGG_2021_Human	Endocytosis	3/252	0.0487983224600078	0.0725925458082761	SMAD2;SRC;CBL
1	GO_Biological_Process_2021	response to tumor necrosis factor (GO:0034612)	2/110	0.0498253559618502	0.0925803370567106	BRCA1;JAK2
2	KEGG_2021_Human	Chronic myeloid leukemia	6/76	7.2134597281519714e-12	8.511882479219327e-10	CDKN2A;ABL1;PTPN11;KRAS;TP53;TGFBR2
2	KEGG_2021_Human	Non-small cell lung cancer	5/72	1.0246159395099e-09	6.04523404310841e-08	RET;CDKN2A;KRAS;JAK3;TP53
2	KEGG_2021_Human	Pathways in cancer	7/531	2.6102743163886793e-08	1.0267078977795473e-06	RET;CDKN2A;ABL1;KRAS;JAK3;TP53;TGFBR2
2	KEGG_2021_Human	Pancreatic cancer	4/76	1.8719749843134577e-07	4.497352228739094e-06	CDKN2A;KRAS;TP53;TGFBR2
2	KEGG_2021_Human	Viral carcinogenesis	5/203	1.905657724041989e-07	4.497352228739094e-06	CDKN2A;REL;KRAS;JAK3;TP53
2	KEGG_2021_Human	Human T-cell leukemia virus 1 infection	5/219	2.778107967357034e-07	5.4636123358021665e-06	CDKN2A;KRAS;JAK3;TP53;TGFBR2
2	KEGG_2021_Human	Neurotrophin signaling pathway	4/119	1.1388435236405172e-06	1.9197647969940148e-05	ABL1;PTPN11;KRAS;TP53
2	KEGG_2021_Human	Thyroid cancer	3/37	2.0917934803415043e-06	3.085395383503719e-05	RET;KRAS;TP53
2	KEGG_2021_Human	Bladder cancer	3/41	2.8650981453035985e-06	3.756462012731385e-05	CDKN2A;KRAS;TP53
2	KEGG_2021_Human	Cellular senescence	4/156	3.354393999102237e-06	3.9581849189406394e-05	CDKN2A;KRAS;TP53;TGFBR2
2	KEGG_2021_Human	Hepatitis B	4/162	3.897244540771783e-06	4.180680507373367e-05	KRAS;JAK3;TP53;TGFBR2
2	KEGG_2021_Human	Hepatocellular carcinoma	4/168	4.5026821223899065e-06	4.427637420350075e-05	CDKN2A;KRAS;TP53;TGFBR2
2	GO_Biological_Process_2021	regulation of thymocyte apoptotic process (GO:0070243)	2/6	6.813965891716014e-06	0.0036114019226094	JAK3;TP53
2	KEGG_2021_Human	Transcriptional misregulation in cancer	4/192	7.642175503342735e-06	6.93674391841879e-05	REL;TP53;TGFBR2;KDM6A
2	KEGG_2021_Human	Central carbon metabolism in cancer	3/70	1.4537663331549407e-05	0.00011887990714352317	RET;KRAS;TP53
2	KEGG_2021_Human	Melanoma	3/72	1.5825925432177543e-05	0.00011887990714352317	CDKN2A;KRAS;TP53
2	KEGG_2021_Human	Ras signaling pathway	4/232	1.611930944318958e-05	0.00011887990714352317	REL;ABL1;PTPN11;KRAS
2	KEGG_2021_Human	Glioma	3/75	1.78961054796072e-05	0.00012422002627021468	CDKN2A;KRAS;TP53
2	KEGG_2021_Human	Colorectal cancer	3/86	2.700026151780025e-05	0.0001770017143944683	KRAS;TP53;TGFBR2
2	GO_Biological_Process_2021	replicative senescence (GO:0090399)	2/12	2.9910033177640367e-05	0.0038220113344995	CDKN2A;TP53
2	GO_Biological_Process_2021	regulation of peptidyl-tyrosine phosphorylation (GO:0050730)	3/92	3.304969870894186e-05	0.0038220113344995	ABL1;PTPN11;TP53
2	GO_Biological_Process_2021	genitalia development (GO:0048806)	2/14	4.120673533565586e-05	0.0038220113344995	PTPN11;TBX3
2	GO_Biological_Process_2021	regulation of cell cycle (GO:0051726)	4/296	4.186219064108759e-05	0.0038220113344995	CDKN2A;ABL1;TP53;TBX3
2	KEGG_2021_Human	MicroRNAs in cancer	4/310	5.012475418288602e-05	0.00031130110492529213	CDKN2A;ABL1;KRAS;TP53
2	GO_Biological_Process_2021	regulation of gene expression (GO:0010468)	6/1079	5.0202301338979314e-05	0.0038220113344995	REL;ABL1;KRAS;TP53;ICOSLG;KDM6A
2	GO_Biological_Process_2021	small GTPase mediated signal transduction (GO:0007264)	3/106	5.04793949839557e-05	0.0038220113344995	CDKN2A;KRAS;TP53
2	GO_Molecular_Function_2021	protein tyrosine kinase activity (GO:0004713)	3/108	5.337530689806465e-05	0.0048037776208258	RET;ABL1;JAK3
2	KEGG_2021_Human	Cell cycle	3/124	8.054598906401727e-05	0.00047522133547770194	CDKN2A;ABL1;TP53
2	GO_Biological_Process_2021	circulatory system development (GO:0072359)	3/126	8.446966360572695e-05	0.0045630470583125	PTPN11;TGFBR2;KDM6A
2	GO_Biological_Process_2021	regulation of cell adhesion (GO:0030155)	3/133	9.918353818155463e-05	0.0045630470583125	RET;ABL1;PTPN11
2	GO_Biological_Process_2021	positive regulation of protein phosphorylation (GO:0001934)	4/371	0.00010064827968271862	0.0045630470583125	ABL1;PTPN11;KRAS;TP53
2	GO_Biological_Process_2021	positive regulation of peptidyl-tyrosine phosphorylation (GO:0050731)	3/134	0.00010141301363285008	0.0045630470583125	ABL1;PTPN11;TP53
2	GO_Biological_Process_2021	negative regulation of phosphate metabolic process (GO:0045936)	2/22	0.00010426836797847276	0.0045630470583125	CDKN2A;TP53
2	GO_Biological_Process_2021	Ras protein signal transduction (GO:0007265)	3/142	0.00012043796739273638	0.0045630470583125	CDKN2A;KRAS;TP53
2	GO_Biological_Process_2021	regulation of cell population proliferation (GO:0042127)	5/764	0.00012053331852146332	0.0045630470583125	CDKN2A;KRAS;TP53;TBX3;TGFBR2
2	KEGG_2021_Human	Signaling pathways regulating pluripotency of stem cells	3/143	0.00012296796389004385	0.0006909628447154845	KRAS;JAK3;TBX3
2	GO_Biological_Process_2021	phosphorylation (GO:0016310)	4/400	0.00013457884579739306	0.0046923184495799	RET;ABL1;JAK3;TGFBR2
2	KEGG_2021_Human	Gastric cancer	3/149	0.00013887917369132856	0.0007448973861625804	KRAS;TP53;TGFBR2
2	GO_Biological_Process_2021	response to cytokine (GO:0034097)	3/150	0.00014165489659109397	0.0046923184495799	REL;PTPN11;JAK3
2	GO_Biological_Process_2021	cellular senescence (GO:0090398)	2/27	0.0001581177517279993	0.0049295534362258	CDKN2A;TBX3
2	GO_Biological_Process_2021	negative regulation of transferase activity (GO:0051348)	2/29	0.0001827480001876529	0.0051433775309341	ABL1;TP53
2	GO_Biological_Process_2021	heart development (GO:0007507)	3/164	0.00018438523224103675	0.0051433775309341	PTPN11;TGFBR2;KDM6A
2	KEGG_2021_Human	Axon guidance	3/182	0.00025059407071890207	0.0012856565367317	ABL1;PTPN11;KRAS
2	GO_Biological_Process_2021	regulation of cell adhesion mediated by integrin (GO:0033628)	2/34	0.00025201247409397716	0.0066783305634903	RET;PTPN11
2	GO_Molecular_Function_2021	RNA polymerase II-specific DNA-binding transcription factor binding (GO:0061629)	3/190	0.0002843709060740964	0.0069397959059317	CDKN2A;TP53;TBX3
2	GO_Molecular_Function_2021	phosphotyrosine residue binding (GO:0001784)	2/37	0.0002988222171700243	0.0069397959059317	ABL1;PTPN11
2	GO_Biological_Process_2021	regulation of programmed cell death (GO:0043067)	3/194	0.0003023109709570223	0.0073947095863851	ABL1;JAK3;TP53
2	GO_Biological_Process_2021	protein phosphorylation (GO:0006468)	4/496	0.0003069502092461779	0.0073947095863851	RET;ABL1;JAK3;TGFBR2
2	GO_Molecular_Function_2021	protein kinase binding (GO:0019901)	4/506	0.00033119879555770364	0.0069397959059317	CDKN2A;ABL1;PTPN11;TP53
2	KEGG_2021_Human	Proteoglycans in cancer	3/205	0.00035538432879943775	0.0017473062832639	PTPN11;KRAS;TP53
2	GO_Molecular_Function_2021	protein phosphorylated amino acid binding (GO:0045309)	2/42	0.0003855442169962099	0.0069397959059317	ABL1;PTPN11
2	GO_Biological_Process_2021	heart looping (GO:0001947)	2/43	0.0004041897176269234	0.009313936971403	TBX3;TGFBR2
2	GO_Biological_Process_2021	positive regulation of intracellular signal transduction (GO:1902533)	4/546	0.0004421773659921787	0.0094828999011765	RET;REL;PTPN11;TP53
2	KEGG_2021_Human	Human cytomegalovirus infection	3/225	0.0004666176628532444	0.0022024353686673	CDKN2A;KRAS;TP53
2	GO_Biological_Process_2021	regulation of T cell activation (GO:0050863)	2/47	0.0004830911270410691	0.0094828999011765	ABL1;JAK3
2	GO_Biological_Process_2021	determination of heart left/right asymmetry (GO:0061371)	2/47	0.0004830911270410691	0.0094828999011765	TBX3;TGFBR2
2	GO_Biological_Process_2021	embryonic heart tube morphogenesis (GO:0003143)	2/47	0.0004830911270410691	0.0094828999011765	TBX3;TGFBR2
2	GO_Biological_Process_2021	regulation of interferon-beta production (GO:0032648)	2/49	0.0005251261040087869	0.0095971322456778	REL;PTPN11
2	GO_Biological_Process_2021	positive regulation of reactive oxygen species metabolic process (GO:2000379)	2/49	0.0005251261040087869	0.0095971322456778	TP53;TGFBR2
2	GO_Biological_Process_2021	intrinsic apoptotic signaling pathway in response to DNA damage (GO:0008630)	2/51	0.0005688783229383101	0.0100501837052434	ABL1;TP53
2	GO_Biological_Process_2021	signal transduction in response to DNA damage (GO:0042770)	2/52	0.0005913970865463289	0.0101109824474049	ABL1;TP53
2	GO_Biological_Process_2021	positive regulation of phosphorylation (GO:0042327)	3/253	0.0006567341679205313	0.0108771596561837	RET;ABL1;KRAS
2	GO_Biological_Process_2021	peptidyl-tyrosine modification (GO:0018212)	2/56	0.0006857442847474783	0.0110134688156413	ABL1;JAK3
2	GO_Biological_Process_2021	regulation of reactive oxygen species metabolic process (GO:2000377)	2/57	0.0007103965063044457	0.0110738278923928	TP53;TGFBR2
2	KEGG_2021_Human	Endometrial cancer	2/58	0.00073547385272901	0.0033379197931547	KRAS;TP53
2	GO_Biological_Process_2021	central nervous system development (GO:0007417)	3/268	0.0007762947558579933	0.0117553205887067	PTPN11;TBX3;TGFBR2
2	GO_Molecular_Function_2021	transmembrane receptor protein kinase activity (GO:0019199)	2/60	0.000786901835472271	0.011803527532084	RET;TGFBR2
2	GO_Biological_Process_2021	regulation of DNA-templated transcription, initiation (GO:2000142)	2/61	0.0008132514305384796	0.0119728682829276	CDKN2A;TP53
2	GO_Biological_Process_2021	regulation of transcription initiation from RNA polymerase II promoter (GO:0060260)	2/64	0.00089483639284657	0.0127843145110695	CDKN2A;TP53
2	GO_Biological_Process_2021	positive regulation of transcription, DNA-templated (GO:0045893)	5/1183	0.0009166112290955504	0.0127843145110695	RET;REL;ABL1;TP53;TBX3
2	GO_Biological_Process_2021	positive regulation of T cell proliferation (GO:0042102)	2/66	0.000951334658661269	0.0129283940792428	JAK3;ICOSLG
2	KEGG_2021_Human	Mitophagy	2/68	0.0010095147214072	0.0042286078536103	KRAS;TP53
2	KEGG_2021_Human	MAPK signaling pathway	3/294	0.001014898869767	0.0042286078536103	KRAS;TP53;TGFBR2
2	KEGG_2021_Human	Renal cell carcinoma	2/69	0.0010392341335144	0.0042286078536103	PTPN11;KRAS
2	GO_Biological_Process_2021	peptidyl-tyrosine phosphorylation (GO:0018108)	2/69	0.0010392341335144	0.013769852269066	ABL1;JAK3
2	GO_Biological_Process_2021	MAPK cascade (GO:0000165)	3/303	0.001107191586842	0.0143124766103972	RET;KRAS;JAK3
2	GO_Molecular_Function_2021	protein tyrosine kinase binding (GO:1990782)	2/72	0.0011309036960398	0.0145401903776551	PTPN11;TP53
2	KEGG_2021_Human	p53 signaling pathway	2/73	0.0011622956069068	0.0045716960538335	CDKN2A;TP53
2	GO_Biological_Process_2021	RNA transport (GO:0050658)	2/76	0.0012589703020374	0.0158870061923768	U2AF1;TGFBR2
2	GO_Biological_Process_2021	negative regulation of protein serine/threonine kinase activity (GO:0071901)	2/78	0.0013254974295978	0.0163375264578343	CDKN2A;ABL1
2	GO_Biological_Process_2021	regulation of apoptotic process (GO:0042981)	4/742	0.0013967375692713	0.0168243389025868	ABL1;JAK3;TP53;TBX3
2	KEGG_2021_Human	ErbB signaling pathway	2/85	0.0015713649938221	0.005981324815194	ABL1;KRAS
2	KEGG_2021_Human	PD-L1 expression and PD-1 checkpoint pathway in cancer	2/89	0.0017209072173333	0.0061904484356552	PTPN11;KRAS
2	KEGG_2021_Human	PI3K-Akt signaling pathway	3/354	0.0017312271048866	0.0061904484356552	KRAS;JAK3;TP53
2	GO_Biological_Process_2021	hemopoiesis (GO:0030097)	2/94	0.001917026013848	0.0225534606762565	TP53;TGFBR2
2	GO_Biological_Process_2021	mRNA metabolic process (GO:0016071)	2/95	0.0019574701719015	0.0225534606762565	U2AF1;TP53
2	KEGG_2021_Human	Prostate cancer	2/97	0.00203957484163	0.0070785244503632	KRAS;TP53
2	GO_Biological_Process_2021	negative regulation of cell population proliferation (GO:0008285)	3/379	0.0021038129778123	0.0237238484732031	CDKN2A;TP53;TBX3
2	KEGG_2021_Human	AGE-RAGE signaling pathway in diabetic complications	2/100	0.0021657651600423	0.0073017225395712	KRAS;TGFBR2
2	KEGG_2021_Human	Longevity regulating pathway	2/102	0.002251908371812	0.0073812552187172	KRAS;TP53
2	GO_Biological_Process_2021	intrinsic apoptotic signaling pathway (GO:0097193)	2/102	0.002251908371812	0.0248648216054244	ABL1;TP53
2	KEGG_2021_Human	C-type lectin receptor signaling pathway	2/104	0.00233965995691	0.0074616182409562	PTPN11;KRAS
2	GO_Biological_Process_2021	positive regulation of cellular metabolic process (GO:0031325)	2/105	0.0023841376349213	0.0257876111532305	TP53;TGFBR2
2	KEGG_2021_Human	Th17 cell differentiation	2/107	0.002474294254998	0.007683334791836	JAK3;TGFBR2
2	GO_Biological_Process_2021	regulation of transcription, DNA-templated (GO:0006355)	6/2244	0.0026754682579458	0.026848716135563	RET;CDKN2A;REL;ABL1;TP53;TBX3
2	GO_Biological_Process_2021	activation of protein kinase activity (GO:0032147)	2/114	0.0028024032097844	0.026848716135563	ABL1;TGFBR2
2	GO_Molecular_Function_2021	phosphatase binding (GO:0019902)	2/114	0.0028024032097844	0.0269557701344657	JAK3;TP53
2	GO_Biological_Process_2021	positive regulation of transcription by RNA polymerase II (GO:0045944)	4/908	0.0029313277507113	0.026848716135563	REL;ABL1;TP53;TBX3
2	KEGG_2021_Human	Sphingolipid signaling pathway	2/119	0.0030486596286902	0.0092241496457809	KRAS;TP53
2	KEGG_2021_Human	Thyroid hormone signaling pathway	2/121	0.0031499209760422	0.0092922668793245	KRAS;TP53
2	GO_Biological_Process_2021	cellular response to organic substance (GO:0071310)	2/123	0.0032527528286674	0.026848716135563	PTPN11;TGFBR2
2	GO_Molecular_Function_2021	protein phosphatase binding (GO:0019903)	2/123	0.0032527528286674	0.0269557701344657	JAK3;TP53
2	GO_Biological_Process_2021	cellular response to oxidative stress (GO:0034599)	2/125	0.00335715123549	0.026848716135563	ABL1;TP53
2	GO_Biological_Process_2021	negative regulation of cell growth (GO:0030308)	2/126	0.0034099366636931	0.026848716135563	CDKN2A;TP53
2	GO_Biological_Process_2021	negative regulation of growth (GO:0045926)	2/126	0.0034099366636931	0.026848716135563	CDKN2A;TP53
2	GO_Biological_Process_2021	activation of protein kinase C activity (GO:1990051)	1/5	0.0034953988931204	0.026848716135563	ABL1
2	GO_Biological_Process_2021	positive regulation of CD4-positive, alpha-beta T cell proliferation (GO:2000563)	1/5	0.0034953988931204	0.026848716135563	TGFBR2
2	GO_Biological_Process_2021	female genitalia development (GO:0030540)	1/5	0.0034953988931204	0.026848716135563	TBX3
2	GO_Biological_Process_2021	glial cell-derived neurotrophic factor receptor signaling pathway (GO:0035860)	1/5	0.0034953988931204	0.026848716135563	RET
2	GO_Biological_Process_2021	positive regulation of epithelial to mesenchymal transition involved in endocardial cushion formation (GO:1905007)	1/5	0.0034953988931204	0.026848716135563	TGFBR2
2	GO_Biological_Process_2021	bone marrow development (GO:0048539)	1/5	0.0034953988931204	0.026848716135563	TP53
2	GO_Biological_Process_2021	regulation of cell proliferation involved in heart morphogenesis (GO:2000136)	1/5	0.0034953988931204	0.026848716135563	TBX3
2	GO_Biological_Process_2021	histone H3-K27 demethylation (GO:0071557)	1/5	0.0034953988931204	0.026848716135563	KDM6A
2	GO_Biological_Process_2021	regulation of dendritic cell cytokine production (GO:0002730)	1/5	0.0034953988931204	0.026848716135563	JAK3
2	GO_Biological_Process_2021	cellular response to antibiotic (GO:0071236)	1/5	0.0034953988931204	0.026848716135563	TP53
2	GO_Biological_Process_2021	sinoatrial node cell differentiation (GO:0060921)	1/5	0.0034953988931204	0.026848716135563	TBX3
2	GO_Biological_Process_2021	tricuspid valve development (GO:0003175)	1/5	0.0034953988931204	0.026848716135563	TGFBR2
2	GO_Biological_Process_2021	tricuspid valve morphogenesis (GO:0003186)	1/5	0.0034953988931204	0.026848716135563	TGFBR2
2	GO_Molecular_Function_2021	histone demethylase activity (H3-K27 specific) (GO:0071558)	1/5	0.0034953988931204	0.0269557701344657	KDM6A
2	KEGG_2021_Human	Relaxin signaling pathway	2/129	0.0035706319406263	0.0100977988754002	KRAS;TGFBR2
2	GO_Molecular_Function_2021	kinase binding (GO:0019900)	3/461	0.0036647309866027	0.0269557701344657	CDKN2A;PTPN11;TP53
2	KEGG_2021_Human	FoxO signaling pathway	2/131	0.0036797063698492	0.0100977988754002	KRAS;TGFBR2
