Cluster_ID	Gene_set	Term	Overlap	P-value	Adjusted P-value	Genes
1	GO_Biological_Process_2021	positive regulation of cardiac muscle cell proliferation (GO:0060045)	2/14	0.0009228750422321748	0.0073487549597631	NOTCH1;ERBB4
1	GO_Biological_Process_2021	positive regulation of glycogen biosynthetic process (GO:0045725)	2/14	0.0009228750422321748	0.0073487549597631	IRS1;INSR
1	GO_Biological_Process_2021	response to X-ray (GO:0010165)	2/14	0.0009228750422321748	0.0073487549597631	MSH2;ATM
1	GO_Biological_Process_2021	synaptic membrane adhesion (GO:0099560)	2/14	0.0009228750422321748	0.0073487549597631	PTPRD;PTPRS
1	GO_Cellular_Component_2021	nBAF complex (GO:0071565)	2/14	0.0009228750422321748	0.0088826722814846	ARID1A;ARID1B
1	GO_Biological_Process_2021	regulation of cell adhesion (GO:0030155)	4/133	0.0009245207852605252	0.0073487549597631	EPHA7;ZFHX3;SRC;ATM
1	KEGG_2021_Human	VEGF signaling pathway	3/59	0.0009353311806859376	0.002439994384398	PIK3CA;SRC;PIK3CD
1	GO_Biological_Process_2021	positive regulation of tyrosine phosphorylation of STAT protein (GO:0042531)	3/59	0.0009353311806859376	0.0073873290703857	CSF1R;ERBB4;JAK2
1	GO_Biological_Process_2021	positive regulation of peptidyl-tyrosine phosphorylation (GO:0050731)	4/134	0.000950661539940448	0.0074358134765601	CSF1R;SRC;ERBB4;JAK2
1	GO_Biological_Process_2021	cellular response to DNA damage stimulus (GO:0006974)	6/350	0.0009534631796557022	0.0074358134765601	MSH2;APC;POLD1;DOT1L;ATM;BRCA1
1	KEGG_2021_Human	Autophagy	4/137	0.0010322054249555	0.0026542425213143	RPTOR;PIK3CA;IRS1;PIK3CD
1	GO_Biological_Process_2021	androgen receptor signaling pathway (GO:0030521)	2/15	0.0010626264349573	0.0080837839223749	AR;ARID1A
1	GO_Biological_Process_2021	positive regulation of glycogen metabolic process (GO:0070875)	2/15	0.0010626264349573	0.0080837839223749	IRS1;INSR
1	GO_Biological_Process_2021	positive regulation of histone H3-K4 methylation (GO:0051571)	2/15	0.0010626264349573	0.0080837839223749	KMT2A;BRCA1
1	GO_Biological_Process_2021	steroid hormone mediated signaling pathway (GO:0043401)	2/15	0.0010626264349573	0.0080837839223749	AR;PGR
1	KEGG_2021_Human	Calcium signaling pathway	5/240	0.001097295351427	0.0027818755388291	NTRK1;ERBB4;FLT4;NTRK3;GNAS
1	KEGG_2021_Human	Basal cell carcinoma	3/63	0.0011320262231592	0.0028300655578981	APC;AXIN1;AXIN2
1	GO_Biological_Process_2021	positive regulation of Ras protein signal transduction (GO:0046579)	3/63	0.0011320262231592	0.0085592226629115	NTRK1;NOTCH1;JAK2
1	KEGG_2021_Human	Apoptosis	4/142	0.0011788528243991	0.0029067603889292	NTRK1;PIK3CA;PIK3CD;ATM
1	GO_Biological_Process_2021	N-terminal protein amino acid acetylation (GO:0006474)	2/16	0.0012118881637081	0.0091075231696853	CREBBP;EP300
1	KEGG_2021_Human	Shigellosis	5/246	0.0012243901304944	0.0029782462633647	RPTOR;PIK3CA;SRC;PIK3CD;ATM
1	GO_Biological_Process_2021	regulation of cellular catabolic process (GO:0031329)	3/65	0.0012394269791336	0.009258370205577	RPTOR;EP300;ATM
1	GO_Molecular_Function_2021	protein kinase binding (GO:0019901)	7/506	0.001247788440018	0.0082443164786907	RPTOR;MSH2;APC;IRS1;AXIN1;RICTOR;JAK2
1	GO_Biological_Process_2021	positive regulation of cell death (GO:0010942)	3/66	0.0012954505464095	0.0096189142368134	NTRK1;APC;AXIN2
1	KEGG_2021_Human	Long-term potentiation	3/67	0.0013530451698362	0.0032473084076069	CREBBP;EP300;BRAF
1	GO_Biological_Process_2021	negative regulation of fatty acid metabolic process (GO:0045922)	2/17	0.0013705988588532	0.0098810615405702	NCOR1;BRCA1
1	GO_Biological_Process_2021	embryo development ending in birth or egg hatching (GO:0009792)	2/17	0.0013705988588532	0.0098810615405702	RICTOR;BRCA1
1	GO_Biological_Process_2021	positive regulation of cardiac muscle tissue growth (GO:0055023)	2/17	0.0013705988588532	0.0098810615405702	NOTCH1;ERBB4
1	GO_Biological_Process_2021	mesenchyme morphogenesis (GO:0072132)	2/17	0.0013705988588532	0.0098810615405702	SMAD2;NOTCH1
1	GO_Biological_Process_2021	vasculature development (GO:0001944)	2/17	0.0013705988588532	0.0098810615405702	PIK3CA;FLT4
1	KEGG_2021_Human	Phospholipase D signaling pathway	4/148	0.0013734127954614	0.0032528197787244	PIK3CA;INSR;GNAS;PIK3CD
1	GO_Biological_Process_2021	regulation of canonical Wnt signaling pathway (GO:0060828)	5/253	0.0013861016616064	0.0099350639329016	AMER1;LATS2;APC;AXIN1;AXIN2
1	GO_Biological_Process_2021	canonical Wnt signaling pathway (GO:0060070)	3/68	0.0014122272932433	0.0100066391064097	AMER1;APC;AXIN1
1	GO_Biological_Process_2021	regulation of tyrosine phosphorylation of STAT protein (GO:0042509)	3/68	0.0014122272932433	0.0100066391064097	CSF1R;ERBB4;JAK2
1	GO_Biological_Process_2021	response to cytokine (GO:0034097)	4/150	0.0014429645108763	0.0101663408720837	CSF1R;SETD2;SRC;JAK2
1	GO_Biological_Process_2021	negative regulation of programmed cell death (GO:0043069)	6/381	0.0014725550468625	0.0103162048480765	NTRK1;SRC;AXL;FLT4;BRAF;CBL
1	GO_Biological_Process_2021	cellular response to light stimulus (GO:0071482)	3/70	0.0015354188071001	0.0105413526142631	CREBBP;POLD1;EP300
1	GO_Biological_Process_2021	chromatin disassembly (GO:0031498)	2/18	0.0015386974380497	0.0105413526142631	ARID1A;ARID2
1	GO_Biological_Process_2021	nucleosome disassembly (GO:0006337)	2/18	0.0015386974380497	0.0105413526142631	ARID1A;ARID2
1	GO_Biological_Process_2021	intracellular estrogen receptor signaling pathway (GO:0030520)	2/18	0.0015386974380497	0.0105413526142631	AR;ARID1A
1	GO_Biological_Process_2021	regulation of glycolytic process (GO:0006110)	3/71	0.0015994600823125	0.010720705416581	NCOR1;INSR;EP300
1	GO_Biological_Process_2021	regulation of TOR signaling (GO:0032006)	3/71	0.0015994600823125	0.010720705416581	RPTOR;PIK3CA;RICTOR
1	GO_Biological_Process_2021	histone acetylation (GO:0016573)	3/71	0.0015994600823125	0.010720705416581	CREBBP;EP300;BRCA2
1	GO_Biological_Process_2021	myeloid leukocyte differentiation (GO:0002573)	3/71	0.0015994600823125	0.010720705416581	CSF1R;PIK3CD;EP300
1	KEGG_2021_Human	Non-alcoholic fatty liver disease	4/155	0.001627543291523	0.0037967185737782	PIK3CA;IRS1;INSR;PIK3CD
1	GO_Biological_Process_2021	positive regulation of NF-kappaB transcription factor activity (GO:0051092)	4/155	0.001627543291523	0.0108502886101534	ALK;NTRK1;AR;EP300
1	GO_Biological_Process_2021	cellular protein modification process (GO:0006464)	10/1025	0.0016432509697861	0.0108964235429667	NTRK1;PTPRD;PTPRS;LATS2;INSR;PIK3CD;BRAF;ATM;CDK12;JAK2
1	KEGG_2021_Human	Melanoma	3/72	0.00166515262954	0.0037967185737782	PIK3CA;PIK3CD;BRAF
1	GO_Biological_Process_2021	response to ionizing radiation (GO:0010212)	3/72	0.00166515262954	0.0109325852876929	MSH2;ATM;BRCA1
1	KEGG_2021_Human	Cellular senescence	4/156	0.0016663375962693	0.0037967185737782	SMAD2;PIK3CA;PIK3CD;ATM
1	GO_Biological_Process_2021	regulation of signal transduction by p53 class mediator (GO:1901796)	4/156	0.0016663375962693	0.0109325852876929	EP300;RICTOR;ATM;BRCA1
1	GO_Molecular_Function_2021	ubiquitin protein ligase binding (GO:0031625)	5/265	0.0016993274395228	0.0106838233713226	SMAD2;APC;AXIN1;BRCA1;AXIN2
1	GO_Biological_Process_2021	DNA double-strand break processing (GO:0000729)	2/19	0.0017161231052228	0.0111999613182965	ATM;BRCA1
1	GO_Cellular_Component_2021	SWI/SNF complex (GO:0016514)	2/19	0.0017161231052228	0.0146823865669066	ARID1A;ARID1B
1	KEGG_2021_Human	Inositol phosphate metabolism	3/73	0.0017325118980523	0.0038981517706177	PIK3CA;INPPL1;PIK3CD
1	GO_Molecular_Function_2021	ATPase binding (GO:0051117)	3/73	0.0017325118980523	0.0106838233713226	AR;SRC;PGR
1	GO_Biological_Process_2021	cellular response to growth factor stimulus (GO:0071363)	4/158	0.0017458489807711	0.0113343075191425	NTRK1;NOTCH1;FLT4;NTRK3
1	GO_Biological_Process_2021	protein deubiquitination (GO:0016579)	5/267	0.0017561985109793	0.0113421153834082	SMAD2;AR;APC;EP300;BRCA1
1	KEGG_2021_Human	Glioma	3/75	0.0018722914206693	0.0041606476014874	PIK3CA;PIK3CD;BRAF
1	GO_Biological_Process_2021	regulation of transcription from RNA polymerase II promoter in response to hypoxia (GO:0061418)	3/75	0.0018722914206693	0.0120292298530051	CREBBP;NOTCH1;EP300
1	GO_Biological_Process_2021	protein-DNA complex disassembly (GO:0032986)	2/20	0.0019028153491433	0.0120999540150651	ARID1A;ARID2
1	GO_Biological_Process_2021	negative regulation of cyclin-dependent protein serine/threonine kinase activity (GO:0045736)	2/20	0.0019028153491433	0.0120999540150651	LATS2;APC
1	GO_Molecular_Function_2021	transcription coactivator binding (GO:0001223)	2/20	0.0019028153491433	0.0113555109545648	AR;PGR
1	GO_Biological_Process_2021	negative regulation of cellular macromolecule biosynthetic process (GO:2000113)	7/547	0.0019461336519214	0.0123122741244007	SMAD2;SPEN;KDM5C;NCOR1;NOTCH1;BRCA1;BCOR
1	GO_Biological_Process_2021	double-strand break repair (GO:0006302)	4/164	0.0020001615584183	0.0123924061405982	ATM;BRCA1;BRCA2;PALB2
1	GO_Biological_Process_2021	cellular response to UV (GO:0034644)	3/77	0.0020189183674246	0.0123924061405982	CREBBP;POLD1;EP300
1	GO_Biological_Process_2021	positive regulation of protein modification by small protein conjugation or removal (GO:1903322)	3/77	0.0020189183674246	0.0123924061405982	AMER1;AXIN1;BRCA1
1	GO_Biological_Process_2021	positive regulation of type I interferon production (GO:0032481)	3/77	0.0020189183674246	0.0123924061405982	SETD2;CREBBP;EP300
1	GO_Biological_Process_2021	protein modification by small protein removal (GO:0070646)	5/276	0.0020295781965239	0.0123924061405982	SMAD2;AR;APC;EP300;BRCA1
1	GO_Biological_Process_2021	regulation of neuron projection development (GO:0010975)	4/165	0.0020449055778314	0.0123924061405982	NTRK1;PTPRS;NTRK3;EP300
1	GO_Biological_Process_2021	regulation of cardiac muscle cell proliferation (GO:0060043)	2/21	0.0020987139431658	0.0123924061405982	NOTCH1;ERBB4
1	GO_Biological_Process_2021	cellular response to steroid hormone stimulus (GO:0071383)	2/21	0.0020987139431658	0.0123924061405982	AR;SRC
1	GO_Biological_Process_2021	regulation of transcription by RNA polymerase III (GO:0006359)	2/21	0.0020987139431658	0.0123924061405982	RPTOR;AR
1	GO_Biological_Process_2021	intrinsic apoptotic signaling pathway in response to DNA damage by p53 class mediator (GO:0042771)	2/21	0.0020987139431658	0.0123924061405982	MSH2;EP300
1	GO_Biological_Process_2021	spindle assembly checkpoint signaling (GO:0071173)	2/21	0.0020987139431658	0.0123924061405982	APC;ATM
1	GO_Biological_Process_2021	positive regulation of transcription from RNA polymerase II promoter involved in cellular response to chemical stimulus (GO:1901522)	2/21	0.0020987139431658	0.0123924061405982	NOTCH1;EP300
1	GO_Biological_Process_2021	mitotic spindle assembly checkpoint signaling (GO:0007094)	2/21	0.0020987139431658	0.0123924061405982	APC;ATM
1	GO_Biological_Process_2021	mitotic spindle checkpoint signaling (GO:0071174)	2/21	0.0020987139431658	0.0123924061405982	APC;ATM
1	GO_Molecular_Function_2021	ephrin receptor binding (GO:0046875)	2/21	0.0020987139431658	0.0121331899839274	SRC;CBL
1	GO_Biological_Process_2021	recombinational repair (GO:0000725)	3/79	0.0021725093986812	0.0127673538121549	BRCA1;BRCA2;PALB2
1	GO_Molecular_Function_2021	ubiquitin-like protein ligase binding (GO:0044389)	5/282	0.0022283544781045	0.0124922902560406	SMAD2;APC;AXIN1;BRCA1;AXIN2
1	GO_Biological_Process_2021	negative regulation of cellular component organization (GO:0051129)	3/80	0.0022519520756684	0.0129848231342809	AR;SRC;EP300
1	GO_Biological_Process_2021	negative regulation of extrinsic apoptotic signaling pathway (GO:2001237)	3/80	0.0022519520756684	0.0129848231342809	AR;SRC;BRCA1
1	GO_Biological_Process_2021	positive regulation of cell adhesion (GO:0045785)	3/80	0.0022519520756684	0.0129848231342809	ZFHX3;ATM;JAK2
1	GO_Biological_Process_2021	negative regulation of biomineral tissue development (GO:0070168)	2/22	0.0023037589431788	0.0129848231342809	NOTCH1;BCOR
1	GO_Biological_Process_2021	negative regulation of cyclin-dependent protein kinase activity (GO:1904030)	2/22	0.0023037589431788	0.0129848231342809	LATS2;APC
1	GO_Biological_Process_2021	negative regulation of mitotic metaphase/anaphase transition (GO:0045841)	2/22	0.0023037589431788	0.0129848231342809	APC;ATM
1	GO_Biological_Process_2021	negative regulation of small molecule metabolic process (GO:0062014)	2/22	0.0023037589431788	0.0129848231342809	NCOR1;EP300
1	GO_Biological_Process_2021	cellular response to nerve growth factor stimulus (GO:1990090)	2/22	0.0023037589431788	0.0129848231342809	NTRK1;NTRK3
1	GO_Biological_Process_2021	osteoclast differentiation (GO:0030316)	2/22	0.0023037589431788	0.0129848231342809	CSF1R;SRC
1	KEGG_2021_Human	B cell receptor signaling pathway	3/81	0.0023331781568254	0.0051216105881533	PIK3CA;INPPL1;PIK3CD
1	GO_Biological_Process_2021	positive regulation of protein ubiquitination (GO:0031398)	3/82	0.0024162013825397	0.0135569670332547	AMER1;AXIN1;BRCA1
1	KEGG_2021_Human	Mismatch repair	2/23	0.0025178906867457	0.0054604858266775	MSH2;POLD1
1	GO_Biological_Process_2021	lymphocyte differentiation (GO:0030098)	3/84	0.0025876933144015	0.0144537824768376	MSH2;AXL;PIK3CD
1	GO_Biological_Process_2021	positive regulation of developmental process (GO:0051094)	4/177	0.002637080769053	0.0146635881328512	ALK;AR;SRC;INSR
1	GO_Biological_Process_2021	positive regulation of protein catabolic process (GO:0045732)	3/85	0.0026761885894795	0.0146825039791813	AMER1;APC;AXIN1
1	GO_Biological_Process_2021	negative regulation of lipid metabolic process (GO:0045833)	2/24	0.0027410497923989	0.0146825039791813	ALK;NCOR1
1	GO_Biological_Process_2021	regulation of cellular response to transforming growth factor beta stimulus (GO:1903844)	2/24	0.0027410497923989	0.0146825039791813	SMAD2;LATS2
1	GO_Biological_Process_2021	negative regulation of ossification (GO:0030279)	2/24	0.0027410497923989	0.0146825039791813	NOTCH1;BCOR
1	GO_Biological_Process_2021	negative regulation of protein depolymerization (GO:1901880)	2/24	0.0027410497923989	0.0146825039791813	APC;PIK3CA
1	GO_Biological_Process_2021	positive regulation of cellular response to transforming growth factor beta stimulus (GO:1903846)	2/24	0.0027410497923989	0.0146825039791813	CREBBP;EP300
1	GO_Biological_Process_2021	mammary gland development (GO:0030879)	2/24	0.0027410497923989	0.0146825039791813	ERBB4;JAK2
1	GO_Biological_Process_2021	positive regulation of transforming growth factor beta receptor signaling pathway (GO:0030511)	2/24	0.0027410497923989	0.0146825039791813	CREBBP;EP300
1	GO_Biological_Process_2021	regulation of cell cycle (GO:0051726)	5/296	0.0027470491315887	0.0146825039791813	NOTCH1;APC;EP300;ATM;BRCA1
1	GO_Biological_Process_2021	regulation of Ras protein signal transduction (GO:0046578)	3/86	0.0027665341491587	0.0147231860298576	NTRK1;NOTCH1;JAK2
1	KEGG_2021_Human	Tuberculosis	4/180	0.0028017061055846	0.0060036559405384	CREBBP;SRC;EP300;JAK2
1	KEGG_2021_Human	Axon guidance	4/182	0.0029152918546353	0.0061735592215807	EPHA7;PIK3CA;SRC;PIK3CD
1	GO_Biological_Process_2021	regulation of intracellular signal transduction (GO:1902531)	6/437	0.002927108470547	0.0154905028361269	NTRK1;NTRK3;EP300;RICTOR;ATM;BRCA1
1	GO_Biological_Process_2021	negative regulation of cellular carbohydrate metabolic process (GO:0010677)	2/25	0.0029731771572566	0.0154905028361269	NCOR1;EP300
1	GO_Biological_Process_2021	regulation of interferon-alpha production (GO:0032647)	2/25	0.0029731771572566	0.0154905028361269	SETD2;PTPRS
1	GO_Biological_Process_2021	positive regulation of peptidyl-threonine phosphorylation (GO:0010800)	2/25	0.0029731771572566	0.0154905028361269	RPTOR;AXIN1
1	GO_Biological_Process_2021	positive regulation of vascular endothelial growth factor production (GO:0010575)	2/25	0.0029731771572566	0.0154905028361269	FLT4;BRCA1
1	GO_Biological_Process_2021	MAPK cascade (GO:0000165)	5/303	0.0030369207142587	0.0157521333768318	PIK3CA;IRS1;ERBB4;BRAF;JAK2
1	GO_Biological_Process_2021	transforming growth factor beta receptor signaling pathway (GO:0007179)	3/89	0.003048800008419	0.0157521333768318	SMAD2;SRC;CBL
1	GO_Biological_Process_2021	regulation of glycogen biosynthetic process (GO:0005979)	2/26	0.0032142139579214	0.0162678583992757	IRS1;INSR
1	GO_Biological_Process_2021	positive regulation of glucose import (GO:0046326)	2/26	0.0032142139579214	0.0162678583992757	IRS1;INSR
1	GO_Biological_Process_2021	histone lysine demethylation (GO:0070076)	2/26	0.0032142139579214	0.0162678583992757	KDM5A;KDM5C
1	GO_Biological_Process_2021	TOR signaling (GO:0031929)	2/26	0.0032142139579214	0.0162678583992757	RPTOR;RICTOR
1	GO_Biological_Process_2021	mononuclear cell differentiation (GO:1903131)	2/26	0.0032142139579214	0.0162678583992757	CSF1R;AXL
1	GO_Biological_Process_2021	regulation of actin cytoskeleton organization (GO:0032956)	3/91	0.003246459284629	0.0163642663127643	CSF1R;PIK3CA;RICTOR
1	KEGG_2021_Human	Th1 and Th2 cell differentiation	3/92	0.0033481699349725	0.0070077975383147	NOTCH3;NOTCH1;JAK2
1	GO_Biological_Process_2021	regulation of peptidyl-tyrosine phosphorylation (GO:0050730)	3/92	0.0033481699349725	0.0167408496748628	EPHA7;SRC;JAK2
1	GO_Biological_Process_2021	Wnt signaling pathway (GO:0016055)	3/92	0.0033481699349725	0.0167408496748628	AMER1;APC;AXIN1
1	GO_Biological_Process_2021	positive regulation of BMP signaling pathway (GO:0030513)	2/27	0.0034641016482661	0.0171819441754002	SMAD2;NOTCH1
1	GO_Biological_Process_2021	regulation of vascular endothelial growth factor production (GO:0010574)	2/27	0.0034641016482661	0.0171819441754002	FLT4;BRCA1
1	KEGG_2021_Human	TGF-beta signaling pathway	3/94	0.0035574122077175	0.0073601631883811	SMAD2;CREBBP;EP300
1	GO_Biological_Process_2021	nucleosome organization (GO:0034728)	3/94	0.0035574122077175	0.017504726736388	SETD2;ARID2;ARID1A
1	GO_Biological_Process_2021	positive regulation of epithelial cell migration (GO:0010634)	3/94	0.0035574122077175	0.017504726736388	SRC;FLT4;PIK3CD
1	GO_Biological_Process_2021	internal peptidyl-lysine acetylation (GO:0018393)	2/28	0.0037227819568748	0.0182460459546436	CREBBP;EP300
1	GO_Molecular_Function_2021	histone demethylase activity (GO:0032452)	2/28	0.0037227819568748	0.020256313588878	KDM5A;KDM5C
1	KEGG_2021_Human	Fc gamma R-mediated phagocytosis	3/97	0.0038859998059354	0.0078593254502065	PIK3CA;INPPL1;PIK3CD
1	KEGG_2021_Human	Phosphatidylinositol signaling system	3/97	0.0038859998059354	0.0078593254502065	PIK3CA;INPPL1;PIK3CD
1	GO_Biological_Process_2021	double-strand break repair via homologous recombination (GO:0000724)	3/97	0.0038859998059354	0.0188966265072939	BRCA1;BRCA2;PALB2
1	GO_Biological_Process_2021	positive regulation of cold-induced thermogenesis (GO:0120162)	3/97	0.0038859998059354	0.0188966265072939	APC;GNAS;JAK2
1	GO_Biological_Process_2021	regulation of neuron apoptotic process (GO:0043523)	3/98	0.003999500085518	0.0193725785392281	NTRK1;EPHA7;MSH2
1	GO_Biological_Process_2021	positive regulation of phosphate metabolic process (GO:0045937)	2/30	0.0042662887226134	0.0205844280779792	AR;SRC
1	KEGG_2021_Human	Melanogenesis	3/101	0.0043520651693262	0.0087041303386524	CREBBP;GNAS;EP300
1	GO_Cellular_Component_2021	axon (GO:0030424)	4/204	0.0043795683675581	0.0337226764301979	NTRK1;PTPRS;NTRK3;INSR
1	KEGG_2021_Human	Amoebiasis	3/102	0.0044736431463163	0.0088489644652411	PIK3CA;GNAS;PIK3CD
1	GO_Molecular_Function_2021	protein homodimerization activity (GO:0042803)	7/636	0.0044853450678195	0.0236151909881719	NTRK1;CSF1R;MSH2;KMT2A;ERBB4;FLT4;AXIN1
1	GO_Biological_Process_2021	regulation of developmental growth (GO:0048638)	2/31	0.0045510000089712	0.0217047692735551	LATS2;INSR
1	GO_Biological_Process_2021	regulation of transmembrane receptor protein serine/threonine kinase signaling pathway (GO:0090092)	2/31	0.0045510000089712	0.0217047692735551	SMAD2;LATS2
1	GO_Biological_Process_2021	protein acetylation (GO:0006473)	2/31	0.0045510000089712	0.0217047692735551	CREBBP;EP300
1	GO_Molecular_Function_2021	zinc ion binding (GO:0008270)	5/336	0.0047083823412019	0.0236151909881719	KDM5A;KDM5C;KMT2A;TET2;TET1
1	KEGG_2021_Human	C-type lectin receptor signaling pathway	3/104	0.0047229445996361	0.0092405437818967	PIK3CA;SRC;PIK3CD
1	GO_Biological_Process_2021	negative regulation of intracellular steroid hormone receptor signaling pathway (GO:0033144)	2/32	0.0048442735710893	0.022527539211715	NCOR1;BRCA1
1	GO_Biological_Process_2021	DNA damage checkpoint signaling (GO:0000077)	2/32	0.0048442735710893	0.022527539211715	DOT1L;ATM
1	GO_Biological_Process_2021	hematopoietic progenitor cell differentiation (GO:0002244)	2/32	0.0048442735710893	0.022527539211715	CSF1R;FLT4
1	GO_Biological_Process_2021	positive regulation of lamellipodium organization (GO:1902745)	2/32	0.0048442735710893	0.022527539211715	PIK3CA;SRC
1	GO_Biological_Process_2021	positive regulation of receptor signaling pathway via STAT (GO:1904894)	2/32	0.0048442735710893	0.022527539211715	NOTCH1;ERBB4
1	GO_Molecular_Function_2021	acetyltransferase activity (GO:0016407)	2/32	0.0048442735710893	0.0236151909881719	CREBBP;EP300
1	GO_Biological_Process_2021	regulation of JNK cascade (GO:0046328)	3/105	0.0048506878786515	0.022527539211715	NCOR1;FLT4;AXIN1
1	GO_Biological_Process_2021	nucleotide-excision repair (GO:0006289)	3/105	0.0048506878786515	0.022527539211715	POLD1;EP300;BRCA2
1	GO_Molecular_Function_2021	growth factor receptor binding (GO:0070851)	3/105	0.0048506878786515	0.0236151909881719	SRC;ERBB4;JAK2
1	GO_Biological_Process_2021	cellular response to peptide hormone stimulus (GO:0071375)	3/106	0.0049805057989435	0.0228734340395924	IRS1;SRC;INSR
1	GO_Biological_Process_2021	chromosome organization (GO:0051276)	3/106	0.0049805057989435	0.0228734340395924	MSH2;DOT1L;AXIN2
1	GO_Biological_Process_2021	positive regulation of protein serine/threonine kinase activity (GO:0071902)	3/106	0.0049805057989435	0.0228734340395924	RPTOR;CSF1R;SRC
1	KEGG_2021_Human	Glucagon signaling pathway	3/107	0.0051124078712052	0.0098949829765262	CREBBP;GNAS;EP300
1	GO_Biological_Process_2021	regulation of histone acetylation (GO:0035065)	2/33	0.0051460525023896	0.0233740113661653	KMT2A;BRCA1
1	GO_Biological_Process_2021	positive regulation of histone modification (GO:0031058)	2/33	0.0051460525023896	0.0233740113661653	TET1;BRCA1
1	GO_Biological_Process_2021	mitotic G2 DNA damage checkpoint signaling (GO:0007095)	2/33	0.0051460525023896	0.0233740113661653	ATM;BRCA1
1	GO_Molecular_Function_2021	2-oxoglutarate-dependent dioxygenase activity (GO:0016706)	2/33	0.0051460525023896	0.023800492823552	TET2;TET1
1	GO_Molecular_Function_2021	DNA secondary structure binding (GO:0000217)	2/33	0.0051460525023896	0.023800492823552	KMT2A;MSH2
1	GO_Biological_Process_2021	DNA replication (GO:0006260)	3/108	0.0052464034510851	0.0237428477348378	POLD1;ATM;BRCA1
1	KEGG_2021_Human	Lipid and atherosclerosis	4/215	0.0052700574946429	0.0100915994578269	PIK3CA;SRC;PIK3CD;JAK2
1	GO_Biological_Process_2021	regulation of protein ubiquitination (GO:0031396)	3/109	0.0053825017417089	0.0242701896717055	AMER1;AXIN1;BRCA1
1	GO_Biological_Process_2021	protein destabilization (GO:0031648)	2/34	0.0054562801662247	0.0245137224859374	CREBBP;EP300
1	GO_Biological_Process_2021	cellular response to lipid (GO:0071396)	4/219	0.0056218428406862	0.0251663722832165	AR;IRS1;AXL;ATM
1	GO_Molecular_Function_2021	protein-lysine N-methyltransferase activity (GO:0016279)	2/35	0.0057749001924772	0.0260574764782511	SETD2;DOT1L
1	GO_Biological_Process_2021	protein-containing complex subunit organization (GO:0043933)	3/112	0.0058035026259025	0.0258861268205725	CREBBP;KMT2A;APC
1	KEGG_2021_Human	Cholinergic synapse	3/113	0.0059481007565112	0.0112700856439159	PIK3CA;PIK3CD;JAK2
1	GO_Biological_Process_2021	cellular response to transforming growth factor beta stimulus (GO:0071560)	3/114	0.0060948453480994	0.0269263417653733	SMAD2;SRC;CBL
1	GO_Biological_Process_2021	negative regulation of DNA metabolic process (GO:0051053)	2/36	0.0061018564807015	0.0269263417653733	KMT2A;MSH2
1	GO_Biological_Process_2021	intrinsic apoptotic signaling pathway by p53 class mediator (GO:0072332)	2/36	0.0061018564807015	0.0269263417653733	MSH2;EP300
1	KEGG_2021_Human	Human cytomegalovirus infection	4/225	0.0061784685679924	0.0115846285649858	PIK3CA;SRC;GNAS;PIK3CD
1	GO_Biological_Process_2021	cellular response to lectin (GO:1990858)	3/115	0.0062437447069517	0.027357750659435	CREBBP;SRC;EP300
1	GO_Biological_Process_2021	stimulatory C-type lectin receptor signaling pathway (GO:0002223)	3/115	0.0062437447069517	0.027357750659435	CREBBP;SRC;EP300
1	KEGG_2021_Human	Thyroid cancer	2/37	0.006437093194111	0.0119451213911338	NTRK1;BRAF
1	GO_Biological_Process_2021	regulation of actin cytoskeleton reorganization (GO:2000249)	2/37	0.006437093194111	0.0280070019673603	CSF1R;NTRK3
1	GO_Biological_Process_2021	regulation of glucose import (GO:0046324)	2/37	0.006437093194111	0.0280070019673603	IRS1;INSR
1	GO_Biological_Process_2021	innate immune response activating cell surface receptor signaling pathway (GO:0002220)	3/119	0.0068610508268521	0.0297472133751632	CREBBP;SRC;EP300
1	KEGG_2021_Human	Thermogenesis	4/232	0.0068729307369792	0.0126237503332271	RPTOR;GNAS;ARID1A;ARID1B
1	GO_Molecular_Function_2021	nuclear receptor binding (GO:0016922)	3/120	0.0070208435263791	0.0306849857777313	NCOR1;EP300;ARID1A
1	GO_Biological_Process_2021	negative regulation of cellular metabolic process (GO:0031324)	2/39	0.0071321858834726	0.0303914450017392	NCOR1;BRCA1
1	GO_Biological_Process_2021	cellular response to ketone (GO:1901655)	2/39	0.0071321858834726	0.0303914450017392	AR;SRC
1	GO_Biological_Process_2021	DNA integrity checkpoint signaling (GO:0031570)	2/39	0.0071321858834726	0.0303914450017392	DOT1L;ATM
1	GO_Biological_Process_2021	regulation of peptidyl-threonine phosphorylation (GO:0010799)	2/39	0.0071321858834726	0.0303914450017392	RPTOR;AXIN1
1	GO_Biological_Process_2021	protein acylation (GO:0043543)	2/39	0.0071321858834726	0.0303914450017392	CREBBP;EP300
1	GO_Molecular_Function_2021	signaling receptor complex adaptor activity (GO:0030159)	2/39	0.0071321858834726	0.0306849857777313	IRS1;AXIN1
