Cluster_ID	Gene_set	Term	Overlap	P-value	Adjusted P-value	Genes
1	GO_Biological_Process_2021	establishment of protein localization to chromosome (GO:0070199)	1/13	0.0376893933426092	0.0776729236712902	BRCA2
1	GO_Biological_Process_2021	positive regulation of cellular carbohydrate metabolic process (GO:0010676)	1/13	0.0376893933426092	0.0776729236712902	IRS1
1	GO_Biological_Process_2021	positive regulation of insulin receptor signaling pathway (GO:0046628)	1/13	0.0376893933426092	0.0776729236712902	IRS1
1	GO_Biological_Process_2021	response to UV-B (GO:0010224)	1/13	0.0376893933426092	0.0776729236712902	MSH2
1	GO_Biological_Process_2021	homeostasis of number of cells (GO:0048872)	1/13	0.0376893933426092	0.0776729236712902	NOTCH1
1	GO_Biological_Process_2021	lymphocyte mediated immunity (GO:0002449)	1/13	0.0376893933426092	0.0776729236712902	MSH2
1	GO_Biological_Process_2021	positive regulation of transporter activity (GO:0032411)	1/13	0.0376893933426092	0.0776729236712902	KMT2A
1	GO_Cellular_Component_2021	integral component of synaptic vesicle membrane (GO:0030285)	1/13	0.0376893933426092	0.1428229642456769	PTPRS
1	GO_Molecular_Function_2021	insulin-like growth factor I binding (GO:0031994)	1/13	0.0376893933426092	0.0771735197015331	INSR
1	GO_Molecular_Function_2021	phosphatidylinositol phosphate kinase activity (GO:0016307)	1/13	0.0376893933426092	0.0771735197015331	PIK3CD
1	GO_Molecular_Function_2021	BMP receptor binding (GO:0070700)	1/13	0.0376893933426092	0.0771735197015331	SRC
1	KEGG_2021_Human	C-type lectin receptor signaling pathway	2/104	0.0378178625945237	0.0660773643135085	SRC;PIK3CD
1	KEGG_2021_Human	Endocytosis	3/252	0.038341558935592	0.0662642159865123	SMAD2;SRC;CBL
1	GO_Biological_Process_2021	regulation of JNK cascade (GO:0046328)	2/105	0.0384804823159181	0.0791655755978523	NCOR1;AXIN1
1	GO_Molecular_Function_2021	cytokine receptor binding (GO:0005126)	2/105	0.0384804823159181	0.0778663877451519	SMAD2;JAK2
1	GO_Biological_Process_2021	regulation of cell cycle process (GO:0010564)	2/106	0.0391475567115874	0.08031456012777	SETD2;APC
1	GO_Molecular_Function_2021	protein homodimerization activity (GO:0042803)	5/636	0.0392272205145012	0.0784544410290024	CSF1R;MSH2;KMT2A;ERBB4;AXIN1
1	KEGG_2021_Human	Th17 cell differentiation	2/107	0.0398190547274451	0.0673535074645082	SMAD2;JAK2
1	KEGG_2021_Human	Glucagon signaling pathway	2/107	0.0398190547274451	0.0673535074645082	CREBBP;EP300
1	GO_Biological_Process_2021	negative regulation of transmembrane receptor protein serine/threonine kinase signaling pathway (GO:0090101)	2/108	0.0404949454372152	0.08031456012777	SMAD2;NOTCH1
1	GO_Biological_Process_2021	negative regulation of bone mineralization (GO:0030502)	1/14	0.040530048064478	0.08031456012777	BCOR
1	GO_Biological_Process_2021	negative regulation of cell migration involved in sprouting angiogenesis (GO:0090051)	1/14	0.040530048064478	0.08031456012777	NOTCH1
1	GO_Biological_Process_2021	atrioventricular valve development (GO:0003171)	1/14	0.040530048064478	0.08031456012777	NOTCH1
1	GO_Biological_Process_2021	cardiac left ventricle morphogenesis (GO:0003214)	1/14	0.040530048064478	0.08031456012777	NOTCH1
1	GO_Biological_Process_2021	cell junction maintenance (GO:0034331)	1/14	0.040530048064478	0.08031456012777	CSF1R
1	GO_Biological_Process_2021	regulation of DNA methylation-dependent heterochromatin assembly (GO:0090308)	1/14	0.040530048064478	0.08031456012777	TET1
1	GO_Biological_Process_2021	regulation of fatty acid beta-oxidation (GO:0031998)	1/14	0.040530048064478	0.08031456012777	IRS1
1	GO_Biological_Process_2021	negative regulation of TORC1 signaling (GO:1904262)	1/14	0.040530048064478	0.08031456012777	ATM
1	GO_Biological_Process_2021	regulation of histone methylation (GO:0031060)	1/14	0.040530048064478	0.08031456012777	TET1
1	GO_Biological_Process_2021	regulation of nitric-oxide synthase biosynthetic process (GO:0051769)	1/14	0.040530048064478	0.08031456012777	JAK2
1	GO_Biological_Process_2021	regulation of response to interferon-gamma (GO:0060330)	1/14	0.040530048064478	0.08031456012777	JAK2
1	GO_Biological_Process_2021	positive regulation of cellular response to insulin stimulus (GO:1900078)	1/14	0.040530048064478	0.08031456012777	IRS1
1	GO_Biological_Process_2021	growth hormone receptor signaling pathway via JAK-STAT (GO:0060397)	1/14	0.040530048064478	0.08031456012777	JAK2
1	GO_Biological_Process_2021	positive regulation of glucose metabolic process (GO:0010907)	1/14	0.040530048064478	0.08031456012777	IRS1
1	GO_Biological_Process_2021	positive regulation of macrophage chemotaxis (GO:0010759)	1/14	0.040530048064478	0.08031456012777	CSF1R
1	GO_Biological_Process_2021	secondary palate development (GO:0062009)	1/14	0.040530048064478	0.08031456012777	SMAD2
1	GO_Biological_Process_2021	positive regulation of protein-containing complex disassembly (GO:0043243)	1/14	0.040530048064478	0.08031456012777	INSR
1	GO_Biological_Process_2021	positive regulation of SMAD protein signal transduction (GO:0060391)	1/14	0.040530048064478	0.08031456012777	JAK2
1	GO_Biological_Process_2021	positive regulation of transmembrane transport (GO:0034764)	1/14	0.040530048064478	0.08031456012777	BRAF
1	GO_Biological_Process_2021	vascular endothelial growth factor signaling pathway (GO:0038084)	1/14	0.040530048064478	0.08031456012777	PIK3CD
1	GO_Molecular_Function_2021	phospholipase binding (GO:0043274)	1/14	0.040530048064478	0.0801283708860945	SRC
1	GO_Biological_Process_2021	positive regulation of cell differentiation (GO:0045597)	3/258	0.0406559433755031	0.0804295373956114	SMAD2;AR;AXIN2
1	GO_Biological_Process_2021	cellular component assembly (GO:0022607)	3/261	0.0418392867061501	0.0825355101573186	CREBBP;KMT2A;APC
1	GO_Biological_Process_2021	response to tumor necrosis factor (GO:0034612)	2/110	0.0418597819447666	0.0825355101573186	BRCA1;JAK2
1	GO_Molecular_Function_2021	transition metal ion binding (GO:0046914)	4/445	0.042201742864636	0.0824852246899705	KDM5A;KDM5C;KMT2A;TET1
1	GO_Biological_Process_2021	regulation of Wnt signaling pathway (GO:0030111)	2/111	0.0425486665846377	0.0830121396943755	AMER1;AXIN1
1	GO_Biological_Process_2021	nervous system development (GO:0007399)	4/447	0.0427846343212934	0.0830121396943755	APC;ERBB4;AXL;EP300
1	GO_Biological_Process_2021	negative regulation of androgen receptor signaling pathway (GO:0060766)	1/15	0.0433624594690451	0.0830121396943755	NCOR1
1	GO_Biological_Process_2021	regulation of dephosphorylation (GO:0035303)	1/15	0.0433624594690451	0.0830121396943755	SRC
1	GO_Biological_Process_2021	regulation of endothelial cell chemotaxis (GO:2001026)	1/15	0.0433624594690451	0.0830121396943755	NOTCH1
1	GO_Biological_Process_2021	cellular response to estrogen stimulus (GO:0071391)	1/15	0.0433624594690451	0.0830121396943755	AR
1	GO_Biological_Process_2021	regulation of extracellular matrix organization (GO:1903053)	1/15	0.0433624594690451	0.0830121396943755	NOTCH1
1	GO_Biological_Process_2021	regulation of integrin activation (GO:0033623)	1/15	0.0433624594690451	0.0830121396943755	SRC
1	GO_Biological_Process_2021	contractile actin filament bundle assembly (GO:0030038)	1/15	0.0433624594690451	0.0830121396943755	SRC
1	GO_Biological_Process_2021	regulation of phospholipase C activity (GO:1900274)	1/15	0.0433624594690451	0.0830121396943755	NTRK3
1	GO_Biological_Process_2021	positive regulation of DNA damage response, signal transduction by p53 class mediator (GO:0043517)	1/15	0.0433624594690451	0.0830121396943755	ATM
1	GO_Biological_Process_2021	histone mRNA catabolic process (GO:0071044)	1/15	0.0433624594690451	0.0830121396943755	ATM
1	GO_Biological_Process_2021	interleukin-27-mediated signaling pathway (GO:0070106)	1/15	0.0433624594690451	0.0830121396943755	JAK2
1	GO_Biological_Process_2021	positive regulation of natural killer cell activation (GO:0032816)	1/15	0.0433624594690451	0.0830121396943755	AXL
1	GO_Biological_Process_2021	stress fiber assembly (GO:0043149)	1/15	0.0433624594690451	0.0830121396943755	SRC
1	GO_Biological_Process_2021	macrophage differentiation (GO:0030225)	1/15	0.0433624594690451	0.0830121396943755	CSF1R
1	GO_Biological_Process_2021	positive regulation of response to cytokine stimulus (GO:0060760)	1/15	0.0433624594690451	0.0830121396943755	AXL
1	GO_Biological_Process_2021	protein localization to chromosome, telomeric region (GO:0070198)	1/15	0.0433624594690451	0.0830121396943755	BRCA2
1	GO_Cellular_Component_2021	integral component of postsynaptic specialization membrane (GO:0099060)	1/15	0.0433624594690451	0.1561048540885624	PTPRS
1	GO_Molecular_Function_2021	insulin-like growth factor binding (GO:0005520)	1/15	0.0433624594690451	0.0838016070637726	INSR
1	KEGG_2021_Human	Cholinergic synapse	2/113	0.043939216777844	0.0735403733439704	PIK3CD;JAK2
1	GO_Biological_Process_2021	positive regulation of cellular component organization (GO:0051130)	2/114	0.0446408219898234	0.0851841772269577	AR;INSR
1	GO_Biological_Process_2021	histone modification (GO:0016570)	2/114	0.0446408219898234	0.0851841772269577	CREBBP;EP300
1	GO_Biological_Process_2021	positive regulation of protein metabolic process (GO:0051247)	2/115	0.0453466072887356	0.0861908369643515	APC;AXIN1
1	GO_Cellular_Component_2021	cell-cell junction (GO:0005911)	3/271	0.0459086719288384	0.1574011608988748	NOTCH1;APC;FAT1
1	GO_Biological_Process_2021	regulation of protein-containing complex assembly (GO:0043254)	2/116	0.0460565428365158	0.0861908369643515	SRC;EP300
1	GO_Biological_Process_2021	positive regulation of angiogenesis (GO:0045766)	2/116	0.0460565428365158	0.0861908369643515	PIK3CD;BRCA1
1	GO_Biological_Process_2021	negative regulation of cell-substrate junction organization (GO:0150118)	1/16	0.0461866510315301	0.0861908369643515	SRC
1	GO_Biological_Process_2021	negative regulation of focal adhesion assembly (GO:0051895)	1/16	0.0461866510315301	0.0861908369643515	SRC
1	GO_Biological_Process_2021	B cell activation involved in immune response (GO:0002312)	1/16	0.0461866510315301	0.0861908369643515	MSH2
1	GO_Biological_Process_2021	negative regulation of histone modification (GO:0031057)	1/16	0.0461866510315301	0.0861908369643515	BRCA1
1	GO_Biological_Process_2021	body fluid secretion (GO:0007589)	1/16	0.0461866510315301	0.0861908369643515	ERBB4
1	GO_Biological_Process_2021	negative regulation of telomere maintenance (GO:0032205)	1/16	0.0461866510315301	0.0861908369643515	ATM
1	GO_Biological_Process_2021	neuron projection organization (GO:0106027)	1/16	0.0461866510315301	0.0861908369643515	INSR
1	GO_Biological_Process_2021	odontogenesis of dentin-containing tooth (GO:0042475)	1/16	0.0461866510315301	0.0861908369643515	ANKRD11
1	GO_Biological_Process_2021	oogenesis (GO:0048477)	1/16	0.0461866510315301	0.0861908369643515	KMT2D
1	GO_Biological_Process_2021	positive regulation by host of viral transcription (GO:0043923)	1/16	0.0461866510315301	0.0861908369643515	EP300
1	GO_Biological_Process_2021	positive regulation of small molecule metabolic process (GO:0062013)	1/16	0.0461866510315301	0.0861908369643515	IRS1
1	GO_Molecular_Function_2021	transmembrane receptor protein phosphatase activity (GO:0019198)	1/16	0.0461866510315301	0.0863489562763389	PTPRD
1	GO_Molecular_Function_2021	transmembrane receptor protein serine/threonine kinase binding (GO:0070696)	1/16	0.0461866510315301	0.0863489562763389	SRC
1	GO_Molecular_Function_2021	transmembrane receptor protein tyrosine phosphatase activity (GO:0005001)	1/16	0.0461866510315301	0.0863489562763389	PTPRD
1	GO_Biological_Process_2021	positive regulation of protein-containing complex assembly (GO:0031334)	2/118	0.0474887460372922	0.0884813900223134	SRC;ATM
1	GO_Molecular_Function_2021	ATP binding (GO:0005524)	3/278	0.0488705204815631	0.0877964077014681	LATS2;MSH2;INSR
1	GO_Biological_Process_2021	negative regulation of ATP metabolic process (GO:1903579)	1/17	0.0490026461589589	0.089473244527529	NCOR1
1	GO_Biological_Process_2021	pulmonary valve morphogenesis (GO:0003184)	1/17	0.0490026461589589	0.089473244527529	NOTCH1
1	GO_Biological_Process_2021	negative regulation of insulin secretion (GO:0046676)	1/17	0.0490026461589589	0.089473244527529	IRS1
1	GO_Biological_Process_2021	cell surface receptor signaling pathway involved in heart development (GO:0061311)	1/17	0.0490026461589589	0.089473244527529	NOTCH1
1	GO_Biological_Process_2021	cellular response to fatty acid (GO:0071398)	1/17	0.0490026461589589	0.089473244527529	IRS1
1	GO_Biological_Process_2021	cellular response to gamma radiation (GO:0071480)	1/17	0.0490026461589589	0.089473244527529	ATM
1	GO_Biological_Process_2021	DNA biosynthetic process (GO:0071897)	1/17	0.0490026461589589	0.089473244527529	POLD1
1	GO_Biological_Process_2021	regulation of transferase activity (GO:0051338)	1/17	0.0490026461589589	0.089473244527529	ATM
1	GO_Biological_Process_2021	histone H2A monoubiquitination (GO:0035518)	1/17	0.0490026461589589	0.089473244527529	BCOR
1	GO_Biological_Process_2021	histone H2A ubiquitination (GO:0033522)	1/17	0.0490026461589589	0.089473244527529	BCOR
1	GO_Biological_Process_2021	ruffle organization (GO:0031529)	1/17	0.0490026461589589	0.089473244527529	CSF1R
1	GO_Biological_Process_2021	positive regulation of positive chemotaxis (GO:0050927)	1/17	0.0490026461589589	0.089473244527529	NTRK3
1	GO_Biological_Process_2021	muscle tissue morphogenesis (GO:0060415)	1/17	0.0490026461589589	0.089473244527529	NOTCH1
1	GO_Cellular_Component_2021	intrinsic component of synaptic vesicle membrane (GO:0098563)	1/17	0.0490026461589589	0.1603722965202293	PTPRS
1	GO_Molecular_Function_2021	ephrin receptor activity (GO:0005003)	1/17	0.0490026461589589	0.0877964077014681	EPHA7
1	GO_Molecular_Function_2021	four-way junction DNA binding (GO:0000400)	1/17	0.0490026461589589	0.0877964077014681	MSH2
1	GO_Molecular_Function_2021	transmembrane-ephrin receptor activity (GO:0005005)	1/17	0.0490026461589589	0.0877964077014681	EPHA7
2	KEGG_2021_Human	Chronic myeloid leukemia	7/76	9.589213022125313e-14	1.3424898230975436e-11	SMAD4;CDKN2A;AKT3;ABL1;PTPN11;KRAS;TP53
2	KEGG_2021_Human	Pancreatic cancer	5/76	2.930065136255416e-09	2.0510455953787918e-07	SMAD4;CDKN2A;AKT3;KRAS;TP53
2	KEGG_2021_Human	Neurotrophin signaling pathway	5/119	2.8399882626636538e-08	1.325327855909705e-06	AKT3;ABL1;PTPN11;KRAS;TP53
2	KEGG_2021_Human	Pathways in cancer	7/531	8.30754139113253e-08	2.907639486896385e-06	SMAD4;CASP8;CDKN2A;AKT3;ABL1;KRAS;TP53
2	KEGG_2021_Human	Hepatitis B	5/162	1.3319067046504116e-07	3.725613177664592e-06	SMAD4;CASP8;AKT3;KRAS;TP53
2	KEGG_2021_Human	Hepatocellular carcinoma	5/168	1.5966913618562538e-07	3.725613177664592e-06	SMAD4;CDKN2A;AKT3;KRAS;TP53
2	GO_Biological_Process_2021	positive regulation of protein phosphorylation (GO:0001934)	6/371	2.678027157353358e-07	0.00014943391538031737	SMAD4;ABL1;PTPN11;KRAS;GATA1;TP53
2	KEGG_2021_Human	Melanoma	4/72	2.718817980543341e-07	4.757931465950846e-06	CDKN2A;AKT3;KRAS;TP53
2	KEGG_2021_Human	Non-small cell lung cancer	4/72	2.718817980543341e-07	4.757931465950846e-06	CDKN2A;AKT3;KRAS;TP53
2	KEGG_2021_Human	Glioma	4/75	3.207487166582338e-07	4.989424481350303e-06	CDKN2A;AKT3;KRAS;TP53
2	KEGG_2021_Human	Viral carcinogenesis	5/203	4.089632544294343e-07	5.72548556201208e-06	CASP8;CDKN2A;REL;KRAS;TP53
2	KEGG_2021_Human	Colorectal cancer	4/86	5.574383323290405e-07	6.946299648764174e-06	SMAD4;AKT3;KRAS;TP53
2	KEGG_2021_Human	Human T-cell leukemia virus 1 infection	5/219	5.953971127512149e-07	6.946299648764174e-06	SMAD4;CDKN2A;AKT3;KRAS;TP53
2	KEGG_2021_Human	Human cytomegalovirus infection	5/225	6.805076766251379e-07	7.328544209809178e-06	CASP8;CDKN2A;AKT3;KRAS;TP53
2	GO_Biological_Process_2021	regulation of peptidyl-tyrosine phosphorylation (GO:0050730)	4/92	7.313610073893652e-07	0.00020404972106163289	ABL1;PTPN11;GATA1;TP53
2	KEGG_2021_Human	Ras signaling pathway	5/232	7.916771653326159e-07	7.916771653326159e-06	AKT3;ABL1;REL;PTPN11;KRAS
2	KEGG_2021_Human	C-type lectin receptor signaling pathway	4/104	1.1966228780320084e-06	1.1168480194965412e-05	CASP8;AKT3;PTPN11;KRAS
2	KEGG_2021_Human	Cell cycle	4/124	2.418021343794222e-06	2.1157686758199443e-05	SMAD4;CDKN2A;ABL1;TP53
2	GO_Biological_Process_2021	positive regulation of peptidyl-tyrosine phosphorylation (GO:0050731)	4/134	3.2938233499113566e-06	0.0006126511430835124	ABL1;PTPN11;GATA1;TP53
2	KEGG_2021_Human	Apoptosis	4/142	4.148364433733182e-06	3.2386555806044714e-05	CASP8;AKT3;KRAS;TP53
2	KEGG_2021_Human	Signaling pathways regulating pluripotency of stem cells	4/143	4.2656882187852494e-06	3.2386555806044714e-05	SMAD4;AKT3;KRAS;TBX3
2	KEGG_2021_Human	Bladder cancer	3/41	4.395318287963211e-06	3.2386555806044714e-05	CDKN2A;KRAS;TP53
2	KEGG_2021_Human	Gastric cancer	4/149	5.022054877081138e-06	3.515438413956797e-05	SMAD4;AKT3;KRAS;TP53
2	KEGG_2021_Human	Cellular senescence	4/156	6.025153581319912e-06	3.932534933245423e-05	CDKN2A;AKT3;KRAS;TP53
2	KEGG_2021_Human	Hepatitis C	4/157	6.179697752242808e-06	3.932534933245423e-05	CASP8;AKT3;KRAS;TP53
2	GO_Biological_Process_2021	regulation of gene expression (GO:0010468)	7/1079	9.706939030554329e-06	0.0013541179947623	CASP8;ABL1;REL;KRAS;TP53;ICOSLG;KDM6A
2	KEGG_2021_Human	Endometrial cancer	3/58	1.2617578205007283e-05	7.68026499435226e-05	AKT3;KRAS;TP53
2	GO_Molecular_Function_2021	RNA polymerase II-specific DNA-binding transcription factor binding (GO:0061629)	4/190	1.313414571416634e-05	0.0011558048228466	CDKN2A;GATA1;TP53;TBX3
2	KEGG_2021_Human	Kaposi sarcoma-associated herpesvirus infection	4/193	1.3970263397318088e-05	8.149320315102218e-05	CASP8;AKT3;KRAS;TP53
2	KEGG_2021_Human	Proteoglycans in cancer	4/205	1.7712446312451226e-05	9.918969934972684e-05	AKT3;PTPN11;KRAS;TP53
2	KEGG_2021_Human	Renal cell carcinoma	3/69	2.131029472269665e-05	0.00011073507831250527	AKT3;PTPN11;KRAS
2	KEGG_2021_Human	Lipid and atherosclerosis	4/215	2.135605081741173e-05	0.00011073507831250527	CASP8;AKT3;KRAS;TP53
2	KEGG_2021_Human	Central carbon metabolism in cancer	3/70	2.225363598485697e-05	0.00011126817992428484	AKT3;KRAS;TP53
2	KEGG_2021_Human	p53 signaling pathway	3/73	2.5247795920511977e-05	0.00012188591134040264	CASP8;CDKN2A;TP53
2	GO_Biological_Process_2021	replicative senescence (GO:0090399)	2/12	3.941561644068303e-05	0.0043281057527472	CDKN2A;TP53
2	KEGG_2021_Human	ErbB signaling pathway	3/85	3.98607061947541e-05	0.0001860166289088525	AKT3;ABL1;KRAS
2	KEGG_2021_Human	PD-L1 expression and PD-1 checkpoint pathway in cancer	3/89	4.574182232818951e-05	0.00020657597180472685	AKT3;PTPN11;KRAS
2	GO_Biological_Process_2021	positive regulation of transcription by RNA polymerase II (GO:0045944)	6/908	4.6595378302580393e-05	0.0043281057527472	SMAD4;ABL1;REL;GATA1;TP53;TBX3
2	GO_Biological_Process_2021	genitalia development (GO:0048806)	2/14	5.429523345740245e-05	0.0043281057527472	PTPN11;TBX3
2	KEGG_2021_Human	Prostate cancer	3/97	5.9155295994329374e-05	0.00025880441997519103	AKT3;KRAS;TP53
2	KEGG_2021_Human	AGE-RAGE signaling pathway in diabetic complications	3/100	6.478177589668101e-05	0.000274831776531374	SMAD4;AKT3;KRAS
2	KEGG_2021_Human	Longevity regulating pathway	3/102	6.872099770941669e-05	0.0002829688140975981	AKT3;KRAS;TP53
2	GO_Biological_Process_2021	regulation of cell cycle (GO:0051726)	4/296	7.435393461035295e-05	0.0047779404367712	CDKN2A;ABL1;TP53;TBX3
2	GO_Biological_Process_2021	small GTPase mediated signal transduction (GO:0007264)	3/106	7.706355543179465e-05	0.0047779404367712	CDKN2A;KRAS;TP53
2	KEGG_2021_Human	MicroRNAs in cancer	4/310	8.892973141241418e-05	0.00035571892564965674	CDKN2A;ABL1;KRAS;TP53
2	GO_Biological_Process_2021	interleukin-6-mediated signaling pathway (GO:0070102)	2/18	9.11177629974979e-05	0.0050843711752603	SMAD4;PTPN11
2	KEGG_2021_Human	Sphingolipid signaling pathway	3/119	0.00010868787723630718	0.0004220712940191911	AKT3;KRAS;TP53
2	KEGG_2021_Human	Thyroid hormone signaling pathway	3/121	0.00011419736496844078	0.0004220712940191911	AKT3;KRAS;TP53
2	KEGG_2021_Human	Human papillomavirus infection	4/331	0.0001145622083766376	0.0004220712940191911	CASP8;AKT3;KRAS;TP53
2	GO_Molecular_Function_2021	DNA-binding transcription activator activity, RNA polymerase II-specific (GO:0001228)	4/333	0.00011725571994245072	0.0031250948988878	SMAD4;REL;GATA1;TP53
2	GO_Biological_Process_2021	negative regulation of cell growth (GO:0030308)	3/126	0.0001287612779389681	0.0054729393156034	SMAD4;CDKN2A;TP53
2	GO_Biological_Process_2021	negative regulation of growth (GO:0045926)	3/126	0.0001287612779389681	0.0054729393156034	SMAD4;CDKN2A;TP53
2	GO_Biological_Process_2021	circulatory system development (GO:0072359)	3/126	0.0001287612779389681	0.0054729393156034	CASP8;PTPN11;KDM6A
2	GO_Biological_Process_2021	negative regulation of phosphate metabolic process (GO:0045936)	2/22	0.00013731388963879662	0.0054729393156034	CDKN2A;TP53
2	KEGG_2021_Human	FoxO signaling pathway	3/131	0.00014448669755253173	0.0005186701963424216	SMAD4;AKT3;KRAS
2	KEGG_2021_Human	Apelin signaling pathway	3/137	0.00016494731177894314	0.000577315591226301	SMAD4;AKT3;KRAS
2	KEGG_2021_Human	Measles	3/139	0.00017216410064785318	0.000587877416846328	CASP8;AKT3;TP53
2	GO_Molecular_Function_2021	RNA polymerase II cis-regulatory region sequence-specific DNA binding (GO:0000978)	6/1149	0.00017248968445051643	0.0031250948988878	SMAD4;REL;GATA1;TP53;TBX3;KDM6A
2	GO_Molecular_Function_2021	cis-regulatory region sequence-specific DNA binding (GO:0000987)	6/1149	0.00017248968445051643	0.0031250948988878	SMAD4;REL;GATA1;TP53;TBX3;KDM6A
2	GO_Molecular_Function_2021	sequence-specific double-stranded DNA binding (GO:1990837)	5/712	0.0001775622101640813	0.0031250948988878	SMAD4;ABL1;GATA1;TP53;TBX3
2	GO_Biological_Process_2021	Ras protein signal transduction (GO:0007265)	3/142	0.0001833698124539928	0.0056831835389919	CDKN2A;KRAS;TP53
2	GO_Biological_Process_2021	positive regulation of protein insertion into mitochondrial membrane involved in apoptotic signaling pathway (GO:1900740)	2/26	0.0001928308312214584	0.0056831835389919	CASP8;TP53
2	GO_Biological_Process_2021	regulation of protein insertion into mitochondrial membrane involved in apoptotic signaling pathway (GO:1900739)	2/26	0.0001928308312214584	0.0056831835389919	CASP8;TP53
2	GO_Biological_Process_2021	positive regulation of transcription, DNA-templated (GO:0045893)	6/1183	0.00020245295351003863	0.0056831835389919	SMAD4;ABL1;REL;GATA1;TP53;TBX3
2	KEGG_2021_Human	Breast cancer	3/147	0.0002030817225688605	0.0006745469534621772	AKT3;KRAS;TP53
2	KEGG_2021_Human	Phospholipase D signaling pathway	3/148	0.000207182278563383	0.0006745469534621772	AKT3;PTPN11;KRAS
2	GO_Biological_Process_2021	cellular senescence (GO:0090398)	2/27	0.0002081602777085212	0.0056831835389919	CDKN2A;TBX3
2	GO_Biological_Process_2021	regulation of apoptotic process (GO:0042981)	5/742	0.00021533597833675084	0.0056831835389919	CASP8;ABL1;GATA1;TP53;TBX3
2	GO_Biological_Process_2021	response to cytokine (GO:0034097)	3/150	0.00021554405195624347	0.0056831835389919	CASP8;REL;PTPN11
2	GO_Biological_Process_2021	cellular response to interleukin-6 (GO:0071354)	2/28	0.00022406816820398208	0.0056831835389919	SMAD4;PTPN11
2	GO_Biological_Process_2021	negative regulation of transferase activity (GO:0051348)	2/29	0.0002405536839323472	0.0058360415493152	ABL1;TP53
2	GO_Biological_Process_2021	regulation of cellular senescence (GO:2000772)	2/31	0.000275254319786104	0.0062556140066239	CDKN2A;AKT3
2	GO_Biological_Process_2021	heart development (GO:0007507)	3/164	0.0002802694447412159	0.0062556140066239	CASP8;PTPN11;KDM6A
2	GO_Molecular_Function_2021	DNA binding (GO:0003677)	5/811	0.00032557315263760124	0.0043550319114829	SMAD4;ABL1;GATA1;TP53;TBX3
2	GO_Biological_Process_2021	positive regulation of mitochondrial outer membrane permeabilization involved in apoptotic signaling pathway (GO:1901030)	2/34	0.00033161703785482386	0.0071170118124227	CASP8;TP53
2	KEGG_2021_Human	Axon guidance	3/182	0.0003803959162280968	0.0012103506425439	ABL1;PTPN11;KRAS
2	KEGG_2021_Human	Thyroid cancer	2/37	0.00039313432145597	0.0012230845556407	KRAS;TP53
2	GO_Molecular_Function_2021	phosphotyrosine residue binding (GO:0001784)	2/37	0.00039313432145597	0.0043550319114829	ABL1;PTPN11
2	GO_Biological_Process_2021	negative regulation of nucleic acid-templated transcription (GO:1903507)	4/464	0.0004169736970837579	0.0086174564063976	SMAD4;CDKN2A;TP53;TBX3
2	GO_Molecular_Function_2021	RNA polymerase II transcription regulatory region sequence-specific DNA binding (GO:0000977)	6/1359	0.0004307316948932258	0.0043550319114829	SMAD4;REL;GATA1;TP53;TBX3;KDM6A
2	GO_Biological_Process_2021	regulation of T cell differentiation (GO:0045580)	2/39	0.0004369986555224512	0.0087087589207688	FANCA;ABL1
2	KEGG_2021_Human	Transcriptional misregulation in cancer	3/192	0.000444817004968388	0.0013537908846863	REL;TP53;KDM6A
2	KEGG_2021_Human	Pathogenic Escherichia coli infection	3/197	0.0004795014604001207	0.0014283022224684	CASP8;ABL1;PTPN11
2	GO_Molecular_Function_2021	protein phosphorylated amino acid binding (GO:0045309)	2/42	0.0005070581642096471	0.0043550319114829	ABL1;PTPN11
2	KEGG_2021_Human	Epstein-Barr virus infection	3/202	0.0005158818488699829	0.0015046553925374	CASP8;AKT3;TP53
2	KEGG_2021_Human	Herpes simplex virus 1 infection	4/498	0.0005447266587112012	0.001556361882032	CASP8;AKT3;PTPN11;TP53
2	GO_Molecular_Function_2021	DNA-binding transcription factor binding (GO:0140297)	3/208	0.0005618254813630726	0.0043550319114829	GATA1;TP53;TBX3
2	GO_Molecular_Function_2021	protein kinase binding (GO:0019901)	4/506	0.0005784433530567389	0.0043550319114829	CDKN2A;ABL1;PTPN11;TP53
2	KEGG_2021_Human	Human immunodeficiency virus 1 infection	3/212	0.0005938679879294956	0.0016628303662025	CASP8;AKT3;KRAS
2	GO_Molecular_Function_2021	transcription regulatory region nucleic acid binding (GO:0001067)	3/212	0.0005938679879294956	0.0043550319114829	SMAD4;GATA1;TP53
2	GO_Biological_Process_2021	regulation of cell growth (GO:0001558)	3/217	0.000635541523045099	0.012228695512385	SMAD4;CDKN2A;TP53
