Cluster_ID	Gene_set	Term	Overlap	P-value	Adjusted P-value	Genes
2	GO_Molecular_Function_2021	cysteine-type endopeptidase activity involved in apoptotic process (GO:0097153)	1/15	0.0119370735063595	0.0375165167342729	CASP8
2	KEGG_2021_Human	Rap1 signaling pathway	2/210	0.0119516939761761	0.0190140585984621	AKT3;KRAS
2	GO_Biological_Process_2021	cytokine-mediated signaling pathway (GO:0019221)	3/621	0.0123365809274038	0.0409070010484783	SMAD4;PTPN11;TP53
2	GO_Biological_Process_2021	positive regulation of protein modification process (GO:0031401)	2/214	0.0123893963748975	0.0409070010484783	ABL1;KRAS
2	GO_Biological_Process_2021	negative regulation of transcription regulatory region DNA binding (GO:2000678)	1/16	0.0127281127836324	0.041533841715011	GATA1
2	GO_Biological_Process_2021	platelet-derived growth factor receptor signaling pathway (GO:0048008)	1/16	0.0127281127836324	0.041533841715011	ABL1
2	GO_Biological_Process_2021	regulation of I-kappaB kinase/NF-kappaB signaling (GO:0043122)	2/224	0.0135142577831541	0.0431048892404284	CASP8;REL
2	GO_Biological_Process_2021	negative regulation of ATPase activity (GO:0032780)	1/17	0.0135185584535393	0.0431048892404284	TP53
2	GO_Biological_Process_2021	negative regulation of cell aging (GO:0090344)	1/17	0.0135185584535393	0.0431048892404284	AKT3
2	GO_Biological_Process_2021	cellular response to gamma radiation (GO:0071480)	1/17	0.0135185584535393	0.0431048892404284	TP53
2	GO_Molecular_Function_2021	four-way junction DNA binding (GO:0000400)	1/17	0.0135185584535393	0.0410218325486712	ABL1
2	GO_Molecular_Function_2021	double-stranded DNA binding (GO:0003690)	3/651	0.0140082884272437	0.0410909793865817	ABL1;GATA1;TBX3
2	GO_Biological_Process_2021	positive regulation of cell migration involved in sprouting angiogenesis (GO:0090050)	1/18	0.0143084109196949	0.0436289250993978	AKT3
2	GO_Biological_Process_2021	regulation of transforming growth factor beta production (GO:0071634)	1/18	0.0143084109196949	0.0436289250993978	SMAD4
2	GO_Biological_Process_2021	negative regulation of fibroblast proliferation (GO:0048147)	1/18	0.0143084109196949	0.0436289250993978	TP53
2	GO_Biological_Process_2021	regulation of vascular endothelial cell proliferation (GO:1905562)	1/18	0.0143084109196949	0.0436289250993978	AKT3
2	GO_Biological_Process_2021	DNA conformation change (GO:0071103)	1/18	0.0143084109196949	0.0436289250993978	ABL1
2	GO_Biological_Process_2021	embryonic axis specification (GO:0000578)	1/18	0.0143084109196949	0.0436289250993978	TBX3
2	GO_Biological_Process_2021	embryonic digit morphogenesis (GO:0042733)	1/18	0.0143084109196949	0.0436289250993978	TBX3
2	GO_Biological_Process_2021	regulation of production of miRNAs involved in gene silencing by miRNA (GO:1903798)	1/18	0.0143084109196949	0.0436289250993978	TP53
2	GO_Biological_Process_2021	pyroptosis (GO:0070269)	1/19	0.0150976705893844	0.0445268095731828	CASP8
2	GO_Biological_Process_2021	atrioventricular valve morphogenesis (GO:0003181)	1/19	0.0150976705893844	0.0445268095731828	SMAD4
2	GO_Biological_Process_2021	positive regulation of focal adhesion assembly (GO:0051894)	1/19	0.0150976705893844	0.0445268095731828	ABL1
2	GO_Biological_Process_2021	positive regulation of oxidoreductase activity (GO:0051353)	1/19	0.0150976705893844	0.0445268095731828	ABL1
2	GO_Biological_Process_2021	regulation of histone H3-K4 methylation (GO:0051569)	1/19	0.0150976705893844	0.0445268095731828	SMAD4
2	GO_Biological_Process_2021	positive regulation of actin cytoskeleton reorganization (GO:2000251)	1/19	0.0150976705893844	0.0445268095731828	ABL1
2	GO_Molecular_Function_2021	R-SMAD binding (GO:0070412)	1/19	0.0150976705893844	0.0428579036085751	SMAD4
2	GO_Biological_Process_2021	regulation of ERK1 and ERK2 cascade (GO:0070372)	2/238	0.0151614584568185	0.0445268095731828	SMAD4;PTPN11
2	KEGG_2021_Human	Chemical carcinogenesis	2/239	0.0152823056823464	0.0240395819722304	AKT3;KRAS
2	GO_Biological_Process_2021	positive regulation of activated T cell proliferation (GO:0042104)	1/20	0.0158863378646896	0.0447705885277616	ICOSLG
2	GO_Biological_Process_2021	negative regulation of cyclin-dependent protein serine/threonine kinase activity (GO:0045736)	1/20	0.0158863378646896	0.0447705885277616	CDKN2A
2	GO_Biological_Process_2021	granulocyte differentiation (GO:0030851)	1/20	0.0158863378646896	0.0447705885277616	GATA1
2	GO_Biological_Process_2021	cardiac epithelial to mesenchymal transition (GO:0060317)	1/20	0.0158863378646896	0.0447705885277616	TBX3
2	GO_Biological_Process_2021	regulation of lymphocyte differentiation (GO:0045619)	1/20	0.0158863378646896	0.0447705885277616	ABL1
2	GO_Biological_Process_2021	mesoderm development (GO:0007498)	1/20	0.0158863378646896	0.0447705885277616	TBX3
2	GO_Biological_Process_2021	myeloid cell development (GO:0061515)	1/20	0.0158863378646896	0.0447705885277616	GATA1
2	GO_Biological_Process_2021	regulation of programmed necrotic cell death (GO:0062098)	1/20	0.0158863378646896	0.0447705885277616	CASP8
2	GO_Molecular_Function_2021	transcription coactivator binding (GO:0001223)	1/20	0.0158863378646896	0.0431573046459837	SMAD4
2	KEGG_2021_Human	Salmonella infection	2/249	0.0165138671657027	0.0256882378133154	CASP8;AKT3
2	GO_Biological_Process_2021	anterior/posterior axis specification (GO:0009948)	1/21	0.0166744131586755	0.0461807864912269	TBX3
2	GO_Biological_Process_2021	intrinsic apoptotic signaling pathway in response to DNA damage by p53 class mediator (GO:0042771)	1/21	0.0166744131586755	0.0461807864912269	TP53
2	GO_Biological_Process_2021	positive regulation of transcription from RNA polymerase II promoter involved in cellular response to chemical stimulus (GO:1901522)	1/21	0.0166744131586755	0.0461807864912269	SMAD4
2	GO_Molecular_Function_2021	ephrin receptor binding (GO:0046875)	1/21	0.0166744131586755	0.0431573046459837	ABL1
2	GO_Molecular_Function_2021	histone acetyltransferase binding (GO:0035035)	1/21	0.0166744131586755	0.0431573046459837	TP53
2	GO_Biological_Process_2021	positive regulation of phosphorylation (GO:0042327)	2/253	0.0170181540006178	0.0461807864912269	ABL1;KRAS
2	GO_Biological_Process_2021	negative regulation of cyclin-dependent protein kinase activity (GO:1904030)	1/22	0.0174618968734111	0.0461807864912269	CDKN2A
2	GO_Biological_Process_2021	regulation of execution phase of apoptosis (GO:1900117)	1/22	0.0174618968734111	0.0461807864912269	TP53
2	GO_Biological_Process_2021	limb morphogenesis (GO:0035108)	1/22	0.0174618968734111	0.0461807864912269	TBX3
2	GO_Molecular_Function_2021	adenylyltransferase activity (GO:0070566)	1/22	0.0174618968734111	0.0436057658095981	ABL1
2	GO_Biological_Process_2021	positive regulation of cell differentiation (GO:0045597)	2/258	0.0176577905461774	0.0461807864912269	SMAD4;ABL1
2	GO_Biological_Process_2021	cellular component assembly (GO:0022607)	2/261	0.0180464894366593	0.0461807864912269	FANCA;TP53
2	GO_Biological_Process_2021	regulation of SMAD protein signal transduction (GO:0060390)	1/23	0.0182487894189074	0.0461807864912269	SMAD4
2	GO_Biological_Process_2021	regulation of supramolecular fiber organization (GO:1902903)	1/23	0.0182487894189074	0.0461807864912269	ABL1
2	GO_Biological_Process_2021	negative regulation of extrinsic apoptotic signaling pathway in absence of ligand (GO:2001240)	1/23	0.0182487894189074	0.0461807864912269	GATA1
2	GO_Biological_Process_2021	positive regulation of histone acetylation (GO:0035066)	1/23	0.0182487894189074	0.0461807864912269	SMAD4
2	GO_Biological_Process_2021	negative regulation of signal transduction in absence of ligand (GO:1901099)	1/23	0.0182487894189074	0.0461807864912269	GATA1
2	GO_Biological_Process_2021	positive regulation of transcription initiation from RNA polymerase II promoter (GO:0060261)	1/23	0.0182487894189074	0.0461807864912269	TP53
2	GO_Biological_Process_2021	regulation of necroptotic process (GO:0060544)	1/23	0.0182487894189074	0.0461807864912269	CASP8
2	GO_Biological_Process_2021	regulation of protein export from nucleus (GO:0046825)	1/23	0.0182487894189074	0.0461807864912269	TP53
2	GO_Molecular_Function_2021	disordered domain specific binding (GO:0097718)	1/23	0.0182487894189074	0.0436057658095981	TP53
2	GO_Molecular_Function_2021	ubiquitin protein ligase binding (GO:0031625)	2/265	0.0185704547149639	0.0436057658095981	CASP8;TP53
2	GO_Biological_Process_2021	regulation of protein phosphorylation (GO:0001932)	2/266	0.0187024595943352	0.0461807864912269	ABL1;KRAS
2	GO_Biological_Process_2021	protein deubiquitination (GO:0016579)	2/267	0.0188348686027473	0.0461807864912269	SMAD4;TP53
2	GO_Biological_Process_2021	central nervous system development (GO:0007417)	2/268	0.0189676810994621	0.0461807864912269	PTPN11;TBX3
2	GO_Biological_Process_2021	positive regulation of cell-substrate junction organization (GO:0150117)	1/24	0.0190350912060612	0.0461807864912269	ABL1
2	GO_Biological_Process_2021	positive regulation of cellular response to transforming growth factor beta stimulus (GO:1903846)	1/24	0.0190350912060612	0.0461807864912269	SMAD4
2	GO_Biological_Process_2021	regulation of cardiac muscle hypertrophy (GO:0010611)	1/24	0.0190350912060612	0.0461807864912269	SMAD4
2	GO_Biological_Process_2021	response to gamma radiation (GO:0010332)	1/24	0.0190350912060612	0.0461807864912269	TP53
2	GO_Biological_Process_2021	heterochromatin assembly (GO:0031507)	1/24	0.0190350912060612	0.0461807864912269	CDKN2A
2	GO_Biological_Process_2021	regulation of cellular response to transforming growth factor beta stimulus (GO:1903844)	1/24	0.0190350912060612	0.0461807864912269	SMAD4
2	GO_Biological_Process_2021	cellular response to catecholamine stimulus (GO:0071870)	1/24	0.0190350912060612	0.0461807864912269	ABL1
2	GO_Biological_Process_2021	mammary gland development (GO:0030879)	1/24	0.0190350912060612	0.0461807864912269	TBX3
2	GO_Biological_Process_2021	nucleotide-binding domain, leucine rich repeat containing receptor signaling pathway (GO:0035872)	1/24	0.0190350912060612	0.0461807864912269	CASP8
2	GO_Biological_Process_2021	positive regulation of transcription from RNA polymerase II promoter in response to stress (GO:0036003)	1/24	0.0190350912060612	0.0461807864912269	TP53
2	GO_Biological_Process_2021	positive regulation of transforming growth factor beta receptor signaling pathway (GO:0030511)	1/24	0.0190350912060612	0.0461807864912269	SMAD4
2	GO_Biological_Process_2021	DNA packaging (GO:0006323)	1/24	0.0190350912060612	0.0461807864912269	TP53
2	GO_Molecular_Function_2021	protein phosphatase 2A binding (GO:0051721)	1/24	0.0190350912060612	0.0436057658095981	TP53
2	GO_Biological_Process_2021	cardiac conduction system development (GO:0003161)	1/25	0.0198208026407264	0.0474678449507526	SMAD4
2	GO_Biological_Process_2021	positive regulation of release of cytochrome c from mitochondria (GO:0090200)	1/25	0.0198208026407264	0.0474678449507526	TP53
2	GO_Biological_Process_2021	outflow tract septum morphogenesis (GO:0003148)	1/25	0.0198208026407264	0.0474678449507526	SMAD4
2	GO_Molecular_Function_2021	actin monomer binding (GO:0003785)	1/25	0.0198208026407264	0.0436057658095981	ABL1
2	GO_Molecular_Function_2021	NF-kappaB binding (GO:0051059)	1/25	0.0198208026407264	0.0436057658095981	CDKN2A
2	GO_Biological_Process_2021	protein modification by small protein removal (GO:0070646)	2/276	0.020044629474778	0.0477099820170523	SMAD4;TP53
2	GO_Molecular_Function_2021	ATP binding (GO:0005524)	2/278	0.0203178565165753	0.0436090578892348	AKT3;ABL1
2	GO_Biological_Process_2021	regulation of regulatory T cell differentiation (GO:0045589)	1/26	0.0206059241328129	0.0477099820170523	FANCA
2	GO_Biological_Process_2021	regulation of synapse organization (GO:0050807)	1/26	0.0206059241328129	0.0477099820170523	ABL1
2	GO_Biological_Process_2021	positive regulation of glucose import (GO:0046326)	1/26	0.0206059241328129	0.0477099820170523	PTPN11
2	GO_Biological_Process_2021	positive regulation of histone methylation (GO:0031062)	1/26	0.0206059241328129	0.0477099820170523	SMAD4
2	GO_Biological_Process_2021	regulation of chondrocyte differentiation (GO:0032330)	1/26	0.0206059241328129	0.0477099820170523	PTPN11
2	GO_Biological_Process_2021	histone lysine demethylation (GO:0070076)	1/26	0.0206059241328129	0.0477099820170523	KDM6A
2	GO_Biological_Process_2021	cellular response to drug (GO:0035690)	1/26	0.0206059241328129	0.0477099820170523	TP53
2	GO_Molecular_Function_2021	ubiquitin-like protein ligase binding (GO:0044389)	2/282	0.0208690627842408	0.043725655357457	CASP8;TP53
2	GO_Biological_Process_2021	negative regulation of catalytic activity (GO:0043086)	1/27	0.0213904560937906	0.0479352389571694	TP53
2	GO_Biological_Process_2021	positive regulation of BMP signaling pathway (GO:0030513)	1/27	0.0213904560937906	0.0479352389571694	SMAD4
2	GO_Biological_Process_2021	regulation of transcription regulatory region DNA binding (GO:2000677)	1/27	0.0213904560937906	0.0479352389571694	GATA1
2	GO_Biological_Process_2021	positive regulation of erythrocyte differentiation (GO:0045648)	1/27	0.0213904560937906	0.0479352389571694	GATA1
2	GO_Biological_Process_2021	positive regulation of gene silencing by miRNA (GO:2000637)	1/27	0.0213904560937906	0.0479352389571694	TP53
2	GO_Biological_Process_2021	positive regulation of muscle cell differentiation (GO:0051149)	1/27	0.0213904560937906	0.0479352389571694	ABL1
2	GO_Biological_Process_2021	cytoplasmic pattern recognition receptor signaling pathway (GO:0002753)	1/27	0.0213904560937906	0.0479352389571694	CASP8
2	GO_Biological_Process_2021	entrainment of circadian clock by photoperiod (GO:0043153)	1/27	0.0213904560937906	0.0479352389571694	TP53
2	GO_Biological_Process_2021	cellular response to epidermal growth factor stimulus (GO:0071364)	1/28	0.0221743989287616	0.0485228023617606	PTPN11
2	GO_Biological_Process_2021	regulation of extrinsic apoptotic signaling pathway in absence of ligand (GO:2001239)	1/28	0.0221743989287616	0.0485228023617606	GATA1
2	GO_Biological_Process_2021	regulation of microtubule polymerization or depolymerization (GO:0031110)	1/28	0.0221743989287616	0.0485228023617606	ABL1
2	GO_Biological_Process_2021	nucleotide-binding oligomerization domain containing signaling pathway (GO:0070423)	1/28	0.0221743989287616	0.0485228023617606	CASP8
2	GO_Biological_Process_2021	ventricular septum morphogenesis (GO:0060412)	1/28	0.0221743989287616	0.0485228023617606	SMAD4
2	GO_Biological_Process_2021	photoperiodism (GO:0009648)	1/28	0.0221743989287616	0.0485228023617606	TP53
2	GO_Molecular_Function_2021	histone demethylase activity (GO:0032452)	1/28	0.0221743989287616	0.0448951615134718	KDM6A
2	GO_Biological_Process_2021	regulation of response to biotic stimulus (GO:0002831)	1/29	0.0229577530466617	0.0496528147288265	CASP8
2	GO_Biological_Process_2021	regulation of ubiquitin-protein transferase activity (GO:0051438)	1/29	0.0229577530466617	0.0496528147288265	ABL1
2	GO_Biological_Process_2021	mismatch repair (GO:0006298)	1/29	0.0229577530466617	0.0496528147288265	ABL1
2	GO_Molecular_Function_2021	pre-mRNA binding (GO:0036002)	1/29	0.0229577530466617	0.0448951615134718	U2AF1
2	GO_Molecular_Function_2021	mitogen-activated protein kinase binding (GO:0051019)	1/29	0.0229577530466617	0.0448951615134718	ABL1
2	GO_Biological_Process_2021	extrinsic apoptotic signaling pathway via death domain receptors (GO:0008625)	1/30	0.0237405188646141	0.0501788239638436	CASP8
2	GO_Biological_Process_2021	negative regulation of cytoskeleton organization (GO:0051494)	1/30	0.0237405188646141	0.0501788239638436	SMAD4
2	GO_Biological_Process_2021	regulation of type I interferon-mediated signaling pathway (GO:0060338)	1/30	0.0237405188646141	0.0501788239638436	PTPN11
2	GO_Biological_Process_2021	histone H3-K4 methylation (GO:0051568)	1/30	0.0237405188646141	0.0501788239638436	KDM6A
2	GO_Biological_Process_2021	regulation of long-term synaptic potentiation (GO:1900271)	1/30	0.0237405188646141	0.0501788239638436	ABL1
2	GO_Biological_Process_2021	TRIF-dependent toll-like receptor signaling pathway (GO:0035666)	1/30	0.0237405188646141	0.0501788239638436	CASP8
2	GO_Molecular_Function_2021	protein serine/threonine kinase inhibitor activity (GO:0030291)	1/30	0.0237405188646141	0.0454166447844793	CDKN2A
2	KEGG_2021_Human	Huntington disease	2/306	0.0243072375318183	0.0373957500489513	CASP8;TP53
2	GO_Molecular_Function_2021	adenyl ribonucleotide binding (GO:0032559)	2/306	0.0243072375318183	0.0455114234638301	AKT3;ABL1
2	GO_Biological_Process_2021	negative regulation of DNA binding (GO:0043392)	1/31	0.0245226967845343	0.051058450767799	GATA1
2	GO_Biological_Process_2021	regulation of transmembrane receptor protein serine/threonine kinase signaling pathway (GO:0090092)	1/31	0.0245226967845343	0.051058450767799	SMAD4
2	GO_Biological_Process_2021	regulation of developmental growth (GO:0048638)	1/31	0.0245226967845343	0.051058450767799	ABL1
2	GO_Biological_Process_2021	MyD88-independent toll-like receptor signaling pathway (GO:0002756)	1/31	0.0245226967845343	0.051058450767799	CASP8
2	GO_Biological_Process_2021	negative regulation of cell-matrix adhesion (GO:0001953)	1/32	0.0253042872146084	0.0515320885611368	CDKN2A
2	GO_Biological_Process_2021	negative regulation of DNA biosynthetic process (GO:2000279)	1/32	0.0253042872146084	0.0515320885611368	TP53
2	GO_Biological_Process_2021	positive regulation of glucose transmembrane transport (GO:0010828)	1/32	0.0253042872146084	0.0515320885611368	PTPN11
2	GO_Biological_Process_2021	regulation of cell migration involved in sprouting angiogenesis (GO:0090049)	1/32	0.0253042872146084	0.0515320885611368	AKT3
2	GO_Biological_Process_2021	hematopoietic progenitor cell differentiation (GO:0002244)	1/32	0.0253042872146084	0.0515320885611368	TP53
2	GO_Biological_Process_2021	membrane depolarization (GO:0051899)	1/32	0.0253042872146084	0.0515320885611368	ABL1
2	GO_Molecular_Function_2021	SH2 domain binding (GO:0042169)	1/32	0.0253042872146084	0.046391193226782	ABL1
2	GO_Biological_Process_2021	signal transduction by p53 class mediator (GO:0072331)	1/33	0.0260852905726611	0.0529294259619815	TP53
2	GO_Molecular_Function_2021	DNA secondary structure binding (GO:0000217)	1/33	0.0260852905726611	0.0468470524570241	ABL1
2	GO_Biological_Process_2021	regulation of activated T cell proliferation (GO:0046006)	1/34	0.0268657072594049	0.0531598037260566	ICOSLG
2	GO_Biological_Process_2021	negative regulation of extrinsic apoptotic signaling pathway via death domain receptors (GO:1902042)	1/34	0.0268657072594049	0.0531598037260566	CASP8
2	GO_Biological_Process_2021	regulation of cell adhesion mediated by integrin (GO:0033628)	1/34	0.0268657072594049	0.0531598037260566	PTPN11
2	GO_Biological_Process_2021	histone lysine methylation (GO:0034968)	1/34	0.0268657072594049	0.0531598037260566	KDM6A
2	GO_Biological_Process_2021	positive regulation of pri-miRNA transcription by RNA polymerase II (GO:1902895)	1/34	0.0268657072594049	0.0531598037260566	TP53
2	GO_Biological_Process_2021	regulation of myoblast differentiation (GO:0045661)	1/34	0.0268657072594049	0.0531598037260566	TBX3
2	GO_Biological_Process_2021	ventricular cardiac muscle tissue morphogenesis (GO:0055010)	1/34	0.0268657072594049	0.0531598037260566	SMAD4
2	GO_Biological_Process_2021	negative regulation of cell cycle G1/S phase transition (GO:1902807)	1/35	0.0276455376880297	0.0535632292705576	CDKN2A
2	GO_Biological_Process_2021	negative regulation of organelle assembly (GO:1902116)	1/35	0.0276455376880297	0.0535632292705576	SMAD4
2	GO_Biological_Process_2021	cellular response to hydrogen peroxide (GO:0070301)	1/35	0.0276455376880297	0.0535632292705576	ABL1
2	GO_Biological_Process_2021	regulation of muscle cell differentiation (GO:0051147)	1/35	0.0276455376880297	0.0535632292705576	ABL1
2	GO_Biological_Process_2021	peptidyl-tyrosine dephosphorylation (GO:0035335)	1/35	0.0276455376880297	0.0535632292705576	PTPN11
2	GO_Biological_Process_2021	regulation of protein polymerization (GO:0032271)	1/35	0.0276455376880297	0.0535632292705576	ABL1
2	GO_Molecular_Function_2021	non-membrane spanning protein tyrosine kinase activity (GO:0004715)	1/35	0.0276455376880297	0.0486561463309323	ABL1
2	GO_Biological_Process_2021	positive regulation of interferon-beta production (GO:0032728)	1/36	0.0284247822669753	0.0537661983219398	PTPN11
2	GO_Biological_Process_2021	intrinsic apoptotic signaling pathway by p53 class mediator (GO:0072332)	1/36	0.0284247822669753	0.0537661983219398	TP53
2	GO_Biological_Process_2021	positive regulation of myeloid leukocyte differentiation (GO:0002763)	1/36	0.0284247822669753	0.0537661983219398	CASP8
2	GO_Biological_Process_2021	positive regulation of substrate adhesion-dependent cell spreading (GO:1900026)	1/36	0.0284247822669753	0.0537661983219398	ABL1
2	GO_Biological_Process_2021	regulation of ossification (GO:0030278)	1/36	0.0284247822669753	0.0537661983219398	PTPN11
2	GO_Biological_Process_2021	embryonic limb morphogenesis (GO:0030326)	1/36	0.0284247822669753	0.0537661983219398	TBX3
2	GO_Biological_Process_2021	platelet aggregation (GO:0070527)	1/36	0.0284247822669753	0.0537661983219398	GATA1
2	KEGG_2021_Human	Aldosterone-regulated sodium reabsorption	1/37	0.0292034414014455	0.0444400195239388	KRAS
2	GO_Biological_Process_2021	regulation of actin cytoskeleton reorganization (GO:2000249)	1/37	0.0292034414014455	0.0543184010066887	ABL1
2	GO_Biological_Process_2021	negative regulation of G1/S transition of mitotic cell cycle (GO:2000134)	1/37	0.0292034414014455	0.0543184010066887	CDKN2A
2	GO_Biological_Process_2021	regulation of erythrocyte differentiation (GO:0045646)	1/37	0.0292034414014455	0.0543184010066887	GATA1
2	GO_Biological_Process_2021	positive regulation of myeloid cell differentiation (GO:0045639)	1/37	0.0292034414014455	0.0543184010066887	GATA1
2	GO_Biological_Process_2021	regulation of glucose import (GO:0046324)	1/37	0.0292034414014455	0.0543184010066887	PTPN11
2	GO_Molecular_Function_2021	core promoter sequence-specific DNA binding (GO:0001046)	1/37	0.0292034414014455	0.0503902518299452	TP53
2	GO_Biological_Process_2021	regulation of axon extension (GO:0030516)	1/38	0.0299815155053699	0.0553963101059484	ABL1
2	GO_Biological_Process_2021	ventricular septum development (GO:0003281)	1/38	0.0299815155053699	0.0553963101059484	SMAD4
2	GO_Biological_Process_2021	positive regulation of multicellular organismal process (GO:0051240)	2/345	0.0303559705372992	0.0559030744548283	SMAD4;PTPN11
2	GO_Biological_Process_2021	regulation of cellular component biogenesis (GO:0044087)	1/39	0.0307590049844483	0.0562205684327121	PTPN11
2	GO_Biological_Process_2021	endothelial cell migration (GO:0043542)	1/39	0.0307590049844483	0.0562205684327121	ABL1
2	GO_Molecular_Function_2021	signaling receptor complex adaptor activity (GO:0030159)	1/39	0.0307590049844483	0.0520537007429125	PTPN11
2	GO_Biological_Process_2021	positive regulation of catalytic activity (GO:0043085)	1/40	0.0315359102498904	0.0562205684327121	ABL1
2	GO_Biological_Process_2021	negative regulation of cell-substrate adhesion (GO:0010812)	1/40	0.0315359102498904	0.0562205684327121	CDKN2A
2	GO_Biological_Process_2021	negative regulation of I-kappaB kinase/NF-kappaB signaling (GO:0043124)	1/40	0.0315359102498904	0.0562205684327121	CASP8
2	GO_Biological_Process_2021	bone development (GO:0060348)	1/40	0.0315359102498904	0.0562205684327121	TP53
2	GO_Biological_Process_2021	positive regulation of intrinsic apoptotic signaling pathway (GO:2001244)	1/40	0.0315359102498904	0.0562205684327121	TP53
2	GO_Biological_Process_2021	positive regulation of ossification (GO:0045778)	1/40	0.0315359102498904	0.0562205684327121	PTPN11
2	GO_Biological_Process_2021	stem cell differentiation (GO:0048863)	1/40	0.0315359102498904	0.0562205684327121	TP53
2	GO_Biological_Process_2021	regulation of microtubule polymerization (GO:0031113)	1/40	0.0315359102498904	0.0562205684327121	ABL1
2	KEGG_2021_Human	Ferroptosis	1/41	0.0323122317033933	0.0486420692309147	TP53
2	GO_Biological_Process_2021	epithelial cell migration (GO:0010631)	1/41	0.0323122317033933	0.0568776823043959	ABL1
2	GO_Biological_Process_2021	regulation of release of cytochrome c from mitochondria (GO:0090199)	1/41	0.0323122317033933	0.0568776823043959	TP53
2	GO_Biological_Process_2021	regulation of response to DNA damage stimulus (GO:2001020)	1/41	0.0323122317033933	0.0568776823043959	ABL1
2	GO_Biological_Process_2021	regulation of mitochondrial membrane potential (GO:0051881)	1/41	0.0323122317033933	0.0568776823043959	ABL1
2	GO_Biological_Process_2021	positive regulation of epithelial to mesenchymal transition (GO:0010718)	1/42	0.033087969760152	0.0578780160694823	SMAD4
2	GO_Biological_Process_2021	regulation of extrinsic apoptotic signaling pathway via death domain receptors (GO:1902041)	1/42	0.033087969760152	0.0578780160694823	CASP8
2	GO_Biological_Process_2021	heart looping (GO:0001947)	1/43	0.0338631248228564	0.0581403804650889	TBX3
2	GO_Biological_Process_2021	cellular response to glucose starvation (GO:0042149)	1/43	0.0338631248228564	0.0581403804650889	TP53
2	GO_Biological_Process_2021	negative regulation of type I interferon production (GO:0032480)	1/43	0.0338631248228564	0.0581403804650889	REL
2	GO_Biological_Process_2021	male gonad development (GO:0008584)	1/43	0.0338631248228564	0.0581403804650889	GATA1
2	GO_Biological_Process_2021	development of primary male sexual characteristics (GO:0046546)	1/43	0.0338631248228564	0.0581403804650889	GATA1
2	GO_Biological_Process_2021	natural killer cell activation (GO:0030101)	1/43	0.0338631248228564	0.0581403804650889	CASP8
2	GO_Biological_Process_2021	positive regulation of cell-matrix adhesion (GO:0001954)	1/44	0.0346376973079083	0.0589263265177221	ABL1
2	GO_Biological_Process_2021	homotypic cell-cell adhesion (GO:0034109)	1/44	0.0346376973079083	0.0589263265177221	GATA1
2	GO_Biological_Process_2021	positive regulation of stress fiber assembly (GO:0051496)	1/44	0.0346376973079083	0.0589263265177221	ABL1
