Cluster_ID	Gene_set	Term	Overlap	P-value	Adjusted P-value	Genes
2	GO_Molecular_Function_2021	DNA binding (GO:0003677)	3/811	0.0173011022873221	0.043409946538471	ABL1;TP53;TBX3
2	GO_Biological_Process_2021	receptor catabolic process (GO:0032801)	1/25	0.0173639786153884	0.0401873740880168	RNF43
2	GO_Biological_Process_2021	positive regulation of release of cytochrome c from mitochondria (GO:0090200)	1/25	0.0173639786153884	0.0401873740880168	TP53
2	GO_Biological_Process_2021	outflow tract septum morphogenesis (GO:0003148)	1/25	0.0173639786153884	0.0401873740880168	TGFBR2
2	GO_Molecular_Function_2021	actin monomer binding (GO:0003785)	1/25	0.0173639786153884	0.043409946538471	ABL1
2	GO_Molecular_Function_2021	NF-kappaB binding (GO:0051059)	1/25	0.0173639786153884	0.043409946538471	CDKN2A
2	GO_Biological_Process_2021	DNA repair (GO:0006281)	2/298	0.0178911667896491	0.0403709757692866	ABL1;TP53
2	GO_Biological_Process_2021	regulation of synapse organization (GO:0050807)	1/26	0.0180526816175866	0.0403709757692866	ABL1
2	GO_Biological_Process_2021	positive regulation of glucose import (GO:0046326)	1/26	0.0180526816175866	0.0403709757692866	PTPN11
2	GO_Biological_Process_2021	regulation of chondrocyte differentiation (GO:0032330)	1/26	0.0180526816175866	0.0403709757692866	PTPN11
2	GO_Biological_Process_2021	histone lysine demethylation (GO:0070076)	1/26	0.0180526816175866	0.0403709757692866	KDM6A
2	GO_Biological_Process_2021	cellular response to drug (GO:0035690)	1/26	0.0180526816175866	0.0403709757692866	TP53
2	GO_Biological_Process_2021	positive regulation of protein insertion into mitochondrial membrane involved in apoptotic signaling pathway (GO:1900740)	1/26	0.0180526816175866	0.0403709757692866	TP53
2	GO_Biological_Process_2021	regulation of protein insertion into mitochondrial membrane involved in apoptotic signaling pathway (GO:1900739)	1/26	0.0180526816175866	0.0403709757692866	TP53
2	GO_Biological_Process_2021	negative regulation of catalytic activity (GO:0043086)	1/27	0.0187409364492418	0.0412145075439759	TP53
2	GO_Biological_Process_2021	positive regulation of gene silencing by miRNA (GO:2000637)	1/27	0.0187409364492418	0.0412145075439759	TP53
2	GO_Biological_Process_2021	positive regulation of muscle cell differentiation (GO:0051149)	1/27	0.0187409364492418	0.0412145075439759	ABL1
2	GO_Biological_Process_2021	entrainment of circadian clock by photoperiod (GO:0043153)	1/27	0.0187409364492418	0.0412145075439759	TP53
2	GO_Biological_Process_2021	positive regulation of apoptotic process (GO:0043065)	2/310	0.0192712479668301	0.0415211047989948	ABL1;TP53
2	GO_Biological_Process_2021	cellular response to epidermal growth factor stimulus (GO:0071364)	1/28	0.0194287433776428	0.0415211047989948	PTPN11
2	GO_Biological_Process_2021	regulation of extrinsic apoptotic signaling pathway in absence of ligand (GO:2001239)	1/28	0.0194287433776428	0.0415211047989948	RET
2	GO_Biological_Process_2021	cellular response to interleukin-6 (GO:0071354)	1/28	0.0194287433776428	0.0415211047989948	PTPN11
2	GO_Biological_Process_2021	regulation of microtubule polymerization or depolymerization (GO:0031110)	1/28	0.0194287433776428	0.0415211047989948	ABL1
2	GO_Biological_Process_2021	ventricular septum morphogenesis (GO:0060412)	1/28	0.0194287433776428	0.0415211047989948	TGFBR2
2	GO_Biological_Process_2021	photoperiodism (GO:0009648)	1/28	0.0194287433776428	0.0415211047989948	TP53
2	GO_Molecular_Function_2021	histone demethylase activity (GO:0032452)	1/28	0.0194287433776428	0.0464217753804117	KDM6A
2	GO_Biological_Process_2021	regulation of ubiquitin-protein transferase activity (GO:0051438)	1/29	0.020116102664845	0.0424762327185971	ABL1
2	GO_Biological_Process_2021	positive regulation of extrinsic apoptotic signaling pathway (GO:2001238)	1/29	0.020116102664845	0.0424762327185971	RET
2	GO_Biological_Process_2021	mismatch repair (GO:0006298)	1/29	0.020116102664845	0.0424762327185971	ABL1
2	GO_Molecular_Function_2021	pre-mRNA binding (GO:0036002)	1/29	0.020116102664845	0.0464217753804117	U2AF1
2	GO_Molecular_Function_2021	mitogen-activated protein kinase binding (GO:0051019)	1/29	0.020116102664845	0.0464217753804117	ABL1
2	GO_Biological_Process_2021	regulation of type I interferon-mediated signaling pathway (GO:0060338)	1/30	0.02080301457834	0.0432376381432164	PTPN11
2	GO_Biological_Process_2021	response to alcohol (GO:0097305)	1/30	0.02080301457834	0.0432376381432164	TGFBR2
2	GO_Biological_Process_2021	histone H3-K4 methylation (GO:0051568)	1/30	0.02080301457834	0.0432376381432164	KDM6A
2	GO_Biological_Process_2021	regulation of long-term synaptic potentiation (GO:1900271)	1/30	0.02080301457834	0.0432376381432164	ABL1
2	GO_Molecular_Function_2021	protein serine/threonine kinase inhibitor activity (GO:0030291)	1/30	0.02080301457834	0.046806782801265	CDKN2A
2	GO_Biological_Process_2021	receptor signaling pathway via JAK-STAT (GO:0007259)	1/31	0.0214894793855565	0.0439746103256563	JAK3
2	GO_Biological_Process_2021	regulation of cellular senescence (GO:2000772)	1/31	0.0214894793855565	0.0439746103256563	CDKN2A
2	GO_Biological_Process_2021	regulation of developmental growth (GO:0048638)	1/31	0.0214894793855565	0.0439746103256563	ABL1
2	GO_Biological_Process_2021	embryonic skeletal system morphogenesis (GO:0048704)	1/31	0.0214894793855565	0.0439746103256563	TGFBR2
2	GO_Cellular_Component_2021	nucleus (GO:0005634)	7/4484	0.0216033203738894	0.2240827238990139	CDKN2A;REL;ABL1;PTPN11;TP53;TBX3;KDM6A
2	KEGG_2021_Human	Human papillomavirus infection	2/331	0.0217920974255476	0.0451134648458705	KRAS;TP53
2	GO_Molecular_Function_2021	DNA-binding transcription activator activity, RNA polymerase II-specific (GO:0001228)	2/333	0.022039082915071	0.0475189228970456	REL;TP53
2	GO_Biological_Process_2021	negative regulation of cell-matrix adhesion (GO:0001953)	1/32	0.0221754973519546	0.0445189908959695	CDKN2A
2	GO_Biological_Process_2021	negative regulation of DNA biosynthetic process (GO:2000279)	1/32	0.0221754973519546	0.0445189908959695	TP53
2	GO_Biological_Process_2021	positive regulation of glucose transmembrane transport (GO:0010828)	1/32	0.0221754973519546	0.0445189908959695	PTPN11
2	GO_Biological_Process_2021	hematopoietic progenitor cell differentiation (GO:0002244)	1/32	0.0221754973519546	0.0445189908959695	TP53
2	GO_Biological_Process_2021	membrane depolarization (GO:0051899)	1/32	0.0221754973519546	0.0445189908959695	ABL1
2	GO_Molecular_Function_2021	SH2 domain binding (GO:0042169)	1/32	0.0221754973519546	0.0475189228970456	ABL1
2	GO_Biological_Process_2021	signal transduction by p53 class mediator (GO:0072331)	1/33	0.022861068741375	0.0455502497478525	TP53
2	GO_Biological_Process_2021	vasculogenesis (GO:0001570)	1/33	0.022861068741375	0.0455502497478525	TGFBR2
2	GO_Molecular_Function_2021	DNA secondary structure binding (GO:0000217)	1/33	0.022861068741375	0.0478487485284594	ABL1
2	GO_Biological_Process_2021	positive regulation of multicellular organismal process (GO:0051240)	2/345	0.0235458075266182	0.0458804512033598	PTPN11;TGFBR2
2	GO_Biological_Process_2021	regulation of activated T cell proliferation (GO:0046006)	1/34	0.0235461938251205	0.0458804512033598	ICOSLG
2	GO_Biological_Process_2021	histone lysine methylation (GO:0034968)	1/34	0.0235461938251205	0.0458804512033598	KDM6A
2	GO_Biological_Process_2021	positive regulation of mitochondrial outer membrane permeabilization involved in apoptotic signaling pathway (GO:1901030)	1/34	0.0235461938251205	0.0458804512033598	TP53
2	GO_Biological_Process_2021	positive regulation of pri-miRNA transcription by RNA polymerase II (GO:1902895)	1/34	0.0235461938251205	0.0458804512033598	TP53
2	GO_Biological_Process_2021	regulation of myoblast differentiation (GO:0045661)	1/34	0.0235461938251205	0.0458804512033598	TBX3
2	GO_Molecular_Function_2021	frizzled binding (GO:0005109)	1/34	0.0235461938251205	0.0481626691877465	RNF43
2	GO_Biological_Process_2021	cellular response to DNA damage stimulus (GO:0006974)	2/350	0.0241860526691936	0.0461955489873443	ABL1;TP53
2	GO_Biological_Process_2021	negative regulation of cell cycle G1/S phase transition (GO:1902807)	1/35	0.0242308728650598	0.0461955489873443	CDKN2A
2	GO_Biological_Process_2021	cellular response to hydrogen peroxide (GO:0070301)	1/35	0.0242308728650598	0.0461955489873443	ABL1
2	GO_Biological_Process_2021	regulation of muscle cell differentiation (GO:0051147)	1/35	0.0242308728650598	0.0461955489873443	ABL1
2	GO_Biological_Process_2021	peptidyl-tyrosine dephosphorylation (GO:0035335)	1/35	0.0242308728650598	0.0461955489873443	PTPN11
2	GO_Biological_Process_2021	regulation of protein polymerization (GO:0032271)	1/35	0.0242308728650598	0.0461955489873443	ABL1
2	GO_Molecular_Function_2021	non-membrane spanning protein tyrosine kinase activity (GO:0004715)	1/35	0.0242308728650598	0.0484617457301197	ABL1
2	GO_Biological_Process_2021	positive regulation of interferon-beta production (GO:0032728)	1/36	0.0249151061269709	0.0466607994604048	PTPN11
2	GO_Biological_Process_2021	intrinsic apoptotic signaling pathway by p53 class mediator (GO:0072332)	1/36	0.0249151061269709	0.0466607994604048	TP53
2	GO_Biological_Process_2021	positive regulation of substrate adhesion-dependent cell spreading (GO:1900026)	1/36	0.0249151061269709	0.0466607994604048	ABL1
2	GO_Biological_Process_2021	regulation of ossification (GO:0030278)	1/36	0.0249151061269709	0.0466607994604048	PTPN11
2	GO_Biological_Process_2021	embryonic limb morphogenesis (GO:0030326)	1/36	0.0249151061269709	0.0466607994604048	TBX3
2	KEGG_2021_Human	Aldosterone-regulated sodium reabsorption	1/37	0.025598893875467	0.0520805082293985	KRAS
2	GO_Biological_Process_2021	regulation of actin cytoskeleton reorganization (GO:2000249)	1/37	0.025598893875467	0.047438509629362	ABL1
2	GO_Biological_Process_2021	negative regulation of G1/S transition of mitotic cell cycle (GO:2000134)	1/37	0.025598893875467	0.047438509629362	CDKN2A
2	GO_Biological_Process_2021	regulation of glucose import (GO:0046324)	1/37	0.025598893875467	0.047438509629362	PTPN11
2	GO_Molecular_Function_2021	core promoter sequence-specific DNA binding (GO:0001046)	1/37	0.025598893875467	0.0500847923650442	TP53
2	GO_Biological_Process_2021	negative regulation of transcription, DNA-templated (GO:0045892)	3/948	0.0261154629515726	0.0481992570370018	CDKN2A;TP53;TBX3
2	KEGG_2021_Human	Primary immunodeficiency	1/38	0.0262822363843274	0.0525644727686548	JAK3
2	GO_Biological_Process_2021	regulation of axon extension (GO:0030516)	1/38	0.0262822363843274	0.0481992570370018	ABL1
2	GO_Biological_Process_2021	ventricular septum development (GO:0003281)	1/38	0.0262822363843274	0.0481992570370018	TGFBR2
2	GO_Biological_Process_2021	regulation of T cell differentiation (GO:0045580)	1/39	0.0269651339122192	0.0486817972295943	ABL1
2	GO_Biological_Process_2021	regulation of cellular component biogenesis (GO:0044087)	1/39	0.0269651339122192	0.0486817972295943	PTPN11
2	GO_Biological_Process_2021	membrane protein proteolysis (GO:0033619)	1/39	0.0269651339122192	0.0486817972295943	RET
2	GO_Biological_Process_2021	endothelial cell migration (GO:0043542)	1/39	0.0269651339122192	0.0486817972295943	ABL1
2	GO_Molecular_Function_2021	signaling receptor complex adaptor activity (GO:0030159)	1/39	0.0269651339122192	0.0516353628106327	PTPN11
2	GO_Biological_Process_2021	positive regulation of catalytic activity (GO:0043085)	1/40	0.0276475867285054	0.0486817972295943	ABL1
2	GO_Biological_Process_2021	negative regulation of cell-substrate adhesion (GO:0010812)	1/40	0.0276475867285054	0.0486817972295943	CDKN2A
2	GO_Biological_Process_2021	bone development (GO:0060348)	1/40	0.0276475867285054	0.0486817972295943	TP53
2	GO_Biological_Process_2021	positive regulation of intrinsic apoptotic signaling pathway (GO:2001244)	1/40	0.0276475867285054	0.0486817972295943	TP53
2	GO_Biological_Process_2021	positive regulation of ossification (GO:0045778)	1/40	0.0276475867285054	0.0486817972295943	PTPN11
2	GO_Biological_Process_2021	stem cell differentiation (GO:0048863)	1/40	0.0276475867285054	0.0486817972295943	TP53
2	GO_Biological_Process_2021	lymphocyte migration (GO:0072676)	1/40	0.0276475867285054	0.0486817972295943	RET
2	GO_Biological_Process_2021	regulation of microtubule polymerization (GO:0031113)	1/40	0.0276475867285054	0.0486817972295943	ABL1
2	GO_Biological_Process_2021	negative regulation of programmed cell death (GO:0043069)	2/381	0.0283153261013413	0.0489077700377435	TP53;TBX3
2	KEGG_2021_Human	Ferroptosis	1/41	0.0283295950973344	0.0557148703580911	TP53
2	GO_Biological_Process_2021	epithelial cell migration (GO:0010631)	1/41	0.0283295950973344	0.0489077700377435	ABL1
2	GO_Biological_Process_2021	regulation of release of cytochrome c from mitochondria (GO:0090199)	1/41	0.0283295950973344	0.0489077700377435	TP53
2	GO_Biological_Process_2021	regulation of response to DNA damage stimulus (GO:2001020)	1/41	0.0283295950973344	0.0489077700377435	ABL1
2	GO_Biological_Process_2021	response to growth factor (GO:0070848)	1/41	0.0283295950973344	0.0489077700377435	TGFBR2
2	GO_Biological_Process_2021	regulation of mitochondrial membrane potential (GO:0051881)	1/41	0.0283295950973344	0.0489077700377435	ABL1
2	GO_Biological_Process_2021	positive regulation of macromolecule metabolic process (GO:0010604)	2/384	0.0287292685998495	0.0494367284348059	KRAS;TP53
2	GO_Biological_Process_2021	positive regulation of epithelial to mesenchymal transition (GO:0010718)	1/42	0.0290111592858413	0.049760240846265	TGFBR2
2	GO_Biological_Process_2021	cellular response to glucose starvation (GO:0042149)	1/43	0.0296922795635159	0.0504388082328957	TP53
2	GO_Biological_Process_2021	cellular response to retinoic acid (GO:0071300)	1/43	0.0296922795635159	0.0504388082328957	RET
2	GO_Biological_Process_2021	negative regulation of type I interferon production (GO:0032480)	1/43	0.0296922795635159	0.0504388082328957	REL
2	GO_Biological_Process_2021	positive regulation of cell-matrix adhesion (GO:0001954)	1/44	0.0303729561855169	0.0509419834757087	ABL1
2	GO_Biological_Process_2021	branching morphogenesis of an epithelial tube (GO:0048754)	1/44	0.0303729561855169	0.0509419834757087	TGFBR2
2	GO_Biological_Process_2021	cardiac ventricle morphogenesis (GO:0003208)	1/44	0.0303729561855169	0.0509419834757087	TGFBR2
2	GO_Biological_Process_2021	positive regulation of stress fiber assembly (GO:0051496)	1/44	0.0303729561855169	0.0509419834757087	ABL1
2	GO_Molecular_Function_2021	cyclin-dependent protein serine/threonine kinase regulator activity (GO:0016538)	1/44	0.0303729561855169	0.055895740963749	CDKN2A
2	GO_Biological_Process_2021	regulation of receptor signaling pathway via JAK-STAT (GO:0046425)	1/45	0.031053189424305	0.0511123925306884	JAK3
2	GO_Biological_Process_2021	negative regulation of T cell activation (GO:0050868)	1/45	0.031053189424305	0.0511123925306884	JAK3
2	GO_Biological_Process_2021	cellular response to radiation (GO:0071478)	1/45	0.031053189424305	0.0511123925306884	TP53
2	GO_Biological_Process_2021	regulation of insulin receptor signaling pathway (GO:0046626)	1/45	0.031053189424305	0.0511123925306884	PTPN11
2	GO_Biological_Process_2021	positive regulation of RNA metabolic process (GO:0051254)	1/45	0.031053189424305	0.0511123925306884	TP53
2	GO_Biological_Process_2021	regulation of pri-miRNA transcription by RNA polymerase II (GO:1902893)	1/45	0.031053189424305	0.0511123925306884	TP53
2	GO_Molecular_Function_2021	copper ion binding (GO:0005507)	1/45	0.031053189424305	0.055895740963749	TP53
2	GO_Molecular_Function_2021	protein kinase C binding (GO:0005080)	1/45	0.031053189424305	0.055895740963749	ABL1
2	GO_Biological_Process_2021	transmembrane receptor protein tyrosine kinase signaling pathway (GO:0007169)	2/404	0.0315518970848755	0.0512758511002433	RET;PTPN11
2	GO_Biological_Process_2021	erythrocyte differentiation (GO:0030218)	1/46	0.0317329795488298	0.0512758511002433	JAK3
2	GO_Biological_Process_2021	regulation of telomerase activity (GO:0051972)	1/46	0.0317329795488298	0.0512758511002433	TP53
2	GO_Biological_Process_2021	regulation of fibroblast proliferation (GO:0048145)	1/46	0.0317329795488298	0.0512758511002433	TP53
2	GO_Biological_Process_2021	positive regulation of nucleocytoplasmic transport (GO:0046824)	1/46	0.0317329795488298	0.0512758511002433	TP53
2	GO_Biological_Process_2021	positive regulation of response to stimulus (GO:0048584)	1/46	0.0317329795488298	0.0512758511002433	CDKN2A
2	GO_Biological_Process_2021	epidermal growth factor receptor signaling pathway (GO:0007173)	1/47	0.0324123268177389	0.0520561612527322	PTPN11
2	GO_Biological_Process_2021	epithelial to mesenchymal transition (GO:0001837)	1/47	0.0324123268177389	0.0520561612527322	TBX3
2	KEGG_2021_Human	Intestinal immune network for IgA production	1/48	0.0330912315021826	0.06401254618455	ICOSLG
2	GO_Biological_Process_2021	cellular response to ionizing radiation (GO:0071479)	1/48	0.0330912315021826	0.052826363542641	TP53
2	GO_Biological_Process_2021	regulation of interleukin-10 production (GO:0032653)	1/48	0.0330912315021826	0.052826363542641	JAK3
2	GO_Molecular_Function_2021	manganese ion binding (GO:0030145)	1/48	0.0330912315021826	0.0583962908862047	ABL1
2	GO_Biological_Process_2021	response to hydrogen peroxide (GO:0042542)	1/49	0.033769693865094	0.0537475608063057	ABL1
2	GO_Biological_Process_2021	positive regulation of cell morphogenesis involved in differentiation (GO:0010770)	1/50	0.0344477141698711	0.0544993686866618	ABL1
2	GO_Biological_Process_2021	regulation of cellular component movement (GO:0051270)	1/50	0.0344477141698711	0.0544993686866618	ABL1
2	GO_Biological_Process_2021	regulation of substrate adhesion-dependent cell spreading (GO:1900024)	1/51	0.035125292681812	0.0549156493255467	ABL1
2	GO_Biological_Process_2021	negative regulation of protein ubiquitination (GO:0031397)	1/51	0.035125292681812	0.0549156493255467	ABL1
2	GO_Biological_Process_2021	regulation of interleukin-12 production (GO:0032655)	1/51	0.035125292681812	0.0549156493255467	JAK3
2	GO_Biological_Process_2021	positive regulation of actin filament bundle assembly (GO:0032233)	1/51	0.035125292681812	0.0549156493255467	ABL1
2	GO_Biological_Process_2021	regulation of nucleic acid-templated transcription (GO:1903506)	2/430	0.0353813480540405	0.0551532778489455	ABL1;TP53
2	GO_Biological_Process_2021	regulation of intrinsic apoptotic signaling pathway (GO:2001242)	1/52	0.035802429669446	0.0554832974409543	TP53
2	GO_Biological_Process_2021	myeloid cell differentiation (GO:0030099)	1/52	0.035802429669446	0.0554832974409543	JAK3
2	GO_Biological_Process_2021	heart morphogenesis (GO:0003007)	1/53	0.0364791253950767	0.0563671616891855	TBX3
2	GO_Biological_Process_2021	regulation of focal adhesion assembly (GO:0051893)	1/54	0.0371553801227102	0.0572452077471988	ABL1
2	GO_Molecular_Function_2021	transition metal ion binding (GO:0046914)	2/445	0.0376705420353642	0.0651990150612073	ABL1;TP53
2	GO_Biological_Process_2021	positive regulation of establishment of protein localization to mitochondrion (GO:1903749)	1/56	0.0385065676493855	0.0588140658621738	TP53
2	GO_Biological_Process_2021	blood vessel morphogenesis (GO:0048514)	1/56	0.0385065676493855	0.0588140658621738	TGFBR2
2	GO_Biological_Process_2021	DNA damage response, signal transduction by p53 class mediator resulting in cell cycle arrest (GO:0006977)	1/56	0.0385065676493855	0.0588140658621738	TP53
2	GO_Molecular_Function_2021	receptor tyrosine kinase binding (GO:0030971)	1/56	0.0385065676493855	0.0653885111027301	TP53
2	GO_Biological_Process_2021	positive regulation of cell junction assembly (GO:1901890)	1/57	0.0391815009686787	0.0595019928750709	ABL1
2	GO_Biological_Process_2021	cellular response to peptide (GO:1901653)	1/57	0.0391815009686787	0.0595019928750709	TP53
2	GO_Biological_Process_2021	positive regulation of mitochondrion organization (GO:0010822)	1/58	0.0398559943558669	0.0601814159789444	TP53
2	GO_Biological_Process_2021	positive regulation of protein binding (GO:0032092)	1/58	0.0398559943558669	0.0601814159789444	ABL1
2	GO_Molecular_Function_2021	purine ribonucleoside triphosphate binding (GO:0035639)	2/460	0.0400166132698702	0.0666943554497836	ABL1;KRAS
2	KEGG_2021_Human	VEGF signaling pathway	1/59	0.040530048064478	0.0759692524785358	KRAS
2	GO_Biological_Process_2021	positive regulation of apoptotic signaling pathway (GO:2001235)	1/59	0.040530048064478	0.0608524800968084	TP53
2	GO_Biological_Process_2021	mitotic DNA damage checkpoint signaling (GO:0044773)	1/59	0.040530048064478	0.0608524800968084	TP53
2	KEGG_2021_Human	Viral myocarditis	1/60	0.0412036623612398	0.0759692524785358	ABL1
2	KEGG_2021_Human	Long-term depression	1/60	0.0412036623612398	0.0759692524785358	KRAS
2	GO_Biological_Process_2021	peptidyl-threonine phosphorylation (GO:0018107)	1/60	0.0412036623612398	0.0616452328188992	TGFBR2
2	GO_Cellular_Component_2021	caveola (GO:0005901)	1/60	0.0412036623612398	0.2240827238990139	TGFBR2
2	GO_Molecular_Function_2021	transmembrane receptor protein tyrosine kinase activity (GO:0004714)	1/60	0.0412036623612398	0.0671835375532219	RET
2	GO_Biological_Process_2021	regulation of cellular macromolecule biosynthetic process (GO:2000112)	2/468	0.0412906748126589	0.0616452328188992	ABL1;TP53
2	GO_Biological_Process_2021	B cell differentiation (GO:0030183)	1/61	0.041876837511306	0.06217009490474	JAK3
2	GO_Biological_Process_2021	regulation of endocytosis (GO:0030100)	1/61	0.041876837511306	0.06217009490474	ABL1
2	GO_Biological_Process_2021	response to retinoic acid (GO:0032526)	1/62	0.0425495737837072	0.062816919513551	RET
2	GO_Biological_Process_2021	I-kappaB kinase/NF-kappaB signaling (GO:0007249)	1/62	0.0425495737837072	0.062816919513551	REL
2	GO_Molecular_Function_2021	SH3 domain binding (GO:0017124)	1/62	0.0425495737837072	0.0671835375532219	ABL1
2	GO_Molecular_Function_2021	syntaxin binding (GO:0019905)	1/62	0.0425495737837072	0.0671835375532219	ABL1
2	KEGG_2021_Human	Basal cell carcinoma	1/63	0.0432218714274676	0.0774527684366803	TP53
2	GO_Biological_Process_2021	cell cycle G1/S phase transition (GO:0044843)	1/63	0.0432218714274676	0.0634559331206589	CDKN2A
2	GO_Biological_Process_2021	cellular response to reactive oxygen species (GO:0034614)	1/63	0.0432218714274676	0.0634559331206589	ABL1
2	GO_Biological_Process_2021	positive regulation of gene expression (GO:0010628)	2/482	0.0435577896812901	0.0637724545057563	KRAS;TP53
2	KEGG_2021_Human	GnRH secretion	1/64	0.0438937307216496	0.0774527684366803	KRAS
2	GO_Biological_Process_2021	regulation of innate immune response (GO:0045088)	1/64	0.0438937307216496	0.064087265240976	PTPN11
2	GO_Biological_Process_2021	negative regulation of apoptotic process (GO:0043066)	2/485	0.0440497332704614	0.0641383478938038	TP53;TBX3
2	GO_Biological_Process_2021	regulation of cell-matrix adhesion (GO:0001952)	1/65	0.0445651519182939	0.0643583937784627	CDKN2A
2	GO_Biological_Process_2021	regulation of cellular catabolic process (GO:0031329)	1/65	0.0445651519182939	0.0643583937784627	ABL1
2	GO_Biological_Process_2021	mitotic G1 DNA damage checkpoint signaling (GO:0031571)	1/65	0.0445651519182939	0.0643583937784627	TP53
2	GO_Biological_Process_2021	ERBB signaling pathway (GO:0038127)	1/66	0.0452361352854174	0.0647977073007331	PTPN11
2	GO_Biological_Process_2021	positive regulation of cell cycle (GO:0045787)	1/66	0.0452361352854174	0.0647977073007331	TBX3
2	GO_Biological_Process_2021	embryonic organ development (GO:0048568)	1/66	0.0452361352854174	0.0647977073007331	TGFBR2
2	KEGG_2021_Human	Acute myeloid leukemia	1/67	0.0459066810912919	0.0774527684366803	KRAS
2	KEGG_2021_Human	Long-term potentiation	1/67	0.0459066810912919	0.0774527684366803	KRAS
2	GO_Biological_Process_2021	peptidyl-threonine modification (GO:0018210)	1/67	0.0459066810912919	0.0655809729875598	TGFBR2
2	GO_Molecular_Function_2021	GDP binding (GO:0019003)	1/67	0.0459066810912919	0.0712345051416598	KRAS
2	KEGG_2021_Human	Herpes simplex virus 1 infection	2/498	0.0462061276633587	0.0774527684366803	PTPN11;TP53
2	GO_Cellular_Component_2021	intracellular membrane-bounded organelle (GO:0043231)	7/5192	0.0462687033501	0.2240827238990139	CDKN2A;REL;ABL1;PTPN11;TP53;TBX3;KDM6A
2	KEGG_2021_Human	Fc epsilon RI signaling pathway	1/68	0.0465767895867937	0.0774527684366803	KRAS
2	GO_Biological_Process_2021	negative regulation of transforming growth factor beta receptor signaling pathway (GO:0030512)	1/68	0.0465767895867937	0.0663594045188191	TGFBR2
2	KEGG_2021_Human	Adipocytokine signaling pathway	1/69	0.0472464610426502	0.0774527684366803	PTPN11
2	GO_Biological_Process_2021	RNA 3'-end processing (GO:0031123)	1/69	0.0472464610426502	0.066953541049745	U2AF1
2	GO_Biological_Process_2021	cellular response to decreased oxygen levels (GO:0036294)	1/69	0.0472464610426502	0.066953541049745	TP53
2	KEGG_2021_Human	Epithelial cell signaling in Helicobacter pylori infection	1/70	0.0479156957277768	0.0774527684366803	PTPN11
2	KEGG_2021_Human	Prolactin signaling pathway	1/70	0.0479156957277768	0.0774527684366803	KRAS
2	GO_Biological_Process_2021	positive regulation of cell-substrate adhesion (GO:0010811)	1/70	0.0479156957277768	0.0674078056591497	ABL1
2	GO_Biological_Process_2021	cellular response to light stimulus (GO:0071482)	1/70	0.0479156957277768	0.0674078056591497	TP53
2	GO_Biological_Process_2021	positive regulation of nucleic acid-templated transcription (GO:1903508)	2/511	0.0484019762993482	0.0674078056591497	RET;TP53
2	KEGG_2021_Human	Adherens junction	1/71	0.0485844938901796	0.0774725713383945	TGFBR2
2	GO_Biological_Process_2021	Fc-gamma receptor signaling pathway involved in phagocytosis (GO:0038096)	1/71	0.0485844938901796	0.0674078056591497	ABL1
2	GO_Biological_Process_2021	gland development (GO:0048732)	1/71	0.0485844938901796	0.0674078056591497	TBX3
2	GO_Biological_Process_2021	regulation of G1/S transition of mitotic cell cycle (GO:2000045)	1/71	0.0485844938901796	0.0674078056591497	CDKN2A
