Cluster_ID	Database	Native_Macro_Sector	N_Pathways_Aggregated	Best_P-value	Unique_Genes_Count	Coverage_%	Total_Input_Genes	Original_Pathways	All_Unique_Genes
0	GO	GO: Regulation of intracellular signal transduction	8	1.833732548635896e-08	19	35.19	54	positive regulation of intracellular signal transduction (GO:1902533) | regulation of protein kinase B signaling (GO:0051896) | regulation of MAPK cascade (GO:0043408) | regulation of signal transduction by p53 class mediator (GO:1901796) | negative regulation of intracellular signal transduction (GO:1902532) | regulation of I-kappaB kinase/NF-kappaB signaling (GO:0043122) | regulation of intrinsic apoptotic signaling pathway (GO:2001242) | regulation of protein kinase C signaling (GO:0090036)	ATR;BRCA1;BRD4;CYLD;EPHB1;ERBB4;ESR1;FGF19;FGF3;FGFR3;FLT1;FLT4;HGF;MTOR;NF1;PDGFRB;PRKD1;TNFAIP3;TP53
0	GO	GO: Enzyme binding	8	0.001453945582274	13	24.07	54	histone acetyltransferase binding (GO:0035035) | kinase binding (GO:0019900) | ubiquitin-like protein ligase binding (GO:0044389) | ATPase binding (GO:0051117) | histone deacetylase binding (GO:0042826) | phosphatase binding (GO:0019902) | protease binding (GO:0002020) | RNA polymerase binding (GO:0070063)	AXIN2;BRCA1;CCND2;CYLD;EPAS1;ESR1;FLT4;NCOR1;PDGFRB;PGR;RB1;TNFAIP3;TP53
0	GO	GO: Cell surface receptor protein tyrosine kinase signaling pathway	6	0.000788771507073	10	18.52	54	vascular endothelial growth factor receptor signaling pathway (GO:0048010) | fibroblast growth factor receptor signaling pathway (GO:0008543) | ephrin receptor signaling pathway (GO:0048013) | hepatocyte growth factor receptor signaling pathway (GO:0048012) | vascular endothelial growth factor signaling pathway (GO:0038084) | platelet-derived growth factor receptor signaling pathway (GO:0048008)	EPHB1;FGF19;FGF3;FGFR3;FLT1;FLT4;HGF;PDGFRB;PRKD1;RASA1
0	GO	GO: Biological regulation	5	3.251576735985038e-05	17	31.48	54	regulation of cell population proliferation (GO:0042127) | regulation of cell cycle (GO:0051726) | regulation of actin filament-based process (GO:0032970) | regulation of cellular response to stress (GO:0080135) | regulation of response to external stimulus (GO:0032101)	ATR;AXIN2;BRCA1;BRD4;CCND2;CYLD;ERBB4;FGF19;FGF3;FGFR3;FLT1;FLT4;MTOR;NOTCH2;PDGFRB;RB1;TP53
0	GO	GO: Regulation of cell population proliferation	5	3.7494144676643296e-05	14	25.93	54	positive regulation of cell population proliferation (GO:0008284) | negative regulation of cell population proliferation (GO:0008285) | regulation of fibroblast proliferation (GO:0048145) | regulation of smooth muscle cell proliferation (GO:0048660) | regulation of epithelial cell proliferation (GO:0050678)	AXIN2;B2M;CCND2;ERBB4;FGF19;FGF3;FGFR3;FLT1;FLT4;NF1;PDGFRB;PRKD1;TNFAIP3;TP53
0	KEGG	KEGG: Cancer: specific types	15	1.689849233140391e-13	15	27.78	54	Breast cancer | Melanoma | Gastric cancer | Glioma | Hepatocellular carcinoma | Prostate cancer | Bladder cancer | Non-small cell lung cancer | Pancreatic cancer | Colorectal cancer | Endometrial cancer | Basal cell carcinoma | Renal cell carcinoma | Chronic myeloid leukemia | Small cell lung cancer	AXIN2;BRCA1;EPAS1;ESR1;FGF19;FGF3;FGFR3;FLT4;HGF;MTOR;NOTCH2;PDGFRB;PGR;RB1;TP53
0	KEGG	KEGG: Signal transduction	12	1.6094698309880954e-11	21	38.89	54	MAPK signaling pathway | PI3K-Akt signaling pathway | Ras signaling pathway | Rap1 signaling pathway | Calcium signaling pathway | ErbB signaling pathway | JAK-STAT signaling pathway | Wnt signaling pathway | Phosphatidylinositol signaling system | NF-kappa B signaling pathway | HIF-1 signaling pathway | TNF signaling pathway	AXIN2;BRCA1;CCND2;CYLD;ERBB4;FGF19;FGF3;FGFR3;FLT1;FLT4;HGF;INPP4B;INPPL1;MAP2K4;MTOR;NF1;PDGFRB;PRKD1;RASA1;TNFAIP3;TP53
0	KEGG	KEGG: Cancer: overview	8	8.932453079187127e-11	21	38.89	54	Pathways in cancer | MicroRNAs in cancer | Central carbon metabolism in cancer | Chemical carcinogenesis | Transcriptional misregulation in cancer | Proteoglycans in cancer | Viral carcinogenesis | Choline metabolism in cancer	AXIN2;BRCA1;CCND2;DNMT3A;EPAS1;ERBB4;ESR1;FGF19;FGF3;FGFR3;FLT1;FLT4;HGF;KDM6A;MTOR;NCOR1;NOTCH2;PDGFRB;PGR;RB1;TP53
0	KEGG	KEGG: Infectious disease: viral	8	1.961919096320476e-06	12	22.22	54	Human T-cell leukemia virus 1 infection | Human papillomavirus infection | Epstein-Barr virus infection | Kaposi sarcoma-associated herpesvirus infection | Human cytomegalovirus infection | Measles | Hepatitis B | Human immunodeficiency virus 1 infection	ATR;AXIN2;B2M;CCND2;MAP2K4;MTOR;NOTCH2;PDGFRB;RB1;TNFAIP3;TP53;XPO1
0	KEGG	KEGG: Endocrine system	3	8.81744284197585e-07	8	14.81	54	Thyroid hormone signaling pathway | Prolactin signaling pathway | Growth hormone synthesis, secretion and action	CCND2;ESR1;MAP2K4;MED12;MTOR;NCOR1;NOTCH2;TP53
0	Reactome	Reactome: Diseases of signal transduction by growth factor receptors and second messengers	1	1.5692207752570948e-10	13	24.07	54	Diseases of Signal Transduction by Growth Factor Receptors and Second Messengers	AMER1;ERBB4;ESR1;FGF19;FGF3;FGFR3;HGF;MTOR;NCOR1;NF1;PDGFRB;RB1;TP53
0	Reactome	Reactome: Disease	1	2.343517092052259e-10	24	44.44	54	Disease	AMER1;ATR;B2M;BRCA1;BRD4;CCND2;DNMT3A;ERBB4;ERCC3;ESR1;FGF19;FGF3;FGFR3;HGF;MAP2K4;MED12;MTOR;NCOR1;NF1;NOTCH2;PDGFRB;RB1;TP53;XPO1
0	Reactome	Reactome: Pi3k akt signaling in cancer	1	5.453958547779573e-10	8	14.81	54	PI3K AKT Signaling in Cancer	ERBB4;ESR1;FGF19;FGF3;FGFR3;HGF;MTOR;PDGFRB
0	Reactome	Reactome: Signaling by receptor tyrosine kinases	1	1.2913437410421267e-09	13	24.07	54	Signaling by Receptor Tyrosine Kinases	ERBB4;ESR1;FGF19;FGF3;FGFR3;FLT1;FLT4;HGF;MTOR;NCOR1;PDGFRB;PGR;RASA1
0	Reactome	Reactome: Constitutive signaling by aberrant pi3k in cancer	1	2.4778277028457797e-09	7	12.96	54	Constitutive Signaling by Aberrant PI3K in Cancer	ERBB4;ESR1;FGF19;FGF3;FGFR3;HGF;PDGFRB
1	GO	GO: Dna metabolic process	10	0.0001510040339141	7	18.92	37	telomere maintenance (GO:0000723) | DNA biosynthetic process (GO:0071897) | DNA strand elongation (GO:0022616) | DNA double-strand break processing (GO:0000729) | DNA replication (GO:0006260) | base-excision repair, gap-filling (GO:0006287) | DNA recombination (GO:0006310) | DNA-dependent DNA replication maintenance of fidelity (GO:0045005) | mitochondrial DNA metabolic process (GO:0032042) | nucleotide-excision repair, DNA gap filling (GO:0006297)	BARD1;MSH2;MSH3;NBN;PARP1;POLE;TERT
1	GO	GO: Regulation of intracellular signal transduction	8	3.767259873973613e-05	14	37.84	37	regulation of protein kinase B signaling (GO:0051896) | regulation of intracellular steroid hormone receptor signaling pathway (GO:0033143) | regulation of signal transduction by p53 class mediator (GO:1901796) | positive regulation of intracellular signal transduction (GO:1902533) | regulation of MAPK cascade (GO:0043408) | regulation of peroxisome proliferator activated receptor signaling pathway (GO:0035358) | regulation of retinoic acid receptor signaling pathway (GO:0048385) | regulation of hippo signaling (GO:0035330)	ASXL1;AXIN1;BARD1;FLT3;GATA3;IGF2;NBN;NF2;PLCG2;PRDM1;PTEN;RPTOR;RUNX1;SH2B3
1	GO	GO: Biological regulation	7	6.811227650160404e-09	17	45.95	37	regulation of cell population proliferation (GO:0042127) | regulation of response to cytokine stimulus (GO:0060759) | negative regulation of response to stimulus (GO:0048585) | regulation of cell cycle (GO:0051726) | regulation of signal transduction (GO:0009966) | regulation of cellular component organization (GO:0051128) | regulation of programmed cell death (GO:0043067)	AXIN1;BAP1;BARD1;CTNNB1;FLT3;GATA3;GLI1;IGF2;KLF4;NBN;NF2;PPM1D;PTEN;RPTOR;RUNX1;SH2B3;TERT
1	GO	GO: Dna repair	6	2.276946855005965e-07	9	24.32	37	mismatch repair (GO:0006298) | double-strand break repair (GO:0006302) | base-excision repair (GO:0006284) | mitochondrial DNA repair (GO:0043504) | recombinational repair (GO:0000725) | nucleotide-excision repair (GO:0006289)	BAP1;BARD1;MLH1;MSH2;MSH3;NBN;PARP1;PMS1;POLE
1	GO	GO: Regulation of cell differentiation	6	0.0003733383137535	7	18.92	37	regulation of epithelial to mesenchymal transition (GO:0010717) | regulation of fat cell differentiation (GO:0045598) | regulation of muscle cell differentiation (GO:0051147) | regulation of cell development (GO:0060284) | regulation of hematopoietic progenitor cell differentiation (GO:1901532) | regulation of stem cell differentiation (GO:2000736)	ASXL1;CTNNB1;FOXO1;GATA3;IGF2;PTEN;RUNX1
1	KEGG	KEGG: Signal transduction	10	0.0033696426922566	13	35.14	37	Hippo signaling pathway | Wnt signaling pathway | PI3K-Akt signaling pathway | Hedgehog signaling pathway | Ras signaling pathway | Phosphatidylinositol signaling system | NF-kappa B signaling pathway | AMPK signaling pathway | FoxO signaling pathway | mTOR signaling pathway	AXIN1;CTNNB1;FLT3;FOXO1;GLI1;IGF2;NF2;PARP1;PLCG2;PTEN;RPTOR;SMO;SOX17
1	KEGG	KEGG: Cancer: specific types	9	5.111408294869728e-07	15	40.54	37	Colorectal cancer | Hepatocellular carcinoma | Endometrial cancer | Basal cell carcinoma | Breast cancer | Gastric cancer | Prostate cancer | Acute myeloid leukemia | Glioma	AXIN1;CTNNB1;FLT3;FOXO1;GLI1;IGF2;MLH1;MSH2;MSH3;NOTCH3;PLCG2;PTEN;RUNX1;SMO;TERT
1	KEGG	KEGG: Cancer: overview	5	1.0323913760513556e-14	17	45.95	37	Pathways in cancer | Proteoglycans in cancer | MicroRNAs in cancer | Transcriptional misregulation in cancer | Central carbon metabolism in cancer	AXIN1;CTNNB1;DROSHA;FLT3;FOXO1;GLI1;IGF2;MLH1;MSH2;MSH3;NOTCH3;PLCG2;PTEN;RPTOR;RUNX1;SMO;TERT
1	KEGG	KEGG: Replication and repair	3	1.006143288287396e-05	7	18.92	37	Mismatch repair | Base excision repair | Homologous recombination	BARD1;MLH1;MSH2;MSH3;NBN;PARP1;POLE
1	KEGG	KEGG: Immune system	3	0.0125560355362712	5	13.51	37	Th1 and Th2 cell differentiation | Th17 cell differentiation | Leukocyte transendothelial migration	CTNNB1;GATA3;NOTCH3;PLCG2;RUNX1
1	Reactome	Reactome: Rna polymerase ii transcription	1	4.414285505421919e-12	18	48.65	37	RNA Polymerase II Transcription	AXIN1;BARD1;CTNNB1;FOXO1;GATA3;KLF4;MGA;MLH1;MSH2;NBN;NOTCH3;PARP1;PPM1D;PRDM1;PTEN;RPTOR;RUNX1;U2AF1
1	Reactome	Reactome: Gene expression (transcription)	1	6.674592551883697e-12	19	51.35	37	Gene Expression (Transcription)	AXIN1;BARD1;CTNNB1;DROSHA;FOXO1;GATA3;KLF4;MGA;MLH1;MSH2;NBN;NOTCH3;PARP1;PPM1D;PRDM1;PTEN;RPTOR;RUNX1;U2AF1
1	Reactome	Reactome: Generic transcription pathway	1	1.1348734582245091e-11	17	45.95	37	Generic Transcription Pathway	AXIN1;BARD1;CTNNB1;FOXO1;GATA3;KLF4;MGA;MLH1;MSH2;NBN;NOTCH3;PARP1;PPM1D;PRDM1;PTEN;RPTOR;RUNX1
1	Reactome	Reactome: Signal transduction	1	2.527280789240564e-08	19	51.35	37	Signal Transduction	AXIN1;CTNNB1;FLT3;FOXO1;GATA3;GLI1;IGF2;NF2;NOTCH3;PARP1;PLCG2;PRDM1;PTEN;RPTOR;RUNX1;SH2B3;SMO;SOX17;TERT
1	Reactome	Reactome: Diseases of dna repair	1	3.61244481679149e-08	5	13.51	37	Diseases of DNA Repair	BARD1;MLH1;MSH2;MSH3;NBN
2	GO	GO: Biological regulation	7	1.501807818395147e-09	18	54.55	33	regulation of cell population proliferation (GO:0042127) | regulation of cell cycle (GO:0051726) | regulation of programmed cell death (GO:0043067) | regulation of actin filament-based process (GO:0032970) | regulation of cell division (GO:0051302) | regulation of cell adhesion molecule production (GO:0060353) | regulation of immune response (GO:0050776)	ALK;ARID2;BCL6;CTCF;EP300;EPHA5;FGF4;HLA-A;IL7R;INHBA;JAK3;NKX3-1;NOTCH1;PAK1;PHOX2B;PIK3C3;TBX3;TSC1
2	GO	GO: Developmental process	7	0.0009500662817566	8	24.24	33	central nervous system development (GO:0007417) | nervous system development (GO:0007399) | exocrine system development (GO:0035272) | enteric nervous system development (GO:0048484) | ovarian follicle development (GO:0001541) | sympathetic nervous system development (GO:0048485) | autonomic nervous system development (GO:0048483)	CIC;EP300;EPHA7;GRIN2A;INHBA;NKX3-1;PHOX2B;TBX3
2	GO	GO: Regulation of signal transduction	6	7.059327593401302e-05	11	33.33	33	regulation of intracellular signal transduction (GO:1902531) | regulation of receptor signaling pathway via STAT (GO:1904892) | positive regulation of signal transduction (GO:0009967) | regulation of Notch signaling pathway (GO:0008593) | regulation of insulin-like growth factor receptor signaling pathway (GO:0043567) | regulation of transmembrane receptor protein serine/threonine kinase signaling pathway (GO:0090092)	ARAF;BRIP1;EP300;IL7R;JAK3;LATS2;NKX3-1;NOTCH1;PAK1;RAD50;ROS1
2	GO	GO: Regulation of cell population proliferation	5	1.417191865769952e-07	10	30.3	33	negative regulation of cell population proliferation (GO:0008285) | positive regulation of cell population proliferation (GO:0008284) | regulation of cell proliferation involved in heart morphogenesis (GO:2000136) | regulation of glial cell proliferation (GO:0060251) | regulation of cardiac muscle cell proliferation (GO:0060043)	ARID2;CTCF;FGF4;IL7R;INHBA;NKX3-1;NOTCH1;PAK1;TBX3;TSC1
2	GO	GO: Cell differentiation	5	0.0001859501704052	6	18.18	33	neuron differentiation (GO:0030182) | myeloid cell differentiation (GO:0030099) | foam cell differentiation (GO:0090077) | cell differentiation in hindbrain (GO:0021533) | glial cell differentiation (GO:0010001)	ALK;EP300;EPHA5;INHBA;JAK3;PHOX2B
2	KEGG	KEGG: Cancer: specific types	14	4.921838003487268e-06	10	30.3	33	Renal cell carcinoma | Non-small cell lung cancer | Prostate cancer | Breast cancer | Melanoma | Gastric cancer | Bladder cancer | Hepatocellular carcinoma | Endometrial cancer | Acute myeloid leukemia | Glioma | Chronic myeloid leukemia | Pancreatic cancer | Colorectal cancer	ALK;ARAF;ARID2;BRAF;EP300;FGF4;JAK3;NKX3-1;NOTCH1;PAK1
2	KEGG	KEGG: Signal transduction	12	2.287086671475288e-06	13	39.39	33	FoxO signaling pathway | ErbB signaling pathway | cAMP signaling pathway | MAPK signaling pathway | JAK-STAT signaling pathway | PI3K-Akt signaling pathway | Notch signaling pathway | Rap1 signaling pathway | Ras signaling pathway | TGF-beta signaling pathway | mTOR signaling pathway | Hippo signaling pathway	ARAF;BCL6;BRAF;EP300;FGF4;GRIN2A;IL7R;INHBA;JAK3;LATS2;NOTCH1;PAK1;TSC1
2	KEGG	KEGG: Infectious disease: viral	7	0.0001413108738776	10	30.3	33	Hepatitis B | Human papillomavirus infection | Kaposi sarcoma-associated herpesvirus infection | Epstein-Barr virus infection | Human T-cell leukemia virus 1 infection | Hepatitis C | Human immunodeficiency virus 1 infection	ARAF;BRAF;BTK;EP300;HLA-A;JAK3;NOTCH1;PAK1;PIK3C3;TSC1
2	KEGG	KEGG: Cancer: overview	4	1.3385727304948757e-07	12	36.36	33	Pathways in cancer | Viral carcinogenesis | Proteoglycans in cancer | MicroRNAs in cancer	ALK;ARAF;BRAF;DNMT3B;EP300;FGF4;HLA-A;IL7R;JAK3;NKX3-1;NOTCH1;PAK1
2	KEGG	KEGG: Endocrine system	4	0.0014759635932553	5	15.15	33	Insulin signaling pathway | Progesterone-mediated oocyte maturation | Parathyroid hormone synthesis, secretion and action | Thyroid hormone signaling pathway	ARAF;BRAF;EP300;NOTCH1;TSC1
2	Reactome	Reactome: Signaling by alk	1	1.6117818039508418e-05	3	9.09	33	Signaling by ALK	ALK;EP300;JAK3
2	Reactome	Reactome: Disease	1	1.6126113985205302e-05	13	39.39	33	Disease	ALK;ARAF;BRAF;BRIP1;BTK;DNMT3B;EP300;FGF4;HLA-A;JAK3;NOTCH1;PIK3C3;RAD50
2	Reactome	Reactome: Signaling by receptor tyrosine kinases	1	2.2263004364100552e-05	7	21.21	33	Signaling by Receptor Tyrosine Kinases	ALK;BRAF;EP300;FGF4;JAK3;PAK1;PIK3C3
2	Reactome	Reactome: Transcriptional regulation by tp53	1	2.4717086726372585e-05	6	18.18	33	Transcriptional Regulation by TP53	BCL6;BRIP1;CDK12;EP300;RAD50;TSC1
2	Reactome	Reactome: Signal transduction	1	2.912391661633469e-05	14	42.42	33	Signal Transduction	ALK;ARAF;BRAF;BTK;EP300;FGF4;INHBA;JAK3;LATS2;NOTCH1;PAK1;PIK3C3;SPEN;TSC1
3	GO	GO: Biological regulation	9	6.408929754963344e-10	16	51.61	31	regulation of cell population proliferation (GO:0042127) | regulation of cell cycle (GO:0051726) | regulation of signal transduction (GO:0009966) | regulation of response to external stimulus (GO:0032101) | regulation of cell adhesion (GO:0030155) | regulation of cellular component organization (GO:0051128) | regulation of programmed cell death (GO:0043067) | regulation of myelination (GO:0031641) | regulation of cellular senescence (GO:2000772)	APC;CDKN2A;CREBBP;CXCR4;DICER1;DOT1L;EGFR;ERBB3;FGFR2;JAK2;KDR;KIT;MEN1;PTCH1;STK11;TSC2
3	GO	GO: Regulation of signal transduction	9	3.9670873774892926e-05	13	41.94	31	positive regulation of signal transduction (GO:0009967) | regulation of smoothened signaling pathway (GO:0008589) | regulation of receptor signaling pathway via STAT (GO:1904892) | regulation of intracellular signal transduction (GO:1902531) | regulation of Wnt signaling pathway (GO:0030111) | regulation of cytokine-mediated signaling pathway (GO:0001959) | regulation of Notch signaling pathway (GO:0008593) | regulation of growth hormone receptor signaling pathway (GO:0060398) | regulation of ERBB signaling pathway (GO:1901184)	AXL;CHEK2;CREBBP;DOT1L;EGFR;FGFR2;JAK2;PIK3R2;PTCH1;SMARCA4;SPRED1;STK11;TSC2
3	GO	GO: Developmental process	8	0.0001519754404094	9	29.03	31	digestive system development (GO:0055123) | circulatory system development (GO:0072359) | nervous system development (GO:0007399) | exocrine system development (GO:0035272) | ovarian follicle development (GO:0001541) | pharyngeal system development (GO:0060037) | vasculature development (GO:0001944) | peripheral nervous system development (GO:0007422)	APC;AXL;CXCR4;ERBB3;FGFR2;KIT;PTCH1;STK11;TSC2
3	GO	GO: Regulation of intracellular signal transduction	7	2.4479348425458732e-08	12	38.71	31	regulation of protein kinase B signaling (GO:0051896) | regulation of MAPK cascade (GO:0043408) | positive regulation of intracellular signal transduction (GO:1902533) | negative regulation of intracellular signal transduction (GO:1902532) | regulation of nitric oxide mediated signal transduction (GO:0010749) | regulation of signal transduction by p53 class mediator (GO:1901796) | regulation of SMAD protein signal transduction (GO:0060390)	AXL;CHEK2;EGFR;ERBB3;FGFR2;JAK2;KDR;KIT;PIK3R2;SPRED1;STK11;TSC2
3	GO	GO: Cell surface receptor protein tyrosine kinase signaling pathway	7	0.0001510234404419	10	32.26	31	vascular endothelial growth factor receptor signaling pathway (GO:0048010) | ERBB signaling pathway (GO:0038127) | insulin receptor signaling pathway (GO:0008286) | fibroblast growth factor receptor signaling pathway (GO:0008543) | insulin-like growth factor receptor signaling pathway (GO:0048009) | vascular endothelial growth factor signaling pathway (GO:0038084) | growth hormone receptor signaling pathway (GO:0060396)	APC;AXL;EGFR;ERBB3;FGFR2;JAK2;KDR;PIK3R2;SPRED1;TSC2
3	KEGG	KEGG: Signal transduction	15	2.20316194976521e-09	13	41.94	31	PI3K-Akt signaling pathway | Rap1 signaling pathway | Ras signaling pathway | Calcium signaling pathway | FoxO signaling pathway | Phospholipase D signaling pathway | MAPK signaling pathway | JAK-STAT signaling pathway | ErbB signaling pathway | HIF-1 signaling pathway | AMPK signaling pathway | mTOR signaling pathway | VEGF signaling pathway | cAMP signaling pathway | Wnt signaling pathway	APC;CREBBP;CXCR4;EGFR;ERBB3;FGFR2;JAK2;KDR;KIT;PIK3R2;PTCH1;STK11;TSC2
3	KEGG	KEGG: Cancer: specific types	15	1.987083071446764e-07	11	35.48	31	Hepatocellular carcinoma | Breast cancer | Pancreatic cancer | Prostate cancer | Gastric cancer | Endometrial cancer | Melanoma | Non-small cell lung cancer | Glioma | Colorectal cancer | Bladder cancer | Basal cell carcinoma | Acute myeloid leukemia | Renal cell carcinoma | Chronic myeloid leukemia	APC;BRCA2;CDKN2A;CREBBP;EGFR;FGFR2;KEAP1;KIT;PIK3R2;PTCH1;SMARCA4
3	KEGG	KEGG: Infectious disease: viral	10	2.306904473471948e-05	9	29.03	31	Human cytomegalovirus infection | Human papillomavirus infection | Human T-cell leukemia virus 1 infection | Hepatitis B | Influenza A | Kaposi sarcoma-associated herpesvirus infection | Hepatitis C | Herpes simplex virus 1 infection | Human immunodeficiency virus 1 infection | Coronavirus disease	APC;CDKN2A;CHEK2;CREBBP;CXCR4;EGFR;JAK2;PIK3R2;TSC2
3	KEGG	KEGG: Cancer: overview	9	9.666982053675886e-12	18	58.06	31	Pathways in cancer | MicroRNAs in cancer | Central carbon metabolism in cancer | Proteoglycans in cancer | PD-L1 expression and PD-1 checkpoint pathway in cancer | Choline metabolism in cancer | Viral carcinogenesis | Chemical carcinogenesis | Transcriptional misregulation in cancer	APC;BRCA2;CDKN2A;CREBBP;CXCR4;DICER1;DOT1L;EGFR;ERBB3;FGFR2;JAK2;KDR;KEAP1;KIT;MEN1;PIK3R2;PTCH1;TSC2
3	KEGG	KEGG: Endocrine system	8	0.0008174676820608	7	22.58	31	Growth hormone synthesis, secretion and action | Thyroid hormone signaling pathway | Adipocytokine signaling pathway | Prolactin signaling pathway | Melanogenesis | Relaxin signaling pathway | Estrogen signaling pathway | Insulin signaling pathway	CREBBP;EGFR;JAK2;KIT;PIK3R2;STK11;TSC2
3	Reactome	Reactome: Diseases of signal transduction by growth factor receptors and second messengers	1	3.82970220531338e-11	11	35.48	31	Diseases of Signal Transduction by Growth Factor Receptors and Second Messengers	APC;CREBBP;EGFR;ERBB3;FGFR2;JAK2;KDR;KIT;PIK3R2;SPRED1;TSC2
3	Reactome	Reactome: Signal transduction	1	4.391726892707291e-09	18	58.06	31	Signal Transduction	APC;AXL;CREBBP;CXCR4;EGFR;ERBB3;FGFR2;JAK2;KDR;KIT;MEN1;PIK3R2;PTCH1;SMARCA4;SPRED1;STAG2;STK11;TSC2
3	Reactome	Reactome: Pi3k akt signaling in cancer	1	1.5876599178457092e-08	6	19.35	31	PI3K AKT Signaling in Cancer	EGFR;ERBB3;FGFR2;KIT;PIK3R2;TSC2
3	Reactome	Reactome: Disease	1	1.6407564529286937e-08	16	51.61	31	Disease	APC;BRCA2;CD79B;CDKN2A;CREBBP;CXCR4;EGFR;ERBB3;FGFR2;JAK2;KDR;KEAP1;KIT;PIK3R2;SPRED1;TSC2
3	Reactome	Reactome: Signaling by receptor tyrosine kinases	1	7.946761237820029e-08	9	29.03	31	Signaling by Receptor Tyrosine Kinases	AXL;EGFR;ERBB3;FGFR2;JAK2;KDR;KIT;PIK3R2;SPRED1
4	GO	GO: Biological regulation	7	9.361307121531274e-08	17	56.67	30	regulation of cell population proliferation (GO:0042127) | regulation of cell division (GO:0051302) | regulation of cell adhesion (GO:0030155) | regulation of cell adhesion molecule production (GO:0060353) | regulation of response to stress (GO:0080134) | regulation of cell killing (GO:0031341) | regulation of lipid storage (GO:0010883)	CSF1R;FBXW7;FLCN;IL10;IRS1;IRS2;KMT2D;MST1R;NCOA3;NOTCH4;PDGFRA;PLK2;PPP2R1A;RET;TET1;TGFBR1;TGFBR2
4	GO	GO: Developmental process	6	2.0415807327257887e-06	7	23.33	30	vasculature development (GO:0001944) | circulatory system development (GO:0072359) | skeletal system development (GO:0001501) | pharyngeal system development (GO:0060037) | hepaticobiliary system development (GO:0061008) | endocrine system development (GO:0035270)	ANKRD11;ARID5B;FBXW7;NOTCH4;PDGFRA;TGFBR1;TGFBR2
4	GO	GO: Signaling receptor binding	5	0.0031852247621403	5	16.67	30	receptor tyrosine kinase binding (GO:0030971) | growth factor receptor binding (GO:0070851) | insulin-like growth factor receptor binding (GO:0005159) | ephrin receptor binding (GO:0046875) | Notch binding (GO:0005112)	CBL;IL10;IRS1;NOTCH4;PDGFRA
4	GO	GO: Cell surface receptor protein tyrosine kinase signaling pathway	5	0.0053503916965906	5	16.67	30	insulin receptor signaling pathway (GO:0008286) | glial cell-derived neurotrophic factor receptor signaling pathway (GO:0035860) | hepatocyte growth factor receptor signaling pathway (GO:0048012) | insulin-like growth factor receptor signaling pathway (GO:0048009) | platelet-derived growth factor receptor signaling pathway (GO:0048008)	IRS1;IRS2;MST1R;PDGFRA;RET
4	GO	GO: Regulation of cytokine production	5	0.0119391531667426	4	13.33	30	regulation of interleukin-18 production (GO:0032661) | positive regulation of cytokine production (GO:0001819) | regulation of interleukin-1 production (GO:0032652) | regulation of transforming growth factor beta production (GO:0071634) | regulation of cytokine production involved in immune response (GO:0002718)	CARD11;CSF1R;IL10;SMAD4
4	KEGG	KEGG: Signal transduction	16	1.4149763355376844e-11	15	50.0	30	FoxO signaling pathway | TGF-beta signaling pathway | MAPK signaling pathway | Hippo signaling pathway | PI3K-Akt signaling pathway | AMPK signaling pathway | Apelin signaling pathway | mTOR signaling pathway | Rap1 signaling pathway | Ras signaling pathway | Calcium signaling pathway | ErbB signaling pathway | Sphingolipid signaling pathway | Phospholipase D signaling pathway | JAK-STAT signaling pathway | cGMP-PKG signaling pathway	CBL;CSF1R;FLCN;IL10;IRS1;IRS2;MST1R;NRAS;PDGFRA;PLK2;PPP2R1A;RET;SMAD4;TGFBR1;TGFBR2
4	KEGG	KEGG: Cancer: specific types	13	9.17166890581546e-08	11	36.67	30	Chronic myeloid leukemia | Colorectal cancer | Gastric cancer | Hepatocellular carcinoma | Pancreatic cancer | Breast cancer | Thyroid cancer | Acute myeloid leukemia | Renal cell carcinoma | Melanoma | Non-small cell lung cancer | Glioma | Prostate cancer	CBL;CSF1R;FLCN;NCOA3;NOTCH4;NRAS;PDGFRA;RET;SMAD4;TGFBR1;TGFBR2
4	KEGG	KEGG: Cancer: overview	7	2.9807925250345286e-09	15	50.0	30	Pathways in cancer | MicroRNAs in cancer | Central carbon metabolism in cancer | Transcriptional misregulation in cancer | PD-L1 expression and PD-1 checkpoint pathway in cancer | Choline metabolism in cancer | Proteoglycans in cancer	CBL;CSF1R;ETV1;ETV6;IRS1;IRS2;NCOA3;NOTCH4;NRAS;PDCD1;PDGFRA;RET;SMAD4;TGFBR1;TGFBR2
4	KEGG	KEGG: Endocrine system	7	5.028191239100909e-05	8	26.67	30	Insulin signaling pathway | Growth hormone synthesis, secretion and action | Thyroid hormone signaling pathway | Relaxin signaling pathway | Regulation of lipolysis in adipocytes | Adipocytokine signaling pathway | Estrogen signaling pathway	CBL;IRS1;IRS2;NCOA3;NOTCH4;NRAS;TGFBR1;TGFBR2
4	KEGG	KEGG: Infectious disease: viral	5	9.644487591248116e-05	7	23.33	30	Hepatitis B | Human T-cell leukemia virus 1 infection | Human papillomavirus infection | Hepatitis C | Human cytomegalovirus infection	NOTCH4;NRAS;PDGFRA;PPP2R1A;SMAD4;TGFBR1;TGFBR2
