Gene_set	Term	Overlap	P-value	Adjusted P-value	Old P-value	Old Adjusted P-value	Odds Ratio	Combined Score	Genes
Reactome_2022	Regulation Of TP53 Activity Thru Phosphorylation R-HSA-6804756	2/90	0.0002968728596410649	0.0246404473502083	0	0	113.10227272727272	918.640025209676	STK11;CHEK2
KEGG_2021_Human	Pathways in cancer	3/531	0.0003505841855305227	0.0135247114730743	0	0	36.86742424242424	293.3138978997738	KEAP1;KRAS;GLI1
GO_Biological_Process_2021	intrinsic apoptotic signaling pathway (GO:0097193)	2/102	0.000381209751704544	0.0265946867311354	0	0	99.47	783.043835264899	STK11;CHEK2
KEGG_2021_Human	Longevity regulating pathway	2/102	0.000381209751704544	0.0135247114730743	0	0	99.47	783.043835264899	STK11;KRAS
KEGG_2021_Human	FoxO signaling pathway	2/131	0.0006277332252970674	0.0135247114730743	0	0	76.99612403100775	567.7228576803623	STK11;KRAS
KEGG_2021_Human	Autophagy	2/137	0.0006862332622619815	0.0135247114730743	0	0	73.55185185185185	535.7732363146357	STK11;KRAS
Reactome_2022	DNA Double-Strand Break Repair R-HSA-5693532	2/149	0.0008108933574650148	0.0248904283234516	0	0	67.50680272108843	480.47116302366464	CHEK2;POLE
KEGG_2021_Human	mTOR signaling pathway	2/154	0.0008658399568620583	0.0135247114730743	0	0	65.26973684210526	460.2698138852921	STK11;KRAS
GO_Biological_Process_2021	regulation of signal transduction by p53 class mediator (GO:1901796)	2/156	0.0008883122339049933	0.0265946867311354	0	0	64.41558441558442	452.5959586961092	STK11;CHEK2
KEGG_2021_Human	Cellular senescence	2/156	0.0008883122339049933	0.0135247114730743	0	0	64.41558441558442	452.5959586961092	CHEK2;KRAS
Reactome_2022	Regulation Of TP53 Activity R-HSA-5633007	2/157	0.0008996540357874079	0.0248904283234516	0	0	63.99677419354839	448.8413932918448	STK11;CHEK2
GO_Biological_Process_2021	protein autophosphorylation (GO:0046777)	2/159	0.0009225488218765396	0.0265946867311354	0	0	63.17515923566879	441.4914039737281	STK11;CHEK2
GO_Biological_Process_2021	negative regulation of canonical Wnt signaling pathway (GO:0090090)	2/165	0.0009929205529342526	0.0265946867311354	0	0	60.831288343558285	420.63983668985327	STK11;GLI1
GO_Biological_Process_2021	regulation of cell population proliferation (GO:0042127)	3/764	0.0010183890757481	0.0265946867311354	0	0	25.27332457293036	174.12140967127098	STK11;KRAS;GLI1
KEGG_2021_Human	Hepatocellular carcinoma	2/168	0.0010290541338208	0.0135247114730743	0	0	59.72289156626506	410.8406520770237	KEAP1;KRAS
GO_Biological_Process_2021	negative regulation of Wnt signaling pathway (GO:0030178)	2/191	0.001326976313266	0.0265946867311354	0	0	52.39417989417989	347.1037070362797	STK11;GLI1
Reactome_2022	Synthesis Of PI R-HSA-1483226	1/5	0.0014992198216206	0.0284317563494147	0	0	999.5	6499.559019889724	CHEK2
GO_Biological_Process_2021	mitotic cell cycle phase transition (GO:0044772)	2/209	0.0015857675752462	0.0265946867311354	0	0	47.79468599033817	308.11736718674643	CHEK2;POLE
KEGG_2021_Human	Human T-cell leukemia virus 1 infection	2/219	0.0017391981209362	0.0200007783907666	0	0	45.56912442396313	289.56130553022484	CHEK2;KRAS
GO_Biological_Process_2021	regulation of autophagy (GO:0010506)	2/231	0.0019323702019421	0.0265946867311354	0	0	43.15502183406114	269.6760743351303	STK11;KEAP1
Reactome_2022	GLI Proteins Bind Promoters Of Hh Responsive Genes To Promote Transcription R-HSA-5635851	1/7	0.0020983872819732	0.0284317563494147	0	0	666.2666666666667	4108.590825691207	GLI1
GO_Biological_Process_2021	regulation of canonical Wnt signaling pathway (GO:0060828)	2/253	0.0023120197483946	0.0265946867311354	0	0	39.32868525896414	238.7107168270355	STK11;GLI1
GO_Biological_Process_2021	cellular protein modification process (GO:0006464)	3/1025	0.0023884165348019	0.0265946867311354	0	0	18.563600782778867	112.07077225630944	STK11;CHEK2;KEAP1
GO_Biological_Process_2021	DNA damage induced protein phosphorylation (GO:0006975)	1/8	0.0023978589692277	0.0265946867311354	0	0	571.0571428571428	3445.2899826083253	CHEK2
Reactome_2022	AMPK Inhibits chREBP Transcriptional Activity R-HSA-163680	1/8	0.0023978589692277	0.0284317563494147	0	0	571.0571428571428	3445.2899826083253	STK11
Reactome_2022	DNA Replication Initiation R-HSA-68952	1/8	0.0023978589692277	0.0284317563494147	0	0	571.0571428571428	3445.2899826083253	POLE
GO_Biological_Process_2021	cellular response to UV-B (GO:0071493)	1/8	0.0023978589692277	0.0265946867311354	0	0	571.0571428571428	3445.2899826083253	STK11
GO_Biological_Process_2021	anoikis (GO:0043276)	1/9	0.0026972559359141	0.0265946867311354	0	0	499.65	2955.689739283532	STK11
GO_Biological_Process_2021	DNA repair (GO:0006281)	2/298	0.0031902372103843	0.0265946867311354	0	0	33.273648648648646	191.2456195358984	CHEK2;POLE
Reactome_2022	DNA Repair R-HSA-73894	2/310	0.003447238059301	0.0357650948652482	0	0	31.95779220779221	181.20649593388407	CHEK2;POLE
GO_Biological_Process_2021	replicative senescence (GO:0090399)	1/12	0.0035949984464796	0.0265946867311354	0	0	363.3272727272727	2044.8828145385055	CHEK2
GO_Biological_Process_2021	cytoplasmic sequestering of protein (GO:0051220)	1/13	0.0038940964853966	0.0265946867311354	0	0	333.03333333333336	1847.7667100463036	KEAP1
GO_Biological_Process_2021	response to UV-B (GO:0010224)	1/13	0.0038940964853966	0.0265946867311354	0	0	333.03333333333336	1847.7667100463036	STK11
GO_Biological_Process_2021	mitotic DNA integrity checkpoint signaling (GO:0044774)	1/13	0.0038940964853966	0.0265946867311354	0	0	333.03333333333336	1847.7667100463036	CHEK2
Reactome_2022	Chk1/Chk2(Cds1) Mediated Inactivation Of Cyclin B:Cdk1 Complex R-HSA-75035	1/13	0.0038940964853966	0.0359122231431028	0	0	333.03333333333336	1847.7667100463036	CHEK2
GO_Biological_Process_2021	negative regulation of TORC1 signaling (GO:1904262)	1/14	0.0041931197986946	0.0265946867311354	0	0	307.4	1682.8029678019434	STK11
GO_Biological_Process_2021	positive regulation of cardiac muscle cell proliferation (GO:0060045)	1/14	0.0041931197986946	0.0265946867311354	0	0	307.4	1682.8029678019434	GLI1
GO_Biological_Process_2021	cytoplasmic sequestering of transcription factor (GO:0042994)	1/14	0.0041931197986946	0.0265946867311354	0	0	307.4	1682.8029678019434	KEAP1
GO_Biological_Process_2021	cellular response to DNA damage stimulus (GO:0006974)	2/350	0.0043723279736053	0.0265946867311354	0	0	28.227011494252874	153.34210224283365	STK11;CHEK2
Reactome_2022	Transcriptional Regulation By TP53 R-HSA-3700989	2/354	0.0044705806428141	0.0361498371660167	0	0	27.900568181818183	150.94868577017542	STK11;CHEK2
KEGG_2021_Human	PI3K-Akt signaling pathway	2/354	0.0044705806428141	0.0456992687932113	0	0	27.900568181818183	150.94868577017542	STK11;KRAS
GO_Biological_Process_2021	mitotic intra-S DNA damage checkpoint signaling (GO:0031573)	1/15	0.0044920683932145	0.0265946867311354	0	0	285.42857142857144	1542.8675927558304	CHEK2
GO_Biological_Process_2021	digestive tract morphogenesis (GO:0048546)	1/16	0.0047909422750142	0.0265946867311354	0	0	266.38666666666666	1422.7786907214238	GLI1
Reactome_2022	FOXO-mediated Transcription Of Cell Death Genes R-HSA-9614657	1/16	0.0047909422750142	0.0361498371660167	0	0	266.38666666666666	1422.7786907214238	STK11
GO_Biological_Process_2021	positive regulation of cardiac muscle tissue growth (GO:0055023)	1/17	0.0050897414535705	0.0265946867311354	0	0	249.725	1318.6799159042428	GLI1
GO_Biological_Process_2021	vasculature development (GO:0001944)	1/17	0.0050897414535705	0.0265946867311354	0	0	249.725	1318.6799159042428	STK11
GO_Biological_Process_2021	DNA biosynthetic process (GO:0071897)	1/17	0.0050897414535705	0.0265946867311354	0	0	249.725	1318.6799159042428	POLE
GO_Biological_Process_2021	positive regulation of DNA replication (GO:0045740)	1/17	0.0050897414535705	0.0265946867311354	0	0	249.725	1318.6799159042428	GLI1
GO_Biological_Process_2021	DNA strand elongation involved in DNA replication (GO:0006271)	1/18	0.0053884659389882	0.0265946867311354	0	0	235.0235294117647	1227.644124299904	POLE
GO_Biological_Process_2021	regulation of catabolic process (GO:0009894)	1/18	0.0053884659389882	0.0265946867311354	0	0	235.0235294117647	1227.644124299904	CHEK2
GO_Biological_Process_2021	positive regulation of cell cycle phase transition (GO:1901989)	1/18	0.0053884659389882	0.0265946867311354	0	0	235.0235294117647	1227.644124299904	GLI1
GO_Biological_Process_2021	phosphorylation (GO:0016310)	2/400	0.0056745907193549	0.0271316368769158	0	0	24.618090452261303	127.31877763874884	STK11;CHEK2
Reactome_2022	Regulation Of TP53 Activity Thru Methylation R-HSA-6804760	1/19	0.0056871157389833	0.0393358838613013	0	0	221.95555555555555	1147.4107993095174	CHEK2
GO_Biological_Process_2021	regulation of cardiac muscle cell proliferation (GO:0060043)	1/21	0.0062841913325394	0.0282788609964274	0	0	199.74	1012.6254955871668	GLI1
GO_Biological_Process_2021	positive regulation of smoothened signaling pathway (GO:0045880)	1/21	0.0062841913325394	0.0282788609964274	0	0	199.74	1012.6254955871668	GLI1
Reactome_2022	PCNA-Dependent Long Patch Base Excision Repair R-HSA-5651801	1/21	0.0062841913325394	0.0401221446615979	0	0	199.74	1012.6254955871668	POLE
GO_Biological_Process_2021	regulation of intracellular signal transduction (GO:1902531)	2/437	0.0067407554688947	0.0289059069933739	0	0	22.4816091954023	112.39867728269508	STK11;CHEK2
GO_Biological_Process_2021	nucleotide-excision repair, DNA gap filling (GO:0006297)	1/24	0.0071792448741713	0.0289059069933739	0	0	173.66086956521738	857.2874884567655	POLE
GO_Biological_Process_2021	positive regulation of cellular response to transforming growth factor beta stimulus (GO:1903846)	1/24	0.0071792448741713	0.0289059069933739	0	0	173.66086956521738	857.2874884567655	STK11
GO_Biological_Process_2021	positive regulation of transforming growth factor beta receptor signaling pathway (GO:0030511)	1/24	0.0071792448741713	0.0289059069933739	0	0	173.66086956521738	857.2874884567655	STK11
Reactome_2022	Resolution Of AP Sites Via Multiple-Nucleotide Patch Replacement Pathway R-HSA-110373	1/25	0.007477446810139	0.0406319562104222	0	0	166.41666666666666	814.7533474976135	POLE
Reactome_2022	Gap-filling DNA Repair Synthesis And Ligation In GG-NER R-HSA-5696397	1/25	0.007477446810139	0.0406319562104222	0	0	166.41666666666666	814.7533474976135	POLE
GO_Biological_Process_2021	positive regulation of cell population proliferation (GO:0008284)	2/474	0.0078925518649344	0.0308816228573587	0	0	20.680084745762716	100.12957396870486	KRAS;GLI1
GO_Biological_Process_2021	positive regulation of cellular component movement (GO:0051272)	1/27	0.0080736268908127	0.0308816228573587	0	0	153.6	740.2218192098322	STK11
GO_Biological_Process_2021	protein phosphorylation (GO:0006468)	2/496	0.0086174371943085	0.0321577534324198	0	0	19.73684210526316	93.8283068636178	STK11;CHEK2
Reactome_2022	Energy Dependent Regulation Of mTOR By LKB1-AMPK R-HSA-380972	1/29	0.0086695086687213	0.0406319562104222	0	0	142.61428571428573	677.1245223853919	STK11
Reactome_2022	Recognition Of DNA Damage By PCNA-containing Replication Complex R-HSA-110314	1/30	0.008967337727522	0.0406319562104222	0	0	137.68965517241378	649.0919521468393	POLE
GO_Biological_Process_2021	positive regulation of nucleic acid-templated transcription (GO:1903508)	2/511	0.0091286107342145	0.0329034067541997	0	0	19.140471512770137	89.89019568837031	CHEK2;GLI1
Reactome_2022	Activation Of Pre-Replicative Complex R-HSA-68962	1/32	0.0095627722512654	0.0406319562104222	0	0	128.79354838709676	598.8742368950442	POLE
Reactome_2022	Termination Of Translesion DNA Synthesis R-HSA-5656169	1/32	0.0095627722512654	0.0406319562104222	0	0	128.79354838709676	598.8742368950442	POLE
GO_Biological_Process_2021	DNA damage checkpoint signaling (GO:0000077)	1/32	0.0095627722512654	0.0329034067541997	0	0	128.79354838709676	598.8742368950442	CHEK2
GO_Biological_Process_2021	signal transduction by p53 class mediator (GO:0072331)	1/33	0.0098603777426936	0.0329034067541997	0	0	124.7625	576.3067827453115	STK11
KEGG_2021_Human	Base excision repair	1/33	0.0098603777426936	0.0590348913905613	0	0	124.7625	576.3067827453115	POLE
GO_Biological_Process_2021	regulation of TORC1 signaling (GO:1903432)	1/35	0.0104553652553503	0.0329034067541997	0	0	117.41176470588236	535.4727918518732	STK11
GO_Biological_Process_2021	smoothened signaling pathway (GO:0007224)	1/35	0.0104553652553503	0.0329034067541997	0	0	117.41176470588236	535.4727918518732	GLI1
GO_Biological_Process_2021	base-excision repair, gap-filling (GO:0006287)	1/35	0.0104553652553503	0.0329034067541997	0	0	117.41176470588236	535.4727918518732	POLE
GO_Biological_Process_2021	positive regulation of cell cycle G1/S phase transition (GO:1902808)	1/35	0.0104553652553503	0.0329034067541997	0	0	117.41176470588236	535.4727918518732	GLI1
Reactome_2022	Regulation Of TP53 Degradation R-HSA-6804757	1/36	0.010752747305294	0.0406319562104222	0	0	114.05142857142856	516.9488201244333	CHEK2
KEGG_2021_Human	DNA replication	1/36	0.010752747305294	0.0590348913905613	0	0	114.05142857142856	516.9488201244333	POLE
GO_Biological_Process_2021	intrinsic apoptotic signaling pathway by p53 class mediator (GO:0072332)	1/36	0.010752747305294	0.0329034067541997	0	0	114.05142857142856	516.9488201244333	STK11
GO_Biological_Process_2021	regulation of cell cycle G1/S phase transition (GO:1902806)	1/36	0.010752747305294	0.0329034067541997	0	0	114.05142857142856	516.9488201244333	GLI1
KEGG_2021_Human	Aldosterone-regulated sodium reabsorption	1/37	0.0110500548998867	0.0590348913905613	0	0	110.87777777777778	499.5398567734965	KRAS
KEGG_2021_Human	Thyroid cancer	1/37	0.0110500548998867	0.0590348913905613	0	0	110.87777777777778	499.5398567734965	KRAS
Reactome_2022	Regulation Of TP53 Expression And Degradation R-HSA-6806003	1/37	0.0110500548998867	0.0406319562104222	0	0	110.87777777777778	499.5398567734965	CHEK2
GO_Biological_Process_2021	DNA replication initiation (GO:0006270)	1/38	0.0113472880561394	0.0329925992272253	0	0	107.87567567567568	483.15104128778233	POLE
GO_Biological_Process_2021	negative regulation of TOR signaling (GO:0032007)	1/38	0.0113472880561394	0.0329925992272253	0	0	107.87567567567568	483.15104128778233	STK11
Reactome_2022	Resolution Of Abasic Sites (AP Sites) R-HSA-73933	1/38	0.0113472880561394	0.0406319562104222	0	0	107.87567567567568	483.15104128778233	POLE
GO_Biological_Process_2021	DNA integrity checkpoint signaling (GO:0031570)	1/39	0.0116444467860795	0.0329925992272253	0	0	105.03157894736842	467.6978364624713	CHEK2
GO_Biological_Process_2021	positive regulation of intracellular transport (GO:0032388)	1/39	0.0116444467860795	0.0329925992272253	0	0	105.03157894736842	467.6978364624713	STK11
Reactome_2022	Translesion Synthesis By Y Family DNA Polymerases Bypasses Lesions On DNA Template R-HSA-110313	1/39	0.0116444467860795	0.0406319562104222	0	0	105.03157894736842	467.6978364624713	POLE
GO_Biological_Process_2021	digestive tract development (GO:0048565)	1/40	0.0119415311049953	0.0332191683466234	0	0	102.33333333333331	453.1046714729428	GLI1
Reactome_2022	Dual Incision In GG-NER R-HSA-5696400	1/41	0.0122385410272356	0.0406319562104222	0	0	99.77	439.3037926149688	POLE
KEGG_2021_Human	Bladder cancer	1/41	0.0122385410272356	0.0590348913905613	0	0	99.77	439.3037926149688	KRAS
Reactome_2022	MTOR Signaling R-HSA-165159	1/41	0.0122385410272356	0.0406319562104222	0	0	99.77	439.3037926149688	STK11
GO_Biological_Process_2021	DNA-dependent DNA replication maintenance of fidelity (GO:0045005)	1/43	0.0128323377374525	0.0344446960321094	0	0	95.0095238095238	413.8412399700829	POLE
GO_Biological_Process_2021	DNA synthesis involved in DNA repair (GO:0000731)	1/43	0.0128323377374525	0.0344446960321094	0	0	95.0095238095238	413.8412399700829	POLE
GO_Biological_Process_2021	mitotic spindle assembly (GO:0090307)	1/44	0.0131291245516557	0.0346337251104021	0	0	92.7953488372093	402.075033372933	CHEK2
GO_Biological_Process_2021	positive regulation of cellular process (GO:0048522)	2/625	0.0134523846762773	0.0348849975503464	0	0	15.546548956661317	66.98384356709545	KRAS;GLI1
KEGG_2021_Human	Nucleotide excision repair	1/47	0.0140190390147642	0.0590348913905613	0	0	86.7304347826087	370.1081619438501	POLE
GO_Biological_Process_2021	negative regulation of cold-induced thermogenesis (GO:0120163)	1/47	0.0140190390147642	0.0353270301421682	0	0	86.7304347826087	370.1081619438501	STK11
GO_Biological_Process_2021	regulation of protein metabolic process (GO:0051246)	1/48	0.0143155285543427	0.0353270301421682	0	0	84.88085106382978	360.4389302463305	CHEK2
Reactome_2022	DNA Damage Bypass R-HSA-73893	1/48	0.0143155285543427	0.0435416526547824	0	0	84.88085106382978	360.4389302463305	POLE
GO_Biological_Process_2021	base-excision repair (GO:0006284)	1/48	0.0143155285543427	0.0353270301421682	0	0	84.88085106382978	360.4389302463305	POLE
Reactome_2022	Cell Cycle R-HSA-1640170	2/654	0.0146731743517289	0.0435416526547824	0	0	14.832822085889571	62.62023415650288	CHEK2;POLE
GO_Biological_Process_2021	regulation of smoothened signaling pathway (GO:0008589)	1/51	0.0152045515346865	0.0355429401711894	0	0	79.776	333.9551362891586	GLI1
GO_Biological_Process_2021	intrinsic apoptotic signaling pathway in response to DNA damage (GO:0008630)	1/51	0.0152045515346865	0.0355429401711894	0	0	79.776	333.9551362891586	CHEK2
Reactome_2022	Ubiquitin Mediated Degradation Of Phosphorylated Cdc25A R-HSA-69601	1/51	0.0152045515346865	0.0435416526547824	0	0	79.776	333.9551362891586	CHEK2
GO_Biological_Process_2021	signal transduction in response to DNA damage (GO:0042770)	1/52	0.0155007440273006	0.0355429401711894	0	0	78.2078431372549	325.8817006096059	CHEK2
GO_Biological_Process_2021	cellular macromolecule catabolic process (GO:0044265)	1/53	0.0157968622983064	0.0355429401711894	0	0	76.7	318.1473007644563	CHEK2
GO_Biological_Process_2021	regulation of DNA replication (GO:0006275)	1/53	0.0157968622983064	0.0355429401711894	0	0	76.7	318.1473007644563	GLI1
GO_Biological_Process_2021	epidermal cell differentiation (GO:0009913)	1/53	0.0157968622983064	0.0355429401711894	0	0	76.7	318.1473007644563	GLI1
KEGG_2021_Human	Hedgehog signaling pathway	1/56	0.0166847718987565	0.0590348913905613	0	0	72.50545454545454	296.7835926147705	GLI1
GO_Biological_Process_2021	DNA damage response, signal transduction by p53 class mediator resulting in cell cycle arrest (GO:0006977)	1/56	0.0166847718987565	0.0364681442929964	0	0	72.50545454545454	296.7835926147705	CHEK2
Reactome_2022	Stabilization Of P53 R-HSA-69541	1/56	0.0166847718987565	0.0435416526547824	0	0	72.50545454545454	296.7835926147705	CHEK2
GO_Biological_Process_2021	negative regulation of metabolic process (GO:0009892)	1/56	0.0166847718987565	0.0364681442929964	0	0	72.50545454545454	296.7835926147705	STK11
KEGG_2021_Human	Endometrial cancer	1/58	0.0172763407705115	0.0590348913905613	0	0	69.95438596491228	283.9040901406788	KRAS
Reactome_2022	Degradation Of GLI1 By Proteasome R-HSA-5610780	1/59	0.0175720139945569	0.0435416526547824	0	0	68.7448275862069	277.8286292162732	GLI1
KEGG_2021_Human	VEGF signaling pathway	1/59	0.0175720139945569	0.0590348913905613	0	0	68.7448275862069	277.8286292162732	KRAS
GO_Biological_Process_2021	mitotic DNA damage checkpoint signaling (GO:0044773)	1/59	0.0175720139945569	0.0378664526924958	0	0	68.7448275862069	277.8286292162732	CHEK2
Reactome_2022	Recruitment And ATM-mediated Phosphorylation Of Repair And Signal Proteins At DNA Double Strand Breaks R-HSA-5693565	1/60	0.0178676130920248	0.0435416526547824	0	0	67.57627118644068	271.9786468771055	CHEK2
KEGG_2021_Human	Long-term depression	1/60	0.0178676130920248	0.0590348913905613	0	0	67.57627118644068	271.9786468771055	KRAS
GO_Biological_Process_2021	cellular protein catabolic process (GO:0044257)	1/60	0.0178676130920248	0.0379686778205527	0	0	67.57627118644068	271.9786468771055	CHEK2
Reactome_2022	DNA Double Strand Break Response R-HSA-5693606	1/61	0.0181631380812362	0.0435416526547824	0	0	66.44666666666667	266.34223514766154	CHEK2
KEGG_2021_Human	Basal cell carcinoma	1/63	0.0187539657915919	0.0590348913905613	0	0	64.29677419354839	255.6664806393233	GLI1
GO_Biological_Process_2021	cell cycle G1/S phase transition (GO:0044843)	1/63	0.0187539657915919	0.0389435273385122	0	0	64.29677419354839	255.6664806393233	POLE
KEGG_2021_Human	GnRH secretion	1/64	0.0190492685407353	0.0590348913905613	0	0	63.27301587301587	250.60711544601853	KRAS
GO_Biological_Process_2021	protein catabolic process (GO:0030163)	1/64	0.0190492685407353	0.0389435273385122	0	0	63.27301587301587	250.60711544601853	CHEK2
Reactome_2022	Gap-filling DNA Repair Synthesis And Ligation In TC-NER R-HSA-6782210	1/64	0.0190492685407353	0.0435416526547824	0	0	63.27301587301587	250.60711544601853	POLE
Reactome_2022	FOXO-mediated Transcription R-HSA-9614085	1/65	0.0193444972400453	0.0435416526547824	0	0	62.28125	245.72116030177747	STK11
Reactome_2022	p53-Dependent G1 DNA Damage Response R-HSA-69563	1/65	0.0193444972400453	0.0435416526547824	0	0	62.28125	245.72116030177747	CHEK2
Reactome_2022	Dual Incision In TC-NER R-HSA-6782135	1/65	0.0193444972400453	0.0435416526547824	0	0	62.28125	245.72116030177747	POLE
GO_Biological_Process_2021	regulation of cellular catabolic process (GO:0031329)	1/65	0.0193444972400453	0.0389435273385122	0	0	62.28125	245.72116030177747	KEAP1
GO_Biological_Process_2021	mitotic G1 DNA damage checkpoint signaling (GO:0031571)	1/65	0.0193444972400453	0.0389435273385122	0	0	62.28125	245.72116030177747	CHEK2
Reactome_2022	HDR Thru Homologous Recombination (HRR) R-HSA-5685942	1/67	0.0199347325407437	0.0435416526547824	0	0	60.38787878787879	236.43616149285907	POLE
KEGG_2021_Human	Acute myeloid leukemia	1/67	0.0199347325407437	0.0590348913905613	0	0	60.38787878787879	236.43616149285907	KRAS
KEGG_2021_Human	Long-term potentiation	1/67	0.0199347325407437	0.0590348913905613	0	0	60.38787878787879	236.43616149285907	KRAS
Reactome_2022	G1/S DNA Damage Checkpoints R-HSA-69615	1/67	0.0199347325407437	0.0435416526547824	0	0	60.38787878787879	236.43616149285907	CHEK2
KEGG_2021_Human	Mitophagy	1/68	0.020229739174506	0.0590348913905613	0	0	59.48358208955224	232.0217507665365	KRAS
KEGG_2021_Human	Fc epsilon RI signaling pathway	1/68	0.020229739174506	0.0590348913905613	0	0	59.48358208955224	232.0217507665365	KRAS
KEGG_2021_Human	Adipocytokine signaling pathway	1/69	0.0205246718159305	0.0590348913905613	0	0	58.60588235294118	227.74993771071075	STK11
KEGG_2021_Human	Renal cell carcinoma	1/69	0.0205246718159305	0.0590348913905613	0	0	58.60588235294118	227.74993771071075	KRAS
KEGG_2021_Human	Central carbon metabolism in cancer	1/70	0.0208195304784689	0.0590348913905613	0	0	57.7536231884058	223.6141610659621	KRAS
GO_Biological_Process_2021	carbohydrate homeostasis (GO:0033500)	1/70	0.0208195304784689	0.0413686774442305	0	0	57.7536231884058	223.6141610659621	STK11
KEGG_2021_Human	Prolactin signaling pathway	1/70	0.0208195304784689	0.0590348913905613	0	0	57.7536231884058	223.6141610659621	KRAS
GO_Biological_Process_2021	response to ionizing radiation (GO:0010212)	1/72	0.0214090259328941	0.0419946277914461	0	0	56.12112676056338	215.7263940291824	STK11
KEGG_2021_Human	Non-small cell lung cancer	1/72	0.0214090259328941	0.0590348913905613	0	0	56.12112676056338	215.7263940291824	KRAS
KEGG_2021_Human	Melanoma	1/72	0.0214090259328941	0.0590348913905613	0	0	56.12112676056338	215.7263940291824	KRAS
Reactome_2022	Base Excision Repair R-HSA-73884	1/72	0.0214090259328941	0.0455627987802618	0	0	56.12112676056338	215.7263940291824	POLE
KEGG_2021_Human	p53 signaling pathway	1/73	0.0217036627474641	0.0590348913905613	0	0	55.33888888888889	211.9631207182121	CHEK2
GO_Biological_Process_2021	mitotic nuclear division (GO:0140014)	1/74	0.0219982256466627	0.0420716065492424	0	0	54.57808219178082	208.31326833148967	CHEK2
GO_Biological_Process_2021	DNA damage response, signal transduction by p53 class mediator (GO:0030330)	1/74	0.0219982256466627	0.0420716065492424	0	0	54.57808219178082	208.31326833148967	CHEK2
KEGG_2021_Human	Glioma	1/75	0.0222927146382014	0.0590348913905613	0	0	53.83783783783784	204.7719659635136	KRAS
KEGG_2021_Human	Chronic myeloid leukemia	1/76	0.0225871297456579	0.0590348913905613	0	0	53.117333333333335	201.3346131407168	KRAS
KEGG_2021_Human	Pancreatic cancer	1/76	0.0225871297456579	0.0590348913905613	0	0	53.117333333333335	201.3346131407168	KRAS
Reactome_2022	G2/M DNA Damage Checkpoint R-HSA-69473	1/77	0.0228814709747458	0.0463210266074123	0	0	52.41578947368421	197.99686155819643	CHEK2
GO_Biological_Process_2021	cellular response to UV (GO:0034644)	1/77	0.0228814709747458	0.043220556285631	0	0	52.41578947368421	197.99686155819643	STK11
Reactome_2022	Transcription-Coupled Nucleotide Excision Repair (TC-NER) R-HSA-6781827	1/77	0.0228814709747458	0.0463210266074123	0	0	52.41578947368421	197.99686155819643	POLE
GO_Biological_Process_2021	positive regulation of ubiquitin-dependent protein catabolic process (GO:2000060)	1/79	0.023469931862476	0.0432638503007089	0	0	51.06666666666667	191.60392946538715	KEAP1
GO_Biological_Process_2021	positive regulation of proteasomal ubiquitin-dependent protein catabolic process (GO:0032436)	1/79	0.023469931862476	0.0432638503007089	0	0	51.06666666666667	191.60392946538715	KEAP1
KEGG_2021_Human	B cell receptor signaling pathway	1/81	0.0240580974265445	0.0590348913905613	0	0	49.785	185.5628164040185	KRAS
Reactome_2022	Global Genome Nucleotide Excision Repair (GG-NER) R-HSA-5696399	1/82	0.0243520695000023	0.0481243278214331	0	0	49.1679012345679	182.66556005448464	POLE
GO_Biological_Process_2021	epidermis development (GO:0008544)	1/83	0.024645967784075	0.0443825530643595	0	0	48.56585365853658	179.84625102158773	GLI1
GO_Biological_Process_2021	spindle assembly (GO:0051225)	1/84	0.0249397922961005	0.0443825530643595	0	0	47.97831325301205	177.10189992485337	CHEK2
KEGG_2021_Human	ErbB signaling pathway	1/85	0.02523354305099	0.0590348913905613	0	0	47.40476190476191	174.42966577015417	KRAS
Reactome_2022	Hedgehog On State R-HSA-5632684	1/85	0.02523354305099	0.0487066063542365	0	0	47.40476190476191	174.42966577015417	GLI1
