Gene_set	Term	Overlap	P-value	Adjusted P-value	Old P-value	Old Adjusted P-value	Odds Ratio	Combined Score	Genes
GO_Biological_Process_2021	positive regulation of cardiac muscle cell proliferation (GO:0060045)	1/14	0.0146046795939876	0.0533941827322387	0	0	76.79230769230769	324.5560291468294	GLI1
GO_Biological_Process_2021	negative regulation of cell activation (GO:0050866)	1/14	0.0146046795939876	0.0533941827322387	0	0	76.79230769230769	324.5560291468294	PDGFRA
GO_Biological_Process_2021	activation of cysteine-type endopeptidase activity (GO:0097202)	1/14	0.0146046795939876	0.0533941827322387	0	0	76.79230769230769	324.5560291468294	GRIN2A
Reactome_2022	Regulation Of TP53 Activity Thru Association With Co-factors R-HSA-6804759	1/14	0.0146046795939876	0.0944302599553096	0	0	76.79230769230769	324.5560291468294	TP53
Reactome_2022	TP53 Regulates Transcription Of Additional Cell Death Genes With Uncertain Roles In P53-Dependent Apoptosis R-HSA-6803205	1/14	0.0146046795939876	0.0944302599553096	0	0	76.79230769230769	324.5560291468294	TP53
Reactome_2022	TP53 Regulates Transcription Of Genes Involved In G1 Cell Cycle Arrest R-HSA-6804116	1/14	0.0146046795939876	0.0944302599553096	0	0	76.79230769230769	324.5560291468294	TP53
GO_Biological_Process_2021	synaptic membrane adhesion (GO:0099560)	1/14	0.0146046795939876	0.0533941827322387	0	0	76.79230769230769	324.5560291468294	PTPRD
GO_Biological_Process_2021	cytoplasmic sequestering of transcription factor (GO:0042994)	1/14	0.0146046795939876	0.0533941827322387	0	0	76.79230769230769	324.5560291468294	KEAP1
KEGG_2021_Human	Axon guidance	2/182	0.0154378686421256	0.0973773252811004	0	0	11.578362573099415	48.29256047702522	EPHA5;EPHA3
GO_Biological_Process_2021	androgen receptor signaling pathway (GO:0030521)	1/15	0.0156400643604775	0.0533941827322387	0	0	71.30357142857143	296.4745049823623	ARID1A
GO_Biological_Process_2021	negative regulation of androgen receptor signaling pathway (GO:0060766)	1/15	0.0156400643604775	0.0533941827322387	0	0	71.30357142857143	296.4745049823623	SMARCA4
GO_Biological_Process_2021	cardiac myofibril assembly (GO:0055003)	1/15	0.0156400643604775	0.0533941827322387	0	0	71.30357142857143	296.4745049823623	PDGFRA
GO_Biological_Process_2021	response to ethanol (GO:0045471)	1/15	0.0156400643604775	0.0533941827322387	0	0	71.30357142857143	296.4745049823623	GRIN2A
GO_Biological_Process_2021	positive regulation of chromosome organization (GO:2001252)	1/15	0.0156400643604775	0.0533941827322387	0	0	71.30357142857143	296.4745049823623	ATRX
GO_Biological_Process_2021	positive regulation of chromatin organization (GO:1905269)	1/15	0.0156400643604775	0.0533941827322387	0	0	71.30357142857143	296.4745049823623	ATRX
GO_Biological_Process_2021	protein localization to chromosome, telomeric region (GO:0070198)	1/15	0.0156400643604775	0.0533941827322387	0	0	71.30357142857143	296.4745049823623	ATRX
GO_Biological_Process_2021	embryonic cranial skeleton morphogenesis (GO:0048701)	1/15	0.0156400643604775	0.0533941827322387	0	0	71.30357142857143	296.4745049823623	PDGFRA
GO_Biological_Process_2021	regulation of phospholipase C activity (GO:1900274)	1/15	0.0156400643604775	0.0533941827322387	0	0	71.30357142857143	296.4745049823623	PDGFRA
GO_Biological_Process_2021	positive regulation of protein export from nucleus (GO:0046827)	1/15	0.0156400643604775	0.0533941827322387	0	0	71.30357142857143	296.4745049823623	TP53
GO_Biological_Process_2021	negative regulation of transcription, DNA-templated (GO:0045892)	4/948	0.0157459563268021	0.0533941827322387	0	0	4.744516450648056	19.69530236237185	ZFHX3;CIC;TP53;SMARCA4
Reactome_2022	Axon Guidance R-HSA-422475	3/519	0.0163212795767279	0.0944302599553096	0	0	6.286498708010336	25.87073714910068	RET;EPHA5;EPHA3
GO_Biological_Process_2021	regulation of GTPase activity (GO:0043087)	2/189	0.0165785435434317	0.0538821505734227	0	0	11.141007599211934	45.67418698737144	EPHA5;EPHA3
GO_Biological_Process_2021	negative regulation of platelet activation (GO:0010544)	1/16	0.0166744131586755	0.0538821505734227	0	0	66.54666666666667	272.4340597931688	PDGFRA
GO_Biological_Process_2021	neuron cell-cell adhesion (GO:0007158)	1/16	0.0166744131586755	0.0538821505734227	0	0	66.54666666666667	272.4340597931688	RET
Reactome_2022	mRNA Decay By 3 To 5 Exoribonuclease R-HSA-429958	1/16	0.0166744131586755	0.0944302599553096	0	0	66.54666666666667	272.4340597931688	DIS3
GO_Biological_Process_2021	positive regulation by host of viral transcription (GO:0043923)	1/16	0.0166744131586755	0.0538821505734227	0	0	66.54666666666667	272.4340597931688	SMARCA4
GO_Biological_Process_2021	platelet-derived growth factor receptor signaling pathway (GO:0048008)	1/16	0.0166744131586755	0.0538821505734227	0	0	66.54666666666667	272.4340597931688	PDGFRA
GO_Biological_Process_2021	regulation of programmed cell death (GO:0043067)	2/194	0.0174149157568336	0.0538821505734227	0	0	10.84813596491228	43.93959596604338	ALK;TP53
Reactome_2022	KSRP (KHSRP) Binds And Destabilizes mRNA R-HSA-450604	1/17	0.0177077269512865	0.0944302599553096	0	0	62.384375	251.6432336564321	DIS3
GO_Biological_Process_2021	positive regulation of DNA replication (GO:0045740)	1/17	0.0177077269512865	0.0538821505734227	0	0	62.384375	251.6432336564321	GLI1
GO_Biological_Process_2021	positive regulation of cardiac muscle tissue growth (GO:0055023)	1/17	0.0177077269512865	0.0538821505734227	0	0	62.384375	251.6432336564321	GLI1
GO_Biological_Process_2021	negative regulation of ATPase activity (GO:0032780)	1/17	0.0177077269512865	0.0538821505734227	0	0	62.384375	251.6432336564321	TP53
Reactome_2022	Tristetraprolin (TTP, ZFP36) Binds And Destabilizes mRNA R-HSA-450513	1/17	0.0177077269512865	0.0944302599553096	0	0	62.384375	251.6432336564321	DIS3
Reactome_2022	Butyrate Response Factor 1 Binds And Destabilizes mRNA R-HSA-450385	1/17	0.0177077269512865	0.0944302599553096	0	0	62.384375	251.6432336564321	DIS3
Reactome_2022	Formation Of Senescence-Associated Heterochromatin Foci (SAHF) R-HSA-2559584	1/17	0.0177077269512865	0.0944302599553096	0	0	62.384375	251.6432336564321	TP53
GO_Biological_Process_2021	vasculature development (GO:0001944)	1/17	0.0177077269512865	0.0538821505734227	0	0	62.384375	251.6432336564321	PDGFRA
GO_Biological_Process_2021	cellular response to gamma radiation (GO:0071480)	1/17	0.0177077269512865	0.0538821505734227	0	0	62.384375	251.6432336564321	TP53
Reactome_2022	Ub-specific Processing Proteases R-HSA-5689880	2/201	0.0186156747475357	0.0944302599553096	0	0	10.46284051838138	41.68135477624176	KEAP1;TP53
GO_Biological_Process_2021	positive regulation of intracellular signal transduction (GO:1902533)	3/546	0.0186668707677043	0.0538821505734227	0	0	5.965623081645181	23.749174976048955	RET;PDGFRA;TP53
GO_Biological_Process_2021	positive regulation of CREB transcription factor activity (GO:0032793)	1/18	0.0187400067082949	0.0538821505734227	0	0	58.71176470588235	233.50224496360525	EPHA5
GO_Biological_Process_2021	positive regulation of cell cycle phase transition (GO:1901989)	1/18	0.0187400067082949	0.0538821505734227	0	0	58.71176470588235	233.50224496360525	GLI1
GO_Biological_Process_2021	positive regulation of cell adhesion mediated by integrin (GO:0033630)	1/18	0.0187400067082949	0.0538821505734227	0	0	58.71176470588235	233.50224496360525	RET
GO_Biological_Process_2021	negative regulation of fibroblast proliferation (GO:0048147)	1/18	0.0187400067082949	0.0538821505734227	0	0	58.71176470588235	233.50224496360525	TP53
GO_Biological_Process_2021	intracellular estrogen receptor signaling pathway (GO:0030520)	1/18	0.0187400067082949	0.0538821505734227	0	0	58.71176470588235	233.50224496360525	ARID1A
GO_Biological_Process_2021	rRNA catabolic process (GO:0016075)	1/18	0.0187400067082949	0.0538821505734227	0	0	58.71176470588235	233.50224496360525	DIS3
GO_Biological_Process_2021	negative regulation of lipid catabolic process (GO:0050995)	1/18	0.0187400067082949	0.0538821505734227	0	0	58.71176470588235	233.50224496360525	ALK
Reactome_2022	Regulation Of NF-kappa B Signaling R-HSA-9758274	1/18	0.0187400067082949	0.0944302599553096	0	0	58.71176470588235	233.50224496360525	TP53
Reactome_2022	MECP2 Regulates Neuronal Receptors And Channels R-HSA-9022699	1/18	0.0187400067082949	0.0944302599553096	0	0	58.71176470588235	233.50224496360525	GRIN2A
GO_Biological_Process_2021	presynapse assembly (GO:0099054)	1/18	0.0187400067082949	0.0538821505734227	0	0	58.71176470588235	233.50224496360525	PTPRD
GO_Biological_Process_2021	regulation of presynapse organization (GO:0099174)	1/18	0.0187400067082949	0.0538821505734227	0	0	58.71176470588235	233.50224496360525	PTPRD
GO_Biological_Process_2021	regulation of presynapse assembly (GO:1905606)	1/18	0.0187400067082949	0.0538821505734227	0	0	58.71176470588235	233.50224496360525	PTPRD
GO_Biological_Process_2021	regulation of production of miRNAs involved in gene silencing by miRNA (GO:1903798)	1/18	0.0187400067082949	0.0538821505734227	0	0	58.71176470588235	233.50224496360525	TP53
Reactome_2022	TP53 Regulates Transcription Of Genes Involved In G2 Cell Cycle Arrest R-HSA-6804114	1/18	0.0187400067082949	0.0944302599553096	0	0	58.71176470588235	233.50224496360525	TP53
GO_Biological_Process_2021	negative regulation of cellular macromolecule biosynthetic process (GO:2000113)	3/547	0.0187572009756704	0.0538821505734227	0	0	5.954350490196078	23.675554733583017	CIC;TP53;SMARCA4
Reactome_2022	Transcriptional Regulation By RUNX1 R-HSA-8878171	2/204	0.0191408279038008	0.0944302599553096	0	0	10.3058884835852	40.76939031744604	ARID1A;SMARCA4
GO_Biological_Process_2021	regulation of protein kinase B signaling (GO:0051896)	2/207	0.01967224733371	0.0547045109568221	0	0	10.153530166880616	39.88861439725005	RET;PDGFRA
Reactome_2022	Signaling By PDGFR In Disease R-HSA-9671555	1/19	0.0197712534056807	0.0944302599553096	0	0	55.44722222222222	217.54863156976407	PDGFRA
GO_Biological_Process_2021	interleukin-7-mediated signaling pathway (GO:0038111)	1/19	0.0197712534056807	0.0547045109568221	0	0	55.44722222222222	217.54863156976407	SMARCA4
Reactome_2022	Nuclear Events Stimulated By ALK Signaling In Cancer R-HSA-9725371	1/19	0.0197712534056807	0.0944302599553096	0	0	55.44722222222222	217.54863156976407	ALK
Reactome_2022	SUMOylation Of Transcription Factors R-HSA-3232118	1/19	0.0197712534056807	0.0944302599553096	0	0	55.44722222222222	217.54863156976407	TP53
Reactome_2022	Regulation Of TP53 Activity Thru Methylation R-HSA-6804760	1/19	0.0197712534056807	0.0944302599553096	0	0	55.44722222222222	217.54863156976407	TP53
GO_Biological_Process_2021	excitatory postsynaptic potential (GO:0060079)	1/19	0.0197712534056807	0.0547045109568221	0	0	55.44722222222222	217.54863156976407	GRIN2A
GO_Biological_Process_2021	DNA methylation or demethylation (GO:0044728)	1/19	0.0197712534056807	0.0547045109568221	0	0	55.44722222222222	217.54863156976407	ATRX
GO_Biological_Process_2021	cellular response to interleukin-7 (GO:0098761)	1/19	0.0197712534056807	0.0547045109568221	0	0	55.44722222222222	217.54863156976407	SMARCA4
GO_Biological_Process_2021	DNA alkylation (GO:0006305)	1/19	0.0197712534056807	0.0547045109568221	0	0	55.44722222222222	217.54863156976407	ATRX
KEGG_2021_Human	Rap1 signaling pathway	2/210	0.0202098924017703	0.110877805464554	0	0	10.005566801619434	39.03755005486292	PDGFRA;GRIN2A
GO_Biological_Process_2021	cellular protein modification process (GO:0006464)	4/1025	0.0204207809207201	0.0553862907396528	0	0	4.3689577691997465	17.000498188257698	RET;PTPRT;PTPRD;KEAP1
GO_Biological_Process_2021	phosphate-containing compound metabolic process (GO:0006796)	2/212	0.0205717611501698	0.0553862907396528	0	0	9.909273182957394	38.48599154099102	ALK;PTPRD
GO_Biological_Process_2021	cellular response to nitrogen compound (GO:1901699)	1/20	0.0208014680109953	0.0553862907396528	0	0	52.526315789473685	203.4203291515269	ATRX
Reactome_2022	Receptor-type Tyrosine-Protein Phosphatases R-HSA-388844	1/20	0.0208014680109953	0.0944302599553096	0	0	52.526315789473685	203.4203291515269	PTPRD
GO_Biological_Process_2021	embryonic digestive tract development (GO:0048566)	1/20	0.0208014680109953	0.0553862907396528	0	0	52.526315789473685	203.4203291515269	PDGFRA
GO_Biological_Process_2021	positive regulation of dendrite morphogenesis (GO:0050775)	1/20	0.0208014680109953	0.0553862907396528	0	0	52.526315789473685	203.4203291515269	PTPRD
Reactome_2022	TP53 Regulates Transcription Of Genes Involved In Cytochrome C Release R-HSA-6803204	1/20	0.0208014680109953	0.0944302599553096	0	0	52.526315789473685	203.4203291515269	TP53
KEGG_2021_Human	cAMP signaling pathway	2/216	0.0213036977963518	0.110877805464554	0	0	9.72208558780128	37.41908843222253	GRIN2A;GLI1
GO_Biological_Process_2021	regulation of cell growth (GO:0001558)	2/217	0.0214883814381741	0.0553862907396528	0	0	9.676376988984089	37.15963791491472	TP53;SMARCA4
GO_Biological_Process_2021	calcium ion transport into cytosol (GO:0060402)	1/21	0.0218306514950446	0.0553862907396528	0	0	49.8975	190.8300081149324	GRIN2A
GO_Biological_Process_2021	regulation of cardiac muscle cell proliferation (GO:0060043)	1/21	0.0218306514950446	0.0553862907396528	0	0	49.8975	190.8300081149324	GLI1
GO_Biological_Process_2021	regulation of lipid catabolic process (GO:0050994)	1/21	0.0218306514950446	0.0553862907396528	0	0	49.8975	190.8300081149324	ALK
GO_Biological_Process_2021	long-term synaptic potentiation (GO:0060291)	1/21	0.0218306514950446	0.0553862907396528	0	0	49.8975	190.8300081149324	GRIN2A
GO_Biological_Process_2021	regulation of cell-substrate junction assembly (GO:0090109)	1/21	0.0218306514950446	0.0553862907396528	0	0	49.8975	190.8300081149324	EPHA3
GO_Biological_Process_2021	positive regulation of smoothened signaling pathway (GO:0045880)	1/21	0.0218306514950446	0.0553862907396528	0	0	49.8975	190.8300081149324	GLI1
GO_Biological_Process_2021	cellular response to inorganic substance (GO:0071241)	1/21	0.0218306514950446	0.0553862907396528	0	0	49.8975	190.8300081149324	ATRX
GO_Biological_Process_2021	intrinsic apoptotic signaling pathway in response to DNA damage by p53 class mediator (GO:0042771)	1/21	0.0218306514950446	0.0553862907396528	0	0	49.8975	190.8300081149324	TP53
Reactome_2022	TP53 Regulates Transcription Of Additional Cell Cycle Genes With Uncertain Roles In P53 Pathway R-HSA-6804115	1/21	0.0218306514950446	0.0944302599553096	0	0	49.8975	190.8300081149324	TP53
Reactome_2022	Negative Regulation Of NMDA Receptor-Mediated Neuronal Transmission R-HSA-9617324	1/21	0.0218306514950446	0.0944302599553096	0	0	49.8975	190.8300081149324	GRIN2A
Reactome_2022	Unblocking Of NMDA Receptors, Glutamate Binding And Activation R-HSA-438066	1/21	0.0218306514950446	0.0944302599553096	0	0	49.8975	190.8300081149324	GRIN2A
GO_Biological_Process_2021	cellular response to lipid (GO:0071396)	2/219	0.0218597777198629	0.0553862907396528	0	0	9.586223623575068	36.6491582998453	RET;EPHA3
GO_Biological_Process_2021	positive regulation of cell motility (GO:2000147)	2/221	0.0222338694816875	0.0560194141689444	0	0	9.497716894977168	36.14962593987968	RET;PDGFRA
GO_Biological_Process_2021	regulation of platelet activation (GO:0010543)	1/22	0.0228588048336812	0.056028918369512	0	0	47.51904761904762	179.54686782262274	PDGFRA
GO_Biological_Process_2021	regulation of DNA recombination at telomere (GO:0072695)	1/22	0.0228588048336812	0.056028918369512	0	0	47.51904761904762	179.54686782262274	ATRX
GO_Biological_Process_2021	regulation of execution phase of apoptosis (GO:1900117)	1/22	0.0228588048336812	0.056028918369512	0	0	47.51904761904762	179.54686782262274	TP53
GO_Biological_Process_2021	negative regulation of phosphate metabolic process (GO:0045936)	1/22	0.0228588048336812	0.056028918369512	0	0	47.51904761904762	179.54686782262274	TP53
GO_Biological_Process_2021	negative regulation of DNA recombination at telomere (GO:0048239)	1/22	0.0228588048336812	0.056028918369512	0	0	47.51904761904762	179.54686782262274	ATRX
KEGG_2021_Human	Human cytomegalovirus infection	2/225	0.0229900922907966	0.110877805464554	0	0	9.325466131696956	35.182110779620515	PDGFRA;TP53
Reactome_2022	Developmental Biology R-HSA-1266738	4/1073	0.0237338868486193	0.0983288494447646	0	0	4.162218676057888	15.570241674778634	RET;EPHA5;EPHA3;SMARCA4
Reactome_2022	Long-term Potentiation R-HSA-9620244	1/23	0.0238859289927226	0.0983288494447646	0	0	45.35681818181818	169.38348350725923	GRIN2A
GO_Biological_Process_2021	regulation of protein export from nucleus (GO:0046825)	1/23	0.0238859289927226	0.0573008190197762	0	0	45.35681818181818	169.38348350725923	TP53
GO_Biological_Process_2021	DNA methylation (GO:0006306)	1/23	0.0238859289927226	0.0573008190197762	0	0	45.35681818181818	169.38348350725923	ATRX
GO_Biological_Process_2021	positive regulation of transcription initiation from RNA polymerase II promoter (GO:0060261)	1/23	0.0238859289927226	0.0573008190197762	0	0	45.35681818181818	169.38348350725923	TP53
GO_Biological_Process_2021	positive regulation of transcription by RNA polymerase I (GO:0045943)	1/23	0.0238859289927226	0.0573008190197762	0	0	45.35681818181818	169.38348350725923	SMARCA4
KEGG_2021_Human	Thermogenesis	2/232	0.0243390304678289	0.110877805464554	0	0	9.038443935926772	33.58391135996294	ARID1A;SMARCA4
KEGG_2021_Human	Ras signaling pathway	2/232	0.0243390304678289	0.110877805464554	0	0	9.038443935926772	33.58391135996294	PDGFRA;GRIN2A
GO_Biological_Process_2021	DNA packaging (GO:0006323)	1/24	0.0249120249496479	0.0579140373829443	0	0	43.38260869565217	160.18614661402282	TP53
Reactome_2022	Defective Intrinsic Pathway For Apoptosis R-HSA-9734009	1/24	0.0249120249496479	0.0983288494447646	0	0	43.38260869565217	160.18614661402282	TP53
GO_Biological_Process_2021	cardiac muscle cell development (GO:0055013)	1/24	0.0249120249496479	0.0579140373829443	0	0	43.38260869565217	160.18614661402282	PDGFRA
GO_Biological_Process_2021	negative regulation of lipid metabolic process (GO:0045833)	1/24	0.0249120249496479	0.0579140373829443	0	0	43.38260869565217	160.18614661402282	ALK
GO_Biological_Process_2021	positive regulation of transcription from RNA polymerase II promoter in response to stress (GO:0036003)	1/24	0.0249120249496479	0.0579140373829443	0	0	43.38260869565217	160.18614661402282	TP53
GO_Biological_Process_2021	response to gamma radiation (GO:0010332)	1/24	0.0249120249496479	0.0579140373829443	0	0	43.38260869565217	160.18614661402282	TP53
GO_Biological_Process_2021	positive regulation of phospholipase activity (GO:0010518)	1/24	0.0249120249496479	0.0579140373829443	0	0	43.38260869565217	160.18614661402282	PDGFRA
Reactome_2022	Chromatin Modifying Enzymes R-HSA-3247509	2/238	0.0255208215898854	0.0983288494447646	0	0	8.805976806422837	32.30261800182854	ARID1A;SMARCA4
GO_Biological_Process_2021	chemical synaptic transmission, postsynaptic (GO:0099565)	1/25	0.0259370936730085	0.0590789355885194	0	0	41.57291666666666	151.8276651730302	GRIN2A
Reactome_2022	Interleukin-7 Signaling R-HSA-1266695	1/25	0.0259370936730085	0.0983288494447646	0	0	41.57291666666666	151.8276651730302	SMARCA4
Reactome_2022	Assembly And Cell Surface Presentation Of NMDA Receptors R-HSA-9609736	1/25	0.0259370936730085	0.0983288494447646	0	0	41.57291666666666	151.8276651730302	GRIN2A
GO_Biological_Process_2021	cAMP-mediated signaling (GO:0019933)	1/25	0.0259370936730085	0.0590789355885194	0	0	41.57291666666666	151.8276651730302	EPHA5
GO_Biological_Process_2021	positive regulation of release of cytochrome c from mitochondria (GO:0090200)	1/25	0.0259370936730085	0.0590789355885194	0	0	41.57291666666666	151.8276651730302	TP53
GO_Biological_Process_2021	negative regulation of endocytosis (GO:0045806)	1/25	0.0259370936730085	0.0590789355885194	0	0	41.57291666666666	151.8276651730302	EPHA3
GO_Biological_Process_2021	positive regulation of cellular process (GO:0048522)	3/625	0.0265696726526808	0.0598988788092332	0	0	5.186763129689175	18.817498000441816	PDGFRA;ZFHX3;GLI1
Reactome_2022	Signaling By ALK R-HSA-201556	1/26	0.0269611361380806	0.0983288494447646	0	0	39.908	144.2019250738276	ALK
Reactome_2022	Pyroptosis R-HSA-5620971	1/26	0.0269611361380806	0.0983288494447646	0	0	39.908	144.2019250738276	TP53
GO_Biological_Process_2021	regulation of telomere maintenance (GO:0032204)	1/26	0.0269611361380806	0.0598988788092332	0	0	39.908	144.2019250738276	ATRX
GO_Biological_Process_2021	regulation of protein insertion into mitochondrial membrane involved in apoptotic signaling pathway (GO:1900739)	1/26	0.0269611361380806	0.0598988788092332	0	0	39.908	144.2019250738276	TP53
GO_Biological_Process_2021	positive regulation of protein insertion into mitochondrial membrane involved in apoptotic signaling pathway (GO:1900740)	1/26	0.0269611361380806	0.0598988788092332	0	0	39.908	144.2019250738276	TP53
GO_Biological_Process_2021	cellular response to drug (GO:0035690)	1/26	0.0269611361380806	0.0598988788092332	0	0	39.908	144.2019250738276	TP53
KEGG_2021_Human	Shigellosis	2/246	0.0271326768449847	0.1170989211204605	0	0	8.513805004314063	30.709435041815343	U2AF1;TP53
Reactome_2022	ATF4 Activates Genes In Response To Endoplasmic Reticulum Stress R-HSA-380994	1/27	0.0279841533165139	0.1000971637859923	0	0	38.371153846153845	137.21973105106596	DIS3
GO_Biological_Process_2021	entrainment of circadian clock by photoperiod (GO:0043153)	1/27	0.0279841533165139	0.0608454508004911	0	0	38.371153846153845	137.21973105106596	TP53
GO_Biological_Process_2021	negative regulation of catalytic activity (GO:0043086)	1/27	0.0279841533165139	0.0608454508004911	0	0	38.371153846153845	137.21973105106596	TP53
GO_Biological_Process_2021	positive regulation of gene silencing by miRNA (GO:2000637)	1/27	0.0279841533165139	0.0608454508004911	0	0	38.371153846153845	137.21973105106596	TP53
GO_Biological_Process_2021	RNA splicing, via transesterification reactions with bulged adenosine as nucleophile (GO:0000377)	2/251	0.0281607626838698	0.0608454508004911	0	0	8.340731346438385	29.77495681800267	U2AF1;RBM10
GO_Biological_Process_2021	positive regulation of signal transduction (GO:0009967)	2/252	0.0283682685696115	0.0608454508004911	0	0	8.306947368421053	29.593367606790306	GLI1;SMARCA4
GO_Biological_Process_2021	regulation of extrinsic apoptotic signaling pathway in absence of ligand (GO:2001239)	1/28	0.0290061461687485	0.0608454508004911	0	0	36.94814814814815	130.8055903894323	RET
GO_Biological_Process_2021	cellular response to interleukin-6 (GO:0071354)	1/28	0.0290061461687485	0.0608454508004911	0	0	36.94814814814815	130.8055903894323	PTPRT
GO_Biological_Process_2021	regulation of insulin secretion involved in cellular response to glucose stimulus (GO:0061178)	1/28	0.0290061461687485	0.0608454508004911	0	0	36.94814814814815	130.8055903894323	EPHA5
Reactome_2022	Downstream Signal Transduction R-HSA-186763	1/28	0.0290061461687485	0.1009805550439222	0	0	36.94814814814815	130.8055903894323	PDGFRA
GO_Biological_Process_2021	positive regulation of synapse assembly (GO:0051965)	1/28	0.0290061461687485	0.0608454508004911	0	0	36.94814814814815	130.8055903894323	PTPRD
GO_Biological_Process_2021	photoperiodism (GO:0009648)	1/28	0.0290061461687485	0.0608454508004911	0	0	36.94814814814815	130.8055903894323	TP53
GO_Biological_Process_2021	positive regulation of phosphatidylinositol 3-kinase activity (GO:0043552)	1/28	0.0290061461687485	0.0608454508004911	0	0	36.94814814814815	130.8055903894323	PDGFRA
GO_Biological_Process_2021	positive regulation of fibroblast proliferation (GO:0048146)	1/28	0.0290061461687485	0.0608454508004911	0	0	36.94814814814815	130.8055903894323	PDGFRA
GO_Biological_Process_2021	positive regulation of extrinsic apoptotic signaling pathway (GO:2001238)	1/29	0.0300271156735161	0.0621203172878705	0	0	35.62678571428572	124.89519987020886	RET
GO_Biological_Process_2021	negative regulation of transferase activity (GO:0051348)	1/29	0.0300271156735161	0.0621203172878705	0	0	35.62678571428572	124.89519987020886	TP53
Reactome_2022	EGR2 And SOX10-mediated Initiation Of Schwann Cell Myelination R-HSA-9619665	1/29	0.0300271156735161	0.1009805550439222	0	0	35.62678571428572	124.89519987020886	SMARCA4
GO_Biological_Process_2021	beta-catenin-TCF complex assembly (GO:1904837)	1/29	0.0300271156735161	0.0621203172878705	0	0	35.62678571428572	124.89519987020886	SMARCA4
Reactome_2022	Regulation Of TP53 Activity Thru Acetylation R-HSA-6804758	1/29	0.0300271156735161	0.1009805550439222	0	0	35.62678571428572	124.89519987020886	TP53
Reactome_2022	Disease R-HSA-1643685	5/1736	0.030763988382002	0.1009805550439222	0	0	3.294338532640092	11.468944696933468	ALK;PDGFRA;ATRX;KEAP1;TP53
GO_Biological_Process_2021	ncRNA catabolic process (GO:0034661)	1/30	0.0310470628007074	0.063358485624973	0	0	34.39655172413793	119.43346355828848	DIS3
Reactome_2022	Activation Of BH3-only Proteins R-HSA-114452	1/30	0.0310470628007074	0.1009805550439222	0	0	34.39655172413793	119.43346355828848	TP53
GO_Biological_Process_2021	positive regulation of lipid kinase activity (GO:0090218)	1/30	0.0310470628007074	0.063358485624973	0	0	34.39655172413793	119.43346355828848	PDGFRA
GO_Biological_Process_2021	response to alcohol (GO:0097305)	1/30	0.0310470628007074	0.063358485624973	0	0	34.39655172413793	119.43346355828848	GRIN2A
GO_Biological_Process_2021	protein deubiquitination (GO:0016579)	2/267	0.0315552257807477	0.0635034326909649	0	0	7.830784508440914	27.063317092653136	KEAP1;TP53
GO_Biological_Process_2021	protein-containing complex assembly (GO:0065003)	2/267	0.0315552257807477	0.0635034326909649	0	0	7.830784508440914	27.063317092653136	TP53;SMARCA4
Reactome_2022	PIP3 Activates AKT Signaling R-HSA-1257604	2/268	0.0317725843621533	0.1009805550439222	0	0	7.800949742777997	26.906657413252557	PDGFRA;TP53
GO_Biological_Process_2021	positive regulation of cell migration (GO:0030335)	2/269	0.031990546942949	0.0635034326909649	0	0	7.771338458505815	26.75139360800837	RET;PDGFRA
GO_Biological_Process_2021	embryonic skeletal system morphogenesis (GO:0048704)	1/31	0.032065988516399	0.0635034326909649	0	0	33.248333333333335	114.37291539918964	PDGFRA
