Gene_set	Term	Overlap	P-value	Adjusted P-value	Old P-value	Old Adjusted P-value	Odds Ratio	Combined Score	Genes
GO_Biological_Process_2021	enzyme linked receptor protein signaling pathway (GO:0007167)	5/140	1.2454968541132366e-07	5.6421007491329606e-05	0	0	56.54415954415954	898.9707765508675	NTRK1;RET;PTPRT;PTPRD;EPHA3
GO_Biological_Process_2021	nucleosome organization (GO:0034728)	4/94	1.3311185321984964e-06	0.00030149834754295945	0	0	63.14920634920635	854.3766169077289	SETD2;ATRX;ARID1A;SMARCA4
GO_Biological_Process_2021	positive regulation of cell projection organization (GO:0031346)	4/117	3.194635446133657e-06	0.00037184656596570286	0	0	50.23767383059418	635.7094124842212	NTRK1;RET;PTPRD;EPHA3
GO_Biological_Process_2021	signal transduction by p53 class mediator (GO:0072331)	3/33	3.283413386010621e-06	0.00037184656596570286	0	0	133.01333333333332	1679.5097473860003	STK11;ATRX;TP53
KEGG_2021_Human	Thyroid cancer	3/37	4.665480298250301e-06	0.00036857294356177375	0	0	117.34117647058824	1440.400463498295	NTRK1;RET;TP53
GO_Biological_Process_2021	chromatin organization (GO:0006325)	4/142	6.898142197146348e-06	0.0006249716830614591	0	0	41.08488612836439	488.26340429215367	SETD2;ATRX;ARID1A;SMARCA4
KEGG_2021_Human	Hepatocellular carcinoma	4/168	1.3407853734130344e-05	0.0005296102224981486	0	0	34.52613240418118	387.3718092973583	KEAP1;ARID1A;TP53;SMARCA4
GO_Biological_Process_2021	cellular response to peptide (GO:1901653)	3/57	1.7372707591100336e-05	0.001311639423128	0	0	73.80740740740741	808.9742160011882	NTRK1;GRIN2A;TP53
KEGG_2021_Human	Central carbon metabolism in cancer	3/70	3.226436358007585e-05	0.0008496282409419974	0	0	59.44776119402985	614.7818301978358	NTRK1;RET;TP53
GO_Biological_Process_2021	positive regulation of neuron projection development (GO:0010976)	3/88	6.402806649405614e-05	0.0039233626544349	0	0	46.8164705882353	452.0686898000704	NTRK1;RET;EPHA3
GO_Biological_Process_2021	positive regulation of nucleic acid-templated transcription (GO:1903508)	5/511	6.943791346723677e-05	0.0039233626544349	0	0	14.8038917604135	141.7484114413767	RET;ARID1A;GLI1;TP53;SMARCA4
GO_Biological_Process_2021	regulation of kinase activity (GO:0043549)	3/94	7.794760240599194e-05	0.0039233626544349	0	0	43.71648351648352	413.5349270002346	NTRK1;RET;EPHA3
KEGG_2021_Human	Pathways in cancer	5/531	8.327500769945268e-05	0.0016446814020641	0	0	14.226381983035976	133.6335570753376	NTRK1;RET;KEAP1;GLI1;TP53
GO_Biological_Process_2021	chromatin remodeling (GO:0006338)	3/103	0.00010232080283081646	0.0043809457825075	0	0	39.764	365.3276763551449	ATRX;ARID1A;SMARCA4
GO_Biological_Process_2021	chromatin disassembly (GO:0031498)	2/18	0.0001160515439074858	0.0043809457825075	0	0	155.984375	1413.4486893926328	ARID1A;SMARCA4
GO_Biological_Process_2021	nucleosome disassembly (GO:0006337)	2/18	0.0001160515439074858	0.0043809457825075	0	0	155.984375	1413.4486893926328	ARID1A;SMARCA4
GO_Biological_Process_2021	positive regulation of kinase activity (GO:0033674)	3/114	0.00013826704047066986	0.0046582292174696	0	0	35.803603603603605	318.1624100587182	NTRK1;RET;EPHA3
GO_Biological_Process_2021	protein-DNA complex disassembly (GO:0032986)	2/20	0.00014396293387323563	0.0046582292174696	0	0	138.63888888888889	1226.393330101256	ARID1A;SMARCA4
Reactome_2022	Synaptic Adhesion-Like Molecules R-HSA-8849932	2/21	0.0001590322318968525	0.0257910873077397	0	0	131.33552631578948	1148.7135280506443	PTPRD;GRIN2A
GO_Biological_Process_2021	negative regulation of growth (GO:0045926)	3/126	0.00018590335200614836	0.0051864000899518	0	0	32.291056910569104	277.3893376442282	STK11;TP53;SMARCA4
GO_Biological_Process_2021	negative regulation of cell growth (GO:0030308)	3/126	0.00018590335200614836	0.0051864000899518	0	0	32.291056910569104	277.3893376442282	STK11;TP53;SMARCA4
GO_Biological_Process_2021	cellular protein modification process (GO:0006464)	6/1025	0.00019463311595845976	0.0051864000899518	0	0	9.304710500490676	79.50311469533888	NTRK1;RET;PTPRT;PTPRD;STK11;KEAP1
GO_Biological_Process_2021	protein dephosphorylation (GO:0006470)	3/139	0.0002483261720567274	0.0062495419967609	0	0	29.185294117647057	242.26033989810887	PTPRT;PTPRD;STK11
GO_Biological_Process_2021	positive regulation of transferase activity (GO:0051347)	3/148	0.0002986348066423768	0.0071200824952103	0	0	27.361379310344827	222.0728650278814	NTRK1;RET;EPHA3
GO_Biological_Process_2021	dephosphorylation (GO:0016311)	3/153	0.00032922931303196065	0.0074570439401739	0	0	26.442666666666668	212.03729330865093	PTPRT;PTPRD;STK11
GO_Biological_Process_2021	regulation of transcription, DNA-templated (GO:0006355)	8/2244	0.0003840848709982411	0.0076771859398728	0	0	6.349194991055456	49.93417741229786	RET;MGA;ATRX;ARID1A;GLI1;CIC;TP53;SMARCA4
GO_Biological_Process_2021	transmembrane receptor protein tyrosine kinase signaling pathway (GO:0007169)	4/404	0.0004009608331317662	0.0076771859398728	0	0	13.987142857142857	109.402491287432	NTRK1;RET;PTPRT;EPHA3
GO_Biological_Process_2021	regulation of neuron projection development (GO:0010975)	3/165	0.0004107419582330657	0.0076771859398728	0	0	24.469135802469136	190.7991968166656	NTRK1;RET;EPHA3
GO_Biological_Process_2021	positive regulation of pri-miRNA transcription by RNA polymerase II (GO:1902895)	2/34	0.0004219121242602919	0.0076771859398728	0	0	77.9296875	605.5692748599668	TP53;SMARCA4
GO_Biological_Process_2021	positive regulation of transcription, DNA-templated (GO:0045893)	6/1183	0.0004236857582711296	0.0076771859398728	0	0	7.988530161427358	62.04306739567673	RET;ATRX;ARID1A;GLI1;TP53;SMARCA4
Reactome_2022	Generic Transcription Pathway R-HSA-212436	6/1190	0.0004373451510728837	0.0257910873077397	0	0	7.938344594594595	61.40141136084646	STK11;GRIN2A;MGA;ARID1A;TP53;SMARCA4
GO_Biological_Process_2021	cellular response to amyloid-beta (GO:1904646)	2/35	0.0004472442885735218	0.0077923716432232	0	0	75.56439393939394	582.7832554136846	NTRK1;GRIN2A
Reactome_2022	RUNX1 Interacts With Co-Factors Whose Precise Effect On RUNX1 Targets Is Not Known R-HSA-8939243	2/35	0.0004472442885735218	0.0257910873077397	0	0	75.56439393939394	582.7832554136846	ARID1A;SMARCA4
GO_Biological_Process_2021	intrinsic apoptotic signaling pathway by p53 class mediator (GO:0072332)	2/36	0.00047330062752558495	0.007940932750707	0	0	73.33823529411765	561.461379980425	STK11;TP53
GO_Biological_Process_2021	stem cell differentiation (GO:0048863)	2/40	0.0005847441918510701	0.0094603256753048	0	0	65.60526315789474	488.3876279088855	SETD2;TP53
GO_Biological_Process_2021	ATP-dependent chromatin remodeling (GO:0043044)	2/42	0.000644780459847493	0.010071915458997	0	0	62.31875	457.8309705931631	ARID1A;SMARCA4
GO_Biological_Process_2021	cellular response to retinoic acid (GO:0071300)	2/43	0.0006758731147824064	0.0102056840332143	0	0	60.795731707317074	443.7787597089313	RET;EPHA3
GO_Biological_Process_2021	response to amyloid-beta (GO:1904645)	2/44	0.0007076805583778768	0.0103412675143605	0	0	59.345238095238095	430.4617381877485	NTRK1;GRIN2A
Reactome_2022	RNA Polymerase II Transcription R-HSA-73857	6/1312	0.0007366658840002995	0.0303579983931873	0	0	7.150076569678407	51.57619154502323	STK11;GRIN2A;MGA;ARID1A;TP53;SMARCA4
GO_Biological_Process_2021	regulation of pri-miRNA transcription by RNA polymerase II (GO:1902893)	2/45	0.000740201623342803	0.0104784792304465	0	0	57.96220930232558	417.82568323656506	TP53;SMARCA4
GO_Biological_Process_2021	protein phosphorylation (GO:0006468)	4/496	0.0008672611422335725	0.0119051302252063	0	0	11.318234610917536	79.79548291055048	NTRK1;RET;STK11;EPHA3
Reactome_2022	RMTs Methylate Histone Arginines R-HSA-3214858	2/49	0.0008773987974909651	0.0303579983931873	0	0	53.0186170212766	373.1741306231756	ARID1A;SMARCA4
GO_Biological_Process_2021	regulation of cell growth (GO:0001558)	3/217	0.0009113716684857772	0.0121426872301193	0	0	18.474766355140183	129.33370601958566	STK11;TP53;SMARCA4
GO_Biological_Process_2021	signal transduction in response to DNA damage (GO:0042770)	2/52	0.0009877327017010398	0.0127840832534448	0	0	49.83	344.82850534778163	ATRX;TP53
GO_Biological_Process_2021	peptidyl-tyrosine modification (GO:0018212)	2/56	0.0011446998237224	0.0144041394485073	0	0	46.129629629629626	312.4181218895314	NTRK1;EPHA3
Reactome_2022	Chromatin Modifying Enzymes R-HSA-3247509	3/238	0.0011897278337605	0.0307248864154379	0	0	16.80595744680851	113.17183354335344	SETD2;ARID1A;SMARCA4
KEGG_2021_Human	Calcium signaling pathway	3/240	0.0012187300690822	0.0190427816878846	0	0	16.662447257383967	111.8041194813529	NTRK1;RET;GRIN2A
Reactome_2022	Gene Expression (Transcription) R-HSA-74160	6/1449	0.0012432034965784	0.0307248864154379	0	0	6.423769923769924	42.975430406796136	STK11;GRIN2A;MGA;ARID1A;TP53;SMARCA4
GO_Biological_Process_2021	response to retinoic acid (GO:0032526)	2/62	0.001401119074102	0.0164729734636366	0	0	41.50416666666667	272.7024639719935	RET;EPHA3
GO_Biological_Process_2021	negative regulation of cellular process (GO:0048523)	4/566	0.0014156530002037	0.0164729734636366	0	0	9.87290289781393	64.76786581964778	NTRK1;STK11;TP53;SMARCA4
GO_Biological_Process_2021	positive regulation of phosphorylation (GO:0042327)	3/253	0.0014182030134256	0.0164729734636366	0	0	15.7856	103.52772168633584	NTRK1;RET;EPHA3
KEGG_2021_Human	Basal cell carcinoma	2/63	0.0014462872168013	0.0190427816878846	0	0	40.82172131147541	266.9232566421176	GLI1;TP53
GO_Biological_Process_2021	peptidyl-tyrosine phosphorylation (GO:0018108)	2/69	0.0017317817196253	0.0196124279747573	0	0	37.15485074626866	236.2530013272004	NTRK1;EPHA3
GO_Biological_Process_2021	response to ionizing radiation (GO:0010212)	2/72	0.0018837899979258	0.0208135821722053	0	0	35.55714285714286	223.10221103497707	STK11;TP53
KEGG_2021_Human	Non-small cell lung cancer	2/72	0.0018837899979258	0.0212599156908776	0	0	35.55714285714286	223.10221103497707	RET;TP53
GO_Biological_Process_2021	chromatin assembly (GO:0031497)	2/73	0.0019358238702516	0.0208792431720001	0	0	35.054577464788736	218.9937370166489	ATRX;TP53
GO_Biological_Process_2021	DNA damage response, signal transduction by p53 class mediator (GO:0030330)	2/74	0.0019885380825574	0.0209490174743844	0	0	34.56597222222222	215.01263688059672	ATRX;TP53
GO_Biological_Process_2021	regulation of transcription by RNA polymerase II (GO:0006357)	7/2206	0.0020801956219504	0.0214165594714444	0	0	5.146182148910662	31.779184354076804	MGA;ATRX;ARID1A;GLI1;CIC;TP53;SMARCA4
GO_Biological_Process_2021	cellular response to UV (GO:0034644)	2/77	0.0021507514812381	0.0216508982444638	0	0	33.178333333333335	203.7792653395557	STK11;TP53
Reactome_2022	Protein-protein Interactions At Synapses R-HSA-6794362	2/88	0.0027973432696242	0.0561976083113334	0	0	28.91860465116279	170.0149390044448	PTPRD;GRIN2A
Reactome_2022	Regulation Of TP53 Activity Thru Phosphorylation R-HSA-6804756	2/90	0.0029235749988554	0.0561976083113334	0	0	28.258522727272727	164.88701340835084	STK11;TP53
GO_Biological_Process_2021	positive regulation of protein localization to membrane (GO:1905477)	2/101	0.003664898238102	0.0360106913178889	0	0	25.10479797979798	140.8116748697442	TP53;EPHA3
KEGG_2021_Human	PI3K-Akt signaling pathway	3/354	0.0036827689231184	0.0327956087474421	0	0	11.185754985754986	62.685981964304816	NTRK1;STK11;TP53
GO_Biological_Process_2021	intrinsic apoptotic signaling pathway (GO:0097193)	2/102	0.0037362085914807	0.0360106913178889	0	0	24.8525	138.91761980413474	STK11;TP53
KEGG_2021_Human	Longevity regulating pathway	2/102	0.0037362085914807	0.0327956087474421	0	0	24.8525	138.91761980413474	STK11;TP53
GO_Biological_Process_2021	regulation of cell population proliferation (GO:0042127)	4/764	0.004212628484932	0.0383963886207927	0	0	7.226315789473684	39.52555172112872	NTRK1;STK11;GLI1;TP53
GO_Biological_Process_2021	negative regulation of cell population proliferation (GO:0008285)	3/379	0.0044587684946218	0.0383963886207927	0	0	10.42872340425532	56.44945622016824	NTRK1;STK11;TP53
GO_Biological_Process_2021	cellular response to antibiotic (GO:0071236)	1/5	0.0044922927083929	0.0383963886207927	0	0	293.79411764705884	1588.072397289777	TP53
GO_Biological_Process_2021	regulation of histone H3-K9 trimethylation (GO:1900112)	1/5	0.0044922927083929	0.0383963886207927	0	0	293.79411764705884	1588.072397289777	ATRX
Reactome_2022	Activation Of NOXA And Translocation To Mitochondria R-HSA-111448	1/5	0.0044922927083929	0.0647638865459986	0	0	293.79411764705884	1588.072397289777	TP53
GO_Biological_Process_2021	glial cell-derived neurotrophic factor receptor signaling pathway (GO:0035860)	1/5	0.0044922927083929	0.0383963886207927	0	0	293.79411764705884	1588.072397289777	RET
GO_Biological_Process_2021	bone marrow development (GO:0048539)	1/5	0.0044922927083929	0.0383963886207927	0	0	293.79411764705884	1588.072397289777	TP53
Reactome_2022	Signaling To P38 Via RIT And RIN R-HSA-187706	1/5	0.0044922927083929	0.0647638865459986	0	0	293.79411764705884	1588.072397289777	NTRK1
Reactome_2022	NGF-independant TRKA Activation R-HSA-187024	1/5	0.0044922927083929	0.0647638865459986	0	0	293.79411764705884	1588.072397289777	NTRK1
KEGG_2021_Human	Neurotrophin signaling pathway	2/119	0.005046763352945	0.0398694304882661	0	0	21.2232905982906	112.25015718571794	NTRK1;TP53
GO_Biological_Process_2021	phosphorylation (GO:0016310)	3/400	0.005182330905406	0.0400159847600273	0	0	9.866498740554157	51.92245299831976	NTRK1;RET;STK11
GO_Biological_Process_2021	transmembrane receptor protein tyrosine phosphatase signaling pathway (GO:0007185)	1/6	0.0053884659389882	0.0400159847600273	0	0	235.0235294117647	1227.644124299904	PTPRD
GO_Biological_Process_2021	regulation of mRNA export from nucleus (GO:0010793)	1/6	0.0053884659389882	0.0400159847600273	0	0	235.0235294117647	1227.644124299904	SETD2
GO_Biological_Process_2021	protein-DNA complex subunit organization (GO:0071824)	1/6	0.0053884659389882	0.0400159847600273	0	0	235.0235294117647	1227.644124299904	SETD2
GO_Biological_Process_2021	regulation of ribonucleoprotein complex localization (GO:2000197)	1/6	0.0053884659389882	0.0400159847600273	0	0	235.0235294117647	1227.644124299904	SETD2
GO_Biological_Process_2021	regulation of thymocyte apoptotic process (GO:0070243)	1/6	0.0053884659389882	0.0400159847600273	0	0	235.0235294117647	1227.644124299904	TP53
Reactome_2022	Activation Of TRKA Receptors R-HSA-187015	1/6	0.0053884659389882	0.0679444284317274	0	0	235.0235294117647	1227.644124299904	NTRK1
GO_Biological_Process_2021	histone H3-K36 methylation (GO:0010452)	1/6	0.0053884659389882	0.0400159847600273	0	0	235.0235294117647	1227.644124299904	SETD2
GO_Biological_Process_2021	positive regulation of nuclear cell cycle DNA replication (GO:0010571)	1/6	0.0053884659389882	0.0400159847600273	0	0	235.0235294117647	1227.644124299904	ATRX
GO_Biological_Process_2021	cellular response to oxidative stress (GO:0034599)	2/125	0.0055530378157033	0.0405730021050584	0	0	20.181910569105693	104.81293913113458	KEAP1;TP53
Reactome_2022	GLI Proteins Bind Promoters Of Hh Responsive Genes To Promote Transcription R-HSA-5635851	1/7	0.0062838777740325	0.0679444284317274	0	0	195.843137254902	992.8792720611536	GLI1
Reactome_2022	ARMS-mediated Activation R-HSA-170984	1/7	0.0062838777740325	0.0679444284317274	0	0	195.843137254902	992.8792720611536	NTRK1
Reactome_2022	RUNX3 Regulates CDKN1A Transcription R-HSA-8941855	1/7	0.0062838777740325	0.0679444284317274	0	0	195.843137254902	992.8792720611536	TP53
GO_Biological_Process_2021	positive regulation of RNA polymerase II transcription preinitiation complex assembly (GO:0045899)	1/7	0.0062838777740325	0.0437807696134497	0	0	195.843137254902	992.8792720611536	TP53
GO_Biological_Process_2021	excitatory chemical synaptic transmission (GO:0098976)	1/7	0.0062838777740325	0.0437807696134497	0	0	195.843137254902	992.8792720611536	GRIN2A
GO_Biological_Process_2021	regulation of intracellular signal transduction (GO:1902531)	3/437	0.0066225022368819	0.0437807696134497	0	0	9.008294930875577	45.1971559987981	NTRK1;STK11;TP53
KEGG_2021_Human	Fluid shear stress and atherosclerosis	2/139	0.0068212195134933	0.0437878303500425	0	0	18.10675182481752	90.31135405106922	KEAP1;TP53
KEGG_2021_Human	Apoptosis	2/142	0.0071085899092238	0.0437878303500425	0	0	17.71607142857143	87.63168596319518	NTRK1;TP53
Reactome_2022	AMPK Inhibits chREBP Transcriptional Activity R-HSA-163680	1/8	0.0071785287204102	0.0698264270319338	0	0	167.85714285714286	828.6537822644398	STK11
GO_Biological_Process_2021	cellular response to UV-B (GO:0071493)	1/8	0.0071785287204102	0.0437807696134497	0	0	167.85714285714286	828.6537822644398	STK11
GO_Biological_Process_2021	peptidyl-tyrosine dephosphorylation involved in inactivation of protein kinase activity (GO:1990264)	1/8	0.0071785287204102	0.0437807696134497	0	0	167.85714285714286	828.6537822644398	PTPRT
GO_Biological_Process_2021	regulation of protein localization to chromatin (GO:1905634)	1/8	0.0071785287204102	0.0437807696134497	0	0	167.85714285714286	828.6537822644398	SETD2
GO_Biological_Process_2021	stress-induced premature senescence (GO:0090400)	1/8	0.0071785287204102	0.0437807696134497	0	0	167.85714285714286	828.6537822644398	TP53
GO_Biological_Process_2021	ER overload response (GO:0006983)	1/8	0.0071785287204102	0.0437807696134497	0	0	167.85714285714286	828.6537822644398	TP53
GO_Biological_Process_2021	positive regulation of execution phase of apoptosis (GO:1900119)	1/8	0.0071785287204102	0.0437807696134497	0	0	167.85714285714286	828.6537822644398	TP53
KEGG_2021_Human	Spinocerebellar ataxia	2/143	0.0072055923360829	0.0437878303500425	0	0	17.5895390070922	86.76739899404662	GRIN2A;CIC
GO_Biological_Process_2021	positive regulation of transcription by RNA polymerase II (GO:0045944)	4/908	0.0077544789536537	0.0437807696134497	0	0	6.029709228824273	29.30127958042036	ATRX;GLI1;TP53;SMARCA4
GO_Biological_Process_2021	negative regulation of nucleic acid-templated transcription (GO:1903507)	3/464	0.0078109941401172	0.0437807696134497	0	0	8.468980477223427	41.09338213391232	CIC;TP53;SMARCA4
GO_Biological_Process_2021	brain development (GO:0007420)	2/150	0.0079014745656277	0.0437807696134497	0	0	16.75168918918919	81.09000040913159	GRIN2A;CIC
GO_Biological_Process_2021	regulation of nuclear cell cycle DNA replication (GO:0033262)	1/9	0.0080724193100501	0.0437807696134497	0	0	146.86764705882354	707.7995527019895	ATRX
GO_Biological_Process_2021	anoikis (GO:0043276)	1/9	0.0080724193100501	0.0437807696134497	0	0	146.86764705882354	707.7995527019895	STK11
Reactome_2022	PI3K/AKT Activation R-HSA-198203	1/9	0.0080724193100501	0.0698264270319338	0	0	146.86764705882354	707.7995527019895	NTRK1
Reactome_2022	PI5P Regulates TP53 Acetylation R-HSA-6811555	1/9	0.0080724193100501	0.0698264270319338	0	0	146.86764705882354	707.7995527019895	TP53
Reactome_2022	Activation Of PUMA And Translocation To Mitochondria R-HSA-139915	1/9	0.0080724193100501	0.0698264270319338	0	0	146.86764705882354	707.7995527019895	TP53
GO_Biological_Process_2021	response to type I interferon (GO:0034340)	1/9	0.0080724193100501	0.0437807696134497	0	0	146.86764705882354	707.7995527019895	SETD2
GO_Biological_Process_2021	regulation of helicase activity (GO:0051095)	1/9	0.0080724193100501	0.0437807696134497	0	0	146.86764705882354	707.7995527019895	TP53
GO_Biological_Process_2021	regulation of signal transduction by p53 class mediator (GO:1901796)	2/156	0.008521247395824	0.0437807696134497	0	0	16.094155844155843	76.69175138060437	STK11;TP53
Reactome_2022	Regulation Of TP53 Activity R-HSA-5633007	2/157	0.0086266172594203	0.0704787208811961	0	0	15.98951612903226	75.99661638491506	STK11;TP53
GO_Biological_Process_2021	protein autophosphorylation (GO:0046777)	2/159	0.0088391257936757	0.0437807696134497	0	0	15.784235668789808	74.63682062852904	NTRK1;STK11
GO_Biological_Process_2021	DNA damage response, signal transduction by p53 class mediator resulting in transcription of p21 class mediator (GO:0006978)	1/10	0.0089655500933473	0.0437807696134497	0	0	130.54248366013073	615.425022203049	TP53
GO_Biological_Process_2021	nerve growth factor signaling pathway (GO:0038180)	1/10	0.0089655500933473	0.0437807696134497	0	0	130.54248366013073	615.425022203049	NTRK1
GO_Biological_Process_2021	negative regulation of telomerase activity (GO:0051974)	1/10	0.0089655500933473	0.0437807696134497	0	0	130.54248366013073	615.425022203049	TP53
GO_Biological_Process_2021	regulation of RNA polymerase II transcription preinitiation complex assembly (GO:0045898)	1/10	0.0089655500933473	0.0437807696134497	0	0	130.54248366013073	615.425022203049	TP53
GO_Biological_Process_2021	hematopoietic stem cell differentiation (GO:0060218)	1/10	0.0089655500933473	0.0437807696134497	0	0	130.54248366013073	615.425022203049	TP53
GO_Biological_Process_2021	cellular response to hydroxyurea (GO:0072711)	1/10	0.0089655500933473	0.0437807696134497	0	0	130.54248366013073	615.425022203049	ATRX
GO_Biological_Process_2021	positive regulation of T cell apoptotic process (GO:0070234)	1/10	0.0089655500933473	0.0437807696134497	0	0	130.54248366013073	615.425022203049	TP53
GO_Biological_Process_2021	presynaptic membrane assembly (GO:0097105)	1/10	0.0089655500933473	0.0437807696134497	0	0	130.54248366013073	615.425022203049	PTPRD
GO_Biological_Process_2021	positive regulation of transcription of nucleolar large rRNA by RNA polymerase I (GO:1901838)	1/10	0.0089655500933473	0.0437807696134497	0	0	130.54248366013073	615.425022203049	SMARCA4
GO_Biological_Process_2021	negative regulation of canonical Wnt signaling pathway (GO:0090090)	2/165	0.0094907282853204	0.0437807696134497	0	0	15.19861963190184	70.78665790754837	STK11;GLI1
GO_Biological_Process_2021	regulation of MAPK cascade (GO:0043408)	2/166	0.0096013708775176	0.0437807696134497	0	0	15.105182926829269	70.1764049009769	NTRK1;RET
GO_Biological_Process_2021	DNA damage response, signal transduction resulting in transcription (GO:0042772)	1/11	0.0098579216348164	0.0437807696134497	0	0	117.48235294117649	542.7073703814344	TP53
GO_Biological_Process_2021	positive regulation of DNA-dependent DNA replication (GO:2000105)	1/11	0.0098579216348164	0.0437807696134497	0	0	117.48235294117649	542.7073703814344	ATRX
GO_Biological_Process_2021	positive regulation of histone exchange (GO:1900051)	1/11	0.0098579216348164	0.0437807696134497	0	0	117.48235294117649	542.7073703814344	ATRX
GO_Biological_Process_2021	positive regulation of transcription from RNA polymerase II promoter in response to endoplasmic reticulum stress (GO:1990440)	1/11	0.0098579216348164	0.0437807696134497	0	0	117.48235294117649	542.7073703814344	TP53
GO_Biological_Process_2021	chromatin-mediated maintenance of transcription (GO:0048096)	1/11	0.0098579216348164	0.0437807696134497	0	0	117.48235294117649	542.7073703814344	ARID1A
GO_Biological_Process_2021	positive regulation of production of miRNAs involved in gene silencing by miRNA (GO:1903800)	1/11	0.0098579216348164	0.0437807696134497	0	0	117.48235294117649	542.7073703814344	TP53
GO_Biological_Process_2021	regulation of histone exchange (GO:1900049)	1/11	0.0098579216348164	0.0437807696134497	0	0	117.48235294117649	542.7073703814344	ATRX
GO_Biological_Process_2021	negative regulation of receptor signaling pathway via STAT (GO:1904893)	1/11	0.0098579216348164	0.0437807696134497	0	0	117.48235294117649	542.7073703814344	PTPRT
GO_Biological_Process_2021	response to hydroxyurea (GO:0072710)	1/11	0.0098579216348164	0.0437807696134497	0	0	117.48235294117649	542.7073703814344	ATRX
GO_Biological_Process_2021	peptidyl-lysine monomethylation (GO:0018026)	1/11	0.0098579216348164	0.0437807696134497	0	0	117.48235294117649	542.7073703814344	SETD2
GO_Biological_Process_2021	presynaptic membrane organization (GO:0097090)	1/11	0.0098579216348164	0.0437807696134497	0	0	117.48235294117649	542.7073703814344	PTPRD
GO_Biological_Process_2021	cell-cell adhesion via plasma-membrane adhesion molecules (GO:0098742)	2/170	0.0100497388152389	0.0441993367310995	0	0	14.742559523809524	67.81884959907823	PTPRT;PTPRD
GO_Biological_Process_2021	replicative senescence (GO:0090399)	1/12	0.0107495345067081	0.0442685375594436	0	0	106.79679144385028	484.0984098875249	TP53
GO_Biological_Process_2021	regulation of histone H3-K9 methylation (GO:0051570)	1/12	0.0107495345067081	0.0442685375594436	0	0	106.79679144385028	484.0984098875249	ATRX
GO_Biological_Process_2021	regulation of RNA export from nucleus (GO:0046831)	1/12	0.0107495345067081	0.0442685375594436	0	0	106.79679144385028	484.0984098875249	SETD2
GO_Biological_Process_2021	mitotic G1/S transition checkpoint signaling (GO:0044819)	1/12	0.0107495345067081	0.0442685375594436	0	0	106.79679144385028	484.0984098875249	TP53
GO_Biological_Process_2021	chromatin assembly or disassembly (GO:0006333)	1/12	0.0107495345067081	0.0442685375594436	0	0	106.79679144385028	484.0984098875249	TP53
GO_Biological_Process_2021	axonal fasciculation (GO:0007413)	1/12	0.0107495345067081	0.0442685375594436	0	0	106.79679144385028	484.0984098875249	EPHA3
Reactome_2022	TP53 Regulates Transcription Of Death Receptors And Ligands R-HSA-6803211	1/12	0.0107495345067081	0.0704787208811961	0	0	106.79679144385028	484.0984098875249	TP53
Reactome_2022	Frs2-mediated Activation R-HSA-170968	1/12	0.0107495345067081	0.0704787208811961	0	0	106.79679144385028	484.0984098875249	NTRK1
Reactome_2022	TP53 Regulates Transcription Of Caspase Activators And Caspases R-HSA-6803207	1/12	0.0107495345067081	0.0704787208811961	0	0	106.79679144385028	484.0984098875249	TP53
GO_Biological_Process_2021	mRNA transcription (GO:0009299)	1/12	0.0107495345067081	0.0442685375594436	0	0	106.79679144385028	484.0984098875249	TP53
GO_Biological_Process_2021	cytoplasmic sequestering of protein (GO:0051220)	1/13	0.011640389286531	0.0446998646177896	0	0	97.8921568627451	435.94063546940737	KEAP1
GO_Biological_Process_2021	regulation of receptor signaling pathway via STAT (GO:1904892)	1/13	0.011640389286531	0.0446998646177896	0	0	97.8921568627451	435.94063546940737	PTPRT
