Sample_Id	SV_Status	Site1_Hugo_Symbol	Site2_Hugo_Symbol	Site1_Chromosome	Site2_Chromosome	Site1_Position	Site2_Position	Site1_Description	Site2_Description	Site2_Effect_On_Frame	NCBI_Build	Class	Tumor_Split_Read_Count	Tumor_Paired_End_Read_Count	Event_Info	Breakpoint_Type	Connection_Type	Annotation	DNA_Support	RNA_Support	SV_Length	Normal_Read_Count	Tumor_Read_Count	Normal_Variant_Count	Tumor_Variant_Count	Comments
P-0045724-T01-IM6	SOMATIC	SPTBN1	ALK								GRCh37				SPTBN1-ALK Fusion - Archer			POSITIVE FOR GENE FUSIONS IN THE CLINICALLY VALIDATED PANEL: SPTBN1-ALK fusion. Note: The rearrangement is an in-frame fusion between genes SPTBN1 Exon7 (NM_003128) and ALK Exon20 (NM_004304).	yes	unknown						Lab Notes Run Number: Archerv3-CLIN-20190159 Macro-dissection: Performed
P-0089265-T01-IM7	SOMATIC	STAT3		17	17	40485905.0	40595683.0	Intron of STAT3(-):3bp after exon 9	IGR: 15Kb before ATP6V0A1(+)		GRCh37	DELETION			STAT3-intragenic	PRECISE	3to5	STAT3 (NM_139276) rearrangement: c.956+4:STAT3_chr17:g.40595683del			109778.0	11680.0	21436.0	0.0	13.0	Note: The STAT3 rearrangement is a deletion of exons 1 - 9. Functional significance is undetermined.
P-0035516-T01-IM6	SOMATIC	STK11	STK11	19	19	1220576.0	1222933.0	Intron of STK11(+):3bp before exon 5	Intron of STK11(+):50bp before exon 8		GRCh37	INVERSION	10.0	15.0	Antisense Fusion	PRECISE	3to3	STK11 (NM_000455) rearrangement: c.598-4_c.921-51inv	yes	unknown	2357.0	4634.0	6867.0	0.0	15.0	Note: The ATK11 rearrangement is an intragenic inversion of exons 5-7. Its functional significance is undetermined.
P-0033066-T01-IM6	SOMATIC	STRN	ALK	2	2	29448365.0	37133845.0	Exon 19 of ALK(-)	Intron of STRN(-):1Kb before exon 4		GRCh37	DELETION	10.0	71.0	Protein Fusion: mid-exon  {STRN:ALK}	PRECISE	3to5	STRN (NM_003162) - ALK (NM_004304) fusion( STRN exons 1-3 fused to ALK exons 19-29): c.413-1084:STRN_c.3134:ALKdel	yes	unknown	7685480.0	48833.0	45642.0	0.0	83.0	Note: The STRN - ALK fusion includes the kinase domain of ALK. One of the breakpoints is within ALK exon 19.
P-0033066-T01-IM6	SOMATIC	STRN	ALK								GRCh37				STRN-ALK Fusion - Archer			POSITIVE FOR THE FOLLOWING GENE FUSION IN THE CLINICALLY VALIDATED PANEL: STRN-ALK fusion. Note: The rearrangement is an in-frame fusion between genes STRN Exon3 (NM_003162) and ALK Exon20 (NM_004304).	yes	unknown						Lab Notes Run Number: ArcherV2-CLIN-20180129 Macro-dissection: Performed
P-0033924-T01-IM6	SOMATIC	SUZ12		17	17	30264646.0	34136244.0	Intron of SUZ12(+):107bp after exon 1	Promoter of TAF15(+):214bp from tx start		GRCh37	INVERSION			Antisense Fusion	PRECISE	3to3	SUZ12 (NM_015355) rearrangement: c.274+107_chr17:g.34136244inv			3871598.0	41717.0	77270.0	0.0	35.0	Note: The SUZ12 rearrangement is an inversion that includes exons 1-16. The functional significance is undetermined.
P-0020845-T02-IM6	SOMATIC	TCEB1		18	8	4459373.0	74859058.0	IGR: 195Kb before DLGAP1-AS5(+)	Intron of TCEB1(-):3bp before exon 4		GRCh37	TRANSLOCATION			TCEB1-intragenic	PRECISE	3to3	TCEB1 (NM_005648) rearrangement: t(8;18)(q21.11;p11.31)(chr8:g.74859058::chr18:g.4459373)			0.0	0.0	0.0	0.0	49.0	Note: The TCEB1 rearrangement is a translocation with a breakpoint in intron 3. The functional significance is undetermined.
P-0032702-T01-IM6	SOMATIC	TEK		X	9	140560188.0	27217610.0	IGR: 31Kb before SPANXA2-OT1(+)	Intron of TEK(+):75bp before exon 19		GRCh37	TRANSLOCATION			TEK-intragenic	PRECISE	3to5	TEK (NM_000459) rearrangement: t(9;X)(p21.2;q27.2)(chr9:g.27217610::chrX:g.140560188)			0.0	0.0	0.0	0.0	14.0	Note: The TEK rearrangement is a translocation with a breakpoint in intron 18. The functional significance is undetermined.
P-0076922-T01-IM7	SOMATIC	TET1	TET1	10	10	70332740.0	70344327.0	Exon 2 of TET1(+)	Intron of TET1(+):10Kb after exon 2		GRCh37	DUPLICATION	3.0	2.0	Duplication within transcript : mid-exon	PRECISE	5to3	TET1 (NM_030625) rearrangement: c.645_c.1914+10318dup	yes	unknown	11587.0	4495.0	9819.0	0.0	2.0	Note: The TET1 rearrangement is an intragenic duplication of exon 2. One of the breakpoints is within exon 2. Functional significance is undetermined.
P-0002778-T01-IM3	SOMATIC	TET2	PAPSS1	4	4	106156573.0	108499812.0	Exon 3 of TET2(+)	IGR: 35Kb before PAPSS1(-)		GRCh37	DUPLICATION	30.0	13.0	PAPSS1-TET2 fusion	PRECISE	5to3		yes	unknown	2343239.0	45890.0	46395.0	0.0	15.0	Note: The TET2 duplication is a rearrangement event, which includes duplication of part of exon 3 and exons 4-11 of TET2. Its functional significance is undetermined.
P-0002778-T01-IM3	SOMATIC	TET2	SEC24B	4	4	106156519.0	110351841.0	Exon 3 of TET2(+)	IGR: 3Kb before SEC24B(+)		GRCh37	DELETION	61.0	28.0	SEC24B-TET2 fusion	PRECISE	3to5		yes	unknown	4195322.0	48312.0	50902.0	0.0	32.0	Note: The TET2 deletion is a rearrangement event, which results in partial deletion of exon 3 and exons 4-11 of TET2. Its functional significance is undetermined
P-0043868-T01-IM6	SOMATIC	TET2	TET2	4	4	105889922.0	106197249.0	IGR: 177Kb before TET2(+)	Exon 11 of TET2(+)		GRCh37	DELETION	6.0	5.0	TET2-intragenic	PRECISE	3to5	TET2 (NM_001127208) rearrangement: c.5582:TET2_chr4:g.105889922del	yes	unknown	307327.0	23947.0	22563.0	0.0	5.0	Note: The TET2 rearrangement is a deletion of exons 1 - 11. One of the breakpoints is within exon 11.Functional significance is undetermined.
P-0035647-T01-IM6	SOMATIC	TFG	GPR128								GRCh37				TFG-GPR128 Fusion - Archer			POSITIVE FOR GENE FUSIONS IN THE INVESTIGATIONAL PANEL: TFG-GPR128 fusion. Note: The rearrangement is an in-frame fusion between genes TFG Exon3 (NM_006070) and GPR128 Exon2 (NM_032787). PMID: 19797732	yes	unknown						Lab Notes Run Number: ArcherV3-CLIN-20180176 Macro-dissection: Unknown
P-0039739-T01-IM6	SOMATIC	TFG	GPR128								GRCh37				TFG-GPR128 Fusion - Archer			POSITIVE FOR GENE FUSIONS IN THE INVESTIGATIONAL PANEL: TFG-GPR128 fusion.  Note: The rearrangement is an in-frame fusion between genes TFG Exon3 (NM_006070) and GPR128 Exon2 (NM_032787). PMID: 19797732  Note1: This is a known structural germline polymorphism seen in healthy individuals.	yes	unknown						Lab Notes Run Number: Archerv3-CLIN-20190055 Macro-dissection: Unknown
P-0059492-T01-IM7	SOMATIC	TGFBR1	TGFBR1	9	9	101135054.0	101867650.0	Intron of GABBR2(-):1Kb before exon 12	Intron of TGFBR1(+):66bp after exon 1		GRCh37	DELETION	10.0	61.0	TGFBR1-intragenic	PRECISE	3to5	TGFBR1 (NM_004612) rearrangement: c.97+66:TGFBR1_chr9:g.101135054del	yes	unknown	732596.0	4132.0	2181.0	0.0	63.0	Note: The TGFBR1 rearrangement is a deletion of exon 1. The rearrangement does not include the kinase domain of TGFBR1.
P-0044856-T01-IM6	SOMATIC	TGFBR2	GADL1	3	3	30713383.0	30808859.0	Exon 5 of TGFBR2(+)	Intron of GADL1(-):11Kb after exon 14		GRCh37	DELETION	7.0	8.0	Antisense Fusion	PRECISE	3to5	TGFBR2 (NM_001024847) rearrangement: c.783:TGFBR2_chr3:g.30808859del	yes	unknown	95476.0	4708.0	7977.0	0.0	8.0	Note: The TGFBR2 rearrangement is a deletion of exons 5 - 8. One of the breakpoints is within exon 5. The rearrangement includes the kinase domain of TGFBR2.
P-0019377-T01-IM6	SOMATIC	TIAM1	NOTCH2	21	1	32851230.0	120510065.0	5-UTR of TIAM1(-):359Kb before coding start	Exon 8 of NOTCH2(-)		GRCh37	TRANSLOCATION	10.0	9.0	Protein Fusion: mid-exon  {NOTCH2:TIAM1}	PRECISE	3to5	NOTCH2 (NM_024408) rearrangement: t(1;21)(p21;q22.11)(chr1:g.120510065::chr21:g.32851230)	yes	unknown	0.0	0.0	0.0	0.0	9.0	Note: The NOTCH2 rearrangement is a translocation that may result in a truncation of exons 8-34. One of the breakpoints is within exon 8. The functional significance is undetermined.
P-0023526-T01-IM6	SOMATIC	TMIE	SETD2	3	3	46747620.0	47165971.0	Intron of TMIE(+):223bp after exon 2	Exon 3 of SETD2(-)		GRCh37	INVERSION	10.0	36.0	Protein Fusion: mid-exon  {SETD2:TMIE}	PRECISE	5to5	SETD2 (NM_014159) - TMIE (NM_147196) rearrangement: c.155:SETD2_c.211+223:TMIEinv	yes	unknown	418351.0	62532.0	43552.0	0.0	38.0	Note: The SETD2 rearrangement is an inversion that results in the fusion of SETD2 exons 1-3 with TMIE exons 3-4. One of the breakpoints is within SETD2 exon 3. The functional significance is undetermined.
P-0056854-T01-IM6	SOMATIC	TOP1		20	20	38343636.0	39744025.0	IGR: 289Kb before LINC01370(+)	Exon 16 of TOP1(+)		GRCh37	DELETION			TOP1-intragenic	IMPPRECISE	3to5	TOP1 (NM_003286) rearrangement: c.1653:TOP1_chr20:g.38343636del			1400389.0	17143.0	17040.0	0.0	6.0	Note: The TOP1 rearrangement is a deletion of exons 1 - 16. One of the breakpoints is within exon 16.
P-0002855-T01-IM3	SOMATIC	TOP1MT	RECQL4	8	8	144394753.0	145742055.0	Intron of TOP1MT(-): 2Kb before exon 13	Exon 5 of RECQL4(-)		GRCh37	DELETION	22.0	17.0	Protein fusion: mid-exon (RECQL4-TOP1MT)	PRECISE	3to5		yes	unknown	1347302.0	33564.0	30408.0	0.0	19.0	Note: The RECQL4-TOP1MT deletion is a rearrangement event which results in the fusion between RECQL4 (NM_004260) exons 1-4 and TOP1MT (NM_052963) exons 13-14.
P-0050516-T01-IM6	SOMATIC	TP53	TP53	17	17	7576928.0	7579727.0	Intron of TP53(-):2bp before exon 9	Intron of TP53(-):6bp before exon 3		GRCh37	DELETION	10.0	88.0	Deletion of 6 exons : out of frame	PRECISE	3to5	TP53 (NM_000546) rearrangement: c.75-6_c.920-2del	yes	unknown	2799.0	9391.0	10871.0	0.0	95.0	Note: The TP53 rearrangement is an intragenic deletion of exons 3 - 8.
P-0048828-T01-IM6	SOMATIC	TP53		17	17	7578616.0	7581327.0	Intron of TP53(-):62bp before exon 5	5-UTR of TP53(-):8Kb before coding start		GRCh37	DELETION			Deletion within transcript	PRECISE	3to5	TP53 (NM_000546) rearrangement: c.376-62:TP53_chr17:g.7581327del			2711.0	5632.0	5725.0	0.0	64.0	Note: The TP53 rearrangement is a deletion of exons 1 - 4.
P-0075517-T01-IM7	SOMATIC	TP53	TP53	17	17	7578511.0	7580923.0	Exon 5 of TP53(-)	5-UTR of TP53(-):8Kb before coding start		GRCh37	DUPLICATION	10.0	77.0	Duplication within transcript : mid-exon	PRECISE	5to3	TP53 (NM_000546) rearrangement: c.419:TP53_chr17:g.7580923dup	yes	unknown	2412.0	7861.0	13013.0	0.0	81.0	Note: The TP53 rearrangement is a duplication of exons 1 - 5. One of the breakpoints is within exon 5. Functional significance is undetermined.
P-0045906-T01-IM6	SOMATIC	TP53	LOC340107	17	5	7578066.0	25413095.0	Intron of TP53(-):110bp after exon 6	IGR: 578Kb before LOC340107(-)		GRCh37	TRANSLOCATION	0.0	9.0	TP53-intragenic	IMPPRECISE	5to5	TP53 (NM_000546) rearrangement: t(5;17)(p14.1;p13.1)(chr5:g.25413095::chr17:g.7578066)	yes	unknown	0.0	0.0	0.0	0.0	9.0	Note: The TP53 rearrangement is a translocation with a breakpoint in intron 6. Functional significance is undetermined.
P-0050143-T01-IM6	SOMATIC	TP53	NDEL1	17	17	7574037.0	8374380.0	Intron of TP53(-):4bp before exon 10	Promoter of NDEL1(+):35Kb from tx start		GRCh37	DELETION	10.0	32.0	TP53-intragenic	PRECISE	3to5	TP53 (NM_000546) rearrangement: c.994-4:TP53_chr17:g.8374380del	yes	unknown	800343.0	54800.0	70221.0	0.0	34.0	Note: The TP53 rearrangement is a deletion of exons 1 - 9.
P-0070375-T01-IM7	SOMATIC	TP53	NPEPPS	17	17	7587950.0	45678738.0	5-UTR of TP53(-):15Kb before coding start	Intron of NPEPPS(+):235bp before exon 15		GRCh37	INVERSION	10.0	53.0	Transcript Fusion {TP53:NPEPPS}	PRECISE	5to5	TP53 (NM_000546) rearrangement: c.-29+2745_chr17:g.45678738inv	yes	unknown	38090788.0	898983.0	854820.0	0.0	63.0	Note: The TP53 rearrangement is an inversion that involves the 5'-UTR of TP53. The breakpoint in TP53 is before the transcription start site. Functional significance is undetermined.
P-0056854-T01-IM6	SOMATIC	TSC2		16	16	2113152.0	2116756.0	Intron of TSC2(+):98bp after exon 14	Intron of TSC2(+):1Kb after exon 16		GRCh37	DELETION			Deletion of 2 exons : in frame	IMPPRECISE	3to5	TSC2 (NM_000548) rearrangement: c.1443+98_c.1716+1120del			3604.0	7257.0	3341.0	0.0	7.0	Note: The TSC2 rearrangement is an intragenic deletion of exons 15 - 16.
P-0004967-T01-IM5	SOMATIC	TSC2	TSC2	16	16	2125903.0	2127674.0	Intron of TSC2(+): 10bp after exon 23	Exon 26 of TSC2(+)		GRCh37	DELETION	143.0	102.0	Deletion within transcript: mid-exon	PRECISE	3to5	TSC2 (NM_000548) rearrangement : c.2639+10_2913del	yes	unknown	1771.0	6443.0	4119.0	0.0	154.0	Note: The TSC2 (NM_000548) rearrangement event results in the intragenic deletion of exons TSC2 exons 24-26. One of the breakpoints is within TSC2 exon26.
P-0004454-T01-IM5	SOMATIC	TSC2	TSC2	16	16	2088970.0	2127535.0	3-UTR of SLC9A3R2(+): 985bp after coding stop	Intron of TSC2(+): 64bp before exon 26		GRCh37	DELETION	8.0	8.0	TSC2-intragenic	PRECISE	3to5	TSC2 (NM_000548) rearrangement : chr16:g.2088970_c.2838-64:TSC2del	yes	unknown	38565.0	30643.0	26528.0	0.0	8.0	Note: The TSC2 (NM_000548) rearrangement event results in the deletion of TSC2 exons 1-25.
P-0028754-T01-IM6	SOMATIC	U2AF1	FGF12	21	3	44513280.0	192445271.0	Exon 8 of U2AF1(-)	5-UTR of FGF12(-):583Kb before coding start		GRCh37	TRANSLOCATION	10.0	37.0	Protein Fusion: mid-exon  {FGF12:U2AF1}	PRECISE	3to5	U2AF1 (NM_006758) rearrangement: t(3;21)(q28-29;q22.3)(chr3:g.192445271::chr21:g.44513280)	yes	unknown	0.0	0.0	0.0	0.0	64.0	Note: The U2AF1 rearrangement is a translocation involving a breakpoint in exon 8. Its functional significance is undetermined
P-0015376-T01-IM6	SOMATIC	WHSC1L1		13	8	30470955.0	38175374.0	IGR: 46Kb after UBL3(-)	Intron of WHSC1L1(-): 1Kb after exon 9		GRCh37	TRANSLOCATION			WHSC1L1-intragenic	PRECISE	3to5	WHSC1L1 (NM_023034) rearrangement: t(8;13)(p11.23;q12.3)(chr8:g.38175374::chr13:g.30470955)			0.0	0.0	0.0	0.0	5.0	Note: The WHSC1L1 rearrangement is a translocation that may result in a truncation of exons 10-24. The functional significance is undetermined.
P-0025468-T01-IM6	SOMATIC	WHSC1L1		8	8	37073664.0	38194986.0	IGR: 190Kb before LOC100507420(-)	Intron of WHSC1L1(-):1bp before exon 4		GRCh37	INVERSION			WHSC1L1-intragenic	PRECISE	3to3	WHSC1L1 (NM_023034) rearrangement: chr8:g.37073664_c.748-1:WHSC1L1inv			1121322.0	39063.0	66849.0	0.0	43.0	Note: The WHSC1L1 rearrangement is an inversion with a breakpoint is intron 3. The functional significance is undetermined.
P-0033812-T01-IM6	SOMATIC	ZFHX3		16	16	72829624.0	73684489.0	Exon 9 of ZFHX3(-)	IGR: 264Kb before LINC01568(+)		GRCh37	DELETION			ZFHX3-intragenic	PRECISE	3to5	ZFHX3 (NM_006885) Rearrangement : c.6957:ZFHX3_chr16:g.73684489del			854865.0	42493.0	46327.0	1.0	21.0	Note: The ZFHX3 Rearrangement results in the deletion of exons 1-9 of ZFHX3. One of the breakpoints is within exon9. Its functional significance is undetermined.
