Sample_Id	SV_Status	Site1_Hugo_Symbol	Site2_Hugo_Symbol	Site1_Chromosome	Site2_Chromosome	Site1_Position	Site2_Position	Site1_Description	Site2_Description	Site2_Effect_On_Frame	NCBI_Build	Class	Tumor_Split_Read_Count	Tumor_Paired_End_Read_Count	Event_Info	Breakpoint_Type	Connection_Type	Annotation	DNA_Support	RNA_Support	SV_Length	Normal_Read_Count	Tumor_Read_Count	Normal_Variant_Count	Tumor_Variant_Count	Comments
P-0057984-T01-IM6	SOMATIC	ADCY8	NBN	8	8	90982718.0	132036985.0	Exon 7 of NBN(-)	Intron of ADCY8(-):15Kb after exon 1		GRCh37	DELETION	10.0	22.0	Protein Fusion: mid-exon  {ADCY8:NBN}	PRECISE	3to5	ADCY8 (NM_001115) - NBN (NM_002485) rearrangement: c.960+14635:ADCY8_c.770:NBNdel	yes	unknown	41054267.0	56168.0	79543.0	0.0	23.0	Note: The ADCY8 - NBN rearrangement is a deletion that results in a fusion of ADCY8 exon 1 to NBN exons 7 - 16. One of the breakpoints is within NBN exon 7.
P-0039746-T01-IM6	SOMATIC	AKT1	LOC387810	14	11	105246411.0	112596469.0	Intron of AKT1(-):13bp after exon 3	IGR: 192Kb before LOC387810(-)		GRCh37	TRANSLOCATION	10.0	32.0	AKT1-intragenic	PRECISE	5to5	AKT1 (NM_001014431) rearrangement: t(11;14)(q23.2;q32.33)(chr11:g.112596469::chr14:g.105246411)	yes	unknown	0.0	0.0	0.0	0.0	34.0	Note: The AKT1 rearrangement is a translocation with a breakpoint in intron 3. Functional significance is undetermined.
P-0064737-T01-IM7	SOMATIC	AKT2	AKT2	19	19	35689951.0	40745832.0	IGR: 26Kb before FAM187B(-)	Intron of AKT2(-):119bp after exon 7		GRCh37	INVERSION	10.0	47.0	AKT2-intragenic	PRECISE	5to5	AKT2 (NM_001626) rearrangement: c.639+120:AKT2_chr19:g.35689951inv	yes	unknown	5055881.0	114505.0	148209.0	0.0	52.0	Note: The AKT2 rearrangement is an inversion of exons 8 - 14. The rearrangement includes a part of the kinase domain of AKT2. Functional significance is undetermined.
P-0052628-T01-IM6	SOMATIC	AMER1	AMER1	X	X	63405633.0	63412087.0	3-UTR of AMER1(-):4Kb after coding stop	Exon 2 of AMER1(-)		GRCh37	DELETION	10.0	79.0	AMER1-intragenic	PRECISE	3to5	AMER1 (NM_152424) rearrangement: c.1080:AMER1_chrX:g.63405633del	yes	unknown	6454.0	17939.0	20763.0	0.0	81.0	Note: The AMER1 rearrangement is a deletion of exon 2. One of the breakpoints is within exon 2.
P-0014026-T01-IM5	SOMATIC	APC	REEP5	5	5	112175655.0	112230071.0	Exon 16 of APC(+)	Intron of REEP5(-): 7Kb before exon 4		GRCh37	DELETION	103.0	86.0	Antisense fusion	PRECISE	3to5	APC(NM_000038) - REEP5(NM_005669)  rearrangement: c.4364:APC_c.352-7191:REEP5del	yes	unknown	54416.0	47108.0	27367.0	0.0	84.0	Note: The APC (NM_000038)_REEP5 (NM_005669) rearrangement results in the deletion of APC exon 16. One of the breakpoints is within APC exon 16.  The functional significance is undetermined.
P-0018329-T01-IM6	SOMATIC	APC	APC	5	5	112174872.0	112175749.0	Exon 16 of APC(+)	Exon 16 of APC(+)		GRCh37	INVERSION	10.0	7.0	APC-intragenic	PRECISE	5to5	APC (NM_000038) rearrangement: c.3581_c.4458inv	yes	unknown	877.0	3464.0	2568.0	0.0	7.0	Note: The APC rearrangement is an inversion (877 bp) with both breakpoints within exon 16. The functional significance is undetermined.
P-0045661-T01-IM6	SOMATIC	APC	APC	5	5	77595801.0	112154997.0	IGR: 59Kb before SCAMP1-AS1(-)	Exon 10 of APC(+)		GRCh37	INVERSION	10.0	55.0	APC-intragenic	PRECISE	3to3	APC (NM_000038) rearrangement: c.1268:APC_chr5:g.77595801inv	yes	unknown	34559196.0	57215.0	74210.0	0.0	59.0	Note: The APC rearrangement is an inversion of exons 1 - 10. One of the breakpoints is within exon 10. Functional significance is undetermined.
P-0040853-T01-IM6	SOMATIC	APC	RBM22	5	5	112157631.0	150062097.0	Exon 11 of APC(+)	IGR: 8Kb before RBM22(-)		GRCh37	DELETION	0.0	7.0	APC-intragenic	IMPPRECISE	3to5	APC (NM_000038) rearrangement: c.1351:APC_chr5:g.150062097del	yes	unknown	37904466.0	203972.0	213878.0	0.0	7.0	Note: The APC rearrangement is a deletion of exons 11 - 16. One of the breakpoints is within exon 11.
P-0013828-T01-IM5	SOMATIC	APC		5	5	95664163.0	112102926.0	IGR: 62Kb before PCSK1(-)	Exon 4 of APC(+)		GRCh37	DUPLICATION			APC-intragenic	PRECISE	5to3	APC (NM_000038) rearrangement: chr5:g.95664163_c.261:APCdup			16438763.0	11763.0	11366.0	0.0	31.0	Note: The APC rearrangement is a duplication of 5UTR and exons 1-4. The functional significance is undetermined.
P-0023588-T01-IM6	SOMATIC	APC		5	5	112176005.0	112187884.0	Exon 16 of APC(+)	IGR: 9Kb before SRP19(+)		GRCh37	DELETION			APC-intragenic	PRECISE	3to5	APC (NM_000038) Rearrangement : c.4714:APC_chr5:g.112187884del			11879.0	22138.0	16957.0	0.0	14.0	Note: The APC Rearrangement results in the intragenic deletion of exon16. Its functional significance is undetermined.
P-0033429-T01-IM6	SOMATIC	APC		14	5	59220602.0	112175465.0	IGR: 74Kb before LINC01500(+)	Exon 16 of APC(+)		GRCh37	TRANSLOCATION			APC-intragenic	PRECISE	5to5	APC (NM_000038) Rearrangement: t(5;14)(q22.2;q23.1)(chr5:g.112175465::chr14:g.59220602)			0.0	0.0	0.0	0.0	17.0	Note: The APC rearrangement is a translocation which involves exon 16 of APC. One of the breakpoints is within exon 16 of APC. The functional significance is undetermined.
P-0020245-T01-IM6	SOMATIC	APC	APC	5	5	112175312.0	112176877.0	Exon 16 of APC(+)	Exon 16 of APC(+)		GRCh37	DELETION	10.0	9.0	Deletion within transcript : mid-exon	PRECISE	3to5	APC (NM_000038) rearrangement: c.4021_c.5586del	yes	unknown	1565.0	7614.0	6394.0	0.0	10.0	Note: The APC rearrangement results in the intragenic deletion of exon 16. The breakpoints are within exon 16. Its functional significance is undetermined.
P-0037370-T01-IM6	SOMATIC	APC	APC	5	5	112175835.0	112177457.0	Exon 16 of APC(+)	Exon 16 of APC(+)		GRCh37	DELETION	10.0	15.0	Deletion within transcript : mid-exon	PRECISE	3to5	APC (NM_000038) rearrangement: c.4544_c.6166del	yes	unknown	1622.0	4217.0	4052.0	0.0	17.0	Note: The APC rearrangement is an intragenic deletion of exon 16. Both breakpoints are within exon 16.
P-0032702-T01-IM6	SOMATIC	APC		5	5	112173005.0	112174729.0	Intron of APC(+):244bp before exon 16	Exon 16 of APC(+)		GRCh37	DELETION			Deletion within transcript : mid-exon	PRECISE	3to5	APC (NM_000038) rearrangement: c.1959-245_c.3438del			1724.0	4686.0	4613.0	0.0	3.0	Note: The APC rearrangement results in the deletion of exon 16. One of the breakpoints is within exon 16.
P-0042166-T01-IM6	SOMATIC	APC		5	5	112154735.0	112157593.0	Exon 10 of APC(+)	Exon 11 of APC(+)		GRCh37	DUPLICATION			Duplication within transcript : mid-exon	PRECISE	5to3	APC (NM_000038) rearrangement: c.1006_c.1313dup			2858.0	2827.0	4582.0	0.0	56.0	Note: The APC rearrangement is an intragenic duplication of exons 10 - 11. The breakpoints are within exon 10 and exon 11. Functional significance is undetermined.
P-0035167-T01-IM6	SOMATIC	AR	CYSLTR1	X	X	66931545.0	77626841.0	Intron of AR(+):14bp after exon 4	IGR: 100Kb before CYSLTR1(-)		GRCh37	DELETION			AR-CYSLTR1 Fusion	PRECISE	3to5	AR (NM_000044) rearrangement: c.2173+14:AR_chrX:g.77626841del			10695296.0	118122.0	172979.0	0.0	27.0	Note: The AR rearrangement is a deletion of exons 5-8. The functional significance is undetermined.
P-0074811-T01-IM7	SOMATIC	ARAF	ARAF	X	X	47424784.0	47429077.0	Intron of ARAF(+):35bp after exon 6	Intron of ARAF(+):21bp after exon 13		GRCh37	DELETION	0.0	45.0	Deletion of 7 exons : out of frame	IMPPRECISE	3to5	ARAF (NM_001654) rearrangement: c.557+35_c.1419+21del	yes	unknown	4293.0	14776.0	17341.0	0.0	49.0	Note: The ARAF rearrangement is an intragenic deletion of exons 7 - 13. The rearrangement includes a part of the kinase domain of ARAF. Functional significance is undetermined.
P-0071268-T01-IM7	SOMATIC	ARID1A		1	1	27099628.0	27103052.0	Intron of ARID1A(+):150bp after exon 14	Intron of ARID1A(+):854bp after exon 19		GRCh37	DELETION			Deletion of 5 exons : out of frame	PRECISE	3to5	ARID1A (NM_006015) rearrangement: c.3715+150_c.5124+854del			3424.0	8364.0	10120.0	0.0	5.0	Note: The ARID1A rearrangement is an intragenic deletion of exons 15 - 19.
P-0016696-T01-IM6	SOMATIC	ARID1A	ARID1A	1	1	27027986.0	27100876.0	Intron of ARID1A(+):4Kb after exon 1	Exon 18 of ARID1A(+)		GRCh37	DELETION	10.0	6.0	Deletion within transcript : mid-exon	PRECISE	3to5	ARID1A (NM_006015) rearrangement: c.1137+3955_c.4158del	yes	unknown	72890.0	26003.0	48533.0	0.0	6.0	Note: The ARID1A rearrangement is an intragenic deletion of exons 2-18. One of the breakpoints is within exon18. The functional significance is undetermined.
P-0020588-T01-IM6	SOMATIC	ARID5B	ARID5B	10	10	63661191.0	63759813.0	5-UTR of ARID5B(+):277bp before coding start	Intron of ARID5B(+):36bp before exon 4		GRCh37	DELETION	10.0	14.0	Deletion within transcript	PRECISE	3to5	ARID5B (NM_032199) rearrangement: c.-278_c.503-37del	yes	unknown	98622.0	4480.0	3374.0	0.0	15.0	Note: The ARID5B rearrangement results in the deletion of the 5UTR and exons 1-3. The functional significance is undetermined.
P-0061902-T01-IM7	SOMATIC	ASXL1	TM9SF4	20	20	30749431.0	31024346.0	Intron of TM9SF4(+):263bp after exon 17	Exon 12 of ASXL1(+)		GRCh37	DUPLICATION	10.0	28.0	Protein Fusion: mid-exon  {ASXL1:TM9SF4}	PRECISE	5to3	ASXL1 (NM_015338) - TM9SF4 (NM_014742) rearrangement: c.3831:ASXL1_c.1779+263:TM9SF4dup	yes	unknown	274915.0	44936.0	43677.0	0.0	29.0	Note: The ASXL1 - TM9SF4 rearrangement is a duplication that results in a fusion of ASXL1 exons 1 - 12 to TM9SF4 exon 18. One of the breakpoints is within ASXL1 exon 12. Functional significance is undetermined.
P-0034192-T01-IM6	SOMATIC	AXIN2	AXIN2	17	17	63512989.0	63533505.0	IGR: 12Kb before AXIN2(-)	Exon 6 of AXIN2(-)		GRCh37	DUPLICATION	8.0	5.0	AXIN2-intragenic	PRECISE	5to3	AXIN2 (NM_004655) rearrangement: c.1649_chr17:g.63512989dup	yes	unknown	20516.0	11580.0	15651.0	0.0	5.0	Note: The AXIN2 rearrangement is a duplication that includes AXIN2 exons 6-11. One of the breakpoints is within exon 6.
P-0052848-T01-IM6	SOMATIC	AXIN2	CEP112	17	17	63532989.0	63586778.0	Exon 7 of AXIN2(-)	IGR: 45Kb before CEP112(-)		GRCh37	INVERSION	10.0	3.0	AXIN2-intragenic	PRECISE	5to5	AXIN2 (NM_004655) rearrangement: c.1905:AXIN2_chr17:g.63586778inv	yes	unknown	53789.0	19525.0	28854.0	0.0	6.0	Note: The AXIN2 rearrangement is an inversion of exons 1 - 7. One of the breakpoints is within exon 7. Functional significance is undetermined.
P-0019637-T01-IM6	SOMATIC	AXIN2	AXIN2	17	17	63554195.0	63555053.0	Exon 2 of AXIN2(-)	5-UTR of AXIN2(-):29Kb before coding start		GRCh37	DELETION	10.0	63.0	Deletion within transcript : mid-exon	PRECISE	3to5	AXIN2 (NM_004655) rearrangement: c.544_c.-116-199del	yes	unknown	858.0	5377.0	1400.0	0.0	66.0	Note: The AXIN2 rearrangement results in the deletion of exons 1-2. One of the breakpoints is within exon 2. The functional significance is undetermined.
P-0046793-T01-IM6	SOMATIC	AXIN2	AXIN2	17	17	63554036.0	63555989.0	Exon 2 of AXIN2(-)	5-UTR of AXIN2(-):30Kb before coding start		GRCh37	DELETION	10.0	37.0	Deletion within transcript : mid-exon	PRECISE	3to5	AXIN2 (NM_004655) rearrangement: c.703:AXIN2_chr17:g.63555989del	yes	unknown	1953.0	3149.0	3488.0	0.0	38.0	Note: The AXIN2 rearrangement is a deletion of exons 1 - 2. One of the breakpoints is within exon 2.
P-0060830-T01-IM7	SOMATIC	AXIN2		17	17	63527607.0	63534433.0	Intron of AXIN2(-):1Kb before exon 11	Exon 5 of AXIN2(-)		GRCh37	DELETION			Deletion within transcript : mid-exon	PRECISE	3to5	AXIN2 (NM_004655) rearrangement: c.1088_c.2406-1387del			6826.0	17203.0	22291.0	0.0	10.0	Note: The AXIN2 rearrangement is an intragenic deletion of exons 5 - 10. One of the breakpoints is within exon 5.
P-0053249-T01-IM6	SOMATIC	AXL		19	19	22709779.0	41743953.0	3-UTR of LOC101929124(-):972bp after coding stop	Exon 7 of AXL(+)		GRCh37	INVERSION			AXL-intragenic	PRECISE	5to5	AXL (NM_021913) rearrangement: c.888:AXL_chr19:g.22709779inv			19034174.0	181677.0	234930.0	0.0	67.0	Note: The AXL rearrangement is an inversion of exons 1 - 7. One of the breakpoints is within exon 7. The rearrangement does not include the kinase domain of AXL. Functional significance is undetermined.
P-0023057-T01-IM6	SOMATIC	B2M	B2M	15	15	45003811.0	45007621.0	Exon 1 of B2M(+)	Exon 2 of B2M(+)		GRCh37	DELETION	10.0	19.0	Deletion within transcript : mid-exon	PRECISE	3to5	B2M (NM_004048) rearrangement: c.67_c.68del	yes	unknown	3810.0	2223.0	2334.0	0.0	23.0	Note: The B2M rearrangement is an intragenic deletion with breakpoints at the splice sites of exons 1 and 2. Its functional significance is undetermined. Multiple rearrangements involving B2M were detected in this sample and a more complex rearrangement resulting in a B2M fusion is possible. Additional testing by an alternative method is recommended, if clinically indicated.
P-0020670-T01-IM6	SOMATIC	BCL10		1	1	65408657.0	85733407.0	5-UTR of JAK1(-):108Kb before coding start	Exon 3 of BCL10(-)		GRCh37	INVERSION			BCL10-intragenic	IMPPRECISE	3to3	BCL10 (NM_003921) rearrangement: g.65408657_c.605inv			20324750.0	43275.0	47788.0	0.0	11.0	Note: The BCL10 rearrangement is an inversion of exon 3. Its functional significance is undetermined.
P-0024865-T01-IM6	SOMATIC	BCL2L1	FSIP1	20	15	30263448.0	40027488.0	Intron of BCL2L1(-):10Kb before exon 3	Intron of FSIP1(-):3Kb after exon 8		GRCh37	TRANSLOCATION	10.0	8.0	Protein Fusion: in frame  {BCL2L1:FSIP1}	PRECISE	5to3	BCL2L1 (NM_138578) - FSIP1 (NM_152597) rearrangement: t(15;20)(q14;q11.21)(chr15:g.40027488::chr20:g.30263448)	yes	unknown	0.0	0.0	0.0	0.0	8.0	Note: The BCL2L1 (NM_138578) - FSIP1 (NM_152597) rearrangement is a translocation that results in the fusion of BCL2L1 exons 1-2 with FSIP1 exons 9-12. The functional significance is undetermined.
P-0069406-T01-IM7	SOMATIC	BIRC3	BIRC3	11	11	102196001.0	102197321.0	Exon 3 of BIRC3(+)	Intron of BIRC3(+):1Kb after exon 4		GRCh37	DUPLICATION	10.0	2.0	Duplication within transcript : mid-exon	PRECISE	5to3	BIRC3 (NM_182962) rearrangement: c.761_c.953+1025dup	yes	unknown	1320.0	1871.0	1636.0	0.0	2.0	Note: The BIRC3 rearrangement is an intragenic duplication of exons 3 - 4. One of the breakpoints is within exon 3. Functional significance is undetermined.
P-0018109-T01-IM6	SOMATIC	BLM	ANKLE2	15	12	91358467.0	133320386.0	Exon 22 of BLM(+)	Intron of ANKLE2(-):524bp before exon 6		GRCh37	TRANSLOCATION	0.0	29.0	Protein Fusion: mid-exon  {BLM:ANKLE2}	IMPPRECISE	3to3	BLM (NM_000057) - ANKLE2 (NM_015114) rearrangement: t(12;15)(q24.33;q26.1)(chr12:g.133320386::chr15:g.91358467)	yes	unknown	0.0	0.0	0.0	0.0	28.0	Note: The BLM - ANKLE2 rearrangement is a translocation that results in the fusion of BLM exons 1-22 with ANKLE2 exons 6-13. One of the breakpoints is within BLM exon 22. The functional significance is undetermined.
P-0002778-T01-IM3	SOMATIC	BMPR1B	TET2	4	4	96025687.0	106156370.0	Exon 4 of BMPR1B(+)	Exon 3 of TET2(+)		GRCh37	INVERSION	40.0	19.0	TET2-BMPR1B fusion	PRECISE	5to5		yes	unknown	10130683.0	23692.0	28487.0	0.0	9.0	Note: The TET2-BMPR1B inversion is a rearrangement event, which inverts part of exon 3 and exons 4-11 of TET2 with exons 4-13 of BMPR1B. Its functional significance is undetermined.
P-0015711-T01-IM6	SOMATIC	BRAF	CAPZA2	7	7	116511653.0	140495400.0	Intron of CAPZA2(+): 9Kb after exon 1	Intron of BRAF(-): 1Kb before exon 8		GRCh37	DUPLICATION			BRAF-CAPZA2 Fusion	PRECISE	5to3	BRAF (NM_004333) - CAPZA2 (NM_006136) rearrangement:  c.981-1133:BRAF_c.39+8949:CAPZA2dup			23983747.0	209304.0	238664.0	0.0	37.0	Note: The BRAF - CAPZA2 rearrangement is a duplication (23983747 bp) which includes the kinase domain of BRAF.
P-0009757-T01-IM5	SOMATIC	BRAF	AGAP3	7	7	140493871.0	150823513.0	Intron of BRAF(-): 237bp after exon 8	Intron of AGAP3(+): 2Kb before exon 10		GRCh37	INVERSION	30.0	40.0	Protein fusion: in frame (AGAP3-BRAF)	PRECISE	3to3	AGAP3 (NM_031946) - BRAF (NM_004333) rearrangement: c.1222-2154:AGAP3_c.1140+237:BRAFinv	yes	unknown	10329642.0	107911.0	131871.0	0.0	37.0	Note: The AGAP3 (NM_031946) - BRAF (NM_004333) rearrangement is a reciprocal inversion which results the fusion of AGAP3 exons 1-9 with BRAF exons 9-18. The fusion is predicted to be in frame and includes the kinase domain of BRAF. (PMID: 26314551)
P-0004795-T01-IM5	SOMATIC	BRAF	CUL1	7	7	140493811.0	148463226.0	Intron of BRAF(-): 297bp after exon 8	Intron of CUL1(+): 427bp before exon 8		GRCh37	INVERSION	20.0	15.0	Protein fusion: in frame (CUL1-BRAF)	PRECISE	3to3	CUL1(NM_003592) - BRAF (NM_004333) Rearrangement :c.790-427:CUL1_c.1140+297:BRAFinv	yes	unknown	7969415.0	51573.0	47940.0	0.0	15.0	Note: The CUL1(NM_003592) - BRAF (NM_004333) Rearrangement  results in the fusion of exons 1 to 7 of CUL1 and exons 9 to 18 of BRAF.Its functional significance is undetermined.
P-0002792-T01-IM3	SOMATIC	BRCA1	SMAD3	17	15	41197391.0	67477119.0	3-UTR of BRCA1(-): 304bp after coding stop	Exon 7 of SMAD3(+)		GRCh37	TRANSLOCATION	72.0	33.0	SMAD3-BRCA1 fusion	PRECISE	5to5		yes	unknown	0.0	0.0	0.0	0.0	33.0	Note: BRCA1 - SMAD3 translocation is a translocation event in which 3 UTR of BRCA1 is fused to exons 7 to 9 of SMAD3 gene. Its functional significance is undetermined.
P-0051721-T01-IM6	SOMATIC	BRCA2	BRCA2	13	13	32911047.0	32913428.0	Exon 11 of BRCA2(+)	Exon 11 of BRCA2(+)		GRCh37	INVERSION	8.0	2.0	Antisense Fusion	PRECISE	3to3	BRCA2 (NM_000059) rearrangement: c.2555_c.4936inv	yes	unknown	2381.0	11548.0	9911.0	0.0	1.0	Note: The BRCA2 rearrangement is an intragenic inversion of exon 11. The breakpoints are within exon 11. Functional significance is undetermined.
P-0061880-T01-IM7	SOMATIC	BRD4	AKT2	19	19	15359252.0	40740959.0	Intron of BRD4(-):4Kb before exon 12	Exon 13 of AKT2(-)		GRCh37	DUPLICATION	7.0	2.0	Protein Fusion: mid-exon  {BRD4:AKT2}	PRECISE	5to3	BRD4 (NM_058243) - AKT2 (NM_001626) rearrangement: c.2159-3679:BRD4_c.1359:AKT2dup	yes	unknown	25381707.0	315071.0	430897.0	0.0	2.0	Note: The BRD4 - AKT2 rearrangement is a duplication that results in a fusion of BRD4 exons 1 - 11 to AKT2 exons 13 - 14. One of the breakpoints is within AKT2 exon 13. The fusion does not include the kinase domain of AKT2. Functional significance is undetermined.
P-0052218-T01-IM6	SOMATIC	C7orf63	ALK								GRCh37				C7orf63-ALK Fusion - Archer			POSITIVE FOR GENE FUSIONS IN THE INVESTIGATIONAL PANEL: C7orf63-ALK fusion. Note: The rearrangement is an out of frame fusion between genes C7orf63 Exon1 (NM_001039706) and ALK Exon2 (NM_004304). Note2: This fusion is out of frame and does not involve the canonical exon usually involved in ALK kinase gene fusion events. Confirmatory testing is indicated.	yes	unknown						Lab Notes Run Number: ArcherV3-CLIN-20200038 Macro-dissection: Performed
P-0063302-T01-IM7	SOMATIC	CALR	CALR	19	19	13050131.0	13054310.0	Intron of CALR(+):82bp after exon 2	Intron of CALR(+):40bp before exon 8		GRCh37	DUPLICATION	0.0	5.0	Duplication of 5 exons : out of frame	IMPPRECISE	5to3	CALR (NM_004343) rearrangement: c.193+82_c.961-41dup	yes	unknown	4179.0	7087.0	10330.0	0.0	5.0	Note: The CALR rearrangement is an intragenic duplication of exons 3 - 7. Functional significance is undetermined.
P-0045318-T01-IM6	SOMATIC	CARD11		7	7	2979444.0	2987527.0	Exon 6 of CARD11(-)	Intron of CARD11(-):106bp before exon 3		GRCh37	DELETION			Deletion within transcript : mid-exon	PRECISE	3to5	CARD11 (NM_032415) rearrangement: c.8-106_c.803del			8083.0	8100.0	12884.0	0.0	4.0	Note: The CARD11 rearrangement is an intragenic deletion of exons 3 - 6. One of the breakpoints is within exon 6. Functional significance is undetermined.
P-0020306-T01-IM6	SOMATIC	CARM1		19	1	11031667.0	111953456.0	Intron of CARM1(+):45bp after exon 13	IGR: 3Kb before OVGP1(-)		GRCh37	TRANSLOCATION			CARM1-intragenic	PRECISE	5to5	CARM1 (NM_199141) rearrangement: t(1;19)(p13.2;p13.2)(chr1:g.111953456::chr19:g.11031667)			0.0	0.0	0.0	0.0	13.0	Note: The CARM1 rearrangement is a translocation that may result in the truncation of exons 14-16. The functional significance is undetermined.
P-0057735-T01-IM6	SOMATIC	CCDC6	RET	10	10	43611887.0	61665755.0	Intron of RET(+):144bp before exon 12	Intron of CCDC6(-):124bp after exon 1		GRCh37	INVERSION	10.0	60.0	Protein Fusion: in frame  {CCDC6:RET}	PRECISE	5to5	CCDC6 (NM_005436) - RET (NM_020975) fusion: c.303+125:CCDC6_c.2137-145:RETinv	yes	unknown	18053868.0	32025.0	38412.0	0.0	79.0	Note: The CCDC6 - RET fusion involves CCDC6 exon 1 and RET exons 12 - 20. The fusion is predicted to be in frame and includes the kinase domain of RET.
P-0052218-T01-IM6	SOMATIC	CD79B		17	17	62009388.0	62012332.0	Intron of CD79B(-):166bp after exon 1	Promoter of CD79B(-):6Kb from tx start		GRCh37	DUPLICATION			Duplication within transcript	PRECISE	5to3	CD79B (NM_001039933) rearrangement: c.67+167:CD79B_chr17:g.62012332dup			2944.0	2855.0	2360.0	0.0	21.0	Note: The CD79B rearrangement is a duplication of exon 1. Functional significance is undetermined.
P-0063042-T01-IM7	SOMATIC	CDC73	CDC73	1	1	193064518.0	193219802.0	Promoter of GLRX2(-):1Kb from tx start	Intron of CDC73(+):3bp before exon 17		GRCh37	DELETION	7.0	6.0	CDC73-intragenic	PRECISE	3to5	CDC73 (NM_024529) rearrangement: c.1560-4:CDC73_chr1:g.193064518del	yes	unknown	155284.0	17650.0	28061.0	0.0	6.0	Note: The CDC73 rearrangement is a deletion of exons 1 - 16.
P-0053138-T01-IM6	SOMATIC	CDC73		1	1	193077325.0	193119332.0	Promoter of GLRX2(-):12Kb from tx start	Intron of CDC73(+):101bp before exon 9		GRCh37	DELETION			CDC73-intragenic	PRECISE	3to5	CDC73 (NM_024529) rearrangement: c.829-102:CDC73_chr1:g.193077325del			42007.0	5961.0	6008.0	0.0	21.0	Note: The CDC73 rearrangement is a deletion of exons 1 - 8.
P-0009703-T01-IM5	SOMATIC	CDH1		16	16	68664883.0	68861965.0	IGR: 13Kb before CDH3(+)	Intron of CDH1(+): 112bp before exon 14		GRCh37	DELETION			CDH1-intragenic	PRECISE	3to5	CDH1 (NM_004360) Rearrangement :   chr16:g.68664883_ c.2165-112:CDH1del			197082.0	44369.0	35786.0	0.0	10.0	Note: The CDH1 (NM_004360) Rearrangement  results in the deletion of exons 1-13 of CDH1. Its functional significance is undetermined.
P-0025558-T01-IM6	SOMATIC	CDH1	CDH1	16	16	68840820.0	68842373.0	Intron of CDH1(+):2Kb before exon 4	Exon 4 of CDH1(+)		GRCh37	DELETION	10.0	22.0	Deletion within transcript : mid-exon	PRECISE	3to5	CDH1(NM_004360) Rearrangement : c.388-1507_c.434del	yes	unknown	1553.0	685.0	840.0	0.0	22.0	Note: The CDH1Rearrangement results in the intragenic deletion of exon4 of CDH1. One of the breakpoint is within exon4.Its functional significance is undetermined.
P-0011039-T01-IM5	SOMATIC	CHEK2	KIAA1984	22	9	29092840.0	139692272.0	Intron of CHEK2(-): 49bp after exon 10	Intron of KIAA1984(+): 1Kb before exon 2		GRCh37	TRANSLOCATION	45.0	80.0	Protein fusion: out of frame (CHEK2-KIAA1984)	PRECISE	5to5	CHEK2 (NM_007194) - KIAA1984 (NM_001039374) rearrangement : t(9;22)(q34.3;q12.1)(chr9:g.139692272::chr22:g.29092840)	yes	unknown	0.0	0.0	0.0	0.0	78.0	Note: The CHEK2-KIAA1984 rearrangement event is a translocation which results in the truncation of CHEK2 exons 11-15.
P-0036054-T01-IM6	SOMATIC	CIC	DEDD2	19	19	42723011.0	42794318.0	3-UTR of DEDD2(-):1Kb after coding stop	Intron of CIC(+):66bp before exon 10		GRCh37	INVERSION			CIC-DEDD2 Fusion	IMPPRECISE	5to5	CIC (NM_015125) - DEDD2 (NM_133328) rearrangement: c.1465-67:CIC_c.-1266:DEDD2inv			71307.0	27187.0	32919.0	0.0	18.0	Note: The CIC - DEDD2 rearrangement is an inversion that include CIC exons 1-10 and the 3UTR of DEDD2. One of the breakpoints is within CIC exon 10.
P-0019529-T01-IM6	SOMATIC	CSDE1	CSDE1	1	1	115267017.0	115268141.0	Intron of CSDE1(-):394bp before exon 17	Intron of CSDE1(-):187bp before exon 16		GRCh37	INVERSION	10.0	17.0	CSDE1-intragenic	PRECISE	3to3	CSDE1 (NM_001242891) rearrangement: c.1779-187_c.1892-394inv	yes	unknown	1124.0	1539.0	7313.0	0.0	11.0	Note: The CSDE1 rearrangement is an inversion (1124  bp) of exon 16. The functional significance is undetermined.
P-0032620-T01-IM6	SOMATIC	CSNK1G2	DOT1L	19	19	1981791.0	2222077.0	Promoter of CSNK1G2(+):41Kb from tx start	Exon 24 of DOT1L(+)		GRCh37	DELETION	10.0	41.0	Protein Fusion: mid-exon  {CSNK1G2:DOT1L}	PRECISE	3to5	DOT1L (NM_032482) rearrangement:c.2909:DOT1L_chr19:g.1981791del	yes	unknown	240286.0	51318.0	32674.0	0.0	42.0	Note: The DOT1L rearrangement results in the deletion of exons 1-24. One of the breakpoints is within exon 24. The functional significance is undetermined.
P-0012683-T01-IM5	SOMATIC	CTNNB1	CTNNB1	3	3	41263595.0	41267019.0	5-UTR of CTNNB1(+): 2Kb before coding start	Exon 5 of CTNNB1(+)		GRCh37	INVERSION	19.0	15.0	CTNNB1-intragenic	PRECISE	5to5	CTNNB1 (NM_001904) rearrangement: c.-48-1917_c.690inv	yes	unknown	3424.0	11367.0	9135.0	0.0	13.0	Note: The CTNNB1 rearrangement is an inversion of exons 1-5. One of the breakpoints is within exon5. The functional significance is undetermined.
P-0049545-T02-IM6	SOMATIC	CTNNB1	CTNNB1	3	3	41264962.0	41266577.0	5-UTR of CTNNB1(+):597bp before coding start	Exon 4 of CTNNB1(+)		GRCh37	DELETION	10.0	77.0	Deletion within transcript : mid-exon	PRECISE	3to5	CTNNB1 (NM_001904) rearrangement: c.374:CTNNB1_chr3:g.41264962del	yes	unknown	1615.0	2300.0	2251.0	0.0	83.0	Note: The CTNNB1 rearrangement is a deletion of exons 1 - 4. One of the breakpoints is within exon 4. Functional significance is undetermined.
P-0068325-T01-IM7	SOMATIC	CTNNB1	CTNNB1	3	3	41266142.0	41266667.0	Exon 3 of CTNNB1(+)	Exon 4 of CTNNB1(+)		GRCh37	DELETION	0.0	63.0	Deletion within transcript : mid-exon	IMPPRECISE	3to5	CTNNB1 (NM_001904) rearrangement: c.139_c.464del	yes	unknown	525.0	1762.0	1348.0	0.0	66.0	Note: The CTNNB1 rearrangement is an intragenic deletion of exons 3 - 4. The breakpoints are within exon 3 and exon 4. Functional significance is undetermined.
P-0010044-T01-IM5	SOMATIC	CTNNB1	CTNNB1	3	3	41265650.0	41266474.0	Intron of CTNNB1(+): 78bp after exon 2	Exon 4 of CTNNB1(+)		GRCh37	DELETION	0.0	102.0	Deletion within transcript: mid-exon	IMPRECISE	3to5	CTNNB1 (NM_001904) Rearrangement : c.13+78_c.271del	yes	unknown	824.0	3221.0	2070.0	0.0	106.0	Note: The CTNNB1 Rearrangement results in the deletion of exons 2-4 of CTNNB1. The breakpoints are within exon2 and exon4 respectively.  Its functional significance is undetermined.
