Sample_Id	SV_Status	Site1_Hugo_Symbol	Site2_Hugo_Symbol	Site1_Chromosome	Site2_Chromosome	Site1_Position	Site2_Position	Site1_Description	Site2_Description	Site2_Effect_On_Frame	NCBI_Build	Class	Tumor_Split_Read_Count	Tumor_Paired_End_Read_Count	Event_Info	Breakpoint_Type	Connection_Type	Annotation	DNA_Support	RNA_Support	SV_Length	Normal_Read_Count	Tumor_Read_Count	Normal_Variant_Count	Tumor_Variant_Count	Comments
P-0049638-T01-IM6	SOMATIC	CTNNB1	ANKRD28	3	3	15815039.0	41275664.0	Intron of ANKRD28(-):7Kb before exon 3	Exon 10 of CTNNB1(+)		GRCh37	INVERSION	10.0	15.0	Protein Fusion: mid-exon  {CTNNB1:ANKRD28}	PRECISE	3to3	CTNNB1 (NM_001904) - ANKRD28 (NM_015199) rearrangement: c.1559:CTNNB1_c.112-7220:ANKRD28inv	yes	unknown	25460625.0	65306.0	82556.0	0.0	14.0	Note: The CTNNB1 - ANKRD28 rearrangement is an inversion that results in a fusion of CTNNB1 exons 1 - 10 to ANKRD28 exons 3 - 28. One of the breakpoints is within CTNNB1 exon 10. Functional significance is undetermined.
P-0071086-T01-IM7	SOMATIC	CTR9	CTR9	11	11	712745.0	10789555.0	Intron of EPS8L2(+):2Kb after exon 4	Intron of CTR9(+):17bp after exon 14		GRCh37	INVERSION	10.0	67.0	CTR9-intragenic	PRECISE	5to5	CTR9 (NM_014633) rearrangement: chr11:g.712745_c.1872+17:CTR9inv	yes	unknown	10076810.0	57556.0	81302.0	0.0	86.0	Note: The CTR9 rearrangement is an inversion of exons 1-14. Its functional significance is undetermined.
P-0005529-T01-IM5	SOMATIC	CUL1	EZH2	7	7	148489819.0	148507391.0	Exon 17 of CUL1(+)	Intron of EZH2(-): 34bp after exon 17		GRCh37	DELETION	41.0	23.0	Antisense fusion	PRECISE	3to5	EZH2 (NM_004456) - CUL1 (NM_003592) rearrangement: c.2029+34:EZH2_c.1808:CUL1del	yes	unknown	17572.0	5231.0	4360.0	0.0	23.0	The EZH2 (NM_004456) - CUL1 (NM_003592) rearrangement is a deletion of EZH2 exons 17-20 and CUL1 exons 17-22.  The functional significance is undetermined.
P-0060828-T01-IM7	SOMATIC	DNMT1	IGFL2	19	19	10265433.0	46639788.0	Exon 20 of DNMT1(-)	IGR: 11Kb before IGFL2(+)		GRCh37	INVERSION	10.0	6.0	DNMT1-intragenic	PRECISE	3to3	DNMT1 (NM_001379) rearrangement: c.1613:DNMT1_chr19:g.46639788inv	yes	unknown	36374355.0	972260.0	1486876.0	0.0	6.0	Note: The DNMT1 rearrangement is an inversion of exons 1 - 20. One of the breakpoints is within exon 20. Functional significance is undetermined.
P-0037865-T01-IM6	SOMATIC	DNMT1		19	19	10292669.0	43650244.0	Intron of DNMT1(-):47bp after exon 2	IGR: 22Kb before PSG5(-)		GRCh37	INVERSION			DNMT1-intragenic	IMPPRECISE	5to5	DNMT1 (NM_001379) Rearrangement : c.117+48:DNMT1_chr19:g.43650244inv			33357575.0	832987.0	795626.0	0.0	12.0	Note: The DNMT1 Rearrangement results in the inversion of exons1-2 of DNMT1. Its functional significance is undetermined.
P-0068262-T01-IM7	SOMATIC	DNMT1	COL5A3	19	19	10092455.0	10265640.0	Intron of COL5A3(-):285bp after exon 32	Exon 19 of DNMT1(-)		GRCh37	DELETION	10.0	111.0	Protein Fusion: mid-exon  {DNMT1:COL5A3}	PRECISE	3to5	DNMT1 (NM_001379) - COL5A3 (NM_015719) rearrangement: c.1537:DNMT1_c.2460+286:COL5A3del	yes	unknown	173185.0	31151.0	33498.0	0.0	113.0	Note: The DNMT1 - COL5A3 rearrangement is a deletion that results in a fusion of DNMT1 exons 1 - 19 to COL5A3 exons 33 - 67. One of the breakpoints is within DNMT1 exon 19. Functional significance is undetermined.
P-0032851-T01-IM6	SOMATIC	DOT1L	DOT1L	19	19	2210437.0	2223140.0	Exon 13 of DOT1L(+)	Intron of DOT1L(+):139bp before exon 25		GRCh37	DUPLICATION	0.0	35.0	Duplication within transcript : mid-exon	IMPPRECISE	5to3	DOT1L (NM_032482) Rearrangement : c.1044_c.3391-140dup	yes	unknown	12703.0	25283.0	35979.0	0.0	36.0	Note: The DOT1L Rearrangement results in the intragenic duplication of exons 13-24. One of the breakpoints is within exon13. Its functional significance is undetermined.
P-0084777-T01-IM7	SOMATIC	DOT1L		19	19	1525841.0	2223276.0	5-UTR of PLK5(+):1Kb before coding start	Intron of DOT1L(+):3bp before exon 25		GRCh37	DELETION			Transcript Fusion {PLK5:DOT1L}	PRECISE	3to5	DOT1L (NM_032482) rearrangement: c.3391-4:DOT1L_chr19:g.1525841del			697435.0	76361.0	49884.0	0.0	21.0	Note: The DOT1L rearrangement is a deletion of exons 1 - 24. Functional significance is undetermined.
P-0030527-T01-IM6	SOMATIC	EDF1	TRAF2	9	9	139757686.0	139815499.0	Intron of EDF1(-):107bp after exon 3	Exon 9 of TRAF2(+)		GRCh37	DELETION	10.0	8.0	TRAF2-EDF1 fusion	PRECISE	3to5	EDF1 (NM_003792) - TRAF2 (NM_021138) rearrangement: c.291+54:EDF1_c.970:TRAF2del	yes	unknown	57813.0	14569.0	17355.0	0.0	8.0	Note: The EDF1 - TRAF2 rearrangement is a deletion that includes EDF1 exons 1-3 and TRAF2 exons 1-9. The functional significance is undetermined.
P-0060411-T01-IM7	SOMATIC	EGFR	VOPP1								GRCh37				EGFR-VOPP1 Fusion - Archer			POSITIVE FOR GENE FUSIONS IN THE INVESTIGATIONAL PANEL: EGFR-VOPP1 fusion. Note: The rearrangement is an in-frame fusion between genes EGFR Exon1 (NM_005228) and VOPP1 Exon2 (NM_001321242). Note 2: The EGFR-VOPP1 fusion was detected at a very low level. This fusion being a secondary event to EGFR amplification cannot be excluded.	yes	unknown						Lab Notes Run Number: ArcherV4-CLIN-20200204 Macro-dissection: Not Performed
P-0019529-T01-IM6	SOMATIC	EIF3H	RAD21	8	8	117708909.0	117869482.0	Intron of EIF3H(-):29Kb after exon 2	Intron of RAD21(-):23bp after exon 6		GRCh37	DELETION	10.0	9.0	Protein Fusion: in frame  {RAD21:EIF3H}	PRECISE	3to5	RAD21 (NM_006265) - EIF3H (NM_003756) rearrangement: c.688+24:RAD21_c.289+29346:EIF3Hdel	yes	unknown	160573.0	11328.0	15222.0	0.0	9.0	Note: The RAD21 - EIF3H rearrangement is a deletion which results in the fusion of RAD21 exon 6 to EIF3H exon 3. The functional significance is undetermined.
P-0065124-T01-IM7	SOMATIC	ENAM	NOTCH2	4	1	71506002.0	120509147.0	Intron of ENAM(+):2Kb before exon 9	Intron of NOTCH2(-):35bp before exon 9		GRCh37	TRANSLOCATION	10.0	66.0	Protein Fusion: out of frame  {ENAM:NOTCH2}	PRECISE	3to3	ENAM (NM_031889) - NOTCH2 (NM_024408) rearrangement: t(1;4)(p12;q13.3)(chr1:g.120509147::chr4:g.71506002)	yes	unknown	0.0	0.0	0.0	0.0	66.0	Note: The ENAM - NOTCH2 rearrangement is a translocation that results in a fusion of ENAM exons 1 - 8 to NOTCH2 exons 9 - 34. Functional significance is undetermined.
P-0072740-T01-IM7	SOMATIC	EP300	RIBC2	22	22	41574674.0	45827329.0	Exon 31 of EP300(+)	Intron of RIBC2(+):383bp after exon 6		GRCh37	DELETION	0.0	40.0	Protein Fusion: mid-exon  {EP300:RIBC2}	IMPPRECISE	3to5	EP300 (NM_001429) - RIBC2 (NM_015653) rearrangement: c.6959:EP300_c.1054+383:RIBC2del	yes	unknown	4252655.0	10470.0	22779.0	0.0	42.0	Note: The EP300 - RIBC2 rearrangement is a deletion that results in a fusion of EP300 exons 1 - 31 to RIBC2 exon 7. One of the breakpoints is within EP300 exon 31.
P-0053129-T01-IM6	SOMATIC	EPHA5		4	4	66233063.0	74666425.0	Intron of EPHA5(-):11bp after exon 10	IGR: 36Kb before CXCL6(+)		GRCh37	INVERSION			EPHA5-intragenic	PRECISE	5to5	EPHA5 (NM_004439) rearrangement: c.1924+12:EPHA5_chr4:g.74666425inv			8433362.0	19859.0	16398.0	1.0	18.0	Note: The EPHA5 rearrangement is an inversion of exons 1 - 10. The rearrangement does not include the kinase domain of EPHA5. Functional significance is undetermined.
P-0042656-T01-IM6	SOMATIC	ERCC2	PPP1R13L	19	19	45861032.0	45903488.0	Intron of ERCC2(-):75bp before exon 13	5-UTR of PPP1R13L(-):20Kb before coding start		GRCh37	DELETION	10.0	5.0	Transcript Fusion {PPP1R13L:ERCC2}	PRECISE	3to5	ERCC2 (NM_000400) rearrangement: c.1238-75:ERCC2_chr19:g.45903488del	yes	unknown	42456.0	15876.0	25831.0	0.0	5.0	Note: The ERCC2 rearrangement is a deletion of exons 1 - 12.
P-0020661-T01-IM6	SOMATIC	ETV6	ETV6	12	12	11977923.0	12010834.0	Intron of ETV6(+):14Kb before exon 3	Intron of ETV6(+):4Kb after exon 4		GRCh37	DUPLICATION	10.0	24.0	Duplication of 2 exons : in frame	PRECISE	5to3	ETV6 (NM_001987) rearrangement: c.164-14151_c.463+4339dup	yes	unknown	32911.0	30249.0	40094.0	1.0	23.0	Note: The ETV6 rearrangement results in the duplication of exons 3-4. Its functional significance is undetermined.
P-0034031-T01-IM6	SOMATIC	EWSR1	AP1B1	22	22	29683155.0	29744005.0	Intron of EWSR1(+):32bp after exon 8	Intron of AP1B1(-):1Kb after exon 11		GRCh37	DUPLICATION	10.0	17.0	AP1B1-EWSR1 fusion	PRECISE	5to3	EWSR1 (NM_013986) - AP1B1 (NM_001127) Rearrangement: c.811+32:EWSR1_c.1437+1202:AP1B1dup	yes	unknown	60850.0	57650.0	103441.0	0.0	17.0	Note: The EWSR1 - AP1B1 rearrangement is a duplication of EWSR1 exons 9 to 18 and AP1B1 exons 12-23. The functional significance is undetermined.
P-0042656-T01-IM6	SOMATIC	EZH2	EZH2	7	7	148415342.0	148523596.0	5-UTR of CUL1(+):12Kb before coding start	Exon 8 of EZH2(-)		GRCh37	DELETION	10.0	21.0	Antisense Fusion	PRECISE	3to5	EZH2 (NM_004456) rearrangement: c.857:EZH2_chr7:g.148415342del	yes	unknown	108254.0	5026.0	14545.0	0.0	21.0	Note: The EZH2 rearrangement is a deletion of exons 8 - 20. One of the breakpoints is within exon 8.
P-0043253-T01-IM6	SOMATIC	FAT1		4	4	186320655.0	187630510.0	Intron of ANKRD37(+):68bp before exon 4	Exon 2 of FAT1(-)		GRCh37	DELETION			Antisense Fusion	PRECISE	3to5	FAT1 (NM_005245) rearrangement: c.472:FAT1_chr4:g.186320655del			1309855.0	79780.0	76388.0	0.0	31.0	Note: The FAT1 rearrangement is a deletion of exons 2 - 27. One of the breakpoints is within exon 2.
P-0068917-T01-IM7	SOMATIC	FGFR1	RNF5P1	8	8	38275631.0	38459075.0	Intron of FGFR1(-):114bp after exon 11	Promoter of RNF5P1(-):1Kb from tx start		GRCh37	DELETION	10.0	51.0	Transcript Fusion {RNF5P1:FGFR1}	PRECISE	3to5	FGFR1 (NM_001174067) rearrangement: c.1523+115:FGFR1_chr8:g.38459075del	yes	unknown	183444.0	20511.0	23563.0	1.0	52.0	Note: The FGFR1 rearrangement is a deletion of exons 1 - 11. The rearrangement does not include the kinase domain of FGFR1. Functional significance is undetermined.
P-0020135-T01-IM6	SOMATIC	FGFR2	BTBD16	10	10	123239702.0	124049317.0	Intron of FGFR2(-):167bp before exon 18	Intron of BTBD16(+):106bp before exon 6		GRCh37	INVERSION	0.0	41.0	Protein Fusion: out of frame  {FGFR2:BTBD16}	IMPPRECISE	5to5	FGFR2 (NM_000141) - BTBD16 (NM_144587) rearrangement: c.2302-167:FGFR2_c.386-107: BTBD16inv	yes	unknown	809615.0	97363.0	2155489.0	0.0	77.0	Note: The FGFR2 - BTBD16 rearrangement is an inversion which results in the fusion of FGFR2 exons 1-17 with BTBD16 exons 6 - 16. The fusion is predicted to be in frame and includes the kinase domain of FGFR2.
P-0064300-T01-IM7	SOMATIC	FLT3		13	13	19760941.0	28609976.0	5-UTR of LOC101928697(+):664bp before coding start	Intron of FLT3(-):95bp after exon 11		GRCh37	INVERSION			Transcript Fusion {LOC101928697:FLT3}	PRECISE	3to3	FLT3 (NM_004119) rearrangement: c.1418+96:FLT3_chr13:g.19760941inv			8849035.0	96063.0	141978.0	0.0	12.0	Note: The FLT3 rearrangement is an inversion of exons 12 - 24. The rearrangement includes the kinase domain of FLT3. Functional significance is undetermined.
P-0048004-T01-IM6	SOMATIC	FOXP1		3	3	71102909.0	71123551.0	Exon 4 of FOXP1(-)	Intron of FOXP1(-):21Kb before exon 4		GRCh37	DELETION			Deletion within transcript : mid-exon	PRECISE	3to5	FOXP1 (NM_001244814) rearrangement: c.283-20627_c.298del			20642.0	270.0	205.0	0.0	11.0	Note: The FOXP1 rearrangement is an intragenic deletion of exon 4. One of the breakpoints is within exon 4.
P-0067327-T01-IM7	SOMATIC	FOXP1		3	3	60256827.0	71015264.0	Intron of FHIT(-):257Kb before exon 6	Intron of FOXP1(-):57bp before exon 16		GRCh37	INVERSION			FOXP1-intragenic	PRECISE	3to3	FOXP1 (NM_001244814) rearrangement: c.1723-57:FOXP1_chr3:g.60256827inv			10758437.0	76228.0	62384.0	0.0	6.0	Note: The FOXP1 rearrangement is an inversion of exons 16 - 17. Functional significance is undetermined.
P-0071558-T01-IM7	SOMATIC	FOXP1		3	3	70706246.0	71064691.0	IGR: 298Kb before FOXP1(-)	Intron of FOXP1(-):8bp after exon 8		GRCh37	DELETION			FOXP1-intragenic	IMPPRECISE	3to5	FOXP1 (NM_001244814) rearrangement: c.974+9:FOXP1_chr3:g.70706246del			358445.0	13305.0	3801.0	0.0	5.0	Note: The FOXP1 rearrangement is a deletion of exons 9 - 17.
P-0060717-T01-IM7	SOMATIC	GPS2	TNK1	17	17	7217441.0	7283565.0	Exon 5 of GPS2(-)	Promoter of TNK1(+):727bp from tx start		GRCh37	DELETION	10.0	22.0	GPS2-intragenic	PRECISE	3to5	GPS2 (NM_004489) rearrangement: c.355:GPS2_chr17:g.7283565del	yes	unknown	66124.0	5756.0	7440.0	0.0	25.0	Note: The GPS2 rearrangement is a deletion of exons 1 - 5. One of the breakpoints is within exon 5.
P-0072873-T01-IM7	SOMATIC	GRB7	CDK12	17	17	37627987.0	37902690.0	Exon 2 of CDK12(+)	Intron of GRB7(+):235bp after exon 14		GRCh37	DUPLICATION	0.0	643.0	Protein Fusion: mid-exon  {GRB7:CDK12}	IMPPRECISE	5to3	GRB7 (NM_005310) - CDK12 (NM_016507) rearrangement: c.1452+235:GRB7_c.1902:CDK12dup	yes	unknown	274703.0	73549.0	2737199.0	0.0	950.0	Note: The GRB7 - CDK12 rearrangement is a duplication that results in a fusion of GRB7 exons 1 - 14 to CDK12 exons 2 - 14. One of the breakpoints is within CDK12 exon 2. The fusion includes the kinase domain of CDK12. Functional significance is undetermined.
P-0032065-T01-IM6	SOMATIC	HIST3H3		1	1	145082149.0	228612866.0	Intron of NBPF20(+):231Kb before exon 54	Exon 1 of HIST3H3(-)		GRCh37	DUPLICATION			HIST3H3-intragenic	IMPPRECISE	5to3	HIST3H3 (NM_003493) rearrangement: c.161:HIST3H3_chr1:g.145082149dup			83530717.0	292637.0	377778.0	0.0	5.0	Note: The HIST3H3 rearrangement results in the duplication of exon 1. One of the breakpoints is within exon 1. The functional significance is undetermined.
P-0021497-T01-IM6	SOMATIC	IGF2		11	11	2161466.0	2283381.0	Exon 2 of IGF2(-)	IGR: 6Kb before ASCL2(-)		GRCh37	INVERSION			IGF2-intragenic	PRECISE	3to3	IGF2 (NM_001127598) rearrangement: c.61:IGF2_chr11:g.2283381inv			121915.0	1872.0	2509.0	0.0	14.0	Note: The IGF2 rearrangement is an inversion with a breakpoint in exon 2. This structural variant occurs along with another distinct rearrangement in IGF2, suggesting a complex rearrangement. The functional significance is undetermined.
P-0086046-T01-IM7	SOMATIC	IGF2		11	8	2161479.0	128732297.0	Exon 2 of IGF2(-)	3-UTR of CASC11(-):14Kb after coding stop		GRCh37	TRANSLOCATION			IGF2-intragenic	PRECISE	3to3	IGF2 (NM_001127598) rearrangement: t(8;11)(q24.21;p15.5)(chr8:g.128732297::chr11:g.2161479)			0.0	0.0	0.0	0.0	67.0	Note: The IGF2 rearrangement is a translocation with a breakpoint in exon 2. Functional significance is undetermined.
P-0078997-T01-IM7	SOMATIC	INPP4B	INPP4B	4	4	128067380.0	143033763.0	IGR: 487Kb before INTU(+)	Exon 22 of INPP4B(-)		GRCh37	INVERSION	10.0	9.0	INPP4B-intragenic	PRECISE	3to3	INPP4B (NM_001101669) rearrangement: c.2208:INPP4B_chr4:g.128067380inv	yes	unknown	14966383.0	43085.0	63424.0	0.0	9.0	Note: The INPP4B rearrangement is an inversion of exons 22 - 26. One of the breakpoints is within exon 22. Functional significance is undetermined.
P-0010512-T01-IM5	SOMATIC	JAK1		1	1	65309647.0	76414149.0	Intron of JAK1(-): 100bp after exon 17	IGR: 30Kb before ASB17(-)		GRCh37	INVERSION			JAK1-intragenic	PRECISE	5to5	JAK1 (NM_002227) rearrangement : c.2403+100:JAK1_chr1:g.76414149inv see note1			11104502.0	79221.0	66584.0	0.0	13.0	Note1: The JAK1 rearrangement event results in the inversion of JAK1 exons 1-17.
P-0050264-T01-IM6	SOMATIC	JAK3	LOC100506022	19	1	17952430.0	9448228.0	Intron of JAK3(-):18bp after exon 7	IGR: 37Kb before LOC100506022(-)		GRCh37	TRANSLOCATION	10.0	9.0	JAK3-intragenic	PRECISE	3to5	JAK3 (NM_000215) rearrangement: t(1;19)(p36.22;p13.11)(chr1:g.9448228::chr19:g.17952430)	yes	unknown	0.0	0.0	0.0	0.0	10.0	Note: The JAK3 rearrangement is a translocation with a breakpoint in intron 7. Functional significance is undetermined.
P-0021351-T01-IM6	SOMATIC	KDM5A		12	8	495087.0	47164681.0	Exon 2 of KDM5A(-)	IGR: 588Kb before LINC00293(+)		GRCh37	TRANSLOCATION			KDM5A-intragenic	PRECISE	5to3	KDM5A (NM_001042603) rearrangement: t(8;12)(q11.1;p13.33)(chr8:g.47164681::chr12:g.495087)			0.0	0.0	0.0	0.0	25.0	Note: The KDM5A rearrangement is a translocation with a breakpoint within exon 2. The functional significance is undetermined.
P-0008483-T01-IM5	SOMATIC	KDM5C	KDM5C	X	X	53238278.0	53245123.0	Intron of KDM5C(-): 1Kb after exon 12	Exon 7 of KDM5C(-)		GRCh37	INVERSION	14.0	14.0	KDM5C-intragenic	PRECISE	3to3	KDM5C (NM_004187) rearrangement: c.817_c.1746+1318inv	yes	unknown	6845.0	15827.0	13902.0	0.0	13.0	The KDM5C (NM_004187) rearrangement is an inversion of exons 7-12. One of the breakpoints is within exon 7. The functional significance is undetermined.
P-0006730-T01-IM5	SOMATIC	KEAP1		19	19	10610197.0	35248755.0	Exon 2 of KEAP1(-)	IGR: 224bp before ZNF599(-)		GRCh37	DELETION			KEAP1-intragenic	PRECISE	3to5	KEAP1(NM_203500) Rearrangement: c.513_chr19:35248755del			24638558.0	382278.0	469499.0	0.0	12.0	Note: The KEAP1(NM_203500) Rearrangement results in the deletion of exons 1 and 2 of KEAP1.The breakpoint is within exon2 .Its functional significance is undetermined.
P-0033720-T01-IM6	SOMATIC	KMT2B		19	19	35558580.0	36210369.0	3-UTR of HPN-AS1(-):39Kb after coding stop	Intron of KMT2B(+):1bp before exon 2		GRCh37	DELETION			KMT2B-intragenic	PRECISE	3to5	KMT2B (NM_014727) Rearrangement :chr19:g.35558580_c.364-2:KMT2Bdel			651789.0	1708.0	1276.0	0.0	7.0	Note: The KMT2B (NM_014727) Rearrangement results in the deletion of exons 1-2 of KMT2B. Its functional significance is undetermined.
P-0075744-T01-IM7	SOMATIC	KRAS	KRAS	12	12	25393856.0	25398267.0	Intron of KRAS(-):4Kb after exon 2	Exon 2 of KRAS(-)		GRCh37	DUPLICATION	10.0	23.0	Duplication within transcript : mid-exon	PRECISE	5to3	KRAS (NM_033360) rearrangement: c.52_c.111+4352dup	yes	unknown	4411.0	350.0	732.0	0.0	23.0	Note: The KRAS rearrangement is an intragenic duplication of exon 2. One of the breakpoints is within exon 2. Functional significance is undetermined.
P-0063415-T01-IM7	SOMATIC	LATS1	IYD	6	6	149982915.0	150675765.0	Exon 8 of LATS1(-)	IGR: 14Kb before IYD(+)		GRCh37	INVERSION	10.0	26.0	LATS1-intragenic	PRECISE	5to5	LATS1 (NM_004690) rearrangement: c.3343:LATS1_chr6:g.150675765inv	yes	unknown	692850.0	18303.0	28541.0	0.0	27.0	Note: The LATS1 rearrangement is an inversion of exons 1 - 8. One of the breakpoints is within exon 8. Functional significance is undetermined.
P-0045531-T01-IM6	SOMATIC	LGR5	NAB2	12	12	57488458.0	71910494.0	Exon 7 of NAB2(+)	Intron of LGR5(+):8Kb before exon 3		GRCh37	DUPLICATION	10.0	35.0	Protein Fusion: mid-exon  {LGR5:NAB2}	PRECISE	5to3	LGR5 (NM_003667) - NAB2 (NM_005967) rearrangement: c.285-7692:LGR5_c.1532:NAB2dup	yes	unknown	14422036.0	54085.0	64626.0	0.0	35.0	Note: The LGR5 - NAB2 rearrangement is a duplication that results in a fusion of LGR5 exons 1 - 2 to NAB2 exon 7. One of the breakpoints is within NAB2 exon 7. Functional significance is undetermined.
P-0064785-T01-IM7	SOMATIC	MAP2K4		17	17	12035522.0	12044653.0	Intron of MAP2K4(+):3Kb after exon 9	3-UTR of MAP2K4(+):120Kb after coding stop		GRCh37	INVERSION			MAP2K4-intragenic	PRECISE	3to3	MAP2K4 (NM_003010) rearrangement: c.1040+2918:MAP2K4_chr17:g.12044653inv			9131.0	1826.0	1182.0	1.0	18.0	Note: The MAP2K4 rearrangement is an inversion of exons 10 - 11. The rearrangement includes a part of the kinase domain of MAP2K4. Functional significance is undetermined.
P-0059355-T02-IM7	SOMATIC	MAP3K1	MAP3K1	5	5	56157413.0	56160781.0	Intron of MAP3K1(+):2Kb after exon 3	Intron of MAP3K1(+):20bp after exon 4		GRCh37	INVERSION	10.0	4.0	Antisense Fusion	PRECISE	3to3	MAP3K1 (NM_005921) rearrangement: c.834+1671_c.1035+20inv	yes	unknown	3368.0	2176.0	837.0	0.0	6.0	Note: The MAP3K1 rearrangement is an intragenic inversion of exon 4. The rearrangement does not include the kinase domain of MAP3K1. Functional significance is undetermined.
P-0025935-T01-IM6	SOMATIC	MAP3K1		5	5	55920869.0	56161216.0	IGR: 114Kb before LOC101928448(-)	Exon 5 of MAP3K1(+)		GRCh37	INVERSION			MAP3K1-intragenic	PRECISE	5to5	MAP3K1 (NM_005921) rearrangement: c.1085:MAP3K1_chr5:g.55920869inv			240347.0	5644.0	9393.0	0.0	13.0	Note: The MAP3K1 rearrangement results in the inversion of exons 1-5. One of the breakpoints is within exon 5. The functional significance is undetermined.
P-0059956-T01-IM7	SOMATIC	MAPK1	MAPK1	22	22	22161945.0	22164646.0	Intron of MAPK1(-):7bp after exon 2	Intron of MAPK1(-):3Kb before exon 2		GRCh37	DELETION	10.0	8.0	Deletion of 1 exon : in frame	PRECISE	3to5	MAPK1 (NM_002745) rearrangement: c.120-2511_c.302+8del	yes	unknown	2701.0	1537.0	1275.0	0.0	8.0	Note: The MAPK1 rearrangement is an intragenic deletion of exon 2. The rearrangement includes a part of the kinase domain of MAPK1. Functional significance is undetermined.
P-0027288-T01-IM6	SOMATIC	MBD3	TCF3	19	19	1593723.0	1621036.0	Promoter of MBD3(-):17Kb from tx start	Exon 12 of TCF3(-)		GRCh37	DUPLICATION	10.0	10.0	Protein Fusion: mid-exon  {MBD3:TCF3}	PRECISE	5to3	TCF3 (NM_001136139) rearrangement: chr19:g.1593723_c.1024dup	yes	unknown	27313.0	12515.0	11283.0	0.0	10.0	Note: The TCF3 rearrangement is an duplication that includes exons 1-12. One of the breakpoints is within exon 12. The functional significance is undetermined.
P-0045582-T01-IM6	SOMATIC	MECOM	RSPO2								GRCh37				MECOM-RSPO2 Fusion - Archer			POSITIVE FOR GENE FUSIONS IN THE INVESTIGATIONAL PANEL: MECOM-RSPO2 fusion. Note: The rearrangement is a fusion between genes MECOM Exon2 (NM_004991) and RSPO2 Exon2 (NM_178565).   Note2: The fusion involves the untranslated region of RSPO2 exon2.	yes	unknown						Lab Notes Run Number: Archerv3-CLIN-20190157 Macro-dissection: Performed
P-0078210-T01-IM7	SOMATIC	MEN1	EHD1	11	11	64572127.0	64635572.0	Exon 10 of MEN1(-)	Intron of EHD1(-):6Kb after exon 2		GRCh37	INVERSION	9.0	6.0	Antisense Fusion	PRECISE	5to5	MEN1 (NM_000244) rearrangement: c.1527:MEN1_chr11:g.64635572inv	yes	unknown	63445.0	17079.0	24040.0	0.0	6.0	Note: The MEN1 rearrangement is an inversion of exons 1 - 10. One of the breakpoints is within exon 10. Functional significance is undetermined.
P-0021078-T01-IM6	SOMATIC	MGA		15	15	42021538.0	51318549.0	Exon 11 of MGA(+)	IGR: 30Kb before TNFAIP8L3(-)		GRCh37	INVERSION			MGA-intragenic	PRECISE	5to5	MGA (NM_001164273) rearrangement: c.3834:MGA_chr15:g.51318549inv			9297011.0	178745.0	129494.0	0.0	9.0	Note: The MGA rearrangement is an inversion of exons 11-24. One of the breakpoints is within exon 11.
P-0012623-T01-IM5	SOMATIC	MGA	CACNA1B	15	9	42041234.0	140896610.0	Intron of MGA(+): 75bp before exon 16	Intron of CACNA1B(+): 5Kb before exon 16		GRCh37	TRANSLOCATION	0.0	34.0	Protein fusion: out of frame (CACNA1B-MGA)	IMPRECISE	5to3	CACNA1B (NM_000718) - MGA (NM_001164273) Rearrangement : t(9;15)(q22.3;p11.1)(chr9:g.140896610::chr15:g.42041234)	yes	unknown	0.0	0.0	0.0	0.0	33.0	Note: The CACNA1B - MGA Rearrangement results in the fusion of exons 1-15 of CACNA1B with exons 16-24 of MGA.Its functional significance is undetermined.
P-0031188-T01-IM6	SOMATIC	MIR99AHG	CTCF	21	16	17465819.0	67671612.0	5-UTR of MIR99AHG(+):516Kb before coding start	Exon 12 of CTCF(+)		GRCh37	TRANSLOCATION	10.0	108.0	Protein Fusion: mid-exon  {MIR99AHG:CTCF}	PRECISE	3to5	CTCF (NM_006565) rearrangement: t(16;21)(q22.1;q21.1)(chr16:g.:67671612::chr21:g.17465819)	yes	unknown	0.0	0.0	0.0	0.0	109.0	Note: The CTCF rearrangement is a translocation with with a breakpoint within exon 12. The functional significance is undetermined.
P-0016293-T01-IM6	SOMATIC	MITF	MITF	3	3	69845477.0	70008361.0	Intron of MITF(+):57Kb after exon 1	Intron of MITF(+):62bp before exon 9		GRCh37	DELETION	10.0	14.0	Deletion of 7 exons : in frame	PRECISE	3to5	MITF (NM_198159) rearrangment : c.104+56625_c.1014-63MITFdel	yes	unknown	162884.0	16286.0	19530.0	0.0	15.0	Note: The MITF rearrangement results in the deletion of exons 2-8. The functional significance is undetermined.
P-0060828-T01-IM7	SOMATIC	MPL	MPL	1	1	40927229.0	43804051.0	Intron of ZFP69B(+):863bp before exon 5	Intron of MPL(+):149bp after exon 2		GRCh37	DUPLICATION	10.0	20.0	Protein Fusion: out of frame  {MPL:ZFP69B}	PRECISE	5to3	MPL (NM_005373) rearrangement: c.212+149:MPL_chr1:g.40927229dup	yes	unknown	2876822.0	12822.0	20212.0	0.0	25.0	Note: The MPL rearrangement is a duplication of exons 1 - 2. Functional significance is undetermined.
P-0076922-T01-IM7	SOMATIC	MTOR	MTOR	1	1	11202957.0	11298637.0	Intron of MTOR(-):2Kb after exon 34	Exon 12 of MTOR(-)		GRCh37	DELETION	10.0	23.0	Deletion within transcript : mid-exon	PRECISE	3to5	MTOR (NM_004958) rearrangement: c.1824_c.4872+1748del	yes	unknown	95680.0	21878.0	36195.0	0.0	26.0	Note: The MTOR rearrangement is an intragenic deletion of exons 12 - 34. One of the breakpoints is within exon 12. Functional significance is undetermined.
P-0053138-T01-IM6	SOMATIC	NBN		8	8	90843195.0	90947853.0	IGR: 71Kb before OSGIN2(+)	Intron of NBN(-):13bp before exon 16		GRCh37	DELETION			NBN-intragenic	PRECISE	3to5	NBN (NM_002485) rearrangement: c.2235-13:NBN_chr8:g.90843195del			104658.0	507.0	487.0	0.0	4.0	Note: The NBN rearrangement is a deletion of exon 16.
P-0019129-T01-IM6	SOMATIC	NCOA3	NCOA3	20	20	46178247.0	46256528.0	5-UTR of NCOA3(+):73Kb before coding start	Intron of NCOA3(+):35bp after exon 7		GRCh37	DUPLICATION	10.0	33.0	Duplication within transcript	PRECISE	5to3	NCOA3 (NM_181659) rearrangement: c.-98-33680_c.721+35dup	yes	unknown	78281.0	8121.0	19238.0	0.0	54.0	Note: The NCOA3 rearrangement is an intragenic duplication (78281 bp) of exons 2-7. The functional significance is undetermined.
P-0046624-T01-IM6	SOMATIC	NCOR1	LRRC75A-AS1	17	17	16022833.0	16345142.0	Intron of NCOR1(-):34bp before exon 17	5-UTR of LRRC75A-AS1(+):29Kb before coding start		GRCh37	DELETION	10.0	13.0	NCOR1-intragenic	PRECISE	3to5	NCOR1 (NM_006311) rearrangement: c.1853-34:NCOR1_chr17:g.16345142del	yes	unknown	322309.0	21415.0	38475.0	0.0	13.0	Note:The NCOR1 rearrangement is a deletion of exons 1 - 16.
P-0036748-T02-IM6	SOMATIC	NCOR1	NCOR1	20	17	2327385.0	15983421.0	IGR: 34Kb before TGM6(+)	Intron of NCOR1(-):43bp before exon 26		GRCh37	TRANSLOCATION	10.0	22.0	NCOR1-intragenic	PRECISE	5to3	NCOR1 (NM_006311) rearrangement: t(17;20)(p12;p13)(chr17:g.15983421::chr20:g.2327385)	yes	unknown	0.0	0.0	0.0	0.0	22.0	Note: The NCOR1 rearrangement is a translocation with a breakpoint in intron 25. Functional significance is undetermined.
