Sample_Id	SV_Status	Site1_Hugo_Symbol	Site2_Hugo_Symbol	Site1_Chromosome	Site2_Chromosome	Site1_Position	Site2_Position	Site1_Description	Site2_Description	Site2_Effect_On_Frame	NCBI_Build	Class	Tumor_Split_Read_Count	Tumor_Paired_End_Read_Count	Event_Info	Breakpoint_Type	Connection_Type	Annotation	DNA_Support	RNA_Support	SV_Length	Normal_Read_Count	Tumor_Read_Count	Normal_Variant_Count	Tumor_Variant_Count	Comments
P-0072383-T01-IM7	SOMATIC	NCOR1	NUP88	17	17	5319515.0	16022605.0	Intron of NUP88(-):317bp after exon 2	Intron of NCOR1(-):131bp after exon 17		GRCh37	DELETION	10.0	26.0	Protein Fusion: out of frame  {NCOR1:NUP88}	PRECISE	3to5	NCOR1 (NM_006311) - NUP88 (NM_002532) rearrangement: c.1915+132:NCOR1_c.467+318:NUP88del	yes	unknown	10703090.0	150954.0	172780.0	0.0	34.0	Note: The NCOR1 - NUP88 rearrangement is a deletion that results in a fusion of NCOR1 exons 1 - 17 to NUP88 exons 3 - 17.
P-0078802-T01-IM7	SOMATIC	NF1	NF1	17	17	29664400.0	29692967.0	Exon 42 of NF1(+)	Intron of NF1(+):5Kb after exon 56		GRCh37	DELETION	10.0	12.0	Deletion within transcript : mid-exon	PRECISE	3to5	NF1 (NM_001042492) rearrangement: c.6442_c.8377+5246del	yes	unknown	28567.0	13669.0	12555.0	0.0	18.0	Note: The NF1 rearrangement is an intragenic deletion of exons 42 - 56. One of the breakpoints is within exon 42.
P-0032702-T01-IM6	SOMATIC	NF1		17	17	28678685.0	29552280.0	IGR: 27Kb before CPD(+)	Intron of NF1(+):12bp after exon 17		GRCh37	INVERSION			NF1-intragenic	PRECISE	3to3	NF1 (NM_001042492) rearrangement: c.2001+12:NF1_chr17:g.28678685inv			873595.0	24360.0	29264.0	0.0	12.0	Note: The NF1 rearrangement results in the inversion of exons 1-17. The functional significance is undetermined.
P-0051577-T02-IM7	SOMATIC	NKX3	KCNU1	8	8	23539154.0	36918959.0	Intron of NKX3-1(-):2bp before exon 2	IGR: 277Kb before KCNU1(+)		GRCh37	DELETION	10.0	7.0	KCNU1-NKX3 fusion	PRECISE	3to5	NKX3-1 (NM_006167) rearrangement: c.287-2:NKX3-1_chr8:g.36918959del	yes	unknown	13379805.0	55350.0	36027.0	0.0	7.0	Note: The NKX3-1 rearrangement is a deletion of exon 1.
P-0089265-T01-IM7	SOMATIC	NOTCH1		9	9	139401522.0	139402605.0	Intron of NOTCH1(-):97bp before exon 23	Intron of NOTCH1(-):14bp before exon 21		GRCh37	DELETION			Deletion of 2 exons : in frame	IMPPRECISE	3to5	NOTCH1 (NM_017617) rearrangement: c.3326-14_c.3644-97del			1083.0	4075.0	5355.0	0.0	29.0	Note: The NOTCH1 rearrangement is an intragenic deletion of exons 21 - 22.
P-0015518-T01-IM6	SOMATIC	NOTCH2		2	1	104768940.0	120510213.0	IGR: 282Kb before LOC150568(+)	Exon 8 of NOTCH2(-)		GRCh37	TRANSLOCATION			NOTCH2-intragenic	PRECISE	5to5	NOTCH2 (NM_024408) Rearrangement : t(1,2)(p11.2,q12.1)(chr1:g.120510213::chr2:g.104768940)			0.0	0.0	0.0	0.0	43.0	Note: The NOTCH2  Rearrangement results in the possible truncation of exons 8-34 of NOTCH2. The breakpoint is within exon 8. Its functional significance is undetermined.
P-0036054-T01-IM6	SOMATIC	NOTCH3		19	19	15285085.0	36346742.0	Exon 25 of NOTCH3(-)	Promoter of KIRREL2(+):1Kb from tx start		GRCh37	INVERSION			Protein Fusion: mid-exon  {KIRREL2:NOTCH3}	PRECISE	3to3	NOTCH3 (NM_000435) rearrangement: c.4530_chr19:g.36346742inv			21061657.0	306004.0	357095.0	0.0	10.0	Note: The NOTCH3 rearrangement is an inversion that includes NOTCH3 exons 1-25. One of the breakpoints is within exon 25. Multiple NOTCH3 rearrangements were detected in this sample a more complex rearrangement is possible.
P-0049919-T01-IM6	SOMATIC	NOTCH4	BRD2	6	6	32169965.0	32929127.0	Exon 21 of NOTCH4(-)	IGR: 7Kb before BRD2(+)		GRCh37	DELETION	10.0	98.0	NOTCH4-intragenic	PRECISE	3to5	NOTCH4 (NM_004557) rearrangement: c.3643:NOTCH4_chr6:g.32929127del	yes	unknown	759162.0	101508.0	97506.0	0.0	107.0	Note: The NOTCH4 rearrangement is a deletion of exons 1 - 21. One of the breakpoints is within exon 21.
P-0049515-T01-IM6	SOMATIC	NRF1	BRAF								GRCh37				NRF1-BRAF Fusion - Archer			POSITIVE FOR GENE FUSIONS IN THE INVESTIGATIONAL PANEL: NRF1-BRAF fusion. Note: The rearrangement is an in-frame fusion between genes NRF1 Exon10 (NM_005011) and BRAF Exon10 (NM_004333). PTPRK-RSPO3 fusion. Note: The rearrangement is an in-frame fusion between genes PTPRK Exon1 (NM_001135648) and RSPO3 Exon2 (NM_032784).	yes	unknown						Lab Notes Run Number: ArcherV3-CLIN-20190230 Macro-dissection: Not Performed
P-0045434-T01-IM6	SOMATIC	NTHL1	TSC2	16	16	2090099.0	2132119.0	Intron of NTHL1(-):34bp after exon 5	Intron of TSC2(+):317bp before exon 32		GRCh37	DELETION	10.0	41.0	TSC2-NTHL1 fusion	PRECISE	3to5	NTHL1 (NM_002528) - TSC2 (NM_000548) rearrangement: c.815+35:NTHL1_c.3815-318:TSC2del	yes	unknown	42020.0	91983.0	132610.0	0.0	41.0	Note: The NTHL1 - TSC2 rearrangement is a deletion of NTHL1 exons 1 - 5 and TSC2 exons 1 - 31.
P-0006864-T01-IM5	SOMATIC	PARK2	PARK2	6	6	162763179.0	162864351.0	Intron of PARK2(-): 79Kb before exon 3	Exon 2 of PARK2(-)		GRCh37	DELETION	9.0	6.0	Deletion within transcript: mid-exon	PRECISE	3to5	PARK2 (NM_004562) rearrangement: c.162_c.172-79382del	yes	unknown	101172.0	936.0	683.0	0.0	6.0	The PARK2 (NM_004562) rearrangement is an intragenic deletion of exon 2. One of the breakpoints is within exon 2. (PMID: 19946270)
P-0012110-T01-IM5	SOMATIC	PBRM1	PBRM1	3	3	52584306.0	52611167.0	Intron of PBRM1(-): 131bp after exon 29	Intron of PBRM1(-): 453bp before exon 23		GRCh37	DUPLICATION	6.0	5.0	Duplication of 7 exons: out of frame	PRECISE	5to3	PBRM1 (NM_018313) Rearrangement :  c.4576+131_c.3459-453dup	yes	unknown	26861.0	22212.0	23494.0	0.0	4.0	Note: The PBRM1 Rearrangement  results in the intragenic duplication of exons 23-29. Its functional significance is undetermined.
P-0008267-T01-IM5	SOMATIC	PBRM1		3	3	52713624.0	53498367.0	Exon 2 of PBRM1(-)	IGR: 31Kb before CACNA1D(+)		GRCh37	DELETION			PBRM1-intragenic	PRECISE	3to5	PBRM1 (NM_018313) rearrangement: c.104:PBRM1_chr3.g.53498367del			784743.0	765.0	900.0	0.0	5.0	Note: PBRM1 (NM_018313) rearrangement results in the deletion of exons 1 to 2. The breakpoint is within exon2. Its functional significance is undetermined.
P-0053249-T01-IM6	SOMATIC	PGAP3	ERBB2	17	17	37839517.0	37879921.0	Intron of PGAP3(-):1Kb after exon 3	Intron of ERBB2(+):8bp after exon 18		GRCh37	INVERSION			Protein Fusion: in frame  {PGAP3:ERBB2}	PRECISE	5to5	PGAP3 (NM_033419) - ERBB2 (NM_004448) rearrangement: c.432+1333:PGAP3_c.2208+8:ERBB2inv			40404.0	34507.0	845718.0	0.0	9.0	Note: The PGAP3 - ERBB2 rearrangement is an inversion that results in a fusion of PGAP3 exons 1 - 3 to ERBB2 exons 19 - 27. The fusion is predicted to be in frame and includes a part of the kinase domain of ERBB2. Functional significance is undetermined and is likely a consequence of the ERBB2 amplification.
P-0072873-T01-IM7	SOMATIC	PHACTR2	CDK12	17	6	37627987.0	144027536.0	Exon 2 of CDK12(+)	Intron of PHACTR2(+):6Kb before exon 2		GRCh37	TRANSLOCATION	0.0	1001.0	Protein Fusion: mid-exon  {PHACTR2:CDK12}	IMPPRECISE	5to3	PHACTR2 (NM_001100164) - CDK12 (NM_016507) rearrangement: t(6;17)(q24.2;q12)(chr6:g.144027536::chr17:g.37627987)	yes	unknown	0.0	0.0	0.0	0.0	5159.0	Note: The PHACTR2 - CDK12 rearrangement is a translocation that results in a fusion of PHACTR2 exon 1 to CDK12 exons 2 - 14. One of the breakpoints is within CDK12 exon 2. The fusion includes the kinase domain of CDK12. Functional significance is undetermined.
P-0008429-T01-IM5	SOMATIC	PIK3R1	PIK3R1	5	5	67585270.0	67591174.0	Intron of PIK3R1(+): 691bp after exon 1	Intron of PIK3R1(+): 22bp after exon 7		GRCh37	DUPLICATION	26.0	24.0	Duplication of 6 exons: out of frame	PRECISE	5to3	PIK3R1 (NM_181523) Rearrangement :  c.917-2817_1745+22dup	yes	unknown	5904.0	6517.0	4648.0	0.0	24.0	Note: The PIK3R1 (NM_181523) Rearrangement results in the intragenic duplication of exons 2 to 7 of PIK3R1. Its functional signficance is undetermined.
P-0036261-T01-IM6	SOMATIC	PIK3R1		5	5	67591123.0	68233907.0	Exon 13 of PIK3R1(+)	IGR: 156Kb before SLC30A5(+)		GRCh37	DELETION			PIK3R1-intragenic	PRECISE	3to5	PIK3R1 (NM_181523) rearrangement: c.1716_chr5:g.5:68233907del			642784.0	2462.0	3250.0	0.0	14.0	Note: The PIK3R1 rearrangement is a deletion that includes PIK3R1 exons 13-15. One of the breakpoints is within exon 13.
P-0053138-T01-IM6	SOMATIC	PIM1		6	2	37140471.0	201920381.0	Intron of PIM1(+):300bp before exon 5	5-UTR of FAM126B(-):74Kb before coding start		GRCh37	TRANSLOCATION			PIM1-intragenic	IMPPRECISE	5to3	PIM1 (NM_002648) rearrangement: t(2;6)(q33.1;p21.2)(chr2:g.201920381::chr6:g.37140471)			0.0	0.0	0.0	0.0	6.0	Note: The PIM1 rearrangement is a translocation with a breakpoint in intron 4. Functional significance is undetermined.
P-0023588-T01-IM6	SOMATIC	POLD1	SIGLECL1	19	19	50918112.0	51762823.0	Exon 20 of POLD1(+)	5-UTR of SIGLECL1(+):10Kb before coding start		GRCh37	DELETION			Protein Fusion: mid-exon  {POLD1:SIGLECL1}	PRECISE	3to5	POLD1 (NM_002691) - SIGLECL1(NM_173635) Rearrangement : c.2429:POLD1_c.-191+1669:SIGLECL1del			844711.0	17739.0	9213.0	0.0	29.0	Note: The POLD1 (NM_002691) - SIGLECL1(NM_173635) Rearrangement results in the fusion of exons 1-20 with 2-6 of SIGLECL1. Its functional significance is undetermined.
P-0035167-T01-IM6	SOMATIC	PRKD1		14	14	26379764.0	30103427.0	IGR: 535Kb before NOVA1(-)	Intron of PRKD1(-):196bp after exon 8		GRCh37	INVERSION			PRKD1-intragenic	PRECISE	5to5	PRKD1 (NM_002742) rearrangement: c.1314+197:PRKD1_chr14:g.26379764inv			3723663.0	21669.0	17438.0	0.0	27.0	Note: The PRKD1 rearrangement is an inversion of exons 9-18. The functional significance is undetermined.
P-0058800-T01-IM7	SOMATIC	PTEN	PTEN	10	10	89709882.0	89711897.0	Intron of PTEN(+):2Kb before exon 6	Exon 6 of PTEN(+)		GRCh37	DELETION	10.0	16.0	Deletion within transcript : mid-exon	PRECISE	3to5	PTEN (NM_000314) rearrangement: c.493-1993_c.515del	yes	unknown	2015.0	204.0	137.0	0.0	20.0	Note: The PTEN rearrangement is an intragenic deletion of exon 6. One of the breakpoints is within exon 6.
P-0074268-T01-IM7	SOMATIC	PTEN		10	10	89693122.0	89732521.0	Intron of PTEN(+):114bp after exon 5	IGR: 109Kb before PTEN(+)		GRCh37	DELETION			PTEN-intragenic	PRECISE	3to5	PTEN (NM_000314) rearrangement: c.492+114:PTEN_chr10:g.89732521del			39399.0	1972.0	2686.0	0.0	6.0	Note: The PTEN rearrangement is a deletion of exons 6 - 9.
P-0024150-T01-IM6	SOMATIC	PTPN11	RPH3A	12	12	112942553.0	113053952.0	Exon 15 of PTPN11(+)	IGR: 176Kb before RPH3A(+)		GRCh37	INVERSION	9.0	2.0	PTPN11-intragenic	PRECISE	5to5	PTPN11 (NM_002834) rearrangement: c.1767_chr12:g.113053952inv	yes	unknown	111399.0	544.0	797.0	0.0	3.0	Note: The PTPN11 rearrangement results in the inversion of exon 15. One of the breakpoints is within exon 15. The functional significance is undetermined.
P-0045531-T01-IM6	SOMATIC	PTPRK	RSPO3								GRCh37				PTPRK-RSPO3 Fusion - Archer			POSITIVE FOR GENE FUSIONS IN THE INVESTIGATIONAL PANEL: PTPRK-RSPO3 fusion. Note: The rearrangement is an in-frame fusion between genes PTPRK Exon1 (NM_001135648) and RSPO3 Exon2 (NM_032784).	yes	unknown						Lab Notes Run Number: Archerv3-CLIN-20190156 Macro-dissection: Not Performed
P-0046018-T01-IM6	SOMATIC	PTPRK	RSPO3								GRCh37				PTPRK-RSPO3 Fusion - Archer			POSITIVE FOR GENE FUSIONS IN THE INVESTIGATIONAL PANEL: PTPRK-RSPO3 fusion. Note: The rearrangement is an in-frame fusion between genes PTPRK Exon1 (NM_001135648) and RSPO3 Exon2 (NM_032784).	yes	unknown						Lab Notes Run Number: Archerv3-CLIN-20190163 Macro-dissection: Not Performed
P-0036261-T01-IM6	SOMATIC	PTPRK	RSPO3								GRCh37				PTPRK-RSPO3 Fusion - Archer			POSITIVE FOR GENE FUSIONS IN THE INVESTIGATIONAL PANEL: PTPRK-RSPO3 fusion. Note: The rearrangement is an in-frame fusion between genes PTPRK Exon7 (NM_001135648) and RSPO3 Exon2 (NM_032784).	yes	unknown						Lab Notes Run Number: ArcherV3-CLIN-20180188 Macro-dissection: Unknown
P-0037865-T01-IM6	SOMATIC	PTPRK	RSPO3								GRCh37				PTPRK-RSPO3 Fusion - Archer			POSITIVE FOR GENE FUSIONS IN THE INVESTIGATIONAL PANEL: PTPRK-RSPO3 fusion. Note: The rearrangement is an in-frame fusion between genes PTPRK Exon7 (NM_001135648) and RSPO3 Exon2 (NM_032784). POSITIVE FOR GENE FUSIONS IN THE INVESTIGATIONAL PANEL: MTMR2-MAML2 fusion. Note: The rearrangement is an in-frame fusion between genes MTMR2 Exon12 (NM_016156) and MAML2 Exon3 (NM_032427).	yes	unknown						Lab Notes Run Number: ArcherV3-CLIN-20190033 Macro-dissection: Unknown
P-0074268-T01-IM7	SOMATIC	PTPRK	RSPO3								GRCh37				PTPRK-RSPO3 Fusion - Archer			POSITIVE FOR GENE FUSIONS IN THE INVESTIGATIONAL PANEL: PTPRK-RSPO3 fusion. Note: The rearrangement is an in-frame fusion between genes PTPRK Exon1 (NM_001135648) and RSPO3 Exon2 (NM_032784).	yes	unknown						Lab Notes Run Number: ArcherV4-CLIN-20220007 Macro-dissection: Performed
P-0034394-T01-IM6	SOMATIC	RAD21		8	8	83572326.0	117866665.0	IGR: 744Kb before LINC01419(+)	Exon 9 of RAD21(-)		GRCh37	INVERSION			RAD21-intragenic	PRECISE	3to3	RAD21 (NM_006265) rearrangement: c.980:RAD21_chr8:g.83572326inv			34294339.0	52375.0	62182.0	0.0	102.0	Note: The RAD21 rearrangement is an inversion of exons 9-14. One of the breakpoints is within exon 9. Its functional significance is undetermined.
P-0036478-T01-IM6	SOMATIC	RAD21	RSPO2								GRCh37				RAD21-RSPO2 Fusion - Archer			POSITIVE FOR GENE FUSIONS IN THE INVESTIGATIONAL PANEL: RAD21-RSPO2 fusion. Note: The rearrangement is an in-frame fusion between genes RAD21 Exon1 (NM_006265) and RSPO2 Exon2 (NM_178565).	yes	unknown						Lab Notes Run Number: ArcherV3-CLIN-20180188 Macro-dissection: Unknown
P-0067823-T01-IM7	SOMATIC	RECQL4		8	8	39203243.0	145737929.0	5-UTR of ADAM5(+):57Kb before coding start	Exon 18 of RECQL4(-)		GRCh37	INVERSION			Protein Fusion: mid-exon  {RECQL4:ADAM5}	PRECISE	5to5	RECQL4 (NM_004260) rearrangement: c.2901:RECQL4_chr8:g.39203243inv			106534686.0	449484.0	693094.0	0.0	14.0	Note: The RECQL4 rearrangement is a inversion of exons 18 - 22. One of the breakpoints is within exon 18. Functional significance is undetermined.
P-0080555-T01-IM7	SOMATIC	RECQL4	RECQL4	8	8	138171353.0	145740301.0	IGR: 247Kb before LOC101927915(-)	Intron of RECQL4(-):18bp after exon 9		GRCh37	INVERSION			RECQL4-intragenic	PRECISE	5to5	RECQL4 (NM_004260) rearrangement: c.1620+19:RECQL4_chr8:g.138171353inv			7568948.0	64567.0	123629.0	0.0	93.0	The RECQL4 rearrangement results in an inversion of exons 10 - 22. One of the breakpoints is within exon intron 9. Functional significance is undetermined.
P-0001151-T01-IM3	SOMATIC	RET	NCOA4	10	10	43611645.0	51589150.0	Intron of RET(+): 387bp before exon 12	Intron of NCOA4(+): 75bp before exon 11		GRCh37	DUPLICATION	27.0	14.0	Protein fusion: in frame (NCOA4-RET)	PRECISE	5to3	RET (NM_020630) - NCOA4 (NM_005437) Duplication : c.2137-387_c.1840-75dup	yes	unknown	7977505.0	33721.0	35267.0	0.0	16.0	Note: rearrangement consistent with NCOA4-RET fusion. Confirmatory RET FISH  is recommended.
P-0053530-T01-IM6	SOMATIC	RET	SLC4A4	10	4	43610439.0	72412310.0	Intron of RET(+):255bp after exon 11	Intron of SLC4A4(+):65bp after exon 19		GRCh37	TRANSLOCATION	10.0	37.0	Protein Fusion: out of frame  {RET:SLC4A4}	PRECISE	3to5	RET (NM_020975) - SLC4A4 (NM_001134742) rearrangement: t(4;10)(q13.3;q11.21)(chr4:g.72412310::chr10:g.43610439)	yes	unknown	0.0	0.0	0.0	0.0	38.0	Note: The RET - SLC4A4 rearrangement is a translocation that results in a fusion of RET exons 1 - 11 to SLC4A4 exons 20 - 25. The fusion does not include the kinase domain of RET. Functional significance is undetermined and further testing to determine the presence or absence of a targetable oncogenic fusion involving RET is required. This sample has been nominated for further analysis using the Archer targeted RNAseq assay. Archer will be performed and reported under a separate accession number if additional material is available.
P-0037971-T01-IM6	SOMATIC	RICTOR	TTC33	5	5	38946536.0	40729443.0	Intron of RICTOR(-):33bp after exon 33	Intron of TTC33(-):865bp before exon 4		GRCh37	DUPLICATION	9.0	4.0	Protein Fusion: out of frame  {RICTOR:TTC33}	PRECISE	5to3	RICTOR (NM_152756) - TTC33 (NM_012382) rearrangement: c.4399+34:RICTOR_c.304-865:TTC33dup	yes	unknown	1782907.0	38679.0	58052.0	0.0	4.0	Note: The RICTOR - TTC33 rearrangement is a duplication that results in a fusion of RICTOR exons 1 - 33 to TTC33 exons 4 - 5. The functional significance is undetermined.
P-0035528-T01-IM6	SOMATIC	RNF43		17	17	56435392.0	56462849.0	Exon 9 of RNF43(-)	Intron of RNF43(-):14Kb before exon 3		GRCh37	DELETION			Deletion within transcript : mid-exon	PRECISE	3to5	RNF43 (NM_017763)  rearrangement: c.253-14455_c.1745del			27457.0	14966.0	14230.0	0.0	37.0	Note: The RNF43 rearrangement is an intragenic deletion of exons 3-9. One of the breakpoints is within exon 9. Its functional significance is undetermined.
P-0008868-T01-IM5	SOMATIC	RNF43	MTMR4	17	17	56492693.0	56579447.0	Exon 2 of RNF43(-)	Intron of MTMR4(-): 2Kb after exon 15		GRCh37	DELETION	24.0	13.0	Protein fusion: mid-exon (MTMR4-RNF43)	PRECISE	3to5	MTMR4 (NM_004687) - RNF43 (NM_017763) rearrangement: c.1811+1658:MTMR4_c.246:RNF43del	yes	unknown	86754.0	1237.0	759.0	0.0	12.0	Note: The MTMR4 (NM_004687) - RNF43 (NM_017763) rearrangement is a deletion that results in the fusion of MTMR4 exons 2-15 with RNF43 exons 2-10. One of the breakpoints is within RNF43 exon 2. The functional significance of this rearrangement is undetermined.
P-0030449-T01-IM6	SOMATIC	RUNX1		X	21	46136512.0	36206846.0	IGR: 49Kb before LINC01186(-)	Exon 7 of RUNX1(-)		GRCh37	TRANSLOCATION			RUNX1-intragenic	PRECISE	3to5	RUNX1 (NM_001754) rearrangement: t(21;X)(q22.12;p11.3)(chr21:g.36206846::chrX:g.46136512)			0.0	0.0	0.0	0.0	13.0	Note: The RUNX1 rearrangement is a translocation with a breakpoint in exon 7. The functional significance is undetermined.
P-0048170-T01-IM6	SOMATIC	RUNX1		21	21	20859351.0	36171911.0	IGR: 926Kb before LOC101927797(-)	Intron of RUNX1(-):152bp before exon 8		GRCh37	INVERSION			RUNX1-intragenic	IMPPRECISE	3to3	RUNX1 (NM_001754) rearrangement: c.806-152:RUNX1_chr21:g.20859351inv			15312560.0	11530.0	13405.0	0.0	5.0	Note: The RUNX1 rearrangement is an inversion of exons 8 - 9. Functional significance is undetermined.
P-0079769-T01-IM7	SOMATIC	SCG5	GREM1	15	15	32942014.0	32994760.0	Intron of SCG5(+):6Kb after exon 2	IGR: 15Kb before GREM1(+)		GRCh37	DELETION	10.0	14.0	SCG5-intragenic	PRECISE	3to5	SCG5 (NM_001144757) rearrangement: c.226+5995:SCG5_chr15:g.32994760del	yes	unknown	52746.0	7095.0	5627.0	1.0	13.0	Note: The SCG5 rearrangement is a deletion of exons 3-6. Functional significance is undetermined.
P-0035726-T01-IM6	SOMATIC	SESN1	INPP5D	6	2	109415104.0	234003013.0	Exon 1 of SESN1(-)	Intron of INPP5D(+):8Kb after exon 5		GRCh37	TRANSLOCATION	0.0	6.0	Protein Fusion: mid-exon  {SESN1:INPP5D}	IMPPRECISE	5to5	SESN1 (NM_014454) - INPP5D (NM_005541) rearrangement: t(2;6)(q37.1;q21)(chr2:g.234003013::chr6:g.109415104)	yes	unknown	0.0	0.0	0.0	0.0	6.0	Note: The SESN1 - INPP5D rearrangement is a translocation that results in the fusion of SESN1 exon 1 with INPP5D exons 6-26. One of the breakpoints is within SESN1 exon 1. The functional significance is undetermined.
P-0034877-T01-IM6	SOMATIC	SHOC2	TSC22D1	13	10	45064416.0	112769116.0	Intron of TSC22D1(-):56Kb before exon 2	Exon 7 of SHOC2(+)		GRCh37	TRANSLOCATION	10.0	46.0	Protein Fusion: mid-exon  {SHOC2:TSC22D1}	PRECISE	3to3	SHOC2 (NM_007373) - TSC22D1 (NM_183422) rearrangement: t(10;13)(q25.2;q14.11)(chr10:g.112769116::chr13:g.45064416)	yes	unknown	0.0	0.0	0.0	0.0	46.0	Note: The SHOC2 - TSC22D1 rearrangement is a translocation that results in the fusion of SHOC2 exons 1-7 with TSC22D1 exons 2-3. One of the breakpoints is within SHOC2 exon 7. The functional significance is undetermined.
P-0029141-T01-IM6	SOMATIC	SLX4		16	16	3617116.0	3639988.0	3-UTR of NLRC3(-):10Kb after coding stop	Exon 12 of SLX4(-)		GRCh37	DELETION			SLX4-intragenic	PRECISE	3to5	SLX4 (NM_032444) rearrangement: c.3651:SLX4_chr16:g.3617116del			22872.0	17169.0	20172.0	0.0	25.0	Note: The SLX4 rearrangement results in the deletion of exons 12-15. One of the breakpoints is within exon 12. The functional significance is undetermined.
P-0067327-T01-IM7	SOMATIC	SMAD2		18	12	45372140.0	42143644.0	Exon 9 of SMAD2(-)	IGR: 312Kb before PDZRN4(+)		GRCh37	TRANSLOCATION			SMAD2-intragenic	PRECISE	5to5	SMAD2 (NM_001003652) rearrangement: t(12;18)(q12;q21.1)(chr12:g.42143644::chr18:g.45372140)			0.0	0.0	0.0	0.0	15.0	Note: The SMAD2 rearrangement is a translocation with a breakpoint in exon 9. Functional significance is undetermined.
P-0020845-T02-IM6	SOMATIC	SMAD3		15	15	67454627.0	67457430.0	Intron of SMAD3(+):3Kb before exon 2	Intron of SMAD3(+):4bp after exon 2		GRCh37	DUPLICATION			Duplication of 1 exon : out of frame	PRECISE	5to3	SMAD3 (NM_005902) rearrangement: c.207-2606_c.400+4dup			2803.0	1879.0	3691.0	0.0	125.0	Note: The SMAD3 rearrangement results in the duplication of exon 2. The functional significance is undetermined.
P-0032311-T01-IM6	SOMATIC	SMAD3	SMAD3	15	15	67353055.0	67457104.0	IGR: 5Kb before SMAD3(+)	Intron of SMAD3(+):128bp before exon 2		GRCh37	DELETION	0.0	7.0	SMAD3-intragenic	IMPPRECISE	3to5	SMAD3 (NM_005902) rearrangement: c.207-129:SMAD3_chr15:g.67353055del	yes	unknown	104049.0	2393.0	727.0	0.0	7.0	Note: The SMAD3 rearrangement results in the deletion of exon 1.
P-0057653-T01-IM6	SOMATIC	SMAD4		18	18	48601293.0	48604507.0	Intron of SMAD4(+):2Kb before exon 11	Intron of SMAD4(+):118bp before exon 12		GRCh37	DELETION			Deletion of 1 exon : out of frame	PRECISE	3to5	SMAD4 (NM_005359) rearrangement: c.1309-1715_c.1448-119del			3214.0	1518.0	1142.0	0.0	26.0	Note: The SMAD4 rearrangement is an intragenic deletion of exon 11.
P-0075243-T01-IM7	SOMATIC	SMAD4	SMAD4	18	18	48578627.0	48584628.0	Intron of SMAD4(+):3Kb before exon 5	Intron of SMAD4(+):14bp after exon 6		GRCh37	DELETION	10.0	22.0	Deletion of 2 exons : in frame	PRECISE	3to5	SMAD4 (NM_005359) rearrangement: c.455-2524_c.787+14del	yes	unknown	6001.0	2071.0	1890.0	0.0	22.0	Note: The SMAD4 rearrangement is an intragenic deletion of exons 5 - 6.
P-0083447-T01-IM7	SOMATIC	SMAD4		18	18	48573761.0	48577697.0	Intron of SMAD4(+):96bp after exon 2	Intron of SMAD4(+):2Kb after exon 4		GRCh37	DELETION			Deletion of 2 exons : out of frame	PRECISE	3to5	SMAD4 (NM_005359) rearrangement: c.249+96_c.454+2003del			3936.0	1921.0	940.0	0.0	13.0	Note: The SMAD4 rearrangement is an intragenic deletion of exons 3 - 4.
P-0078997-T01-IM7	SOMATIC	SMAD4	SND1	18	7	48591950.0	127291317.0	Exon 9 of SMAD4(+)	Promoter of SND1(+):884bp from tx start		GRCh37	TRANSLOCATION	10.0	16.0	Protein Fusion: mid-exon  {SMAD4:SND1}	PRECISE	3to5	SMAD4 (NM_005359) rearrangement: t(7;18)(q32.1;q21.2)(chr7:g.127291317::chr18:g.48591950)	yes	unknown	0.0	0.0	0.0	0.0	16.0	Note: The SMAD4 rearrangement is a translocation with a breakpoint in exon 9. Functional significance is undetermined.
P-0053667-T01-IM6	SOMATIC	SMARCD2	CD79B	17	17	61915279.0	62009532.0	Intron of SMARCD2(-):294bp before exon 2	Intron of CD79B(-):22bp after exon 1		GRCh37	DUPLICATION	7.0	3.0	Protein Fusion: out of frame  {SMARCD2:CD79B}	PRECISE	5to3	SMARCD2 (NM_001098426) - CD79B (NM_001039933) rearrangement: c.217-294:SMARCD2_c.67+23:CD79Bdup	yes	unknown	94253.0	9936.0	10630.0	0.0	3.0	Note: The SMARCD2 - CD79B rearrangement is a duplication that results in a fusion of SMARCD2 exon 1 to CD79B exons 2 - 6. Functional significance is undetermined.
P-0051973-T01-IM6	SOMATIC	SOCS6	MAML2								GRCh37				SOCS6-MAML2 Fusion - Archer			POSITIVE FOR GENE FUSIONS IN THE INVESTIGATIONAL PANEL: SOCS6-MAML2 fusion. Note: The rearrangement is a fusion between genes SOCS6 5'UTR (NM_004232) and MAML2 Exon2 (NM_032427). Note2: The functional significance of this event is unknown.	yes	unknown						Lab Notes Run Number: ArcherV3-CLIN-20200034 Macro-dissection: Not Performed
P-0070197-T01-IM7	SOMATIC	SOX2		3	3	181430738.0	181439386.0	Exon 1 of SOX2(+)	5-UTR of SOX2-OT(+):21Kb before coding start		GRCh37	DELETION			Protein Fusion: mid-exon  {SOX2:SOX2-OT}	PRECISE	3to5	SOX2 (NM_003106) rearrangement: c.590:SOX2_chr3:g.181439386del			8648.0	4616.0	6682.0	0.0	28.0	Note: The SOX2 rearrangement is a deletion of exon 1. One of the breakpoints is within exon 1. Functional significance is undetermined.
P-0046624-T01-IM6	SOMATIC	SPATA2L	FANCA	16	16	89765309.0	89869723.0	Intron of SPATA2L(-):596bp before exon 3	Exon 8 of FANCA(-)		GRCh37	DUPLICATION	10.0	12.0	Protein Fusion: mid-exon  {SPATA2L:FANCA}	PRECISE	5to3	SPATA2L (NM_152339) - FANCA (NM_000135) rearrangement: c.304-596:SPATA2L_c.736:FANCAdup	yes	unknown	104414.0	61572.0	59956.0	0.0	21.0	Note:The SPATA2L - FANCA rearrangement is a duplication that results in a fusion of SPATA2L exons 1 - 2 to FANCA exons 8 - 43. One of the breakpoints is within FANCA exon 8. Functional significance is undetermined.
P-0040601-T01-IM6	SOMATIC	SPRYD3	KMT2D	12	12	49422643.0	53461041.0	Exon 45 of KMT2D(-)	Intron of SPRYD3(-):390bp after exon 8		GRCh37	DELETION	10.0	37.0	Protein Fusion: mid-exon  {SPRYD3:KMT2D}	PRECISE	3to5	SPRYD3 (NM_032840) - KMT2D (NM_003482) rearrangement: c.901+391:SPRYD3_c.14350:KMT2Ddel	yes	unknown	4038398.0	152495.0	235157.0	0.0	37.0	Note: The SPRYD3 - KMT2D rearrangement is a deletion that results in a fusion of SPRYD3 exons 1 - 8 to KMT2D exons 45 - 54. One of the breakpoints is within KMT2D exon 45.
P-0045724-T01-IM6	SOMATIC	SPTBN1	ALK	2	2	29446796.0	54848081.0	Intron of ALK(-):402bp before exon 20	Intron of SPTBN1(+):455bp before exon 8		GRCh37	INVERSION	10.0	63.0	Protein Fusion: in frame  {SPTBN1:ALK}	PRECISE	3to3	SPTBN1 (NM_003128) - ALK (NM_004304) fusion: c.764-456:SPTBN1_c.3173-402:ALKinv	yes	unknown	25401285.0	171072.0	166309.0	0.0	63.0	Note: The SPTBN1 - ALK fusion involves SPTBN1 exons 1 - 7 and ALK exons 20 - 29. The fusion is predicted to be in frame and includes the kinase domain of ALK.
